{
  "student_info": {
    "name": "주서연",
    "gender": "여",
    "birth": "060105",
    "address": "서울특별시 노원구 노원로15길 52, 11동 402호 (중계동, 한신코아빌라)",
    "school_history": [
      "2022년 1월 27일 중원중학교 제3학년 졸업",
      "2022년 3월 2일 용화여자고등학교 제1학년 입학",
      "2025년 2월 5일 용화여자고등학교 제3학년 졸업"
    ]
  },
  "attendance": "출결 구간 전체 raw 저장됨",
  "awards": [
    {
      "grade": "2",
      "award_name": "공로상",
      "date": "2022. 12. 29."
    },
    {
      "grade": "2",
      "award_name": "교과 우수상",
      "date": ""
    },
    {
      "grade": "1",
      "award_name": "교과 우수상",
      "date": ""
    },
    {
      "grade": "3",
      "award_name": "교과우수상",
      "date": ""
    },
    {
      "grade": "2",
      "award_name": "개근상",
      "date": "2025. 02.05."
    },
    {
      "grade": "4",
      "award_name": "창의적체험활동상",
      "date": ""
    },
    {
      "grade": "7",
      "award_name": "창의적체험활동상",
      "date": ""
    },
    {
      "grade": "2",
      "award_name": "창의적체험활동상",
      "date": ""
    },
    {
      "grade": "2",
      "award_name": "학기 정의 관련 신 문 스크랩 활동에 성실히 참여하여 사회 현상에 대한 이해력 및 비판적 사고력이 향상",
      "date": ""
    },
    {
      "grade": "2",
      "award_name": "차 시험에 최고점을 받는 등 노력 하는 모습이 인상",
      "date": ""
    },
    {
      "grade": "2",
      "award_name": "자신이 맡은 일에 대해서는 적극적이며 추진력이 있는 성격으로 학급 회장으로서 학기초에 많이 어색할 수 있는 상",
      "date": ""
    },
    {
      "grade": "3",
      "award_name": "긍정적이고 밝은 성격을 지니고 있어 어떤 상",
      "date": ""
    }
  ],
  "certificates": "및 인증 취득상황 \n<자격증 및 인증 취득상황> \n구분 \n명칭 또는 종류 \n번호 또는 내용 \n취득연월일 \n발급기관 \n<국가직무능력표준 이수상황> \n능력단위 \n학년 학기 \n세분류 \n이수시간 원점수 성취도 \n비고 \n(능력단위코드) \n해당 사항 없음",
  "creative_activities": {
    "grade1": "00:20:27 \nKST \n문서확인번호: 1763-6519-8118-8469 (신청인:주서연) \n학교생활세부사항기록부(학교생활기록부II) \n졸업대장번호 17944 \n구분 \n학년",
    "grade2": "3 \n1. 인적·학적사항 \n성명 : 주서연 \n학생정보 \n학과 \n반 번호 \n담임성명 \n12 \n16 \n심방울 \n12 \n13 \n심방울 \n07 \n13 \n추미혜 \n성별 : 여 \n주민등록번호 : 060105-****늘은 많은 것은 \n주소 : 서울특별시 노원구 노원로15길 52, 11동 402호 (중계동, 한신코아빌라) \n2022년 1월 27일 중원중학교 제3학년 졸업 \n학적사항 2022년 3월 2일 용화여자고등학교 제1학년 입학 \n2025년 2월 5일 용화여자고등학교 제3학년 졸업 \n특기사항 \n2. 출결상황 \n결석일수 \n지각 \n조퇴 \n결과 \n학년 수업일수 \n특기사항 \n질병 미인정 기타 질병 미인정 기타 질병 미인정 기타 질병 미인정 기타",
    "grade3": "1. 인적·학적사항 \n성명 : 주서연 \n학생정보 \n학과 \n반 번호 \n담임성명 \n12 \n16 \n심방울 \n12 \n13 \n심방울 \n07 \n13 \n추미혜 \n성별 : 여 \n주민등록번호 : 060105-****늘은 많은 것은 \n주소 : 서울특별시 노원구 노원로15길 52, 11동 402호 (중계동, 한신코아빌라) \n2022년 1월 27일 중원중학교 제3학년 졸업 \n학적사항 2022년 3월 2일 용화여자고등학교 제1학년 입학 \n2025년 2월 5일 용화여자고등학교 제3학년 졸업 \n특기사항 \n2. 출결상황 \n결석일수 \n지각 \n조퇴 \n결과 \n학년 수업일수 \n특기사항 \n질병 미인정 기타 질병 미인정 기타 질병 미인정 기타 질병 미인정 기타"
  },
  "academic_records": [
    "문서확인번호: 1763-6519-8118-8469 (신청인:주서연) \n학교생활세부사항기록부(학교생활기록부II) \n졸업대장번호 17944 \n구분 \n학년 \n1 \n2 \n3 \n1. 인적·학적사항 \n성명 : 주서연 \n학생정보 \n학과 \n반 번호 \n담임성명 \n12 \n16 \n심방울 \n12 \n13 \n심방울 \n07 \n13 \n추미혜 \n성별 : 여 \n주민등록번호 : 060105-****늘은 많은 것은 \n주소 : 서울특별시 노원구 노원로15길 52, 11동 402호 (중계동, 한신코아빌라) \n2022년 1월 27일 중원중학교 제3학년 졸업 \n학적사항 2022년 3월 2일 용화여자고등학교 제1학년 입학 \n2025년 2월 5일 용화여자고등학교 제3학년 졸업 \n특기사항 \n2. 출결상황 \n결석일수 \n지각 \n조퇴 \n결과 \n학년 수업일수 \n특기사항 \n질병 미인정 기타 질병 미인정 기타 질병 미인정 기타 질병 미인정 기타 \n1 \n190 \n원격수업일수 4일, 개근 \n2 \n190 \n3 \n190 \n3. 수상경력 \n원격수업일수 0일, \n개근 \n개근 \n용화여자고등학교 \n2025년 11월 21일 1/20 반 \n07 \n번호 \n13 이름 \n주서연 \n(KOR), \ngov.kr \n정부24",
    "문서확인번호: 1763-6519-8118-8469 (신청인:주서연) \n학년 \n(학기) \n수상명 \n등급(위) \n수상연월일 \n수여기관 \n1 \n2 \n공로상 \n2022. 12. 29. \n2 \n2 \n교과 우수상(음악) \n2023. 12. 29. \n1 \n교과 우수상(운동과 건강) \n2024, 07, 23. \n용화여자고등학교장 \n용화여자고등학교장 \n용화여자고등학교장 \n참가대상 \n(참가인원) \n1학년(238명) \n수강자 \n수강자 \n3 \n교과우수상(물리학 II) \n2025.01.02. \n용화여자고등학교장 \n수강자 \n2 \n개근상 \n2025. 02.05. 용화여자고등학교장 \n3학년(221명) \n4. 자격증 및 인증 취득상황 \n<자격증 및 인증 취득상황> \n구분 \n명칭 또는 종류 \n번호 또는 내용 \n취득연월일 \n발급기관 \n<국가직무능력표준 이수상황> \n능력단위 \n학년 학기 \n세분류 \n이수시간 원점수 성취도 \n비고 \n(능력단위코드) \n해당 사항 없음 \n5. 창의적 체험활동상황 \n창의적체험활동상황 \n학년 \n영역 \n시간 \n특기사항 \n용화여자고등학교 \n2025년 11월 21일 2/20 반 \n07 \n번호 \n13 이름 \n주서연 \ngov.kr \n정부24 \n1",
    "문서확인번호: 1763-6519-8118-8469 (신청인:주서연) \n학년 \n영역 \n시간 \n자율활동 \n동아리활동 \n80 \n24 \n창의적체험활동상황 \n특기사항 \n1학기 학급 회장(2022.03.02.-2022.08.18.)으로서 리더십이 뛰어나고 학급 친구들 이 모두 참여할 수 있는 다양한 활동들을 제시함. 저녁 시간대에 줌스터디 인원 모집, 진로와 관련된 학급신문 만들기, 시험기간 중 학습한 내용 시험 문제 만들기 등의 활동 을 친구들에게 함께 하자고 제안하여 학급의 발전을 위해 노력하는 모습을 보임. (정보 네티켓) 코딩의 기초인 순서도 작성과 알고리즘 설계를 공부하고 실제 프로그래밍을 통하여 적용하고 보완하는 연습을 통해 기초적인 프로그래밍 능력을 함양함. 수학과학 페임랩 (2022.04.01.)에 '나노 기술을 이용한 뇌종양 치료 약물 전달 시스템'을 주제로 참여함. 수학위크(2022.06.25.)에서 'AI 매쓰봇 좌회전금지미로 게임'에 참여하여 A I매쓰봇 교재와 소프트웨어 게임을 이용하여 좌회전을 하지 않고 미로를 탈출하는 게 임을 수행함. 경우의 수와 수학적 확률을 활용하는 미로 설계, 게임 실행 과정을 통해 AI와 수학의 밀접한 연관성을 직접 경험하며 미래 산업 기술의 바탕이 되는 수학의 필 요성을 인식함. 특히 학년 대표로 친구들이 프로그램에 잘 참여할 수 있도록 동기를 부 여하고 제작한 AI 매쓰봇 교재를 전시하여 수학위크 활동을 알리는 역할을 함. \n(과학재능기부반(라이트)) (24시간) 2학기 동아리 회장(2022.08.19.-2023.02.28.) 으로서 책임감과 봉사 정신을 가지고 동아리원의 의견을 반영하여 주도적으로 연간 계 획을 수립하고 부원들을 이끌며 적극적으로 활동함. 금속의 불꽃 반응 실험과 빛의 굴 절 실험을 하며 조원들과 협동심이 돋보임. 마스크 색에 따른 자외선 차단율에 대해 조 사하고 카드 뉴스를 제작하여 SNS에 공유함. 교사와 학생 입장을 생각하며 지구와 달 의 공전과 파동을 이용한 기타 제작에 대해 과학 멘토링 준비를 하고, 자신만의 개성있 는 수업을 하여 친구들에게 많은 박수를 받음. 강점, 약점, 기회, 위협을 분석하여 원자 력 발전에 대해 심층적으로 알아보고 친구들에게 자신감있게 설명할 수 있음. '알루미 늄 태그 만들기'라는 주제로 체험 부스를 운영함. 부스 준비 과정에서 여러 차례의 예 비 실험에 한 번도 빠짐없이 참석해 부원들과의 협동심과 리더십을 보여주었으며, 실 험 과정에 문제 발생 시 본인만의 창의적인 방법으로 해결책을 제시함. \n용화여자고등학교 \n2025년 11월 21일 3/20 반 \n07 \n번호 13 이름 \n주서연 \ngov.kr \n정부24",
    "문서확인번호: 1763-6519-8118-8469 (신청인:주서연) \n학년 \n영역 \n시간 \n1 \n진로활동 \n2 \n자율활동 \n창의적체험활동상황 \n특기사항 \n35 \n115 \n희망분야 컴퓨터 분야 개발자 \n직업인(CEO)과의 만남 행사 (2022.06.20.)에 참여하여 구체적인 직업정보와 진로 방 향에 대한 조언을 듣고 질의 응답 시간을 가졌음. 성장형전공탐색프로그램 화학계열 (2 022.05.09.-2022.06.22.)을 이수함. 식품 속의 염분량 측정 활동을 통해 앙금생성 반응에 대해 더 깊이 이해하고, 알코올의 산화와 음주측정을 통해 일상생활 속에 화학 적 원리들을 적용하고 이해해봄. 화학전지 만들기 실험에 참여하여 교과서의 내용을 더욱 심화하여 학습하고 실제적인 실험 수행 능력을 향상시킴. '내 주변 모든 것이 신 약이 될 수 있다'라는 주제로 열린 강연 6pm(2022.05.11.) 에 참석하여 성분에 따른 천연물 의약품, 합성 의약품, 바이오 의약품의 분류에 대하여 배움. 성장형전공탐색프 로그램 수학공학계열 (2022.09.05. -2022. 11. 26)을 이수함. 모스부호, 이진법, 16진 법, 삼원색의 이진법 및 16진법 표현 등을 배워 데이터를 다양하게 표현해 봄. 이를 활 용하여 '손으로 보내는 팩스 활동'에서 흑백, 컬러 팩스를 송수신해 봄. 칸토르의 대각 선 논법을 배우고 이를 응용해 괴델의 불완전성의 원리를 튜링의 멈춤 문제로 접근하여 이해해 봄. 클로드 섀넌의 디지털 논리회로와 집합의 관계에 대해 탐구함. 집합을 이 용해 가위, 바위, 보 회로를 간단히 정리해 봄. 수학과 공학의 관계성을 직접 체험하고 수학의 필요성과 가치를 크게 느껴봄. '에너지는 미래로, 미래는 에너지로'라는 주제로 열린 강연 6pm(2022.10.31.)에 참석하여 막대한 양의 에너지가 필요한 데이터 센터 를 유지하기 위해 에너지 하베스팅과 열전소자, 광전소자, 전자기파 포집과 변환 기술 등의 원리를 배움. 창작해 내는 데 흥미를 느껴 자신의 창의력을 펼칠 수 있는 공학 분 야로의 진학을 희망함. \n코딩 활동을 통해 소프트웨어의 역할에 대해 명확히 이해하고 자신이 고민하던 문제에 대해 아두이노를 기반으로 프로그래밍에 대해 학습함. 이 과정에서 알고리즘을 설계하 고 아두이노를 통해 구현하는 등 지식의 적용에 있어 뛰어난 모습을 보임. 다문화 수업 에서 인터넷 사용과 관련하여 국가별 개인정보보호법의 특징을 문화의 특징과 연관지 어 설명함. 이를 통해 다문화가 우리의 생활과 밀접하게 연관되어 있다는 사실을 인식 하게 됨. 수학과학인문융합축전(2023.07.18.)에서 '정전기 스노우볼 만들기'라는 주 제로 체험 부스를 운영함. 부스 운영 전 준비과정에서 제작 방법을 익히고 정전기의 원 리를 찾아 정리함. 동아리 부원들과 역할을 나눠 스노우볼 만드는 방법 및 정리를 하고 \n부스 운영 전 미리 재료를 준비함. 인공지능캠프(2023.08.44.)에 참여하여 컴퓨팅 사고력, 플로우고리즘, 파이게임, 파이썬에 대해 배우고 이를 바탕으로 게임 제작 및 자율주행자동차 실습을 해봄. 코딩을 이론적으로만 배우는 것이 아니라 실제로 체험해 보며 자신의 적성을 탐색해볼 수 있었고 코딩에 대한 관심이 높아짐. 역사평화 활동을 통해 사회적 소수자에 대한 차별적 사례들을 정리하고 이들의 차별 시정을 위한 제도 마련을 주장하였음. \n용화여자고등학교 \n2025년 11월 21일 4/20 반 \n07 \n번호 \n13 이름 \n주서연 \ngov.kr \n정부24 \n2",
    "문서확인번호: 1763-6519-8118-8469 (신청인:주서연) \n학년 \n영역 \n시간 \n동아리활동 \n진로활동 \n24 \n17 \n창의적체험활동상황 \n특기사항 \n(과학재능기부반) (24시간) 1학기 동아리 회장(2023.3.2.-2023. 8. 15.)으로 홍보물 과 안내 문구를 기획과 제작을 하는 등 책임감 있게 동아리 활동을 잘 이끔. 짝선배 짝 후배 제도를 효과적으로 운영하기 위하여 각자 진로나 관심 분야가 비슷한 학생들을 선 별하여 짝선배 짝후배로 선정하여 운영을 함. 팀실험으로 그람염색실험을 하였으나 염 색이 잘 되지 않아 그 원인으로 열고정을 할 때 오래 열처리를 했기 때문이라는 보고서 를 작성하여 제출함. 실험이 실패하더라도 원인을 찾는 과정에서 배울 수 있는 점을 깨 달음. 다양한 주제의 카드뉴스 활동에서는 동아리 소셜네트워크서비스 계정에 업로드 하여 사람들에게 재치있게 과학정보를 알림. 과학 지식을 쉽게 정보를 제공하는 과정 에 흥미를 느끼고 관련 직종에 관심을 가짐. 외부 활동 준비로 태양광 팽이 만들기 부 스 운영을 위하여 주제를 제안하고 나이 별로 설명 내용을 변경하여 준비함. \n희망분야 공학계열 \n진로 한마당 (2023.07.14.)행사에 참여함. 특히 학과 및 대학 정보 컨설팅 프로그램 참 여를 통하여 대학 진학에 필요한 구체적인 정보들을 공유하며 입시 방향을 설정하는데 도움이 되는 시간을 가졌음. 구체적인 내용들을 정리하여 보고서로 제출함. 진로진학 탐색시간을 통해 정보를 확인하고 '파인먼이 들려주는 불확정성 원리 이야기'를 읽고 원자에 대한 설명과 불확정성 원리, 원자핵에 대한 내용을 파악하고 일상 속 사물만이 아닌 모든 것에 적용된다는 사실을 알게 되었다 함. 성장형전공적성프로그램 ITSW 열(2023.04.10. -2023.10.28.)을 이수함. 지오지브라를 이용하여 다양한 함수들의 그래프를 그려보고 수업 시간에 삼각함수의 그래프를 그렸던 활동을 더 심도 깊게 이해 하게 됨. 또한 다양한 코딩앱을 사용하여 복사, 출석부, 그래프 도출 등을 공부하며 본 인의 진로를 고민하는 기회를 만들었으며 추후 더 많은 코딩에 대한 학습의지를 다짐. 이 과정에서 컴퓨터의 다양한 프로그램들이 학습에 많은 도움을 주고 있으며 이를 활용 하여 더 깊이 있는 학업의 이해도를 높일 수 있음을 깨달았고 여러 분야에 꼭 필요한 도구가 되었음을 인지함. 1학기 강연 6PM (2023.05.17.)을 수강함. 전 국립과학수사 연구소 첫 여성원장님께 국과수의 다양한 업무와 분야, 역할 등에 대해 듣고 다양한 전 공의 필요성과 사명감에 대해 듣고 자신의 진로를 생각해보는 계기를 가짐. 창의융합 프로젝트 '두두타운'에 '라이다' 팀명으로 참여함 (2023.05.26.-2023.09.08.). 전동 킥보드의 안전 사고 증가에 대한 관심을 갖고 충격량을 흡수할 수 있는 안전 장치가 없 다는 사실을 알게 되어 충돌을 대비한 초음파 센서를 제작하는 활동을 진행함. \n용화여자고등학교 \n2025년 11월 21일 5/20 반 \n07 \n번호 13 이름 \n주서연 \ngov.kr \n정부24",
    "문서확인번호: 1763-6519-8118-8469 (신청인:주서연) \n학년 \n영역 \n시간 \n자율활동 \n3 \n동아리활동 \n13 \n92 \n창의적체험활동상황 \n특기사항 \n생활인성 수업을 통해 한글 우주의 원리를 담아 가장 단순하고도 배우기 쉬운 한글을 창제하신 세종대왕님께 다시 한번 감사함을 느끼게 되었음. 창체봉사 수업 시간을 통 해 이태석 신부의 영상을 접하고, 참된 봉사에 대해 생각해 보는 계기를 가짐. 진정한 봉사는 개인 더 나아가 사회를 변화시킬 수 있다는 힘이 있다는 것을 알게 되었다는 자 신의 생각을 정립함. 이를 계기로 도덕윤리에 대해 깊이 알아보았으며, 인큐베이터 속 아기 환자를 매일 진심으로 돌보는 간호사의 사례를 찾아보면서 간호란 무엇이며 간호 사가 가져야 하는 봉사정신에 대해 생각해 봄. 1학기 학급 체육 담당으로서 하급의 방 역물품을 잘 관리하였으며, 중간중간 학급 환기를 해주어 건강한 학교생활이 가능하도 록 도움. \n(과학재능기부반) (13시간) 다른 학생들이 작성한 카드뉴스를 통해 새로운 정보를 습득 하고 자기계발에 힘씀. 적극적인 태도로 새로운 아이디어를 제시하고 토론을 통해 학 생들 간의 유대감을 증진시킴. 모든 활동에 열정적으로 참여하고 자신의 의견을 적극 적으로 표현함. \n희망분야 간호, 보건 \n간호학과에 대한 관심이 많아 진학 탐색 시간에 다양한 대학을 찾는 활동을 함. 수학 교과가 진학에 중요하다는 것을 알고, 자기 주도 학습을 통해 이를 보완하는 계획, 주 말 등의 시간을 잘 활용하는 계획 등을 진로탐색 보고서를 통해 작성하고 실행하는 모 습을 보임. \n진로활동 \n42 \n학년 \n일자 또는 기간 \n2022. 04. 25. \n2022.05.30. \n봉사활동실적 \n장소 또는 주관기관명 \n(학교)용화여자고등학교 \n(학교)용화여자고등학교 \n활동내용 \n시간 누계시간 \n봉사활동 소양 교육 \n장애 이해교육 \n1 \n1 \n2 \n1 \n2022.07.25. - 2022.08. 01. (개인)북부종합사회복지관 \n초등 여름방학 특강 과학 멘토링 활동 \n3 \nLO \n5 \n2022.09.13. \n2022.10.17. \n(학교)용화여자고등학교 \n(학교)용화여자고등학교 \n봉사활동 소양교육 \n1 \nCo \n6 \n장애 이해교육 \n1 \n7 \n2023. 04.10. \n(학교)용화여자고등학교 \n봉사활동 소양 교육 \n1 \n1 \n2 \n2023.09.04. \n(학교)용화여자고등학교 \n장애 인식 개선 교육 \n1 \n2 \n2023.09.25. \n(학교)용화여자고등학교 \n봉사활동 소양 교육 (환경분야) \n1 \n3 \n3 \n2024.04.15. \n(학교)용화여자고등학교 \n봉사활동 소양 교육(기본) \n1 \n1 \n용화여자고등학교 \n2025년 11월 21일 6/20 반 \n07 \n번호 13|이름 \n주서연 \n(KOR \ngov.kr \n정부24",
    "문서확인번호: 1763-6519-8118-8469 (신청인:주서연) \n봉사활동실적 \n학년 \n일자 또는 기간 \n2024.06.24. \n장소 또는 주관기관명 \n(학교)용화여자고등학교 \n활동내용 \n시간 누계시간 \n장애 인식 개선 교육 \n2 \n3 \n2024.09.02. \n(학교)용화여자고등학교 \n2024.09.30. \n(학교)용화여자고등학교 \n봉사활동 소양교육(환경) \n장애 인식 개선 교육 \n1 \n3 \n1 \n4 \n6. 교과학습발달상황 \n[1학년] \n원점수/과목평균 \n성취도 \n학기 \n교과 \n과목 \n단위수 \n석차등급 \n비고 \n(표준편차) \n(수강자수) \n국어 \n국어 \n4 \n95/85.3(9.3) \nA(239) \n2 \n수학 \n수학 \n69/70.7(14.3) \nC(239) \n5 \n영어 \n영어 \n4 \n58/72.0(19.6) \nE(239) \nCO \n6 \n한국사 \n한국사 \n3 \n83/77.6(15.3) \nB(239) \nсл \n5 \n사회(역사/도덕 \n통합사회 \n4 \n83/82.2(9.7) \nB(239) \n5 \n1 \n포함) \n과학 \n통합과학 \n4 \n52/64.0(22.1) \nE(239) \n6 \n과학 \n과학탐구실험 \n1 \n98/83.6(13.2) \nA(239) \n기술.가정/제2 외국어/한문/교 양 \n기술·가정 \n2 \n76/68.5(14.7) \nC(239) \n국어 \n국어 \n4 \n88/83.9(10.7) \nB(237) \n5 \n수학 \n수학 \n81/72,0(16.0) \nB(237) \n4 \n영어 \n영어 \n67/72.4(20.7) \nD(237) \n5 \n한국사 \n한국사 \n3 \n78/76.5(17.5) \nC(237) \n5 \n사회(역사/도덕 \n통합사회 \n4 \n89/80.6(11,6) \nB(237) \n4 \n2 \n포함) \n과학 \n통합과학 \n79/65,2(20.2) \nC(237) \n과학 \n과학탐구실험 \n1 \n98/84.7(15.7) \nA(237) \n기술.가정/제2 \n외국어/한문/교 기술·가정 양 \n2 \n58/63.4(17.7) \nE(237) \n6 \n이수단위 합계 \n52 \n용화여자고등학교 \n2025년 11월 21일 7/20 반 \n07 \n번호 \n13 이름 \n주서연 \n이 \ngov.kr \n정부24",
    "문서확인번호: 1763-6519-8118-8469 (신청인:주서연) \n과목 \n세부능력 및 특기사항",
    "국어: 항상 진지한 태도로 성실하게 수업에 집중하는 학생이며, 심화 적용 문제를 많이 풀어보며 깊이 이해하기 위해 노력하 는 학생임. 부정적인 언어 사용이 화자와 청자에게 미치는 영향에 대해 학습하고 긍정적인 말을 담아 10년 후 나에게 편지를 쓰고 발표함으로써 긍정적인 언어의 효과를 직접 느껴봄. 바람직한 의사소통 문화 발전을 위해 차별이나 비하하는 말은 사용 하지 말아야 하며, 상대방을 배려하고 존중하는 말하기가 중요하다는 것을 학습함. 요즘 새롭게 쓰이는 신조어에 대해 알아 보고, 신조어를 사전에 올린다고 가정하고 뜻풀이를 작성하는 활동에 적극적으로 참여함. 평소 자신의 언어생활을 돌아보고 기본적인 언어 규범을 준수하는 것이 중요함을 학습함. \n고전소설 성춘향전을 현대적으로 재창작하여 영상으로 제작하는 모둠활동에서 모둠 기깔나조의 모둠장, 연출, 자료조사, 대 본 제작, 촬영, 소품준비, 발표 대본 작성, 배우 이몽룡 역할 등을 맡아 솔선수범하는 자세로 리더십을 나타내었으며, 모둠에 서 완성한 영상을 발표하는 시사회 활동을 주도함. \n진로 탐색하기 독서 활동으로 빅데이터와 데이터 과학(박성현, 박태성, 이영조)을 읽고 빅데이터와 비즈니스 플랫폼의 발전 부 분에 깊은 인상을 받음.",
    "수학: 수업에 대한 집중도와 참여도가 높아 긍정적인 수업분위기를 형성하는데 큰 역할을 함. 수업활동 중 집합의 서로소 관 계를 명확하게 이해하고 있어 두 개가 동시에 일어날 수 없는 경우의 수의 합의 법칙 개념과 연계시켜 이해하려는 태도를 보 며 수학 내적 창의융합능력이 있어 보였음. 발표 수업시에 늘 자신감이 넘치는 우렁찬 목소리로 출제의도와 개념설명을 조리 있고 깔끔하게 설명하였고, 2차함수의 위치관계를 설명하면서 부등식 관계로 재해석하여 문제풀이과정을 능숙하고 여유롭게 설명하는 모습에 수학적 기초가 탄탄하고 해석과 분석능력이 우수하다고 생각함. 또한, 부등식 문제 설명을 절댓값 그래프 를 이용하여 재구성하는 모습도 보여줌. \n심화주제발표시 함수의 기원과 현대적 정의에 대해 관심을 갖고 조사하여 ppt를 제작 발표 하였고, 함수의 다양한 일상 속에 서의 유용성, 함수와 그래프 관계, 발전된 수학 등에 많은 지식을 알게 되어 다양한 함수에 대한 호기심을 갖게 되었고 수학 학습에 열정과 관심을 더욱 심화 시켰음.",
    "영어: 수업 시간에 적극적으로 참여하였으며 교과서 어휘와 본문을 암기하고 문장을 반복해 쓰면서 문장 구조를 파악하고 이 해하면서 영어 성적 향상을 위해 꾸준히 노력함. 창의력을 최대한 발휘하고 상상한 것을 실현하기 위해 미래 과학 기술을 이 끌어 갈 컴퓨터 엔지니어링과 소프트웨어 분야에서 일하는 연구원이 되고 싶다고 'My Dream'이라는 프레젠테이션을 통해 영어로 발표함.",
    "한국사: 한국사 시간에 열의를 가지고 성실히 참여함. 수업내용의 심화학습을 위해 고대사회의 종교와 사상, 식민지시기 도 농의 변화와 신사상의 수용에 대해 교과서를 토대로 학습활동지를 성실하게 작성함. 고려시대 여성의 지위를 학습하면서 현 대사회에 주는 함의와 성역할의 사회성에 대해서 짧은 보고서를 작성함. 농민에서 솔거노비로 전락하였다가 사회변동을 목도 하며 다시 신분상승을 꿈꾸는 인물의 심리를 잘 표현한 조선시대 신분별 가상일기를 작성함. 모둠별 주제발표에서 조선사 전 체의 맥락에서 본 흥선대원군의 개혁정치라는 주제로 조선조 전반에 이어진 재정과 국방정책의 지속된 모순과 대원군이 펼친 개혁의 의의를 탐구함. 자료조사를 맡아서 고종대는 물론 조선조 전반의 흐름에 대해 폭넓게 조사하고 최신연구들을 소개하 여 발표에 기여함. 어떤 개혁정책도 시대적 한계를 가질 수 밖에 없음을 깨달음. 한국현대사관련 영화감상 활동에서 인천상 륙작전을 감상하고 보고서를 작성함. 극중 인물들의 생각과 감정에 공감하며 중대한 정책결정을 내린 인물부터 시작해서 수 없이 많은 인물들이 다양한 사정과 동인으로 역사를 만들어간다는 점을 통해 역사는 다층적이며 세심한 이해를 필요로 한다 는 점을 깨달음. \n통합사회 : '도시문제 해결을 위한 아이디어 제시하기'라는 주제로 실시한 조별 토론 및 발표수업에서 닭백숙조의 아이디어 제 시 및 발표 대본을 맡아 골목길의 범죄와 교통사고를 예방하는 방안으로 블랙박스가 탑재되어 있고 애플리케이션을 이용해서 위급상황이 발생하면 자동으로 구조요청이 되는 기능을 갖춘 스마트가로등을 소개하였는데 시각적 효과를 높인 PPT와 차분 \n용화여자고등학교 \n2025년 11월 21일 8/20 반 \n07 \n번호| 13 |이름 \n주서연 \ngov.kr \n정부24 \n과목",
    "문서확인번호: 1763-6519-8118-8469 (신청인:주서연) \n세부능력 및 특기사항 \n한 자세로 정성을 다해 발표한 모습이 보기 좋았음. \n2학기 협력적 독서활동 관련 수행평가에서 '아픔이 길이 되려면'이라는 책을 읽고, 부조장의 역할을 맡아 조장과 함께 독서토 론 진행 등 활동 전반에 적극적으로 참여함. 독서토론 활동에서 조원들과 협력하여 책을 읽게 된 점이 좋았던 반면 방학동안 조원들 간의 일정에 맞춰 온라인 상의 중간 회의를 개최하는 것이 힘들었다는 소감을 밝힘. 1학기 인권, 2학기 정의 관련 신 문 스크랩 활동에 성실히 참여하여 사회 현상에 대한 이해력 및 비판적 사고력이 향상됨. \n'디지털 시대에 따른 변화'라는 주제로 플랫폼 경제는 인공지능에 의해 분석되고 공공재의 성격을 띠게 된다고 설명함. 자국 플랫폼을 보유한 나라들이 새로운 산업에도 쉽게 진입할 수 있어 나라 간의 빈부격차가 발생하는 현상을 살펴봄.",
    "통합과학: 물리 시간을 통해 배운 중력과 자연현상이 생명 시스템에 주는 영향에 대해 알아보기 위해 생명과학의 심화학습 발표수업에서 '중력이 생명시스템에 미치는 영향'을 주제로 자료를 조사하고 학습하여 발표함. 중력이 동식물과 인체에 미치 는 영향을 소개하였으며 이 과정에서 중력과 생물의 진화의 연관성에 대해서도 생각해보는 기회를 가짐. 물리, 화학, 생명 분 야 등의 다양한 과학 분야에 두루 관심이 있고 흥미를 가짐. 영화 앤트맨을 소재로 하여 앤트맨의 능력인 원자핵과 전자 사이 의 빈 공간을 조절하는 것이 현대과학에서 불가능한 이유를 양자역학의 전자의 입자성과 파동성과 연관지어 발표함. 전자는 파동성이 있기에 정상궤도를 지나지만 미시세계에서는 확률적으로 존재함을 설명함. 1학기 동아리 실험과 연관 지어 전자의 입자성과 파동성을 밝힌 이중슬릿 실험에 대해 소개함. 현대과학으론 파동을 갖고 움직이는 전자의 위치를 파악할 수 없는 이 유를 제시하는 과정을 통해 여러 과학 원리를 스스로 찾아보고 조사하며 궁금증과 흥미를 가지게 됨. 지구과학 심화발표에서 '우주에서 가능한 물리현상'이라는 주제로 지구와 다른 환경인 우주에서 가능한 특별한 물리현상들에 대해 조사하여 발표함.",
    "과학탐구실험: 학교 주변에서 일어나는 충돌 사고에 대해 알아보고 안전사고예방을 위한 포스터를 제작함. 다양한 재료들을 이용하여 입체적으로 제작하였으며 운동량과 충격량에 대한 개념을 이해하고 과학적 원리를 설명에 포함하여 단순히 포스터 제작에만 그친 것이 아니라 수업 시간에 배운 물리학적 내용을 상기하여 과학 포스터를 제작함. 인디고카민 용액, 포도당, 수 산화나트륨 용액을 이용해 물질의 산화, 환원 반응 실험을 진행함. 실험을 통해 우리 주변의 산화, 환원의 예로 철의 부식, 표 백제를 이용한 섬유 표백, 과일의 갈변 등을 토론을 통해 확인함. \n(1학기)기술·가정 : 가족관계에 대한 중요성을 잘 이해하여 가족이 가지는 소중한 가치, 가족간의 의사소통과 갈등 해결능력 을 습득하여 건강한 가족관계를 형성할 수 있는 방법에 대해 친구들과 토론함. \n(2학기)기술·가정 : 첨단과학 기술의 활용 단원을 배우면서 주거환경의 변화, 액티브하우스와 패시브 하우스의 차이점, 융 합, 태양광 발전, 태양광 발전의 원리인 광전 효과, 제로에너지 하우스, 신재생 에너지에 대해 관심을 갖고 자료를 심도있게 조사해 프리젠 테이션을 제출함. 첨단 과학기술의 활용 단원과 물리를 연관지어 이해하고 조사함. \n<진로 선택 과목> \n성취도 \n성취도별 \n학기 \n교과 \n과목 \n단위수원점수/과목평균 \n비고 \n(수강자수) \n분포비율 \n이수단위 합계 \n과목 \n해당 사항 없음 \n<체육·예술> \n세 부 능력 및 특기사항 \n용화여자고등학교 \n2025년 11월 21일 9/20 반 \n07 \n번호 \n13 이름 \n주서연 \n(KOR), \ngov.kr \n정부24",
    "문서확인번호: 1763-6519-8118-8469 (신청인:주서연) \n학기 \n교과 \n과목 \n단위수 \n성취도 \n비고 \n체육 \n체육 \n2 \nB \n1 \n예술 \n체육 \n음악 \n체육 \n2 \nB \n2 \nA \n2 \n예술 \n미술 \n2 \nA \n이수단위 합계 \n8 \n과목 \n세부능력 및 특기사항",
    "체육: 배구 스윙에서 손목을 활용하여 원하는 곳으로 스윙 할 수 있음. 리그전에서 팀원들 간의 협동을 통한 공동체 역량을 발휘하여 팀의 안정적인 경기운영에 기여했으며, 심판, 기록원, 아나운서 등의 비선수 역할을 수행하며 규칙을 이해하고 공 정하게 경기를 운영함. 근방추의 민감도가 매우 낮아 햄스트링 스트레칭에 매우 효율적인 움직임을 보임. 배구 스킬첼린지에 서 끝까지 포기하지않고 언더와 오버핸드토스를 수행하는 모습을 보여주었으며 조별 리그전에서 헌신적인 플레이로 팀 동료 들의 사기를 높여줌. 멀리뛰기를 효과적으로 수행하는 방법을 잘 알고있으며, 자신이 목표한 거리를 뛰어넘기 위한 도전정신 이 뛰어남. 배구 서브에서 하체의 각도가 좋고 엄지손가락의 힘을 잘 컨트롤하여 서브를 수행하며, 스파이크 수행시 타점과 손목의 임팩트가 좋아 배구공이 날아가는 궤적이 매우 일관됨. 또한 경기에서 심판의 역할을 충실히 이행하며 규칙을 이해하 고 공정하게 경기를 운영함.",
    "음악: 오페라와 뮤지컬 수업을 통해 오페라의 종류에 대하여 지식을 습득함. 모차르트 감상 비평문을 읽어보니 천재성을 인 정받아 성공적인 음악 생활을 하였으나 갑작스런 열병으로 요절한 음악가 모차르트의 다양한 음악을 경험하는 계기가 되었음 을 감상문에 잘 기재함. 아 목동아 악보 사보 시 가사 창작을 통해 표현력의 향상과 창작의 성취감을 경험함. 엘가 사랑의 인 사를 듣고 영국음악의 특징에 대하여 이해함. 악기 연주 하는 수업 시 학급교우와 포핸즈 연주를 통해 서로 배려하는 모습을 보여주었음.",
    "미술: <디자인> 포스터컬러의 혼합으로 다양한 색채를 얻어 낼 수 있으며 원과 삼각형의 반복으로 직선과 곡선의 율동미를 표 현함. 다양한 색으로 채색하고 쉬프팅 기법으로 명도의 변화를 효과적으로 표현함. \n[2학년] \n원점수/과목평균 \n성취도 \n학기 \n교과 \n과목 \n단위수 \n석차등급 \n비고 \n(표준편차) \n(수강자수) \n국어 \n문학 \n92/80.7(17.2) \nA (223) \n4 \n수학 \n수학 I \n68/65.2(25.4) \nB(223) \n5 \n수학 \n확률과 통계 \n2 \n54/55.4(21,5) \nC(162) \n5 \n영어 \n영어 I \n3 \n70/66.4(22.5) \nC(223) \n5 \n1 \n과학 \n물리학 I \n2 \n41/56.3(22.1) \nD(60) \n6 \n과학 \n화학 I \n2 \n60/61.1(17.1) \nC(116) \n5 \n과학 \n생명과학 I \n2 \n75/68.1(19.1) \nB(117) \n5 \n과학 \n지구과학I \n2 \n76/60.0(23.7) \nB(104) \n4 \n용화여자고등학교 \n2025년 11월 21일 10/20 반 \n07 \n번호 \n13 이름 \n주서연 \n(KOR), \ngov.kr \n정부24",
    "문서확인번호: 1763-6519-8118-8469 (신청인:주서연) \n학기 \n교과 \n과목 \n단위수 \n원점수/과목평균 (표준편차) \n성취도 \n석차등급 \n비고 \n(수강자수) \n기술.가정/제2 \n1 외국어/한문/교 \n양 \n중국어 I \n3 \n72/80.7(15.4) \nB(90) \n7 \n국어 \n독서 \n4 \n96/79.6(19.5) \nA(220) \n3 \n수학 \n수학II \n4 \n83/61.1(27.0) \nA(220) \n4 \n수학 \n확률과 통계 \n2 \n59/53.5(26.3) \nC(159) \n5 \n영어 \n영어 I \n3 \n55/61,2(25.5) \nE (220) \n5 \n과학 \n물리학 I \n2 \n56/59.9(26.4) \nC(60) \n5 \n2 \n과학 \n화학 I \n2 \n52/58.6(23.7) \nC(114) \n5 \n과학 \n생명과학 I \n2 \n60/60.8(22.0) \nC(115) \n5 \n과학 \n지구과학I \n2 \n80/55.4(27,2) \nA(103) \n4 \n기술.가정/제2 외국어/한문/교 양 \n중국어 I \n3 \n68/74.1(21.9) \nB(90) \n6 \n이수단위 합계 \n과목 \n48 \n세부능력 및 특기사항",
    "독서: 인문, 예술, 사회, 문화, 과학, 기술, 문학 등 다양한 분야의 고유한 가치를 탐구하고 자신의 관심사를 넓히며 다양한 분야의 책을 균형 있게 독서를 함. 신상영의 안전한 마을 만들기를 읽고 기억과 함께 배워보는 주민들의 노력을 주제로 글쓰 기 활동을 함. 안전한 마을을 만들기 위해서는 지자체와 정부뿐만이 아니라 주민들의 협조, 자발적이고 조직화된 참여가 필 요함을 제시함. 다양한 장르의 책을 읽으며 균형이 있는 독서 습관을 기르기 위해 노력하는 자세가 돋보임. 독서 목표를 세우 고 그에 맞는 책을 선택해 읽는 것을 습관화하여 균형 있는 독서 습관을 형성하기 위해 노력함.",
    "문학: 문학 작품에 드러난 인생의 가치와 의미를 파악하여, 이를 자신의 삶 및 타인의 삶과 관련지어 설명하는 독서 활동을 함. 이생규장전과 운영전을 읽고 공통점과 차이점을 체계적으로 비교하여 정리하고, 이 두 작품을 시대상과 관련된 고전소 설 속 여성 인물들의 모습을 중심으로 비교, 분석하여 보고서를 제출함. 작품 개밥바라기별을 읽고 PPT를 제작하여 작품에 대한 전반적인 해설을 발표함. 작가 소개, 줄거리, 특성 등을 중심으로 발표함. 작품에 대한 전반적인 이해도가 매우 높음. 문 학 작품의 구성 요소들과 전체 사이의 유기적 관계를 구체적으로 이해하여 창의적 문학 활동을 함. 자신의 생각을 논리적이고 명확하게 서술하는 능력이 뛰어나며 진지하고 성실한 자세로 수업에 임함. 교과서 필기 정리를 잘하며 읽은 글의 내용을 논 리정연하게 요약정리를 잘함. \n수학 I: 분수의 성질과 인수분해를 이용한 2가지 방법으로 거듭제곱이 있는 식의 계산 과정을 보여주며 지수법칙을 이용하 여 정확하게 도출하고 그 과정을 설명함. 시그마의 성질을 이용하여 주어진 식의 값을 구하는 과정을 자세하게 발표하며 친구 들의 큰 호응을 얻음. \n지수와 로그의 방정식, 부등식 문제를 해결하여 퍼즐을 완성하는 모둠활동에 적극적으로 참여했으며 계산 실수를 줄이고자 스스로 노력하는 모습이 인상적임. 컴퓨터 기하 프로그램을 활용한 삼각함수의 그래프 탐구활동에서 삼각함수의 그래프 개형 이 변수에 따라 무엇이 달라지는지를 살펴보며 그래프의 특징을 정리함. \n용화여자고등학교 \n2025년 11월 21일 11/20 반 \n07 \n번호| 13 |이름 \n주서연 \ngov.kr \n정부24",
    "문서확인번호: 1763-6519-8118-8469 (신청인:주서연) \n과목 \n세 부 능력 및 특기사항 \n주제 탐구활동에서 수열의 귀납적 정의를 배우면서 궁금했던 재귀 알고리즘을 주제로 탐구함. 재귀 알고리즘에 대해 개념과 다양한 사례를 찾아보며 정확하게 이해할 수 있었고, 코딩 언어로 표현해 보는 것이 쉽지 않았지만 재귀 알고리즘을 이용하여 \n코딩 프로그램을 만들어 보고 싶다는 포부를 밝힘. \n수학II: 수업 활동에 참여하여 최선을 다하는 모습을 보이는 학생임. 활동을 하면서 수학에 대한 관심이 높아지고 더 잘하고 싶은 의지를 보임. 기본 개념 습득뿐만 아니라 교과서 문제를 반복적으로 풀어보며 열심히 하는 모습이 기특함. 주어진 조건 에서 함수의 그래프 개형을 알고 방정식의 서로 다른 실근의 개수가 4개가 되도록 하는 조건을 추론하여 정답을 찾아가는 과 정을 자신감 있게 발표함. 나도 출제자 활동에서 정적분의 활용과 관련된 문항을 직접 출제하고 모범답안을 작성함. 곡선과 직선으로 둘러싸인 도형의 넓이에 대한 최솟값을 구하는 문제를 출제함으로써 정적분과 산술기하평균의 다양한 수학적 개념 을 적용하여 해결하는 경험을 친구들에게 제공함. 다른 친구들이 출제한 미분과 적분에 관한 여러 가지 유형의 문제를 풀어보 면서 관련 개념을 더욱 정확하게 인지하고 융합적으로 사고할 수 있는 기회를 가짐. 이차함수와 x축으로 둘러싸인 도형의 영 역을 그림으로 이해하고 도형의 넓이를 구하는 과정을 친구들과 함께 유도하며 공식으로 정리하는 활동에 참여함. \n확률과 통계: 확률분포표 작성을 위한 실생활 자료의 분석과 해석 능력이 우수하며, 경우의 수와 확률을 적용하여 관계를 찾 아 확률분포표를 구체화하여 확률밀도함수와 기호, 수학적 용어를 사용하여 간단명료하게 표현하고, 평균과 표준편차를 산출 하며 그 의미를 잘 해석할 줄 앎. \n9 \n문제 해결과 관련하여 자기 생각을 잘 표현하며, 주변의 의견을 잘 반영하여 새로운 해결책을 추구하는 의지와 자기관리 역량 이 우수함. \n중단원 문제풀이 시간에 확률의 곱셈정리를 이용한 문제를 그림으로 도식화하여 알기 쉽게 표현하여 학생들에게 이해도를 높 였으며, 기본 해법 이외 다른 해법도 제시하며 문제 해결하는 모습에서 뛰어난 발표능력과 소통하는 능력을 엿볼 수 있었음. 자유 심화주제 발표 시간에 정규분포의 실생활 활용에 관해 관심이 생겨 조사 활동을 하고 ppt를 제작, 발표함. \n정규분포는 많은 자연현상과 사회적 데이터가 따르는 패턴으로 이 결과를 분석, 종합하여 미래 현상을 예측하는 도구이며, 예시로 학생들의 시험점수, 사람들의 키, 기업의 판매 데이터 등에 활용됨을 알게 되었음. \n많은 현상들이 실제로는 규칙적인 통계를 따르게 되어 그래프나 도표로 표현이 가능해지므로, 이를 정확하게 이해하고 분석 이 필요함을 깨달음. \n영어 I: 영어에 관심이 있으며 영문판 Jane Eyre (제인에어)를 읽고 보고서를 제출함. 번역판이 아닌 원서를 읽으면서 문학 관련 영어문장 구성과 어휘를 접할 수 있었고 좀 더 일상적인 영어를 습득할 수 있는 기회를 갖고 실력 향상을 위해 노력함. 3분 스피치 시간에 'Into the World of Computer Engineering' 라는 주제를 발표함. 평소 관심 분야인 컴퓨터 공학의 역사, 가능성, 장점 등을 PPT 자료를 활용하여 이해하기 쉬운 영어로 설명하고 발표함. 수행평가 시 인터뷰에서 유창한 발 음으로 자신을 소개함. 매일 일정하게 영어 어휘를 익히고 구문파악을 통해 영어 실력 향상을 위해 노력함. \n물리학 I: 수업 시간에 마찰력에 대한 학습을 한 후 학교에서 신발을 신고 미끄러질 뻔한 순간이 자주 있어서 과연 어떤 신발 을 신어야 덜 미끄러질 수 있는지 궁금증을 갖고 마찰력 공식을 이용하여 마찰력을 측정해 보는 실험을 진행함. 실험 결과 마 찰력에 영향을 주는 요인으로 신발의 종류와는 관계없이 신발 밑창 재질과 문양에 영향을 받는다는 것을 알게 되었으며 슬리 퍼가 가장 많이 미끄러졌으므로 EVA 재질에 문양이 거의 없는 밑창이 마찰력이 가장 약하며 고무재질에 무늬가 많은 밑창을 가진 장화가 마찰력이 가장 강하다는 점을 알게 됨. 마찰력은 접촉면 거칠기 (마찰계수), 무게(수직항력)에 비례하므로 수직 항력을 일정하게 만들고 동일한 경사면을 사용하여 다른 예외 없이 마찰계수의 영향만을 받아 신발 밑창에 따른 마찰력의 차 이를 계산해 보는 활동을 진행하여 실험을 할 때 변인통제의 의미를 알고 수행하는 모습에서 과학적 탐구능력이 향상됨. 또한 \nMBL을 이용한 운동량 보존 실험에서 거리와 시간 관계 그래프를 이용하여 속도, 가속도 값을 분석하고 미분, 적분을 활용 하여 조건을 변화시켜가며 원하는 물리량을 얻는 등 데이터를 분석하는 활동에서도 오차를 고려하고 실험을 수행함. \n용화여자고등학교 \n2025년 11월 21일 12/20 반 \n07 \n번호| 13 |이름 주서연 \ngov.kr \n정부24",
    "문서확인번호: 1763-6519-8118-8469 (신청인:주서연) \n과목 \n세 부 능력 및 특기사항 \n화학I: 수업에 대한 집중력이 높고 교사의 발문에 적극적으로 대답하며 수업 내용에 대해 자신이 이해한 부분을 친구들에게 가르쳐주며 수업을 이끌어감. 물질의 양을 몰 개념으로 표현하는 데 능숙하며, 몰 농도에 대한 이해를 바탕으로 0.1 M 황산 구리 수용액을 정확한 절차대로 제작함. 지시약을 이용해 식초에 포함된 아세트산의 농도를 정확하게 측정하고, 해당 결과를 활용하여 식초 속 아세트산의 함량을 계산해 보고서에 작성함, 역동적인 화학 반응 단원에서 산화 환원 반응에 대해 학습한 후, 이론적인 지식을 실험을 통해 확인하고자 산화 환원 반응이 이용되는 은거울 반응 실험을 준비함. 탐구를 수행하며 반응 과정의 영상을 찍는 역할을 맡아 수행함. 실험 과정에서 퍼센트 농도로 표현되어 있는 용액을 몰 농도로 환산하여 정확한 양 을 맞춰야 할 때 교과 시간에 배운 몰 농도 개념을 이용하는 등 개념을 능숙히 응용할 줄 아는 학생임. 은 이온이 환원되고, 알데하이드가 산화되며 은거울 반응이 진행된다는 사실을 조사하여 실험을 통해 얻은 결과와 함께 보고서를 작성함. \n생명과학I: 효소의 특징을 이해하고 일상생활에서 효소가 이용되는 사례를 찾아서 정리하고 콩즙이 암모니아로 분해될 때 사용되는 '유레이스 효소'를 찾는 과정을 통해 과학적 사고 능력을 확산함. '콩즙으로 요소 분해하기' 실험을 진행을 할 때 모 둠 협력 활동이 우수하며 집중력이 뛰어나 모둠원들과 함께 실험 개요를 작성하고 준비하는 과정 및 효소의 활성에 대한 내용 을 정리하는 과정에서 주도성, 협력 및 리더십을 함께 보임. 좀개구리밥 개체군의 생장과 pH와의 관련성에 대한 가설을 세우 고 생장곡선을 그리는 활동을 수행함. 실험 설계에서 조작 변인과 통제 변인을 설정하고 개체군의 생장과 환경 저항을 연결 지어 실제적 생장곡선이 그려지는 활동지를 작성함. \n지구과학I: 지구과학 스터디 그룹을 결성하여 10회에 걸쳐 공동 학습을 진행함. 단원별 핵심 주제를 구분하여 책임자를 정 한 후 집중 탐구하여 학습 내용을 심화하였고 그 결과를 다른 팀원들에게 강의식으로 전달하며 학습 효율을 높였음. 이 과정 에서 학습 내용의 체계화와 전달 능력, 책임감이 증진되었고 학습에 대한 자신감을 갖는 계기가 되었으며 어려운 기출 문제 를 함께 해결하며 협력 학습을 통해 협동심이 증진되었음. \n베니오프대와 해령, 열점에서 생성되는 마그마의 특성 차이 및 생성 원리를 잘 비교하였고 깊이에 따른 지각과 맨틀의 온도 및 압력 그래프상에서 온도 상승, 압력 감소에 따라 마그마가 생성되는 물리량의 변화, 물의 유무에 따른 맨틀 용융 온도 변 화원리를 이해하는 과정에서 분석력이 돋보였음. \n중국어 I: 중국 주제 탐구 활동에서 '지금은 중국을 읽을 시간 1'이라는 책을 읽고 중국 대입 시험에서 드론을 활용해 부정행 위를 감시한다는 내용이 흥미로웠다고 함. 평소 컴퓨터 공학에 관심이 많아 드론에 활용된 공학 기술에 대해 자세히 알고 싶 다고 했으며, 중국의 컴퓨터 공학 기술의 발전 정도가 커서 놀랐다고 함. \n중국 온라인 사업 기획 활동에서 '지금은 중국을 읽을 시간 2'라는 책을 읽고 중국인이 좋아하는 한국 드라마에 대해 조사하 여 선호하는 이유에 대해 활동지에 글로 표현함. 한국의 식품인 김을 수출하고 싶어 하며, 한국 드라마에서 김을 먹는 장면을 \n연계하여 홍보하고 싶어 함. \n원어민 교사와 함께 하는 수업 시간에 즐겁게 참여하려고 노력하는 모습을 보임. 중국어 인사말, 음식, 날짜, 시간 등 다양한 표현을 연습함. 중국 명절, 음식, 숫자 등 중국 문화를 이해하고자 노력함. 중국 전지 공예 작품을 열심히 만듦. \n<진로 선택 과목> \n성취도 \n성취도별 \n학기 \n교과 \n과목 \n단위수원점수/과목평균 \n비고 \n(수강자수) \n분포비율 \n기술·가정/ 1 제2외국어/한 문/교양 \n인공지능과 미 래사회 \n1 \n96/92.4 \nA(28) \nA(96.4) B(3.6) C(0.0) \n용화여자고등학교 \n2025년 11월 21일 13/20 반 \n07 \n번호 13 이름 \n주서연 \ngov.kr \n정부24",
    "문서확인번호: 1763-6519-8118-8469 (신청인:주서연) \n성취도 \n성취도별 \n학기 \n교과 \n과목 \n단위수원점수/과목평균 \n비고 \n(수강자수) \n분포비율 \n2 \n기술·가정/ 제2외국어/한 문/교양 \n인공지능과 미 래사회 \n1 \n94/95.9 \nA(28) \nA(96.4) B(3.6) C(0.0) \n이수단위 합계 \n과목 \n2 \n세부능력 및 특기사항 \n(1학기) 인공지능과 미래사회: 인공지능이 발전하는 사회에서 데이터의 활용과 예측이 중요하다는 점을 이해하고 인공지능을 학습 시키는 빅 데이터의 효율적인 활용 방법에 대해 조사하여 발표함. 그 과정에서 데이터의 학습과 예측의 중요성에 대해 다시 한번 알게 됨. 학교에서 활용 가능한 인공지능의 아이디어로 교수 학습을 도와주는 인공지능에 대한 아이디어를 제안하 여빅 데이터로 학습한 내용을 바탕으로 개인 별 맞춤형 서비스를 제공할 수 있도록 아이디어를 발표함. \n(2학기) 인공지능과 미래사회: 수업 시간에 배운 내용을 바탕으로 인공지능 기기들에 대해 조사하고 발전 가능성에 대해 고민 하여 정보 기술과 소프트웨어의 발달이 개인의 삶과 사회에 미친 영향과 가치를 진지하게 고민함. 인공지능의 학습 방법과 데 이터의 양에 따라 예측 값의 정확성이 변동 된다는 사실을 파악하고 현실 세계에서 문제 상황을 가정하여 스트레스 지수 간의 \n상관관계 분석에 대한 인공지능 모델을 설계하여 구현하기 위해 노력하는 모습을 보임. \n<체육·예술> \n학기 \n교과 \n과목 \n단위수 \n성취도 \n비고 \n체육 \n운동과 건강 \n2 \nA \n1 \n예술 \n미술 \n3 \nA \n체육 \n운동과 건강 \n2 \nA \n2 \n예술 \n음악 \n3 \nA \n이수단위 합계 \n10 \n과목 \n세부능력 및 특기사항 \n운동과 건강: 농구 경기에서 인원이 부족한 팀이 경기를 할 때 자발적으로 지원하여 더 많은 시합에 참여하는 적극적인 모습 을 보이고 승패를 떠나서 팀원들을 격려하고 매너있는 태도로 수업에 임함. 특히 패드민턴 포, 백핸드 올려치기 수행평가 1 차 시험에서 실수하여 매우 적은 횟수를 기록하였으나 이후 더 열심히 연습하고 집중하여 2차 시험에 최고점을 받는 등 노력 하는 모습이 인상적인 학생임.",
    "음악: 수업시간에 성실히 참여하며 음악에 대한 관심도가 높은 학생임. 기악(피아노) 영역에서는 제재곡 '버터플라이 왈츠'를 바른 자세와 주법을 통해 연주함. 제재곡의 음정, 박자 등 기본적인 음악요소 뿐만 아니라 스스로 곡을 해석하고 이에 맞는 악상기호를 능동적으로 적용할 줄 아는 학생임. 또한, 음악적 프레이징을 고려하기 위해 레가토 페달의 사용법을 익히고 이 를 연습하였으며 친구들과 서로의 연주를 감상하고 이에 대한 조언 등을 나누며 음악적 소통역량을 갖춤. 제재곡 뿐 아니라 다른 곡에도 관심이 생겨 다른 곡을 연주해보는 등 자기주도적으로 연습과정에 참여한 점이 인상적임. 감상 활동에서는 다양 한 시대의 음악을 듣고 시대의 변천에 따른 음악의 특징을 비교하여 학습함. 특히 무소르그스키의 피아노 모음곡 '전람회의 그림'이 저린한 화가 하르트만의 유작 전시회를 보고 작곡한 사실을 알고 음색, 곡의 분위기, 리듬 등을 바탕으로 작곡가의 감정이 어떠한 음악적인 요소를 통해 표현되었는지를 중심으로 해석하고 이에 느낀바를 작성함. \n용화여자고등학교 \n2025년 11월 21일 14/20 반 \n07 \n번호| 13 |이름 \n주서연 \ngov.kr \n정부24 \n과목",
    "문서확인번호: 1763-6519-8118-8469 (신청인:주서연) \n세 부 능력 및 특기사항",
    "미술: 〈회화> 클로드 모네의 '센 강의 만곡부'라는 작품을 선택하여 작가소개와 작품에 대한 발표를 잘함. 원작의 형태를 잘 옮겨 그리고 색채와 붓 터치 등을 세심하게 관찰하여 인상파 화풍을 잘 재현함. 학습 목표를 잘 이해하고 회화적 표현력과 몰 입하는 자세가 좋음. \n[3학년] \n원점수/과목평균 \n성취도 \n학기 \n교과 \n과목 \n단위수 \n석차등급 \n비고 \n(표준편차) \n(수강자수) \n국어 \n언어와 매체 \n3 \n70/64.9(26.0) \nC(141) \n5 \n수학 \n미적분 \n54/65.8(23.7) \nC(113) \n6 \n영어 \n영어II \n3 \n38/48.4(26.1) \nE(220) \n5 \n1 \n기술.가정/제2 \n외국어/한문/교 양 \n심리학 \n2 \nP \nP \n국어 \n언어와 매체 \n3 \n53/55,2(27.6) \nE(142) \n5 \n수학 \n미적분 \n12/49.5(28.3) \nE(113) \n8 \n영어 \n영어II \n3 25/34.3(20,9) \nE (221) \n5 \n2 \n기술.가정/제2 외국어/한문/교 양 \n심리학 \n2 \nP \nP \n이수단위 합계 \n22 \n과목 \n세부능력 및 특기사항 \n언어와 매체: 자신의 의견을 명확하고 논리적으로 전달할 수 있는 학생이며 매번 성실하고 바른 자세로 수업에 임함. 화법, 작문, 문법, 문학 등 국어 영역에 대한 흥미와 성취도가 높음.",
    "미적분: 지수함수와 삼각함수의 곱으로 이루어진 함수에서 부분적분법을 할 때, 동일한 패턴이 반복될 수 있음을 방정식을 이용하여 바르게 이해했으며, 이때 패턴의 규칙성을 이용하여 적분할 수 있음을 확인함. 또한 여러 가지 함수에 대한 치환적 분법을 통해 적분변수를 삼각함수로 치환하여 정적분의 값을 구하는 능력이 뛰어난 학생임. 특히 주어진 함수를 새로운 변수 로 변환하거나 부분적으로 분해하여 적분값을 효과적으로 구하는 능력이 우수함. \n적분을 이용하여 접선의 기울기를 계산하고, 이를 통해 함수의 대수적인 특성과 그래프의 특성을 분석하는 능력이 뛰어남. \n영어 II: 수업참여도가 높아 수업내용과 관련된 질문에 실수를 두려워 하지 않고 해답을 찾을 때까지 대답하는 열의를 보여 줌. 논리력과 어휘력이 풍부하여 까다로운 지문을 제시하더라도 글의 주제를 파악할 수 있으며 영문법에 대한 꾸준한 학습을 바탕으로 글의 구조를 파악하는데도 우수한 자질을 드러냄.",
    "심리학: 수업 시간에 열심히 참여하는 모습을 보임. 자신의 성격 분석 보고서 작성하기 활동에서 긍정적이며 노력하는 성격 임을 교과서 자료를 활용해 찾아내고, 이 성격을 긍정적으로 활용하기 위해 스스로 어떤 목표를 세우고 이를 실천하는 주도성 \n용화여자고등학교 \n2025년 11월 21일 15/20 반 \n07 \n번호 13 이름 \n주서연 \n(KOR \ngov.kr \n정부24 \n과목",
    "문서확인번호: 1763-6519-8118-8469 (신청인:주서연) \n세부능력 및 특기사항 \n을 지니면 더욱 좋은 효과가 있을 것 같다는 자기 분석을 함. 스스로 자기 주도성을 지니기 위해 가져야 할 심리적 자신감을 붇돋는 활동을 탐색하고, 이를 바탕으로 단기, 장기 목표를 세우고 제시하는 연습을 추가로 함. \n<진로 선택 과목> \n성취도 \n학기 \n교과 \n과목 \n단위수원점수/과목평균 \n(수강자수) \n성취도별 \n분포비율 \n비고 \n수학 \n기하 \n3 \n61/74.0 \nB(88) \n수학 \n수학과제 탐구 \n3 \n32/63.1 \nC(134) \nA(50.0) B(29.5) C(20.5) \nA(47.0) B(13.4) C(39.6) \n사회(역사/도 \n여행지리 \n2 \n78/87.1 \nB(28) \nA(71.4) B(28.6) C(0.0) \n덕포함) \n1 \n과학 \n물리학 II \n2 \n52/72.8 \nC(49) \n과학 \n화학II \n2 \n60/73.2 \nB(74) \nA(44.9) B(26.5) C(28.6) \nA(47.3) B(24.3) C(28.4) \n과학 \n생명과학II \n2 \n60/68.4 \nB(87) \nA(50.6) B(12.6) C(36.8) \n과학 \n지구과학II \n2 \n58/64.4 \nC(34) \nA(35.3) B(23.5) C(41.2) \n과학 \n고급 물리학 \n2 \n74/86.4 \nB(11) \nA(63.6) B(36.4) C(0.0) \n수학 \n기하 \n3 \n47/66.2 \nC(88) \nA(34.1) B(28.4) C(37.5) \n수학 \n수학과제 탐구 \n3 \n16/39.8 \nC(134) \nA(29.1) B(9.7) C(61.2) \n사회(역사/도 \n여행지리 \n2 \n84/88.9 \nA(28) \nA(85.7) B(10.7) C(3.6) \n덕포함) \n2 \n과학 \n물리학 II \n2 \n100/95.8 \nA(49) \nA(95.9) B(0.0) C(4. 1) \n과학 \n화학II \n2 \n52/81.2 \nC(74) \nA(66.2) B(1.4) C(32.4) \n과학 \n생명과학II \n2 \n75/82.0 \nB(87) \nA(48.3) B(44.8) C(6.9) \n과학 \n지구과학II \n2 \n69/80.1 \nB(34) \nA(61.8) B(23.5) C(14.7) \n과학 \n고급 물리학 \n2 \n74/76,2 \nB(11) \nA(9.1) B(90.9) C(0.0) \n이수단위 합계 \n36 \n과목 \n세부능력 및 특기사항",
    "기하: 수학에 대한 큰 관심과 흥미를 가지고 있으며, 문제 해결에 대한 끈기와 열정적인 학습 태도를 보임. 사분면 상의 점을 원점과 이은 벡터를 주어진 벡터를 이용하여 표현하는 과정을 벡터의 개념과 연산을 활용하여 체계적으로 풀어낼 수 있음. \n수학과제 탐구: 학습태도가 바른 학생으로 수학과제탐구를 통해 알고 있는 개념을 수학 문제에 적용해서 해결하는 능력을 기 름.",
    "여행지리: 수업에 성실히 참여하고 다양한 활동과 발표에 적극적으로 임함. '우리나라의 다양한 여행지와 특산물'을 주제로' 군산 지역'에 대해 조사함. 군산의 지리적 위치와 화교의 유입이라는 역사적 사실을 바탕으로 '군산에 짬뽕이 유명한 이유'를 \n용화여자고등학교 \n2025년 11월 21일 16/20 반 \n07 \n번호| 13 |이름 \n주서연 \ngov.kr \n정부24 \n과목",
    "문서확인번호: 1763-6519-8118-8469 (신청인:주서연) \n세부능력 및 특기사항 \n논리적으로 추론하고 발표함. '교통수단과 여행'을 주제로 운송비 그래프를 다양한 교통수단의 특징과 연결지어 분석함. 또 한, 다양한 기후 지역 그래프를 분석하였고, 강수량과 기온을 바탕으로 해당 지역주민의 삶을 추론하여 글로 서술함. 각 그래 프에 대한 분석은 타당했고, 각각의 수치 값들이 어떤 의미를 나타내는지 알고 있는 학생임을 알 수 있었음. '동네 심상지도' 를 그리고, 자신의 지역을 소개하는 '여행 상품'을 제작함. 지도를 그리며 조망 능력과 정향 능력 등, 공간 능력을 적절히 사 용하려는 모습을 보임. 여행 상품을 제작하며 다양한 지도와 자료를 조사하였고, 자료 사용에 있어 객관성과 신뢰성을 철저 히 확인함. 영화 '라스트 홀리데이 (웨인 왕 감독)'을 보고, 여행의 소중함을 깨달았다고 소감을 밝혔으며, 여행을 통해 내적 성장을 이뤄내고자 다짐하는 모습을 보임. \n물리학 II: 물리학에 대한 이해를 높이기 위해 '10대에게 권하는 물리학 (이강영)'을 읽음. 고대의 자연철학부터 뉴턴의 만유 인력의 법칙으로 대표되는 고전물리학, 그리고 현대물리학에 이르기까지 물리학의 발전 과정을 살펴보면서 각 이론의 핵심 내용을 흥미 있게 이해할 수 있는 계기가 됨. 특히 아인슈타인의 상대성 이론이 갈릴레이의 상대성 원리와 맥스웰 방정식 등 여러 원리와 이론을 거쳐 발전해 왔다는 것을 알게 됨. 또한 물리학을 통해 과학적 사고에 꼭 필요한 환원적 사고방식을 배울 \n수 있다는 점에 깊은 인상을 받음. 전기 회로의 원리를 이해하고 직류 회로에서 저항의 연결 방식에 따라 전류와 전위차를 측정하며 전기 에너지를 정확히 산출함. 전기장을 배우면서 검전기를 대전하여 실험을 성공적으로 수행하고 정전기 유도와 유전분극의 개념을 경험적으로 익힘. \n화학II: 촉매가 생명 현상이나 산업 현장에서 중요한 역할을 하는 예를 찾을 수 있음. 화학 전지의 작동 원리를 산화환원 반 응으로 설명할 수 있음. \n생명과학II: 양파 세포의 삼투압 모의 실험을 통해 식물은 동물과 다르게 세포벽이 있어 저장액과 고장액에서 동물과 다른 양상을 보인다는 것을 이해하게 되었고, 농도가 서로 다른 동물의 삼투압을 비교할 수 있게 됨. 유전자 형질 발현 모의 실험 을 통해 유전자의 흐름을 알게 되었고, 유전자의 방향성은 5탄당의 탄소 번호가 기준이라는 것을 이해하게 됨. \n지구과학II: 지구를 구성하는 다양한 광물의 종류를 알고, 각 광물의 물리적 특징에 대해 알아보았으며, 편광현미경을 통해 서 관측되는 간섭색, 다색성, 소광현상 등 다양한 광학적 특징에 대해 이해함. 대기와 해양을 움직이는 힘인 기압경도력, 수 압경도력, 마찰력, 전향력, 중력에 대해 이해하고 각 힘들의 역학적 상관관계에 따라 대기와 해양이 움직이는 방향을 예측할 수 있음. 대기가 높은 산을 통과하면서 기온과 이슬점의 변화를 계산할 수 있으며, 이를 통해 상대습도와 절대습도의 변화를 분석하여 그래프로 표현함. \n고급 물리학: 늘 성실하게 수업에 임하며 교사와의 상호작용이 훌륭한 학생임. 물리학에 대한 흥미와 탐구심이 있어 스스로 학습하는 능력이 뛰어남. 새롭게 배운 내용과 기존의 알고 있는 지식을 종합하고 재정리하는 능력이 물리학 전 영역에 걸쳐 우수함. '양자역학 소녀'를 읽고 양자역학이라는 학문과 우리 삶 속 인간관계를 연결시켜 활용한 부분을 보고서로 작성하여 발표함. 교과서에 나오지 않은 창의적인 방법으로 중력가속도를 측정하는 탐구 과정에서 단진자의 단진동을 통해 중력가속도 를 측정하고 이론적인 값과 측정값의 차이가 나는 이유를 분석하고 오차에 대한 보고서를 작성함. \n<체육·예술> \n학기 \n교과 \n과목 \n단위수 \n성취도 \n비고 \n1 체육 \n운동과 건강 \n1 \nA \n2 \n체육 \n운동과 건강 \n1 \nA \n이수단위 합계 \n2 \n용화여자고등학교 \n2025년 11월 21일 17/20 반 \n07 \n번호 \n13 이름 \n주서연 \n많은 \n(KOR \ngov.kr \n정부24",
    "문서확인번호: 1763-6519-8118-8469 (신청인:주서연) \n과목 \n세부능력 및 특기사항 \n운동과 건강: 체육부장으로서 수업 전 교구를 준비하고 수업에 대한 전반적인 준비를 잘하며 뛰어난 리더십으로 학생들이 수 업에 집중 할 수 있도록 도움. 또한 배드민턴 수업 시 경기에서 경쟁의 의미와 페어플레이 정신을 배우고, 뛰어난 탐구능력을 바탕으로 스매시동작에 대한 연구를 끊임없이 함. 스매시 할 때의 팔꿈치의 각속도와 회전반경을 연구하여 훨씬 더 나은 동 작을 보임. 점프 동작에 대한 과학적인 원리를 알아보고 점프 시 지면반력의 작용, 지면반력이 이용되는 근육의 종류를 확인 하여 여러자세로 점프하여 경험해보고 좋은 자세를 찾는 탐구를 진행함. \n7. 독서활동상황 \n학년 \n과목 또는 영역 \n1 \n2 \n3 \n8. 행동특성 및 종합의견 \n학년 \n독서 활동 상황 \n행동특성 및 종합의견 \n1 \n2 \n자신이 맡은 일에 대해서는 적극적이며 추진력이 있는 성격으로 학급 회장으로서 학기초에 많이 어색할 수 있는 상 황이었지만 반친구들의 화합을 위해 노력함. 줌을 통한 자습 스터디를 조직하여 친구들과 공부하는 모습을 공유하며 친해질 수 있는 계기를 마련하였으며 학급 자치 시간에도 반에서 지켜야 하는 학급 규칙들을 정하는 일에 앞장서서 아이들을 설득 시키고 먼저 솔선수범하여 깨끗한 교실을 유지하는데 리더십을 발휘함. 학급 친구들과도 갈등없이 두 루 어울리며 학급의 회장으로서 집단을 잘 이끌어 나감. 학업 계획에 있어서도 스스로 주도하여 자신의 학습을 설계 하는 습관을 갖고 있으며 자신의 계획대로 실천해 나가는 실행 능력도 갖추고 있음. 부족한 학습량을 보완하기 위해 평일 아침 조회 시작 전 영어 스터디 모임을 구성하여 미리 영어 단어와 본문을 외운 후 각자 활동지를 만들어와서 공유하며 문제를 풀어보는 활동을 함. 학업성취도 면에서도 학습 플래너를 이용하여 매일 체계적인 계획을 세우고 꾸준히 노력하여 조금씩 향상 되었으며 자발적이고 적극적인 학습 태도를 가지고 있어 앞으로의 성장이 기대되는 학 생임. \n매사에 긍정적이며 다른 사람에게 웃음을 줄 수 있는 매력을 지니고 있고, 늘 다른 사람들과 즐겁게 학교생활을 하는 모습이 보기 좋고 새로운 것에도 과감하게 도전하는 적극성이 있음. 과학, 영어과목을 자기주도학습을 통해 공부하 였는데 특히 영어 단어는 아침 일찍 등교하여 친구와 함께 학습하여 테스트를 보는 형태로 서로에게 멘토, 멘티가 되 어 공부하는 모습을 보임. 또한 지구과학 스터디를 결성하여 각자 범위를 정하고 해당부분의 설명과 관련문제를 푸 는 형식으로 하여 서로 설명해주며 진행하였으며 시험 막바지에는 노트정리를 공유하여 서로에게 요약본을 제공하 는 등 자기주도적으로 학습하려고 노력함. 또한 중학생 대상 학교 홍보 실험 체험 활동에 참여하여 다양한 실험 활동 운영의 경험을 바탕으로 실험 준비, 진행 보조, 뒷정리 등에 알맞은 도움을 주며 원활한 체험 활동에 기여하고 이상 적인 이공계 선배로서의 모습을 보여줌. 학급에서 1년동안 미디어 담당을 하여 선생님들의 수업이 유연하게 진행될 수 있도록 도왔으며 소소한 일들에 대해서 묵묵히 자신의 역할을 다해 주는 모습을 통해 무슨 일이든 책임감을 갖고 성실하게 수행할 수 있는 학생임을 보임. \n3 \n긍정적이고 밝은 성격을 지니고 있어 어떤 상황에서도 낙관적인 태도를 유지하며 주변에 활력을 불어넣음. 현실적인 판단력이 뛰어나며, 어려운 문제에 직면했을 때도 쉽게 포기하지 않고 해결책을 모색하는 능력을 갖추고 있음. 학급 \n용화여자고등학교 \n2025년 11월 21일 18/20 반 \n07 \n번호 13 이름 \n주서연 \ngov.kr \n정부24 \n학년",
    "문서확인번호: 1763-6519-8118-8469 (신청인:주서연) \n행동특성 및 종합의견 \n행사를 계획하는 과정에서 다양한 의견을 제시하며, 행사 진행 시 발생할 수 있는 문제 상황을 미리 예상하고 대비 하여 행사가 성공적으로 진행될 수 있도록 기여함. 학급 분위기를 밝게 만들어주며, 원활한 대인관계를 형성하여 새 로운 친구들과 선생님들과도 두루 좋은 관계를 유지함. 학업 스트레스를 효과적으로 관리하며 꾸준하게 노력하는 자 세를 유지하는 등 자기 주도적인 학습 태도가 돋보임. 새로운 환경에서도 위기 극복 능력이 뛰어나며, 변화를 긍정적 으로 받아들이고 능동적으로 적응하는 모습이 인상적임. 성실함과 긍정적인 태도를 바탕으로 공동체에 기여하며, 지 속적으로 성장해 나가는 학생으로 앞으로가 기대됨. \n용화여자고등학교 \n2025년 11월 21일 \n19/20 반 \n07 \n번호 \n13 이름 \n주서연 \ngov.kr \n정부24",
    "문서확인번호: 1763-6519-8118-8469 (신청인:주서연)",
    "발급번호: B100000512-2025-002738 \n학교생활기록 부 \n성 \n명 \n주서연 \n인적 \n사항 \n주민등록번호 060105-******* \n담당부서 \n용화여자고등학교 \n담당자 전화번호 \n조용준 \n02-950-3527 \n위 사람의 학교생활기록부 사본임을 증명합니다. \n2025년 11월 21일 \n용화여자고등학교장 \n용화여자고등학교 \n2025년 11월 21일 20/20 반 \n07 \n번호 \n13 이름 \n주서연 \ngov.kr \n정부24"
  ],
  "reading": "학년 \n과목 또는 영역 \n1 \n2 \n3",
  "behavior": {
    "grade1": "00:20:27 \nKST \n문서확인번호: 1763-6519-8118-8469 (신청인:주서연) \n학교생활세부사항기록부(학교생활기록부II) \n졸업대장번호 17944 \n구분 \n학년",
    "grade2": "3",
    "grade3": "1. 인적·학적사항 \n성명 : 주서연 \n학생정보 \n학과 \n반 번호 \n담임성명"
  },
  "raw_text": "점 \n확 \n인 \n'진본 \n2025/11/21 \n00:20:27 \nKST \n문서확인번호: 1763-6519-8118-8469 (신청인:주서연) \n학교생활세부사항기록부(학교생활기록부II) \n졸업대장번호 17944 \n구분 \n학년 \n1 \n2 \n3 \n1. 인적·학적사항 \n성명 : 주서연 \n학생정보 \n학과 \n반 번호 \n담임성명 \n12 \n16 \n심방울 \n12 \n13 \n심방울 \n07 \n13 \n추미혜 \n성별 : 여 \n주민등록번호 : 060105-****늘은 많은 것은 \n주소 : 서울특별시 노원구 노원로15길 52, 11동 402호 (중계동, 한신코아빌라) \n2022년 1월 27일 중원중학교 제3학년 졸업 \n학적사항 2022년 3월 2일 용화여자고등학교 제1학년 입학 \n2025년 2월 5일 용화여자고등학교 제3학년 졸업 \n특기사항 \n2. 출결상황 \n결석일수 \n지각 \n조퇴 \n결과 \n학년 수업일수 \n특기사항 \n질병 미인정 기타 질병 미인정 기타 질병 미인정 기타 질병 미인정 기타 \n1 \n190 \n원격수업일수 4일, 개근 \n2 \n190 \n3 \n190 \n3. 수상경력 \n원격수업일수 0일, \n개근 \n개근 \n용화여자고등학교 \n2025년 11월 21일 1/20 반 \n07 \n번호 \n13 이름 \n주서연 \n(KOR), \ngov.kr \n정부24 \n문서확인번호: 1763-6519-8118-8469 (신청인:주서연) \n학년 \n(학기) \n수상명 \n등급(위) \n수상연월일 \n수여기관 \n1 \n2 \n공로상 \n2022. 12. 29. \n2 \n2 \n교과 우수상(음악) \n2023. 12. 29. \n1 \n교과 우수상(운동과 건강) \n2024, 07, 23. \n용화여자고등학교장 \n용화여자고등학교장 \n용화여자고등학교장 \n참가대상 \n(참가인원) \n1학년(238명) \n수강자 \n수강자 \n3 \n교과우수상(물리학 II) \n2025.01.02. \n용화여자고등학교장 \n수강자 \n2 \n개근상 \n2025. 02.05. 용화여자고등학교장 \n3학년(221명) \n4. 자격증 및 인증 취득상황 \n<자격증 및 인증 취득상황> \n구분 \n명칭 또는 종류 \n번호 또는 내용 \n취득연월일 \n발급기관 \n<국가직무능력표준 이수상황> \n능력단위 \n학년 학기 \n세분류 \n이수시간 원점수 성취도 \n비고 \n(능력단위코드) \n해당 사항 없음 \n5. 창의적 체험활동상황 \n창의적체험활동상황 \n학년 \n영역 \n시간 \n특기사항 \n용화여자고등학교 \n2025년 11월 21일 2/20 반 \n07 \n번호 \n13 이름 \n주서연 \ngov.kr \n정부24 \n1 \n문서확인번호: 1763-6519-8118-8469 (신청인:주서연) \n학년 \n영역 \n시간 \n자율활동 \n동아리활동 \n80 \n24 \n창의적체험활동상황 \n특기사항 \n1학기 학급 회장(2022.03.02.-2022.08.18.)으로서 리더십이 뛰어나고 학급 친구들 이 모두 참여할 수 있는 다양한 활동들을 제시함. 저녁 시간대에 줌스터디 인원 모집, 진로와 관련된 학급신문 만들기, 시험기간 중 학습한 내용 시험 문제 만들기 등의 활동 을 친구들에게 함께 하자고 제안하여 학급의 발전을 위해 노력하는 모습을 보임. (정보 네티켓) 코딩의 기초인 순서도 작성과 알고리즘 설계를 공부하고 실제 프로그래밍을 통하여 적용하고 보완하는 연습을 통해 기초적인 프로그래밍 능력을 함양함. 수학과학 페임랩 (2022.04.01.)에 '나노 기술을 이용한 뇌종양 치료 약물 전달 시스템'을 주제로 참여함. 수학위크(2022.06.25.)에서 'AI 매쓰봇 좌회전금지미로 게임'에 참여하여 A I매쓰봇 교재와 소프트웨어 게임을 이용하여 좌회전을 하지 않고 미로를 탈출하는 게 임을 수행함. 경우의 수와 수학적 확률을 활용하는 미로 설계, 게임 실행 과정을 통해 AI와 수학의 밀접한 연관성을 직접 경험하며 미래 산업 기술의 바탕이 되는 수학의 필 요성을 인식함. 특히 학년 대표로 친구들이 프로그램에 잘 참여할 수 있도록 동기를 부 여하고 제작한 AI 매쓰봇 교재를 전시하여 수학위크 활동을 알리는 역할을 함. \n(과학재능기부반(라이트)) (24시간) 2학기 동아리 회장(2022.08.19.-2023.02.28.) 으로서 책임감과 봉사 정신을 가지고 동아리원의 의견을 반영하여 주도적으로 연간 계 획을 수립하고 부원들을 이끌며 적극적으로 활동함. 금속의 불꽃 반응 실험과 빛의 굴 절 실험을 하며 조원들과 협동심이 돋보임. 마스크 색에 따른 자외선 차단율에 대해 조 사하고 카드 뉴스를 제작하여 SNS에 공유함. 교사와 학생 입장을 생각하며 지구와 달 의 공전과 파동을 이용한 기타 제작에 대해 과학 멘토링 준비를 하고, 자신만의 개성있 는 수업을 하여 친구들에게 많은 박수를 받음. 강점, 약점, 기회, 위협을 분석하여 원자 력 발전에 대해 심층적으로 알아보고 친구들에게 자신감있게 설명할 수 있음. '알루미 늄 태그 만들기'라는 주제로 체험 부스를 운영함. 부스 준비 과정에서 여러 차례의 예 비 실험에 한 번도 빠짐없이 참석해 부원들과의 협동심과 리더십을 보여주었으며, 실 험 과정에 문제 발생 시 본인만의 창의적인 방법으로 해결책을 제시함. \n용화여자고등학교 \n2025년 11월 21일 3/20 반 \n07 \n번호 13 이름 \n주서연 \ngov.kr \n정부24 \n문서확인번호: 1763-6519-8118-8469 (신청인:주서연) \n학년 \n영역 \n시간 \n1 \n진로활동 \n2 \n자율활동 \n창의적체험활동상황 \n특기사항 \n35 \n115 \n희망분야 컴퓨터 분야 개발자 \n직업인(CEO)과의 만남 행사 (2022.06.20.)에 참여하여 구체적인 직업정보와 진로 방 향에 대한 조언을 듣고 질의 응답 시간을 가졌음. 성장형전공탐색프로그램 화학계열 (2 022.05.09.-2022.06.22.)을 이수함. 식품 속의 염분량 측정 활동을 통해 앙금생성 반응에 대해 더 깊이 이해하고, 알코올의 산화와 음주측정을 통해 일상생활 속에 화학 적 원리들을 적용하고 이해해봄. 화학전지 만들기 실험에 참여하여 교과서의 내용을 더욱 심화하여 학습하고 실제적인 실험 수행 능력을 향상시킴. '내 주변 모든 것이 신 약이 될 수 있다'라는 주제로 열린 강연 6pm(2022.05.11.) 에 참석하여 성분에 따른 천연물 의약품, 합성 의약품, 바이오 의약품의 분류에 대하여 배움. 성장형전공탐색프 로그램 수학공학계열 (2022.09.05. -2022. 11. 26)을 이수함. 모스부호, 이진법, 16진 법, 삼원색의 이진법 및 16진법 표현 등을 배워 데이터를 다양하게 표현해 봄. 이를 활 용하여 '손으로 보내는 팩스 활동'에서 흑백, 컬러 팩스를 송수신해 봄. 칸토르의 대각 선 논법을 배우고 이를 응용해 괴델의 불완전성의 원리를 튜링의 멈춤 문제로 접근하여 이해해 봄. 클로드 섀넌의 디지털 논리회로와 집합의 관계에 대해 탐구함. 집합을 이 용해 가위, 바위, 보 회로를 간단히 정리해 봄. 수학과 공학의 관계성을 직접 체험하고 수학의 필요성과 가치를 크게 느껴봄. '에너지는 미래로, 미래는 에너지로'라는 주제로 열린 강연 6pm(2022.10.31.)에 참석하여 막대한 양의 에너지가 필요한 데이터 센터 를 유지하기 위해 에너지 하베스팅과 열전소자, 광전소자, 전자기파 포집과 변환 기술 등의 원리를 배움. 창작해 내는 데 흥미를 느껴 자신의 창의력을 펼칠 수 있는 공학 분 야로의 진학을 희망함. \n코딩 활동을 통해 소프트웨어의 역할에 대해 명확히 이해하고 자신이 고민하던 문제에 대해 아두이노를 기반으로 프로그래밍에 대해 학습함. 이 과정에서 알고리즘을 설계하 고 아두이노를 통해 구현하는 등 지식의 적용에 있어 뛰어난 모습을 보임. 다문화 수업 에서 인터넷 사용과 관련하여 국가별 개인정보보호법의 특징을 문화의 특징과 연관지 어 설명함. 이를 통해 다문화가 우리의 생활과 밀접하게 연관되어 있다는 사실을 인식 하게 됨. 수학과학인문융합축전(2023.07.18.)에서 '정전기 스노우볼 만들기'라는 주 제로 체험 부스를 운영함. 부스 운영 전 준비과정에서 제작 방법을 익히고 정전기의 원 리를 찾아 정리함. 동아리 부원들과 역할을 나눠 스노우볼 만드는 방법 및 정리를 하고 \n부스 운영 전 미리 재료를 준비함. 인공지능캠프(2023.08.44.)에 참여하여 컴퓨팅 사고력, 플로우고리즘, 파이게임, 파이썬에 대해 배우고 이를 바탕으로 게임 제작 및 자율주행자동차 실습을 해봄. 코딩을 이론적으로만 배우는 것이 아니라 실제로 체험해 보며 자신의 적성을 탐색해볼 수 있었고 코딩에 대한 관심이 높아짐. 역사평화 활동을 통해 사회적 소수자에 대한 차별적 사례들을 정리하고 이들의 차별 시정을 위한 제도 마련을 주장하였음. \n용화여자고등학교 \n2025년 11월 21일 4/20 반 \n07 \n번호 \n13 이름 \n주서연 \ngov.kr \n정부24 \n2 \n문서확인번호: 1763-6519-8118-8469 (신청인:주서연) \n학년 \n영역 \n시간 \n동아리활동 \n진로활동 \n24 \n17 \n창의적체험활동상황 \n특기사항 \n(과학재능기부반) (24시간) 1학기 동아리 회장(2023.3.2.-2023. 8. 15.)으로 홍보물 과 안내 문구를 기획과 제작을 하는 등 책임감 있게 동아리 활동을 잘 이끔. 짝선배 짝 후배 제도를 효과적으로 운영하기 위하여 각자 진로나 관심 분야가 비슷한 학생들을 선 별하여 짝선배 짝후배로 선정하여 운영을 함. 팀실험으로 그람염색실험을 하였으나 염 색이 잘 되지 않아 그 원인으로 열고정을 할 때 오래 열처리를 했기 때문이라는 보고서 를 작성하여 제출함. 실험이 실패하더라도 원인을 찾는 과정에서 배울 수 있는 점을 깨 달음. 다양한 주제의 카드뉴스 활동에서는 동아리 소셜네트워크서비스 계정에 업로드 하여 사람들에게 재치있게 과학정보를 알림. 과학 지식을 쉽게 정보를 제공하는 과정 에 흥미를 느끼고 관련 직종에 관심을 가짐. 외부 활동 준비로 태양광 팽이 만들기 부 스 운영을 위하여 주제를 제안하고 나이 별로 설명 내용을 변경하여 준비함. \n희망분야 공학계열 \n진로 한마당 (2023.07.14.)행사에 참여함. 특히 학과 및 대학 정보 컨설팅 프로그램 참 여를 통하여 대학 진학에 필요한 구체적인 정보들을 공유하며 입시 방향을 설정하는데 도움이 되는 시간을 가졌음. 구체적인 내용들을 정리하여 보고서로 제출함. 진로진학 탐색시간을 통해 정보를 확인하고 '파인먼이 들려주는 불확정성 원리 이야기'를 읽고 원자에 대한 설명과 불확정성 원리, 원자핵에 대한 내용을 파악하고 일상 속 사물만이 아닌 모든 것에 적용된다는 사실을 알게 되었다 함. 성장형전공적성프로그램 ITSW 열(2023.04.10. -2023.10.28.)을 이수함. 지오지브라를 이용하여 다양한 함수들의 그래프를 그려보고 수업 시간에 삼각함수의 그래프를 그렸던 활동을 더 심도 깊게 이해 하게 됨. 또한 다양한 코딩앱을 사용하여 복사, 출석부, 그래프 도출 등을 공부하며 본 인의 진로를 고민하는 기회를 만들었으며 추후 더 많은 코딩에 대한 학습의지를 다짐. 이 과정에서 컴퓨터의 다양한 프로그램들이 학습에 많은 도움을 주고 있으며 이를 활용 하여 더 깊이 있는 학업의 이해도를 높일 수 있음을 깨달았고 여러 분야에 꼭 필요한 도구가 되었음을 인지함. 1학기 강연 6PM (2023.05.17.)을 수강함. 전 국립과학수사 연구소 첫 여성원장님께 국과수의 다양한 업무와 분야, 역할 등에 대해 듣고 다양한 전 공의 필요성과 사명감에 대해 듣고 자신의 진로를 생각해보는 계기를 가짐. 창의융합 프로젝트 '두두타운'에 '라이다' 팀명으로 참여함 (2023.05.26.-2023.09.08.). 전동 킥보드의 안전 사고 증가에 대한 관심을 갖고 충격량을 흡수할 수 있는 안전 장치가 없 다는 사실을 알게 되어 충돌을 대비한 초음파 센서를 제작하는 활동을 진행함. \n용화여자고등학교 \n2025년 11월 21일 5/20 반 \n07 \n번호 13 이름 \n주서연 \ngov.kr \n정부24 \n문서확인번호: 1763-6519-8118-8469 (신청인:주서연) \n학년 \n영역 \n시간 \n자율활동 \n3 \n동아리활동 \n13 \n92 \n창의적체험활동상황 \n특기사항 \n생활인성 수업을 통해 한글 우주의 원리를 담아 가장 단순하고도 배우기 쉬운 한글을 창제하신 세종대왕님께 다시 한번 감사함을 느끼게 되었음. 창체봉사 수업 시간을 통 해 이태석 신부의 영상을 접하고, 참된 봉사에 대해 생각해 보는 계기를 가짐. 진정한 봉사는 개인 더 나아가 사회를 변화시킬 수 있다는 힘이 있다는 것을 알게 되었다는 자 신의 생각을 정립함. 이를 계기로 도덕윤리에 대해 깊이 알아보았으며, 인큐베이터 속 아기 환자를 매일 진심으로 돌보는 간호사의 사례를 찾아보면서 간호란 무엇이며 간호 사가 가져야 하는 봉사정신에 대해 생각해 봄. 1학기 학급 체육 담당으로서 하급의 방 역물품을 잘 관리하였으며, 중간중간 학급 환기를 해주어 건강한 학교생활이 가능하도 록 도움. \n(과학재능기부반) (13시간) 다른 학생들이 작성한 카드뉴스를 통해 새로운 정보를 습득 하고 자기계발에 힘씀. 적극적인 태도로 새로운 아이디어를 제시하고 토론을 통해 학 생들 간의 유대감을 증진시킴. 모든 활동에 열정적으로 참여하고 자신의 의견을 적극 적으로 표현함. \n희망분야 간호, 보건 \n간호학과에 대한 관심이 많아 진학 탐색 시간에 다양한 대학을 찾는 활동을 함. 수학 교과가 진학에 중요하다는 것을 알고, 자기 주도 학습을 통해 이를 보완하는 계획, 주 말 등의 시간을 잘 활용하는 계획 등을 진로탐색 보고서를 통해 작성하고 실행하는 모 습을 보임. \n진로활동 \n42 \n학년 \n일자 또는 기간 \n2022. 04. 25. \n2022.05.30. \n봉사활동실적 \n장소 또는 주관기관명 \n(학교)용화여자고등학교 \n(학교)용화여자고등학교 \n활동내용 \n시간 누계시간 \n봉사활동 소양 교육 \n장애 이해교육 \n1 \n1 \n2 \n1 \n2022.07.25. - 2022.08. 01. (개인)북부종합사회복지관 \n초등 여름방학 특강 과학 멘토링 활동 \n3 \nLO \n5 \n2022.09.13. \n2022.10.17. \n(학교)용화여자고등학교 \n(학교)용화여자고등학교 \n봉사활동 소양교육 \n1 \nCo \n6 \n장애 이해교육 \n1 \n7 \n2023. 04.10. \n(학교)용화여자고등학교 \n봉사활동 소양 교육 \n1 \n1 \n2 \n2023.09.04. \n(학교)용화여자고등학교 \n장애 인식 개선 교육 \n1 \n2 \n2023.09.25. \n(학교)용화여자고등학교 \n봉사활동 소양 교육 (환경분야) \n1 \n3 \n3 \n2024.04.15. \n(학교)용화여자고등학교 \n봉사활동 소양 교육(기본) \n1 \n1 \n용화여자고등학교 \n2025년 11월 21일 6/20 반 \n07 \n번호 13|이름 \n주서연 \n(KOR \ngov.kr \n정부24 \n문서확인번호: 1763-6519-8118-8469 (신청인:주서연) \n봉사활동실적 \n학년 \n일자 또는 기간 \n2024.06.24. \n장소 또는 주관기관명 \n(학교)용화여자고등학교 \n활동내용 \n시간 누계시간 \n장애 인식 개선 교육 \n2 \n3 \n2024.09.02. \n(학교)용화여자고등학교 \n2024.09.30. \n(학교)용화여자고등학교 \n봉사활동 소양교육(환경) \n장애 인식 개선 교육 \n1 \n3 \n1 \n4 \n6. 교과학습발달상황 \n[1학년] \n원점수/과목평균 \n성취도 \n학기 \n교과 \n과목 \n단위수 \n석차등급 \n비고 \n(표준편차) \n(수강자수) \n국어 \n국어 \n4 \n95/85.3(9.3) \nA(239) \n2 \n수학 \n수학 \n69/70.7(14.3) \nC(239) \n5 \n영어 \n영어 \n4 \n58/72.0(19.6) \nE(239) \nCO \n6 \n한국사 \n한국사 \n3 \n83/77.6(15.3) \nB(239) \nсл \n5 \n사회(역사/도덕 \n통합사회 \n4 \n83/82.2(9.7) \nB(239) \n5 \n1 \n포함) \n과학 \n통합과학 \n4 \n52/64.0(22.1) \nE(239) \n6 \n과학 \n과학탐구실험 \n1 \n98/83.6(13.2) \nA(239) \n기술.가정/제2 외국어/한문/교 양 \n기술·가정 \n2 \n76/68.5(14.7) \nC(239) \n국어 \n국어 \n4 \n88/83.9(10.7) \nB(237) \n5 \n수학 \n수학 \n81/72,0(16.0) \nB(237) \n4 \n영어 \n영어 \n67/72.4(20.7) \nD(237) \n5 \n한국사 \n한국사 \n3 \n78/76.5(17.5) \nC(237) \n5 \n사회(역사/도덕 \n통합사회 \n4 \n89/80.6(11,6) \nB(237) \n4 \n2 \n포함) \n과학 \n통합과학 \n79/65,2(20.2) \nC(237) \n과학 \n과학탐구실험 \n1 \n98/84.7(15.7) \nA(237) \n기술.가정/제2 \n외국어/한문/교 기술·가정 양 \n2 \n58/63.4(17.7) \nE(237) \n6 \n이수단위 합계 \n52 \n용화여자고등학교 \n2025년 11월 21일 7/20 반 \n07 \n번호 \n13 이름 \n주서연 \n이 \ngov.kr \n정부24 \n문서확인번호: 1763-6519-8118-8469 (신청인:주서연) \n과목 \n세부능력 및 특기사항 \n국어: 항상 진지한 태도로 성실하게 수업에 집중하는 학생이며, 심화 적용 문제를 많이 풀어보며 깊이 이해하기 위해 노력하 는 학생임. 부정적인 언어 사용이 화자와 청자에게 미치는 영향에 대해 학습하고 긍정적인 말을 담아 10년 후 나에게 편지를 쓰고 발표함으로써 긍정적인 언어의 효과를 직접 느껴봄. 바람직한 의사소통 문화 발전을 위해 차별이나 비하하는 말은 사용 하지 말아야 하며, 상대방을 배려하고 존중하는 말하기가 중요하다는 것을 학습함. 요즘 새롭게 쓰이는 신조어에 대해 알아 보고, 신조어를 사전에 올린다고 가정하고 뜻풀이를 작성하는 활동에 적극적으로 참여함. 평소 자신의 언어생활을 돌아보고 기본적인 언어 규범을 준수하는 것이 중요함을 학습함. \n고전소설 성춘향전을 현대적으로 재창작하여 영상으로 제작하는 모둠활동에서 모둠 기깔나조의 모둠장, 연출, 자료조사, 대 본 제작, 촬영, 소품준비, 발표 대본 작성, 배우 이몽룡 역할 등을 맡아 솔선수범하는 자세로 리더십을 나타내었으며, 모둠에 서 완성한 영상을 발표하는 시사회 활동을 주도함. \n진로 탐색하기 독서 활동으로 빅데이터와 데이터 과학(박성현, 박태성, 이영조)을 읽고 빅데이터와 비즈니스 플랫폼의 발전 부 분에 깊은 인상을 받음. \n수학: 수업에 대한 집중도와 참여도가 높아 긍정적인 수업분위기를 형성하는데 큰 역할을 함. 수업활동 중 집합의 서로소 관 계를 명확하게 이해하고 있어 두 개가 동시에 일어날 수 없는 경우의 수의 합의 법칙 개념과 연계시켜 이해하려는 태도를 보 며 수학 내적 창의융합능력이 있어 보였음. 발표 수업시에 늘 자신감이 넘치는 우렁찬 목소리로 출제의도와 개념설명을 조리 있고 깔끔하게 설명하였고, 2차함수의 위치관계를 설명하면서 부등식 관계로 재해석하여 문제풀이과정을 능숙하고 여유롭게 설명하는 모습에 수학적 기초가 탄탄하고 해석과 분석능력이 우수하다고 생각함. 또한, 부등식 문제 설명을 절댓값 그래프 를 이용하여 재구성하는 모습도 보여줌. \n심화주제발표시 함수의 기원과 현대적 정의에 대해 관심을 갖고 조사하여 ppt를 제작 발표 하였고, 함수의 다양한 일상 속에 서의 유용성, 함수와 그래프 관계, 발전된 수학 등에 많은 지식을 알게 되어 다양한 함수에 대한 호기심을 갖게 되었고 수학 학습에 열정과 관심을 더욱 심화 시켰음. \n영어: 수업 시간에 적극적으로 참여하였으며 교과서 어휘와 본문을 암기하고 문장을 반복해 쓰면서 문장 구조를 파악하고 이 해하면서 영어 성적 향상을 위해 꾸준히 노력함. 창의력을 최대한 발휘하고 상상한 것을 실현하기 위해 미래 과학 기술을 이 끌어 갈 컴퓨터 엔지니어링과 소프트웨어 분야에서 일하는 연구원이 되고 싶다고 'My Dream'이라는 프레젠테이션을 통해 영어로 발표함. \n한국사: 한국사 시간에 열의를 가지고 성실히 참여함. 수업내용의 심화학습을 위해 고대사회의 종교와 사상, 식민지시기 도 농의 변화와 신사상의 수용에 대해 교과서를 토대로 학습활동지를 성실하게 작성함. 고려시대 여성의 지위를 학습하면서 현 대사회에 주는 함의와 성역할의 사회성에 대해서 짧은 보고서를 작성함. 농민에서 솔거노비로 전락하였다가 사회변동을 목도 하며 다시 신분상승을 꿈꾸는 인물의 심리를 잘 표현한 조선시대 신분별 가상일기를 작성함. 모둠별 주제발표에서 조선사 전 체의 맥락에서 본 흥선대원군의 개혁정치라는 주제로 조선조 전반에 이어진 재정과 국방정책의 지속된 모순과 대원군이 펼친 개혁의 의의를 탐구함. 자료조사를 맡아서 고종대는 물론 조선조 전반의 흐름에 대해 폭넓게 조사하고 최신연구들을 소개하 여 발표에 기여함. 어떤 개혁정책도 시대적 한계를 가질 수 밖에 없음을 깨달음. 한국현대사관련 영화감상 활동에서 인천상 륙작전을 감상하고 보고서를 작성함. 극중 인물들의 생각과 감정에 공감하며 중대한 정책결정을 내린 인물부터 시작해서 수 없이 많은 인물들이 다양한 사정과 동인으로 역사를 만들어간다는 점을 통해 역사는 다층적이며 세심한 이해를 필요로 한다 는 점을 깨달음. \n통합사회 : '도시문제 해결을 위한 아이디어 제시하기'라는 주제로 실시한 조별 토론 및 발표수업에서 닭백숙조의 아이디어 제 시 및 발표 대본을 맡아 골목길의 범죄와 교통사고를 예방하는 방안으로 블랙박스가 탑재되어 있고 애플리케이션을 이용해서 위급상황이 발생하면 자동으로 구조요청이 되는 기능을 갖춘 스마트가로등을 소개하였는데 시각적 효과를 높인 PPT와 차분 \n용화여자고등학교 \n2025년 11월 21일 8/20 반 \n07 \n번호| 13 |이름 \n주서연 \ngov.kr \n정부24 \n과목 \n문서확인번호: 1763-6519-8118-8469 (신청인:주서연) \n세부능력 및 특기사항 \n한 자세로 정성을 다해 발표한 모습이 보기 좋았음. \n2학기 협력적 독서활동 관련 수행평가에서 '아픔이 길이 되려면'이라는 책을 읽고, 부조장의 역할을 맡아 조장과 함께 독서토 론 진행 등 활동 전반에 적극적으로 참여함. 독서토론 활동에서 조원들과 협력하여 책을 읽게 된 점이 좋았던 반면 방학동안 조원들 간의 일정에 맞춰 온라인 상의 중간 회의를 개최하는 것이 힘들었다는 소감을 밝힘. 1학기 인권, 2학기 정의 관련 신 문 스크랩 활동에 성실히 참여하여 사회 현상에 대한 이해력 및 비판적 사고력이 향상됨. \n'디지털 시대에 따른 변화'라는 주제로 플랫폼 경제는 인공지능에 의해 분석되고 공공재의 성격을 띠게 된다고 설명함. 자국 플랫폼을 보유한 나라들이 새로운 산업에도 쉽게 진입할 수 있어 나라 간의 빈부격차가 발생하는 현상을 살펴봄. \n통합과학: 물리 시간을 통해 배운 중력과 자연현상이 생명 시스템에 주는 영향에 대해 알아보기 위해 생명과학의 심화학습 발표수업에서 '중력이 생명시스템에 미치는 영향'을 주제로 자료를 조사하고 학습하여 발표함. 중력이 동식물과 인체에 미치 는 영향을 소개하였으며 이 과정에서 중력과 생물의 진화의 연관성에 대해서도 생각해보는 기회를 가짐. 물리, 화학, 생명 분 야 등의 다양한 과학 분야에 두루 관심이 있고 흥미를 가짐. 영화 앤트맨을 소재로 하여 앤트맨의 능력인 원자핵과 전자 사이 의 빈 공간을 조절하는 것이 현대과학에서 불가능한 이유를 양자역학의 전자의 입자성과 파동성과 연관지어 발표함. 전자는 파동성이 있기에 정상궤도를 지나지만 미시세계에서는 확률적으로 존재함을 설명함. 1학기 동아리 실험과 연관 지어 전자의 입자성과 파동성을 밝힌 이중슬릿 실험에 대해 소개함. 현대과학으론 파동을 갖고 움직이는 전자의 위치를 파악할 수 없는 이 유를 제시하는 과정을 통해 여러 과학 원리를 스스로 찾아보고 조사하며 궁금증과 흥미를 가지게 됨. 지구과학 심화발표에서 '우주에서 가능한 물리현상'이라는 주제로 지구와 다른 환경인 우주에서 가능한 특별한 물리현상들에 대해 조사하여 발표함. \n과학탐구실험: 학교 주변에서 일어나는 충돌 사고에 대해 알아보고 안전사고예방을 위한 포스터를 제작함. 다양한 재료들을 이용하여 입체적으로 제작하였으며 운동량과 충격량에 대한 개념을 이해하고 과학적 원리를 설명에 포함하여 단순히 포스터 제작에만 그친 것이 아니라 수업 시간에 배운 물리학적 내용을 상기하여 과학 포스터를 제작함. 인디고카민 용액, 포도당, 수 산화나트륨 용액을 이용해 물질의 산화, 환원 반응 실험을 진행함. 실험을 통해 우리 주변의 산화, 환원의 예로 철의 부식, 표 백제를 이용한 섬유 표백, 과일의 갈변 등을 토론을 통해 확인함. \n(1학기)기술·가정 : 가족관계에 대한 중요성을 잘 이해하여 가족이 가지는 소중한 가치, 가족간의 의사소통과 갈등 해결능력 을 습득하여 건강한 가족관계를 형성할 수 있는 방법에 대해 친구들과 토론함. \n(2학기)기술·가정 : 첨단과학 기술의 활용 단원을 배우면서 주거환경의 변화, 액티브하우스와 패시브 하우스의 차이점, 융 합, 태양광 발전, 태양광 발전의 원리인 광전 효과, 제로에너지 하우스, 신재생 에너지에 대해 관심을 갖고 자료를 심도있게 조사해 프리젠 테이션을 제출함. 첨단 과학기술의 활용 단원과 물리를 연관지어 이해하고 조사함. \n<진로 선택 과목> \n성취도 \n성취도별 \n학기 \n교과 \n과목 \n단위수원점수/과목평균 \n비고 \n(수강자수) \n분포비율 \n이수단위 합계 \n과목 \n해당 사항 없음 \n<체육·예술> \n세 부 능력 및 특기사항 \n용화여자고등학교 \n2025년 11월 21일 9/20 반 \n07 \n번호 \n13 이름 \n주서연 \n(KOR), \ngov.kr \n정부24 \n문서확인번호: 1763-6519-8118-8469 (신청인:주서연) \n학기 \n교과 \n과목 \n단위수 \n성취도 \n비고 \n체육 \n체육 \n2 \nB \n1 \n예술 \n체육 \n음악 \n체육 \n2 \nB \n2 \nA \n2 \n예술 \n미술 \n2 \nA \n이수단위 합계 \n8 \n과목 \n세부능력 및 특기사항 \n체육: 배구 스윙에서 손목을 활용하여 원하는 곳으로 스윙 할 수 있음. 리그전에서 팀원들 간의 협동을 통한 공동체 역량을 발휘하여 팀의 안정적인 경기운영에 기여했으며, 심판, 기록원, 아나운서 등의 비선수 역할을 수행하며 규칙을 이해하고 공 정하게 경기를 운영함. 근방추의 민감도가 매우 낮아 햄스트링 스트레칭에 매우 효율적인 움직임을 보임. 배구 스킬첼린지에 서 끝까지 포기하지않고 언더와 오버핸드토스를 수행하는 모습을 보여주었으며 조별 리그전에서 헌신적인 플레이로 팀 동료 들의 사기를 높여줌. 멀리뛰기를 효과적으로 수행하는 방법을 잘 알고있으며, 자신이 목표한 거리를 뛰어넘기 위한 도전정신 이 뛰어남. 배구 서브에서 하체의 각도가 좋고 엄지손가락의 힘을 잘 컨트롤하여 서브를 수행하며, 스파이크 수행시 타점과 손목의 임팩트가 좋아 배구공이 날아가는 궤적이 매우 일관됨. 또한 경기에서 심판의 역할을 충실히 이행하며 규칙을 이해하 고 공정하게 경기를 운영함. \n음악: 오페라와 뮤지컬 수업을 통해 오페라의 종류에 대하여 지식을 습득함. 모차르트 감상 비평문을 읽어보니 천재성을 인 정받아 성공적인 음악 생활을 하였으나 갑작스런 열병으로 요절한 음악가 모차르트의 다양한 음악을 경험하는 계기가 되었음 을 감상문에 잘 기재함. 아 목동아 악보 사보 시 가사 창작을 통해 표현력의 향상과 창작의 성취감을 경험함. 엘가 사랑의 인 사를 듣고 영국음악의 특징에 대하여 이해함. 악기 연주 하는 수업 시 학급교우와 포핸즈 연주를 통해 서로 배려하는 모습을 보여주었음. \n미술: <디자인> 포스터컬러의 혼합으로 다양한 색채를 얻어 낼 수 있으며 원과 삼각형의 반복으로 직선과 곡선의 율동미를 표 현함. 다양한 색으로 채색하고 쉬프팅 기법으로 명도의 변화를 효과적으로 표현함. \n[2학년] \n원점수/과목평균 \n성취도 \n학기 \n교과 \n과목 \n단위수 \n석차등급 \n비고 \n(표준편차) \n(수강자수) \n국어 \n문학 \n92/80.7(17.2) \nA (223) \n4 \n수학 \n수학 I \n68/65.2(25.4) \nB(223) \n5 \n수학 \n확률과 통계 \n2 \n54/55.4(21,5) \nC(162) \n5 \n영어 \n영어 I \n3 \n70/66.4(22.5) \nC(223) \n5 \n1 \n과학 \n물리학 I \n2 \n41/56.3(22.1) \nD(60) \n6 \n과학 \n화학 I \n2 \n60/61.1(17.1) \nC(116) \n5 \n과학 \n생명과학 I \n2 \n75/68.1(19.1) \nB(117) \n5 \n과학 \n지구과학I \n2 \n76/60.0(23.7) \nB(104) \n4 \n용화여자고등학교 \n2025년 11월 21일 10/20 반 \n07 \n번호 \n13 이름 \n주서연 \n(KOR), \ngov.kr \n정부24 \n문서확인번호: 1763-6519-8118-8469 (신청인:주서연) \n학기 \n교과 \n과목 \n단위수 \n원점수/과목평균 (표준편차) \n성취도 \n석차등급 \n비고 \n(수강자수) \n기술.가정/제2 \n1 외국어/한문/교 \n양 \n중국어 I \n3 \n72/80.7(15.4) \nB(90) \n7 \n국어 \n독서 \n4 \n96/79.6(19.5) \nA(220) \n3 \n수학 \n수학II \n4 \n83/61.1(27.0) \nA(220) \n4 \n수학 \n확률과 통계 \n2 \n59/53.5(26.3) \nC(159) \n5 \n영어 \n영어 I \n3 \n55/61,2(25.5) \nE (220) \n5 \n과학 \n물리학 I \n2 \n56/59.9(26.4) \nC(60) \n5 \n2 \n과학 \n화학 I \n2 \n52/58.6(23.7) \nC(114) \n5 \n과학 \n생명과학 I \n2 \n60/60.8(22.0) \nC(115) \n5 \n과학 \n지구과학I \n2 \n80/55.4(27,2) \nA(103) \n4 \n기술.가정/제2 외국어/한문/교 양 \n중국어 I \n3 \n68/74.1(21.9) \nB(90) \n6 \n이수단위 합계 \n과목 \n48 \n세부능력 및 특기사항 \n독서: 인문, 예술, 사회, 문화, 과학, 기술, 문학 등 다양한 분야의 고유한 가치를 탐구하고 자신의 관심사를 넓히며 다양한 분야의 책을 균형 있게 독서를 함. 신상영의 안전한 마을 만들기를 읽고 기억과 함께 배워보는 주민들의 노력을 주제로 글쓰 기 활동을 함. 안전한 마을을 만들기 위해서는 지자체와 정부뿐만이 아니라 주민들의 협조, 자발적이고 조직화된 참여가 필 요함을 제시함. 다양한 장르의 책을 읽으며 균형이 있는 독서 습관을 기르기 위해 노력하는 자세가 돋보임. 독서 목표를 세우 고 그에 맞는 책을 선택해 읽는 것을 습관화하여 균형 있는 독서 습관을 형성하기 위해 노력함. \n문학: 문학 작품에 드러난 인생의 가치와 의미를 파악하여, 이를 자신의 삶 및 타인의 삶과 관련지어 설명하는 독서 활동을 함. 이생규장전과 운영전을 읽고 공통점과 차이점을 체계적으로 비교하여 정리하고, 이 두 작품을 시대상과 관련된 고전소 설 속 여성 인물들의 모습을 중심으로 비교, 분석하여 보고서를 제출함. 작품 개밥바라기별을 읽고 PPT를 제작하여 작품에 대한 전반적인 해설을 발표함. 작가 소개, 줄거리, 특성 등을 중심으로 발표함. 작품에 대한 전반적인 이해도가 매우 높음. 문 학 작품의 구성 요소들과 전체 사이의 유기적 관계를 구체적으로 이해하여 창의적 문학 활동을 함. 자신의 생각을 논리적이고 명확하게 서술하는 능력이 뛰어나며 진지하고 성실한 자세로 수업에 임함. 교과서 필기 정리를 잘하며 읽은 글의 내용을 논 리정연하게 요약정리를 잘함. \n수학 I: 분수의 성질과 인수분해를 이용한 2가지 방법으로 거듭제곱이 있는 식의 계산 과정을 보여주며 지수법칙을 이용하 여 정확하게 도출하고 그 과정을 설명함. 시그마의 성질을 이용하여 주어진 식의 값을 구하는 과정을 자세하게 발표하며 친구 들의 큰 호응을 얻음. \n지수와 로그의 방정식, 부등식 문제를 해결하여 퍼즐을 완성하는 모둠활동에 적극적으로 참여했으며 계산 실수를 줄이고자 스스로 노력하는 모습이 인상적임. 컴퓨터 기하 프로그램을 활용한 삼각함수의 그래프 탐구활동에서 삼각함수의 그래프 개형 이 변수에 따라 무엇이 달라지는지를 살펴보며 그래프의 특징을 정리함. \n용화여자고등학교 \n2025년 11월 21일 11/20 반 \n07 \n번호| 13 |이름 \n주서연 \ngov.kr \n정부24 \n문서확인번호: 1763-6519-8118-8469 (신청인:주서연) \n과목 \n세 부 능력 및 특기사항 \n주제 탐구활동에서 수열의 귀납적 정의를 배우면서 궁금했던 재귀 알고리즘을 주제로 탐구함. 재귀 알고리즘에 대해 개념과 다양한 사례를 찾아보며 정확하게 이해할 수 있었고, 코딩 언어로 표현해 보는 것이 쉽지 않았지만 재귀 알고리즘을 이용하여 \n코딩 프로그램을 만들어 보고 싶다는 포부를 밝힘. \n수학II: 수업 활동에 참여하여 최선을 다하는 모습을 보이는 학생임. 활동을 하면서 수학에 대한 관심이 높아지고 더 잘하고 싶은 의지를 보임. 기본 개념 습득뿐만 아니라 교과서 문제를 반복적으로 풀어보며 열심히 하는 모습이 기특함. 주어진 조건 에서 함수의 그래프 개형을 알고 방정식의 서로 다른 실근의 개수가 4개가 되도록 하는 조건을 추론하여 정답을 찾아가는 과 정을 자신감 있게 발표함. 나도 출제자 활동에서 정적분의 활용과 관련된 문항을 직접 출제하고 모범답안을 작성함. 곡선과 직선으로 둘러싸인 도형의 넓이에 대한 최솟값을 구하는 문제를 출제함으로써 정적분과 산술기하평균의 다양한 수학적 개념 을 적용하여 해결하는 경험을 친구들에게 제공함. 다른 친구들이 출제한 미분과 적분에 관한 여러 가지 유형의 문제를 풀어보 면서 관련 개념을 더욱 정확하게 인지하고 융합적으로 사고할 수 있는 기회를 가짐. 이차함수와 x축으로 둘러싸인 도형의 영 역을 그림으로 이해하고 도형의 넓이를 구하는 과정을 친구들과 함께 유도하며 공식으로 정리하는 활동에 참여함. \n확률과 통계: 확률분포표 작성을 위한 실생활 자료의 분석과 해석 능력이 우수하며, 경우의 수와 확률을 적용하여 관계를 찾 아 확률분포표를 구체화하여 확률밀도함수와 기호, 수학적 용어를 사용하여 간단명료하게 표현하고, 평균과 표준편차를 산출 하며 그 의미를 잘 해석할 줄 앎. \n9 \n문제 해결과 관련하여 자기 생각을 잘 표현하며, 주변의 의견을 잘 반영하여 새로운 해결책을 추구하는 의지와 자기관리 역량 이 우수함. \n중단원 문제풀이 시간에 확률의 곱셈정리를 이용한 문제를 그림으로 도식화하여 알기 쉽게 표현하여 학생들에게 이해도를 높 였으며, 기본 해법 이외 다른 해법도 제시하며 문제 해결하는 모습에서 뛰어난 발표능력과 소통하는 능력을 엿볼 수 있었음. 자유 심화주제 발표 시간에 정규분포의 실생활 활용에 관해 관심이 생겨 조사 활동을 하고 ppt를 제작, 발표함. \n정규분포는 많은 자연현상과 사회적 데이터가 따르는 패턴으로 이 결과를 분석, 종합하여 미래 현상을 예측하는 도구이며, 예시로 학생들의 시험점수, 사람들의 키, 기업의 판매 데이터 등에 활용됨을 알게 되었음. \n많은 현상들이 실제로는 규칙적인 통계를 따르게 되어 그래프나 도표로 표현이 가능해지므로, 이를 정확하게 이해하고 분석 이 필요함을 깨달음. \n영어 I: 영어에 관심이 있으며 영문판 Jane Eyre (제인에어)를 읽고 보고서를 제출함. 번역판이 아닌 원서를 읽으면서 문학 관련 영어문장 구성과 어휘를 접할 수 있었고 좀 더 일상적인 영어를 습득할 수 있는 기회를 갖고 실력 향상을 위해 노력함. 3분 스피치 시간에 'Into the World of Computer Engineering' 라는 주제를 발표함. 평소 관심 분야인 컴퓨터 공학의 역사, 가능성, 장점 등을 PPT 자료를 활용하여 이해하기 쉬운 영어로 설명하고 발표함. 수행평가 시 인터뷰에서 유창한 발 음으로 자신을 소개함. 매일 일정하게 영어 어휘를 익히고 구문파악을 통해 영어 실력 향상을 위해 노력함. \n물리학 I: 수업 시간에 마찰력에 대한 학습을 한 후 학교에서 신발을 신고 미끄러질 뻔한 순간이 자주 있어서 과연 어떤 신발 을 신어야 덜 미끄러질 수 있는지 궁금증을 갖고 마찰력 공식을 이용하여 마찰력을 측정해 보는 실험을 진행함. 실험 결과 마 찰력에 영향을 주는 요인으로 신발의 종류와는 관계없이 신발 밑창 재질과 문양에 영향을 받는다는 것을 알게 되었으며 슬리 퍼가 가장 많이 미끄러졌으므로 EVA 재질에 문양이 거의 없는 밑창이 마찰력이 가장 약하며 고무재질에 무늬가 많은 밑창을 가진 장화가 마찰력이 가장 강하다는 점을 알게 됨. 마찰력은 접촉면 거칠기 (마찰계수), 무게(수직항력)에 비례하므로 수직 항력을 일정하게 만들고 동일한 경사면을 사용하여 다른 예외 없이 마찰계수의 영향만을 받아 신발 밑창에 따른 마찰력의 차 이를 계산해 보는 활동을 진행하여 실험을 할 때 변인통제의 의미를 알고 수행하는 모습에서 과학적 탐구능력이 향상됨. 또한 \nMBL을 이용한 운동량 보존 실험에서 거리와 시간 관계 그래프를 이용하여 속도, 가속도 값을 분석하고 미분, 적분을 활용 하여 조건을 변화시켜가며 원하는 물리량을 얻는 등 데이터를 분석하는 활동에서도 오차를 고려하고 실험을 수행함. \n용화여자고등학교 \n2025년 11월 21일 12/20 반 \n07 \n번호| 13 |이름 주서연 \ngov.kr \n정부24 \n문서확인번호: 1763-6519-8118-8469 (신청인:주서연) \n과목 \n세 부 능력 및 특기사항 \n화학I: 수업에 대한 집중력이 높고 교사의 발문에 적극적으로 대답하며 수업 내용에 대해 자신이 이해한 부분을 친구들에게 가르쳐주며 수업을 이끌어감. 물질의 양을 몰 개념으로 표현하는 데 능숙하며, 몰 농도에 대한 이해를 바탕으로 0.1 M 황산 구리 수용액을 정확한 절차대로 제작함. 지시약을 이용해 식초에 포함된 아세트산의 농도를 정확하게 측정하고, 해당 결과를 활용하여 식초 속 아세트산의 함량을 계산해 보고서에 작성함, 역동적인 화학 반응 단원에서 산화 환원 반응에 대해 학습한 후, 이론적인 지식을 실험을 통해 확인하고자 산화 환원 반응이 이용되는 은거울 반응 실험을 준비함. 탐구를 수행하며 반응 과정의 영상을 찍는 역할을 맡아 수행함. 실험 과정에서 퍼센트 농도로 표현되어 있는 용액을 몰 농도로 환산하여 정확한 양 을 맞춰야 할 때 교과 시간에 배운 몰 농도 개념을 이용하는 등 개념을 능숙히 응용할 줄 아는 학생임. 은 이온이 환원되고, 알데하이드가 산화되며 은거울 반응이 진행된다는 사실을 조사하여 실험을 통해 얻은 결과와 함께 보고서를 작성함. \n생명과학I: 효소의 특징을 이해하고 일상생활에서 효소가 이용되는 사례를 찾아서 정리하고 콩즙이 암모니아로 분해될 때 사용되는 '유레이스 효소'를 찾는 과정을 통해 과학적 사고 능력을 확산함. '콩즙으로 요소 분해하기' 실험을 진행을 할 때 모 둠 협력 활동이 우수하며 집중력이 뛰어나 모둠원들과 함께 실험 개요를 작성하고 준비하는 과정 및 효소의 활성에 대한 내용 을 정리하는 과정에서 주도성, 협력 및 리더십을 함께 보임. 좀개구리밥 개체군의 생장과 pH와의 관련성에 대한 가설을 세우 고 생장곡선을 그리는 활동을 수행함. 실험 설계에서 조작 변인과 통제 변인을 설정하고 개체군의 생장과 환경 저항을 연결 지어 실제적 생장곡선이 그려지는 활동지를 작성함. \n지구과학I: 지구과학 스터디 그룹을 결성하여 10회에 걸쳐 공동 학습을 진행함. 단원별 핵심 주제를 구분하여 책임자를 정 한 후 집중 탐구하여 학습 내용을 심화하였고 그 결과를 다른 팀원들에게 강의식으로 전달하며 학습 효율을 높였음. 이 과정 에서 학습 내용의 체계화와 전달 능력, 책임감이 증진되었고 학습에 대한 자신감을 갖는 계기가 되었으며 어려운 기출 문제 를 함께 해결하며 협력 학습을 통해 협동심이 증진되었음. \n베니오프대와 해령, 열점에서 생성되는 마그마의 특성 차이 및 생성 원리를 잘 비교하였고 깊이에 따른 지각과 맨틀의 온도 및 압력 그래프상에서 온도 상승, 압력 감소에 따라 마그마가 생성되는 물리량의 변화, 물의 유무에 따른 맨틀 용융 온도 변 화원리를 이해하는 과정에서 분석력이 돋보였음. \n중국어 I: 중국 주제 탐구 활동에서 '지금은 중국을 읽을 시간 1'이라는 책을 읽고 중국 대입 시험에서 드론을 활용해 부정행 위를 감시한다는 내용이 흥미로웠다고 함. 평소 컴퓨터 공학에 관심이 많아 드론에 활용된 공학 기술에 대해 자세히 알고 싶 다고 했으며, 중국의 컴퓨터 공학 기술의 발전 정도가 커서 놀랐다고 함. \n중국 온라인 사업 기획 활동에서 '지금은 중국을 읽을 시간 2'라는 책을 읽고 중국인이 좋아하는 한국 드라마에 대해 조사하 여 선호하는 이유에 대해 활동지에 글로 표현함. 한국의 식품인 김을 수출하고 싶어 하며, 한국 드라마에서 김을 먹는 장면을 \n연계하여 홍보하고 싶어 함. \n원어민 교사와 함께 하는 수업 시간에 즐겁게 참여하려고 노력하는 모습을 보임. 중국어 인사말, 음식, 날짜, 시간 등 다양한 표현을 연습함. 중국 명절, 음식, 숫자 등 중국 문화를 이해하고자 노력함. 중국 전지 공예 작품을 열심히 만듦. \n<진로 선택 과목> \n성취도 \n성취도별 \n학기 \n교과 \n과목 \n단위수원점수/과목평균 \n비고 \n(수강자수) \n분포비율 \n기술·가정/ 1 제2외국어/한 문/교양 \n인공지능과 미 래사회 \n1 \n96/92.4 \nA(28) \nA(96.4) B(3.6) C(0.0) \n용화여자고등학교 \n2025년 11월 21일 13/20 반 \n07 \n번호 13 이름 \n주서연 \ngov.kr \n정부24 \n문서확인번호: 1763-6519-8118-8469 (신청인:주서연) \n성취도 \n성취도별 \n학기 \n교과 \n과목 \n단위수원점수/과목평균 \n비고 \n(수강자수) \n분포비율 \n2 \n기술·가정/ 제2외국어/한 문/교양 \n인공지능과 미 래사회 \n1 \n94/95.9 \nA(28) \nA(96.4) B(3.6) C(0.0) \n이수단위 합계 \n과목 \n2 \n세부능력 및 특기사항 \n(1학기) 인공지능과 미래사회: 인공지능이 발전하는 사회에서 데이터의 활용과 예측이 중요하다는 점을 이해하고 인공지능을 학습 시키는 빅 데이터의 효율적인 활용 방법에 대해 조사하여 발표함. 그 과정에서 데이터의 학습과 예측의 중요성에 대해 다시 한번 알게 됨. 학교에서 활용 가능한 인공지능의 아이디어로 교수 학습을 도와주는 인공지능에 대한 아이디어를 제안하 여빅 데이터로 학습한 내용을 바탕으로 개인 별 맞춤형 서비스를 제공할 수 있도록 아이디어를 발표함. \n(2학기) 인공지능과 미래사회: 수업 시간에 배운 내용을 바탕으로 인공지능 기기들에 대해 조사하고 발전 가능성에 대해 고민 하여 정보 기술과 소프트웨어의 발달이 개인의 삶과 사회에 미친 영향과 가치를 진지하게 고민함. 인공지능의 학습 방법과 데 이터의 양에 따라 예측 값의 정확성이 변동 된다는 사실을 파악하고 현실 세계에서 문제 상황을 가정하여 스트레스 지수 간의 \n상관관계 분석에 대한 인공지능 모델을 설계하여 구현하기 위해 노력하는 모습을 보임. \n<체육·예술> \n학기 \n교과 \n과목 \n단위수 \n성취도 \n비고 \n체육 \n운동과 건강 \n2 \nA \n1 \n예술 \n미술 \n3 \nA \n체육 \n운동과 건강 \n2 \nA \n2 \n예술 \n음악 \n3 \nA \n이수단위 합계 \n10 \n과목 \n세부능력 및 특기사항 \n운동과 건강: 농구 경기에서 인원이 부족한 팀이 경기를 할 때 자발적으로 지원하여 더 많은 시합에 참여하는 적극적인 모습 을 보이고 승패를 떠나서 팀원들을 격려하고 매너있는 태도로 수업에 임함. 특히 패드민턴 포, 백핸드 올려치기 수행평가 1 차 시험에서 실수하여 매우 적은 횟수를 기록하였으나 이후 더 열심히 연습하고 집중하여 2차 시험에 최고점을 받는 등 노력 하는 모습이 인상적인 학생임. \n음악: 수업시간에 성실히 참여하며 음악에 대한 관심도가 높은 학생임. 기악(피아노) 영역에서는 제재곡 '버터플라이 왈츠'를 바른 자세와 주법을 통해 연주함. 제재곡의 음정, 박자 등 기본적인 음악요소 뿐만 아니라 스스로 곡을 해석하고 이에 맞는 악상기호를 능동적으로 적용할 줄 아는 학생임. 또한, 음악적 프레이징을 고려하기 위해 레가토 페달의 사용법을 익히고 이 를 연습하였으며 친구들과 서로의 연주를 감상하고 이에 대한 조언 등을 나누며 음악적 소통역량을 갖춤. 제재곡 뿐 아니라 다른 곡에도 관심이 생겨 다른 곡을 연주해보는 등 자기주도적으로 연습과정에 참여한 점이 인상적임. 감상 활동에서는 다양 한 시대의 음악을 듣고 시대의 변천에 따른 음악의 특징을 비교하여 학습함. 특히 무소르그스키의 피아노 모음곡 '전람회의 그림'이 저린한 화가 하르트만의 유작 전시회를 보고 작곡한 사실을 알고 음색, 곡의 분위기, 리듬 등을 바탕으로 작곡가의 감정이 어떠한 음악적인 요소를 통해 표현되었는지를 중심으로 해석하고 이에 느낀바를 작성함. \n용화여자고등학교 \n2025년 11월 21일 14/20 반 \n07 \n번호| 13 |이름 \n주서연 \ngov.kr \n정부24 \n과목 \n문서확인번호: 1763-6519-8118-8469 (신청인:주서연) \n세 부 능력 및 특기사항 \n미술: 〈회화> 클로드 모네의 '센 강의 만곡부'라는 작품을 선택하여 작가소개와 작품에 대한 발표를 잘함. 원작의 형태를 잘 옮겨 그리고 색채와 붓 터치 등을 세심하게 관찰하여 인상파 화풍을 잘 재현함. 학습 목표를 잘 이해하고 회화적 표현력과 몰 입하는 자세가 좋음. \n[3학년] \n원점수/과목평균 \n성취도 \n학기 \n교과 \n과목 \n단위수 \n석차등급 \n비고 \n(표준편차) \n(수강자수) \n국어 \n언어와 매체 \n3 \n70/64.9(26.0) \nC(141) \n5 \n수학 \n미적분 \n54/65.8(23.7) \nC(113) \n6 \n영어 \n영어II \n3 \n38/48.4(26.1) \nE(220) \n5 \n1 \n기술.가정/제2 \n외국어/한문/교 양 \n심리학 \n2 \nP \nP \n국어 \n언어와 매체 \n3 \n53/55,2(27.6) \nE(142) \n5 \n수학 \n미적분 \n12/49.5(28.3) \nE(113) \n8 \n영어 \n영어II \n3 25/34.3(20,9) \nE (221) \n5 \n2 \n기술.가정/제2 외국어/한문/교 양 \n심리학 \n2 \nP \nP \n이수단위 합계 \n22 \n과목 \n세부능력 및 특기사항 \n언어와 매체: 자신의 의견을 명확하고 논리적으로 전달할 수 있는 학생이며 매번 성실하고 바른 자세로 수업에 임함. 화법, 작문, 문법, 문학 등 국어 영역에 대한 흥미와 성취도가 높음. \n미적분: 지수함수와 삼각함수의 곱으로 이루어진 함수에서 부분적분법을 할 때, 동일한 패턴이 반복될 수 있음을 방정식을 이용하여 바르게 이해했으며, 이때 패턴의 규칙성을 이용하여 적분할 수 있음을 확인함. 또한 여러 가지 함수에 대한 치환적 분법을 통해 적분변수를 삼각함수로 치환하여 정적분의 값을 구하는 능력이 뛰어난 학생임. 특히 주어진 함수를 새로운 변수 로 변환하거나 부분적으로 분해하여 적분값을 효과적으로 구하는 능력이 우수함. \n적분을 이용하여 접선의 기울기를 계산하고, 이를 통해 함수의 대수적인 특성과 그래프의 특성을 분석하는 능력이 뛰어남. \n영어 II: 수업참여도가 높아 수업내용과 관련된 질문에 실수를 두려워 하지 않고 해답을 찾을 때까지 대답하는 열의를 보여 줌. 논리력과 어휘력이 풍부하여 까다로운 지문을 제시하더라도 글의 주제를 파악할 수 있으며 영문법에 대한 꾸준한 학습을 바탕으로 글의 구조를 파악하는데도 우수한 자질을 드러냄. \n심리학: 수업 시간에 열심히 참여하는 모습을 보임. 자신의 성격 분석 보고서 작성하기 활동에서 긍정적이며 노력하는 성격 임을 교과서 자료를 활용해 찾아내고, 이 성격을 긍정적으로 활용하기 위해 스스로 어떤 목표를 세우고 이를 실천하는 주도성 \n용화여자고등학교 \n2025년 11월 21일 15/20 반 \n07 \n번호 13 이름 \n주서연 \n(KOR \ngov.kr \n정부24 \n과목 \n문서확인번호: 1763-6519-8118-8469 (신청인:주서연) \n세부능력 및 특기사항 \n을 지니면 더욱 좋은 효과가 있을 것 같다는 자기 분석을 함. 스스로 자기 주도성을 지니기 위해 가져야 할 심리적 자신감을 붇돋는 활동을 탐색하고, 이를 바탕으로 단기, 장기 목표를 세우고 제시하는 연습을 추가로 함. \n<진로 선택 과목> \n성취도 \n학기 \n교과 \n과목 \n단위수원점수/과목평균 \n(수강자수) \n성취도별 \n분포비율 \n비고 \n수학 \n기하 \n3 \n61/74.0 \nB(88) \n수학 \n수학과제 탐구 \n3 \n32/63.1 \nC(134) \nA(50.0) B(29.5) C(20.5) \nA(47.0) B(13.4) C(39.6) \n사회(역사/도 \n여행지리 \n2 \n78/87.1 \nB(28) \nA(71.4) B(28.6) C(0.0) \n덕포함) \n1 \n과학 \n물리학 II \n2 \n52/72.8 \nC(49) \n과학 \n화학II \n2 \n60/73.2 \nB(74) \nA(44.9) B(26.5) C(28.6) \nA(47.3) B(24.3) C(28.4) \n과학 \n생명과학II \n2 \n60/68.4 \nB(87) \nA(50.6) B(12.6) C(36.8) \n과학 \n지구과학II \n2 \n58/64.4 \nC(34) \nA(35.3) B(23.5) C(41.2) \n과학 \n고급 물리학 \n2 \n74/86.4 \nB(11) \nA(63.6) B(36.4) C(0.0) \n수학 \n기하 \n3 \n47/66.2 \nC(88) \nA(34.1) B(28.4) C(37.5) \n수학 \n수학과제 탐구 \n3 \n16/39.8 \nC(134) \nA(29.1) B(9.7) C(61.2) \n사회(역사/도 \n여행지리 \n2 \n84/88.9 \nA(28) \nA(85.7) B(10.7) C(3.6) \n덕포함) \n2 \n과학 \n물리학 II \n2 \n100/95.8 \nA(49) \nA(95.9) B(0.0) C(4. 1) \n과학 \n화학II \n2 \n52/81.2 \nC(74) \nA(66.2) B(1.4) C(32.4) \n과학 \n생명과학II \n2 \n75/82.0 \nB(87) \nA(48.3) B(44.8) C(6.9) \n과학 \n지구과학II \n2 \n69/80.1 \nB(34) \nA(61.8) B(23.5) C(14.7) \n과학 \n고급 물리학 \n2 \n74/76,2 \nB(11) \nA(9.1) B(90.9) C(0.0) \n이수단위 합계 \n36 \n과목 \n세부능력 및 특기사항 \n기하: 수학에 대한 큰 관심과 흥미를 가지고 있으며, 문제 해결에 대한 끈기와 열정적인 학습 태도를 보임. 사분면 상의 점을 원점과 이은 벡터를 주어진 벡터를 이용하여 표현하는 과정을 벡터의 개념과 연산을 활용하여 체계적으로 풀어낼 수 있음. \n수학과제 탐구: 학습태도가 바른 학생으로 수학과제탐구를 통해 알고 있는 개념을 수학 문제에 적용해서 해결하는 능력을 기 름. \n여행지리: 수업에 성실히 참여하고 다양한 활동과 발표에 적극적으로 임함. '우리나라의 다양한 여행지와 특산물'을 주제로' 군산 지역'에 대해 조사함. 군산의 지리적 위치와 화교의 유입이라는 역사적 사실을 바탕으로 '군산에 짬뽕이 유명한 이유'를 \n용화여자고등학교 \n2025년 11월 21일 16/20 반 \n07 \n번호| 13 |이름 \n주서연 \ngov.kr \n정부24 \n과목 \n문서확인번호: 1763-6519-8118-8469 (신청인:주서연) \n세부능력 및 특기사항 \n논리적으로 추론하고 발표함. '교통수단과 여행'을 주제로 운송비 그래프를 다양한 교통수단의 특징과 연결지어 분석함. 또 한, 다양한 기후 지역 그래프를 분석하였고, 강수량과 기온을 바탕으로 해당 지역주민의 삶을 추론하여 글로 서술함. 각 그래 프에 대한 분석은 타당했고, 각각의 수치 값들이 어떤 의미를 나타내는지 알고 있는 학생임을 알 수 있었음. '동네 심상지도' 를 그리고, 자신의 지역을 소개하는 '여행 상품'을 제작함. 지도를 그리며 조망 능력과 정향 능력 등, 공간 능력을 적절히 사 용하려는 모습을 보임. 여행 상품을 제작하며 다양한 지도와 자료를 조사하였고, 자료 사용에 있어 객관성과 신뢰성을 철저 히 확인함. 영화 '라스트 홀리데이 (웨인 왕 감독)'을 보고, 여행의 소중함을 깨달았다고 소감을 밝혔으며, 여행을 통해 내적 성장을 이뤄내고자 다짐하는 모습을 보임. \n물리학 II: 물리학에 대한 이해를 높이기 위해 '10대에게 권하는 물리학 (이강영)'을 읽음. 고대의 자연철학부터 뉴턴의 만유 인력의 법칙으로 대표되는 고전물리학, 그리고 현대물리학에 이르기까지 물리학의 발전 과정을 살펴보면서 각 이론의 핵심 내용을 흥미 있게 이해할 수 있는 계기가 됨. 특히 아인슈타인의 상대성 이론이 갈릴레이의 상대성 원리와 맥스웰 방정식 등 여러 원리와 이론을 거쳐 발전해 왔다는 것을 알게 됨. 또한 물리학을 통해 과학적 사고에 꼭 필요한 환원적 사고방식을 배울 \n수 있다는 점에 깊은 인상을 받음. 전기 회로의 원리를 이해하고 직류 회로에서 저항의 연결 방식에 따라 전류와 전위차를 측정하며 전기 에너지를 정확히 산출함. 전기장을 배우면서 검전기를 대전하여 실험을 성공적으로 수행하고 정전기 유도와 유전분극의 개념을 경험적으로 익힘. \n화학II: 촉매가 생명 현상이나 산업 현장에서 중요한 역할을 하는 예를 찾을 수 있음. 화학 전지의 작동 원리를 산화환원 반 응으로 설명할 수 있음. \n생명과학II: 양파 세포의 삼투압 모의 실험을 통해 식물은 동물과 다르게 세포벽이 있어 저장액과 고장액에서 동물과 다른 양상을 보인다는 것을 이해하게 되었고, 농도가 서로 다른 동물의 삼투압을 비교할 수 있게 됨. 유전자 형질 발현 모의 실험 을 통해 유전자의 흐름을 알게 되었고, 유전자의 방향성은 5탄당의 탄소 번호가 기준이라는 것을 이해하게 됨. \n지구과학II: 지구를 구성하는 다양한 광물의 종류를 알고, 각 광물의 물리적 특징에 대해 알아보았으며, 편광현미경을 통해 서 관측되는 간섭색, 다색성, 소광현상 등 다양한 광학적 특징에 대해 이해함. 대기와 해양을 움직이는 힘인 기압경도력, 수 압경도력, 마찰력, 전향력, 중력에 대해 이해하고 각 힘들의 역학적 상관관계에 따라 대기와 해양이 움직이는 방향을 예측할 수 있음. 대기가 높은 산을 통과하면서 기온과 이슬점의 변화를 계산할 수 있으며, 이를 통해 상대습도와 절대습도의 변화를 분석하여 그래프로 표현함. \n고급 물리학: 늘 성실하게 수업에 임하며 교사와의 상호작용이 훌륭한 학생임. 물리학에 대한 흥미와 탐구심이 있어 스스로 학습하는 능력이 뛰어남. 새롭게 배운 내용과 기존의 알고 있는 지식을 종합하고 재정리하는 능력이 물리학 전 영역에 걸쳐 우수함. '양자역학 소녀'를 읽고 양자역학이라는 학문과 우리 삶 속 인간관계를 연결시켜 활용한 부분을 보고서로 작성하여 발표함. 교과서에 나오지 않은 창의적인 방법으로 중력가속도를 측정하는 탐구 과정에서 단진자의 단진동을 통해 중력가속도 를 측정하고 이론적인 값과 측정값의 차이가 나는 이유를 분석하고 오차에 대한 보고서를 작성함. \n<체육·예술> \n학기 \n교과 \n과목 \n단위수 \n성취도 \n비고 \n1 체육 \n운동과 건강 \n1 \nA \n2 \n체육 \n운동과 건강 \n1 \nA \n이수단위 합계 \n2 \n용화여자고등학교 \n2025년 11월 21일 17/20 반 \n07 \n번호 \n13 이름 \n주서연 \n많은 \n(KOR \ngov.kr \n정부24 \n문서확인번호: 1763-6519-8118-8469 (신청인:주서연) \n과목 \n세부능력 및 특기사항 \n운동과 건강: 체육부장으로서 수업 전 교구를 준비하고 수업에 대한 전반적인 준비를 잘하며 뛰어난 리더십으로 학생들이 수 업에 집중 할 수 있도록 도움. 또한 배드민턴 수업 시 경기에서 경쟁의 의미와 페어플레이 정신을 배우고, 뛰어난 탐구능력을 바탕으로 스매시동작에 대한 연구를 끊임없이 함. 스매시 할 때의 팔꿈치의 각속도와 회전반경을 연구하여 훨씬 더 나은 동 작을 보임. 점프 동작에 대한 과학적인 원리를 알아보고 점프 시 지면반력의 작용, 지면반력이 이용되는 근육의 종류를 확인 하여 여러자세로 점프하여 경험해보고 좋은 자세를 찾는 탐구를 진행함. \n7. 독서활동상황 \n학년 \n과목 또는 영역 \n1 \n2 \n3 \n8. 행동특성 및 종합의견 \n학년 \n독서 활동 상황 \n행동특성 및 종합의견 \n1 \n2 \n자신이 맡은 일에 대해서는 적극적이며 추진력이 있는 성격으로 학급 회장으로서 학기초에 많이 어색할 수 있는 상 황이었지만 반친구들의 화합을 위해 노력함. 줌을 통한 자습 스터디를 조직하여 친구들과 공부하는 모습을 공유하며 친해질 수 있는 계기를 마련하였으며 학급 자치 시간에도 반에서 지켜야 하는 학급 규칙들을 정하는 일에 앞장서서 아이들을 설득 시키고 먼저 솔선수범하여 깨끗한 교실을 유지하는데 리더십을 발휘함. 학급 친구들과도 갈등없이 두 루 어울리며 학급의 회장으로서 집단을 잘 이끌어 나감. 학업 계획에 있어서도 스스로 주도하여 자신의 학습을 설계 하는 습관을 갖고 있으며 자신의 계획대로 실천해 나가는 실행 능력도 갖추고 있음. 부족한 학습량을 보완하기 위해 평일 아침 조회 시작 전 영어 스터디 모임을 구성하여 미리 영어 단어와 본문을 외운 후 각자 활동지를 만들어와서 공유하며 문제를 풀어보는 활동을 함. 학업성취도 면에서도 학습 플래너를 이용하여 매일 체계적인 계획을 세우고 꾸준히 노력하여 조금씩 향상 되었으며 자발적이고 적극적인 학습 태도를 가지고 있어 앞으로의 성장이 기대되는 학 생임. \n매사에 긍정적이며 다른 사람에게 웃음을 줄 수 있는 매력을 지니고 있고, 늘 다른 사람들과 즐겁게 학교생활을 하는 모습이 보기 좋고 새로운 것에도 과감하게 도전하는 적극성이 있음. 과학, 영어과목을 자기주도학습을 통해 공부하 였는데 특히 영어 단어는 아침 일찍 등교하여 친구와 함께 학습하여 테스트를 보는 형태로 서로에게 멘토, 멘티가 되 어 공부하는 모습을 보임. 또한 지구과학 스터디를 결성하여 각자 범위를 정하고 해당부분의 설명과 관련문제를 푸 는 형식으로 하여 서로 설명해주며 진행하였으며 시험 막바지에는 노트정리를 공유하여 서로에게 요약본을 제공하 는 등 자기주도적으로 학습하려고 노력함. 또한 중학생 대상 학교 홍보 실험 체험 활동에 참여하여 다양한 실험 활동 운영의 경험을 바탕으로 실험 준비, 진행 보조, 뒷정리 등에 알맞은 도움을 주며 원활한 체험 활동에 기여하고 이상 적인 이공계 선배로서의 모습을 보여줌. 학급에서 1년동안 미디어 담당을 하여 선생님들의 수업이 유연하게 진행될 수 있도록 도왔으며 소소한 일들에 대해서 묵묵히 자신의 역할을 다해 주는 모습을 통해 무슨 일이든 책임감을 갖고 성실하게 수행할 수 있는 학생임을 보임. \n3 \n긍정적이고 밝은 성격을 지니고 있어 어떤 상황에서도 낙관적인 태도를 유지하며 주변에 활력을 불어넣음. 현실적인 판단력이 뛰어나며, 어려운 문제에 직면했을 때도 쉽게 포기하지 않고 해결책을 모색하는 능력을 갖추고 있음. 학급 \n용화여자고등학교 \n2025년 11월 21일 18/20 반 \n07 \n번호 13 이름 \n주서연 \ngov.kr \n정부24 \n학년 \n문서확인번호: 1763-6519-8118-8469 (신청인:주서연) \n행동특성 및 종합의견 \n행사를 계획하는 과정에서 다양한 의견을 제시하며, 행사 진행 시 발생할 수 있는 문제 상황을 미리 예상하고 대비 하여 행사가 성공적으로 진행될 수 있도록 기여함. 학급 분위기를 밝게 만들어주며, 원활한 대인관계를 형성하여 새 로운 친구들과 선생님들과도 두루 좋은 관계를 유지함. 학업 스트레스를 효과적으로 관리하며 꾸준하게 노력하는 자 세를 유지하는 등 자기 주도적인 학습 태도가 돋보임. 새로운 환경에서도 위기 극복 능력이 뛰어나며, 변화를 긍정적 으로 받아들이고 능동적으로 적응하는 모습이 인상적임. 성실함과 긍정적인 태도를 바탕으로 공동체에 기여하며, 지 속적으로 성장해 나가는 학생으로 앞으로가 기대됨. \n용화여자고등학교 \n2025년 11월 21일 \n19/20 반 \n07 \n번호 \n13 이름 \n주서연 \ngov.kr \n정부24 \n문서확인번호: 1763-6519-8118-8469 (신청인:주서연) \n발급번호: B100000512-2025-002738 \n학교생활기록 부 \n성 \n명 \n주서연 \n인적 \n사항 \n주민등록번호 060105-******* \n담당부서 \n용화여자고등학교 \n담당자 전화번호 \n조용준 \n02-950-3527 \n위 사람의 학교생활기록부 사본임을 증명합니다. \n2025년 11월 21일 \n용화여자고등학교장 \n용화여자고등학교 \n2025년 11월 21일 20/20 반 \n07 \n번호 \n13 이름 \n주서연 \ngov.kr \n정부24 \n"
}