{
  "student_info": {
    "name": "백민건",
    "gender": "남",
    "birth": "060731",
    "address": "경기도 수원시 권선구 매송고색로 751-17, 103동 604호 (고색동, 상우아파트)",
    "school_history": [
      "2022년 1월 7일 수성중학교 제3학년 졸업",
      "2022년 3월 2일 고색고등학교 제1학년 입학",
      "2025년 1월 3일 고색고등학교 제3학년 졸업"
    ]
  },
  "attendance": "출결 구간 전체 raw 저장됨",
  "awards": [
    {
      "grade": "1",
      "award_name": "교과우수상",
      "date": ""
    },
    {
      "grade": "2",
      "award_name": "모범상",
      "date": ""
    },
    {
      "grade": "0",
      "award_name": "창의적체험활동상",
      "date": ""
    },
    {
      "grade": "4",
      "award_name": "창의적체험활동상",
      "date": ""
    },
    {
      "grade": "1",
      "award_name": "시간) 자율주행 자동차 프로젝트를 실시함에 능동적이며 적극적 으로 프로젝트를 실시하는 모습이 인상",
      "date": ""
    },
    {
      "grade": "0",
      "award_name": "창의적체험활동상",
      "date": ""
    },
    {
      "grade": "6",
      "award_name": "창의적체험활동상",
      "date": ""
    },
    {
      "grade": "3",
      "award_name": "개의 단추 중에 하나를 선택하여 클릭하여 상",
      "date": ""
    },
    {
      "grade": "2",
      "award_name": "개의 도시를 구상",
      "date": ""
    },
    {
      "grade": "3",
      "award_name": "독서 활동 상",
      "date": ""
    },
    {
      "grade": "1",
      "award_name": "역활을 성실히 수행하였으며 인터 넷 강의 수강과 문제풀이를 통해 심화학습을 진행하고 있어 앞으로 성적에도 많은 향상",
      "date": ""
    }
  ],
  "certificates": "및 인증 취득상황 \n<자격증 및 인증 취득상황> \n구분 \n명칭 또는 종류 \n번호 또는 내용 \n취득연월일 \n발급기관 \n<국가직무능력표준 이수상황> \n능력단위 \n학년 \n학기 \n세분류 \n이수시간 원점수 \n성취도 \n비고 \n(능력단위코드) \n해당 사항 없음",
  "creative_activities": {
    "grade1": "2",
    "grade2": "구분 \n학년",
    "grade3": "1. 인적·학적사항 \n성명 : 백민건 \n학생정보 \n학과 \n반 번호 \n담임성명"
  },
  "academic_records": [
    "문서확인번호: 1763-6399-9850-6483 (신청인 : 백민건) \n학교생활세부사항기록부(학교생활기록부II) \n졸업대장번호 3442 \n구분 \n학년 \n1 \n2 \n3 \n1. 인적·학적사항 \n성명 : 백민건 \n학생정보 \n학과 \n반 번호 \n담임성명 \n7 \n12 \n백은정 \n9 \n8 \n백종진 \n1 \n6 \n심한계 \n성별 : 남 \n주민등록번호 : 060731-***** 같은 은",
    "주소: 경기도 수원시 권선구 매송고색로 751-17, 103동 604호 (고색동, 상우아파트) \n2022년 1월 7일 수성중학교 제3학년 졸업 \n학적사항 2022년 3월 2일 고색고등학교 제1학년 입학 \n2025년 1월 3일 고색고등학교 제3학년 졸업 \n특기사항 \n2. 출결상황 \n결석일수 \n지각 \n학년 수업일수 \n조퇴 \n결과 \n질병 미인정 기타 질병 미인정 기타 질병 미인정 기타 질병 미인정 기타 \n1 \n191 \n3 \n1 \n2 \n190 \n1 \n1 \n3 \n190 \n4 \n3. 수상경력 \n학년 \n수상명 \n(학기) \n1 \n특기사항 \n원격수업일수 3일 \n원격수업일수 0일 \n참가대상 \n등급(위) \n수상연월일 \n수여기관 \n(참가인원) \n1 교과우수상(인공지능 수학) \n2024.07.19. \n고색고등학교장 \n수강자 \n3 \n2 \n모범상(선행부문) \n2024, 11, 22. \n고색고등학교장 \n3학년(247명) \n고색고등학교 \n2025년 11월 20일 1/20 반 \n1 \n번호 6 \n이름 \n백민건 \n(KOR), \ngov.kr \n정부24",
    "문서확인번호: 1763-6399-9850-6483 (신청인 : 백민건) \n4. 자격증 및 인증 취득상황 \n<자격증 및 인증 취득상황> \n구분 \n명칭 또는 종류 \n번호 또는 내용 \n취득연월일 \n발급기관 \n<국가직무능력표준 이수상황> \n능력단위 \n학년 \n학기 \n세분류 \n이수시간 원점수 \n성취도 \n비고 \n(능력단위코드) \n해당 사항 없음 \n5. 창의적 체험활동상황 \n학년 \n영역 \n시간 \n1 \n자율활동 \n90 \n창의적체험활동상황 \n특기사항 \n동사형꿈 진로캠프(2022.03.18.)에 참여하여 자신의 본질과 긍정적인 자아 형성 과정 을 체험하고 이해함. \n사제동행 소백산 극기캠프(2022.05.14.)에 참여하여 호연지기를 키우고, 모험, 극 기, 봉사활동을 통해 자아정체성을 확보함. \n고교학점제 디자인 씽킹 2045 진로캠프 (2022.06.17.)에 참여하여 자기 주도적으로 진로와 연계한 학업 계획을 수립 이수할 수 있는 역량을 함양함. \n착한 지구인 프로젝트 환경 특강 (2022.08.26.)을 통해 탄소중립의 필요성과 우리나라 에서 탄소중립 실천을 위해 적극적으로 시행되고 있는 분리수거와 자원 순환에 대한 강 의를 듣고 국가적 차원, 사회적 차원, 개인적 차원에서 가능한 일 등을 정리하고 스스 로 실천가능한 방안을 제시함. \n착한 지구인 프로젝트 환경 특강(2022. 11. 11.)을 통해 기후 위기에 대응하기 위한 다 양한 정책과 실천 방안 교육을 통해 기후변화를 멈추기 위해 자기 주도적으로 실천할 수 있는 다양한 방법을 제시함. \n뮤지컬에서 조연 역할을 맡아 연기하였으며 연기에 대한 관심이 많아 흥미로워하고, 열심히 참여하는 모습을 보임. 대사 및 가사를 성실하게 암기하며 완벽한 결과물을 만 들어 냄. 매사에 열정적인 모습으로 수업에 임하며 배려심이 많아 친구들을 잘 챙겨주 며 리더십이 높음. \n고색고등학교 \n2025년 11월 20일 2/20 반 \n1 \n번호 6 이름 \n백민건 \ngov.kr \n정부24 \n1",
    "문서확인번호: 1763-6399-9850-6483 (신청인 : 백민건) \n학년 \n영역 \n시간 \n동아리활동 \n31 \n진로활동 \n34 \n창의적체험활동상황 \n특기사항 \n(인공지능코딩반) (31시간) 자율주행 자동차 프로젝트를 실시함에 능동적이며 적극적 으로 프로젝트를 실시하는 모습이 인상 깊음. 어려운 상황에 마주하였을 때 친구와 함 께 협력하여 문제를 해결하는 과정이 돋보이며 이해가 되지 않는 프로그래밍 문법이나 명령어를 주변 친구들과 협력하여 해결하는 모습을 보임. 텍스트 기반 프로그래밍 언 어에 대한 이해도가 높은 학생이며 자동차 맵을 따라 자율주행을 하는 과정에서 수많 은 실패를 겪으면서도 포기하지 않고 끝까지 도전하여 성공해 내는 모습이 인상 깊음. \n희망분야 과학자 \n모방시 쓰기에서 나 자신을 사랑하는 마음을 잘 표현하였으며 타인을 잘 도와주는 이타 적 정신을 시로 작성하여 발표함. 차분하고 진지하며 수업 목표를 정확히 이해하여 수 업에 참여함. \n교내에서 실시한 전공흥미검사 결과 해당 전공과 연관된 직무활동과 직업에 대한 선호 도를 고려할 때, 주거·의류, 영상 · 공연, 미술·디자인에 가장 많은 흥미를 보이는 것 으로 나타남. 1순위인 주거(인테리어) · 의류 전공은 인간이 머리부터 발끝까지 몸에 걸 치는 의류와 생활하는 공간을 아름답고 효율적으로 기능하도록 디자인하여 제작하는 실용 학문으로, 본인이 선호하는 활동과 직업을 고려했을 때 가장 관련성이 높은 전공 임. 또한 선호직무유형은 아이디어형으로, 기획적 사고력을 바탕으로 창의적인 생각을 발전시키고 표현하는 활동을 선호함. 검사 결과를 통해 진로에 대한 현황을 전반적으 로 점검하고, 부족한 부분을 보완하는 계획서를 완성함. \n'나의 꿈 포트폴리오 만들기' 활동에서 대입 정보 포털을 활용하여 대학 및 학과를 탐색 \n하며 컴퓨터학부와 데이터 과학부에 대해 자세히 알아보고 정리하여 분석함. 곤충 채 집이나 식물 관찰 등 과학 실험과 새로운 아이디어로 발명품 만들기, 컴퓨터 프로그래 밍에 흥미가 많음. 해당 흥미 분야에 따른 직업 발표 활동에서 게임 기획자, 인공 지능 전문가, 가상현실 전문가의 3개 직업군을 선택하여 추가로 조사하며 흥미나 재미를 느 끼는 취미를 따라 직업을 선택하는 것의 중요성에 대해 발표하며 깊이 있는 진로 탐색 자세를 보여줌. 정형화된 과제보다는 자신만의 독창적인 생각을 실현할 수 있는 과제 에 더 흥미를 느끼고 정성을 쏟음. 자신의 관심 분야를 정확하게 파악하고 이에 따라 뚜렷한 진로 설계를 하는 점이 바람직함. \n고색고등학교 \n2025년 11월 20일 3/20 반 \n1 \n번호 \n6 이름 \n백민건 \ngov.kr \n정부24 \n2",
    "문서확인번호: 1763-6399-9850-6483 (신청인 : 백민건) \n학년 \n영역 \n시간 \n자율활동 \n95 \n동아리활동 \n30 \n창의적체험활동상황 \n특기사항 \n학교 기본 교육 활동에 참여함. 체육 한마당에서 각종 종목에 출전하여 학급이 좋은 성 적을 얻도록 최선을 다함. 또한 공정한 스포츠맨십도 발휘하고 응원 장소도 깨끗하게 정리함. 학교 스포츠클럽 농구에서 센터를 맡아 학급이 준우승하는데 공헌함. 착한 지 구인프로젝트 (2023.06.23.)에서 환경 감수성 및 환경 인식 교육을 통해 기후 위기로 기후난민이 고통받는 것을 사례로 접하면서 기후 위기는 범지구적 문제임을 인식하고, 기후 변화를 멈추기 위해 자기 주도적으로 실천할 수 있는 다양한 방법을 제시함. 1회 용품 줄이기 학생 교육 (2023. 10.27.)에서 지구를 지키는 여러 가지 제안을 주제로 한 교육을 통해 1회용품을 줄일 수 있는 구체적인 실천 방안을 배우며 1회용품 줄이기 뿐 만 아니라 이메일함 비우기, 폐의약품 따로 거두기도 환경 보호 활동의 일원이라는 것 을 배움. 자신의 관심 대학을 설정하고 진학을 위해 갖추어야 할 조건에 대해 스스로 탐색하는 시간을 가짐. 진학 상담 카드를 작성하고 미래에 자신이 갖게 될 직업을 설정 하여 명함을 제작함. 또한 자신에게 쓰는 편지를 작성하는 과정을 통해 미래의 수험생 으로서의 마음가짐을 다시 한번 새롭게 다짐하는 계기가 됨. \n(수학집중탐구반) (30시간) 모든 활동에 적극적으로 참여하는학생임. 학생 주도적 문제 \n탐구 활동에 친구들이 준비해 온 문제를 함께 탐구하고 해결하기 위해 노력함. 혼자 고민할 때 어려웠던 것들이 친구와 함께하면서 좀 더 흥미롭게 재밌게 느껴졌다는 소감 을 이야기 함. 알지오매스의 작도 프로그램을 이용하여 각의 이등분선과 선분의 수직 이등분선을 작도해보고, 블록코딩을 이용하여 확률과 통계에서 학습한 조합의 성질을 코딩을 통해 확인해 봄. 인공지능에 관심이 많아 '인공지능을 위한 수학 (이시카와 아카 히코)'이란 도서를 선정하여 꾸준히 탐독함. 인공지능에서 사용하는 모델 중 하나인 ' 신경망'에서는 '가중치'라는 개념이 있는데, 컴퓨터가 이러한 가중치를 학습할 때는 가 중치가 '변수'의 역할을 하지만, 학습이 끝나고 해당 가중치를 학습 모델로 활용할 때는 \n'상수'의 역할을 한다는 내용을 읽고 '변수'와 '상수'는 문제 상황을 바라보는 관점에 따라 달라질 수 있다는 것이 매우 흥미로웠다고 친구들에게 책을 소개함. 학교 축제에 동아리 기획 회의에 적극적으로 아이디어를 제공하고 확률의 계산을 통해 손해보지 않 으며 즐겁게 할 수 있는 '확률게임' 부스를 운영함. \n고색고등학교 \n2025년 11월 20일 4/20 반 \n1 \n번호 \n6 \n이름 \n백민건 \ngov.kr \n정부24",
    "문서확인번호: 1763-6399-9850-6483 (신청인 : 백민건) \n창의적체험활동상황 \n학년 \n영역 \n시간 \n특기사항 \n희망분야 프로그래머 \n2 \n진로활동 \n35 \n3 \n자율활동 \n58 \n진로연계 독서토론에서 '개인적 가치관'에 관한 글을 읽고, 다수결 원칙이 항상 합리적 인 의사결정 방법이 아님을 제시함. 나아가 도덕 과목에서 배운 배경지식을 동원하여 세상에는 옳은 소수의 의견도 중요하다는 의견을 내놓음. 알고리즘 챌린지에 참가하여 논리적 사고력을 바탕으로 문제를 해결할 때 높은 집중력을 보여주었으며, 문제를 분 석하고 핵심 요소를 추출하여 풀이하는 과정 자체를 즐기는 모습이 인상 깊음. 어려운 문제를 접할 때도 포기하지 않고 자신이 가진 역량을 충분히 발휘하는 모습을 보임. 앞 으로도 다양한 활동에 참여하여 창의력과 문제 해결력을 신장시키고 싶다는 의지를 밝 힘. 온라인 코딩파티 시즌2에 참가하여 자기 주도적 학습 태도로 코딩 미션 수행과정 을 이수함. 텍스트 코딩 '토끼의 당근 수집'에서 횟수에 따라 반복하는 반복문으로 토끼 와 함께 당근을 수집하고 조건문으로 당근밭을 찾아 더 멀리 가보기를 실습하였으며 조 건에 따라 반복하는 반복문으로 당근을 모두 찾아 집으로 돌아오기를 효과적으로 코딩 함. 활동을 통해 프로그래밍의 작동 원리를 파악하고 기본 지식을 함양할 수 있어 실력 이 향상됨을 느꼈다고 이야기함. 앞으로도 다양한 활동에 참여하여 능력을 키우고 싶 다고 이야기함. 자신의 진로 목표 설정과 실현에 대한 자신감이 부족한 진로 장벽으로 불안감이 있었으나, 기업가정신 진로캠프(2023.03.17.)으로 자신의 적성을 고려한 기 업인으로의 명확한 진로 목표를 설정하고 긍정적인 사고를 지니는 계기가 됨. 디자인 씽킹 생활기록부 2045 진로캠프(2023.05.01.)에서 배운 목표 설정과 계획 수립 기술 을 활용하여, 자신이 꿈꾸는 미래에 한 발짝 더 가까워질 수 있도록 생활기록부에 반영 하고 있음. \n2학기 학급자치회 부회장(2024.08.09. -2025.01.03.)으로 책임감과 봉사정신을 가 지고 궂은 일을 함에 있어 솔선수범하고 인화의 리더십으로 학급회의를 이끌어 나감. 학급자치 시간에 학급 구성원 모두가 함께 만들어가는 공동체를 만들기 위해 학급 협약 제정이 필요하다는 점을 인식하고 그 내용을 적극적으로 만들어 가는 모습을 보임. 학 교폭력 예방교육(2024.03.06)을 통해 학교폭력의 가해자가 그에 따른 책임을 져야 한다는 인식을 가졌으며 이를 통해 학생으로서 지켜야 할 5가지 실천 지침을 만들어 봄. 성매매 및 성폭력 예방교육 (2024.06.12.)을 통해 성매매의 역사적 변천, 성매매 방지를 위한 실천 방안을 배우고 성폭력의 연관성과 인권침해 그리고 피해자의 트라우 마 등을 알고 4대 폭력을 예방하는 방법의 중요성을 깨달음. 정보통신윤리교육 (2024. 06.12.)을 통하여 개인정보 보호에 대한 필요성을 깨닫고 개인정보 노출로 타인의 권 익을 침범하지 않도록 주의할 것을 다짐함. \n고색고등학교 \n2025년 11월 20일 5/20 반 \n1 \n번호 6 \n이름 \n백민건 \ngov.kr \n정부24 \n3",
    "문서확인번호: 1763-6399-9850-6483 (신청인 : 백민건) \n학년 \n영역 \n시간 \n동아리활동 \n진로활동 \n26 \n창의적체험활동상황 \n특기사항 \n(딥러닝) (26시간) 모둠활동 프로젝트 발표하기에서 '몬테카를로 시뮬레이션을 이용한 게임'을 주제로 역할을 분배하고 프로그램을 만들어서 잘 발표함. 몬테카를로 시뮬레이 션의 개념, 개념을 설명하기 위한 예시, 시뮬레이션이 활용되는 곳, 행동 트리의 개념, 행동트리의 노드, 행동트리의 장단점, 몬테카를로 시뮬레이션의 장단점 등을 잘 설명 함. 프로그램은 100줄 정도의 기본 틀을 받아서 400줄 정도로 확장하여 구성함. 게임 은 플레이(사용자), 에너미 (컴퓨터)로 크게 구성되어 있고 서로 싸우는 게임임. 플레이 어는 어택, 디펜드, 힐이라는 단추를 가지고 있어서 3개의 단추 중에 하나를 선택하여 클릭하여 상대방의 에너지를 모두 없애면 끝나는 게임이었는데 발표 중에 설계한대로 실행시킴. 몬테카를로 시뮬레이션과 행동트리로 적AI를 구현하는 과정에서 수많은 오 류가 발생하고 원하는 결과가 나오지 않았으나 문제해결을 위해 관련 정보를 찾아보고 여러 번 오류를 검토하여 문제를 해결함. \n희망분야 프로그래며 \n36 \n2025학년도 대입 전형의 이해를 통해 대학 입시의 주요 구조인 수시전형과 정시전형 에 대한 전반적인 특징과 일정에 대한 이해를 함. 또한 우수 지원 사례들을 보면서 지 원자의 특성과 성공할 수 있었던 요인에 대해 이해를 하게 되었으며 자신만의 대입 전 략 수립의 필요성을 느낌. 정시전형의 분석을 통해 자신의 모의고사 성적과 교과목 학 습 방법과 습관을 분석해 보고 체계적인 학습 목표를 세워 학습할 것을 다짐함. 자신의 진로에 대해 끊임없이 생각하며 많은 상담을 함. 대학의 입시정보가 들어있는 책과 홈 페이지를 보며 관심 있는 학교별 입시전형과 등급 분포도를 살펴봄. 이를 통해 더 체계 적이고 실용적인 정보를 얻을 수 있었으며 자신의 입시 비전을 명확하게 함. 진학하고 자 하는 학교에 대한 목표를 세우고 목표 학교 및 학과 홈페이지를 방문하여 정보를 찾 는 적극성을 보임. 자신의 롤 모델 찾기 활동에서 소셜 미디어 창업자를 롤 모델로 선 정함. 성공에 안주하지 않고 위험을 감수하여 혁신적인 아이디어를 가져오는 모습을 보며 자신 또한 새로운 것에 도전하는 삶을 살고 싶다고 발표함. \n봉사활동실적 \n학년 \n일자 또는 기간 \n장소 또는 주관기관명 \n활동내용 \n시간 누계시간 \n2022.03.03. - 2022. 12. 26. \n(학교)고색고등학교 \n1 \n2022.03.11. \n(학교)고색고등학교 \n급식실 배식 지원 \n봉사활동 사전교육 \n5 \n5 \n1 \n6 \n2022.12.28. \n(학교)고색고등학교 \n교내환경정화활동 \n1 \n7 \n2023.03.10. \n(학교)고색고등학교 \n봉사활동 사전교육 \n1 \n1 \n2 \n2024.01. 04. \n(학교)고색고등학교 \n교내 환경 정화 활동 \n1 \n2 \n3 \n2024.03.13. \n(학교)고색고등학교 \n봉사활동 사전교육 \n1 \n1 \n고색고등학교 \n2025년 11월 20일 6/20 반 \n1 \n번호 \n6 \n이름 \n백민건 \ngov.kr \n정부24",
    "문서확인번호: 1763-6399-9850-6483 (신청인 : 백민건) \n봉사활동실적 \n학년 \n일자 또는 기간 \n장소 또는 주관기관명 \n활동내용 \n시간 누계시간 \n3 \n2024.07.19. \n(학교)고색고등학교 \n교내 환경 정화 \n1 \n2 \n6. 교과학습발달상황 \n[1학년] \n원점수/과목평균 \n성취도 \n학기 \n교과 \n과목 \n단위수 \n석차등급 \n비고 \n(표준편차) \n(수강자수) \n국어 \n국어 \n4 \n85/70.5(15.6) \nB(262) \n3 \n수학 \n수학 \n4 \n80/67.0(15.3) \nB(262) \n3 \n영어 \n영어 \n4 \n96/68.2(17.0) \nA (262) \n2 \n한국사 \n한국사 \n3 \n94/74.5(14,9) \nA (262) \n3 \n사회(역사/도덕 \n통합사회 \n3 \n94/74.8(13.7) \nA (262) \n2 \n1 \n포함) \n과학 \n통합과학 \n3 85/70.4(18.1) \nB(262) \n4 \n과학 \n과학탐구실험 \n1 \n97/89.5(10.2) \nA(262) \n기술·가정/제2 외국어/한문/교 양 \n한문 I \n3 \n95/84.7(7,8) \nA(130) \n2 \n국어 \n국어 \n4 \n81/67.0(17.4) \nB(256) \n4 \n수학 \n수학 \n4 \n87/67.4(18.0) \nB(256) \n3 \n영어 \n영어 \n4 \n93/69.2(17.7) \nA(256) \n2 \n한국사 \n한국사 \n3 \n80/70.7(15.0) \nB(256) \n4 \n사회(역사/도덕 \n통합사회 \n3 \n88/71.5(17.1) \nB(256) \n3 \n2 \n포함) \n과학 \n통합과학 \n3 \n82/68.2(18.5) \nB(256) \n4 \n과학 \n과학탐구실험 \n1 \n95/90.3(8.8) \nA (256) \n기술·가정/제2 외국어/한문/교 \n양 \n정보 \n3 \n86/64.2(15.8) \nB(127) \n2 \n이수단위 합계 \n과목 \n50 \n세부능력 및 특기사항",
    "국어: '장영실'을 주제로 미니 강연 활동에 참여함. 성량이 매우 좋으며 전달력을 높이기 위해 반언어 및 비언어적 표현 등을 \n고색고등학교 \n2025년 11월 20일 7/20 반 \n1 \n번호 6 이름 \n백민건 \ngov.kr \n정부24",
    "문서확인번호: 1763-6399-9850-6483 (신청인 : 백민건) \n과목 \n세부능력 및 특기사항 \n적절히 활용하려고 노력하는 태도를 보임. 문제해결의 구조를 활용하고, 용어를 설명하는 등 청중의 이해를 돕기 위한 전략 을 활용함. 한 학기 한 권 읽기 활동에서 '문어 (김동식)'를 읽은 후 자신의 생각을 표현함. '아홉 켤레의 구두로 남은 사내(윤 흥길)'를 읽은 후 중심 내용을 정리하며, 문학 작품의 현실 반영에 대해 모둠원들과 의견을 공유함. 다양한 사례를 통해 맞춤 법규정 적용 원리에 대해 학습함.",
    "수학: 항상 유쾌함으로 수업 분위기를 주도하며 집중력이 강해 학습에 있어 높은 성과를 나타내는 학생임. 자신이 아는 문제 를 친구들에게 알려주며 함께 성장해 나가기를 도모하는 모범적인 면이 돋보임. 자발적인 발표로 월등한 발표횟수를 기록하 였으며 문제 해결과정 또한 논리적이고 분석적 이어서 높은 수학적 역량을 드러냄. 풀이과정에서 토론거리가 될만한 요소를 잘 찾아내어 그 논리에 대해 토론하는 과정을 통해 친구들과 함께 수학적 사고력을 향상함. 교과와 진로연계 발표에서 화학공 학에 사용되는 수학의 예를 들어 발표하며 실생활 문제를 수학적 방법으로 풀어내는 사고의 유연성을 보여줌. 발표 중 풀이과 정에 실수가 있었으나 당황하지 않고 차분히 다시 풀어내는 모습에서 수학적 의사소통 영역의 강점이 보임.",
    "영어: 영어 과목에 흥미가 높고 어휘와 구문 학습을 꾸준히 실천하며 매사에 적극적이고 지적 호기심이 높은 학생임. 조별 활 동에서 자신이 가진 능력을 다른 친구를 위해 쓸 줄 아는 모습을 보이며 필요한 것이 있거나 질문 사항이 있으면 묻고 해결해 가는 과정에서 능동적인 상황 대처 능력을 보임. 과학자의 꿈을 가지고 있는 학생으로, 발명 아이디어 제안하기 활동에서' 내비게이션 자전거'라는 실용적이고 현실적인 아이템을 제안하여 조원들로부터 번뜩이는 생각이라는 칭찬을 받음. 휴대전화 로 내비게이션을 켜며 자전거를 타서 불편했던 자기 경험을 바탕으로 청중들의 공감을 자아내어 이목을 끎. 자전거의 핸들 가 운데에 내비게이션이 장착되어 페달을 밟아 나오는 운동에너지로 작동하는 원리를 밝히며 적절한 연결어를 사용하여 글의 전 개가 응집성이 높은 설명문을 완성하여 발표한 점이 주목할 만함. 독서 서평 활동에서는 '허생전'을 골라 한 사람에 의해 조선 의 경제가 좌지우지되는 상황을 풍자하는 글의 핵심을 잘 짚어내고 내용을 간략히 요약하는 과정에서 적절한 어휘로 잘 번역 함. 발표 시간에 자신감 있는 모습으로 여유롭게 친구들의 눈을 맞추며 자기 생각을 적극적으로 전달하는 모습을 보임.",
    "한국사: 교사의 질문에 적극적으로 대답하고 수업 분위기를 밝게 만드는 학생임. 문화재 홍보물 제작하기 활동에서 거중기에 관하여 조사한 다양한 자료가 적재적소에 사용되어 도르래의 원리를 활용한 조선 시대 과학 기술의 발전을 보여준다는 내용 으로 문화재의 우수성이 잘 나타나도록 리플릿을 내용 전달이 효과적이고 미적 완성도가 높게 제작함. 역사 속 진로 탐구 활 동에서 조선 시대와 현재의 과학자라는 직업에 대하여 주요 활동, 취업 방법, 필요한 역량 등을 조사하여 비교한 내용을 활동 지에 정리함. 인터뷰 형식으로 과거와 현재 과학자를 만나서 직업에 대한 설명을 해주는 인공지능 웹툰을 만듦. 역사 신문 제 작하기 활동에서 '조선인의 삶을 바꾼 개혁'이라는 제목으로 을미사변을 계기로 추진된 을미개혁이 조선의 사회체제를 일본 과 동일하게 만들려는 의도가 있었다는 기사를 작성함. 광고 홍보물 지면을 구성하여 인물 사진을 첨부하고 명성황후의 죽음 에 대한 정보를 전달함. 역사 인물 평전 쓰기 활동에서 안창호에 주목하여 프로필과 그가 주로 활동했던 시대 상황을 살펴보 며 신민회에 참여하여 대성학교 설립, 한국독립당 창당 등 인물의 업적을 긍정적으로 평가한다는 생각을 표현함.",
    "통합사회: 진로 여행지 홍보하기 활동에서 '과학이 살아 숨 쉬는 런던 박물관'을 주제로 박물관에서 할 수 있는 진로 체험 활 동을 소개하는 여행 팸플릿을 프레젠테이션으로 제작함. 인권 캠페인 활동에서 장애인 특수학급에 대한 차별 사건의 원인, 전개 과정, 결과 및 영향을 분석, 정리하여 스토리텔링 형식의 카드뉴스로 제작하였으며 이를 웹툰으로 재구성하는 등 창의 성을 보임. 개인적 차원의 해결 방안으로 장애인 인권 개선 서명 운동에 참여하기, 사회적 차원의 해결 방안으로 평등권을 보 장하는 법 정비하기를 제시함. 청소년 노동 인권 홍보물 제작 활동에서 청소년 연소자 표준 근로 계약서를 작성하는 활동을 한 후 청소년 급여 규정을 알려주는 웹툰을 제작함. 지속가능발전목표 캠페인 활동에서 깨끗한 에너지 부문의 목표 달성을 위 해 탄소 배출과 신재생에너지 문제를 다룬 뉴스 기사를 분석하여 해결 방안을 모색함. 미래에서 과거로 온 사람이 에너지 문 제를 해결한다는 내용의 웹툰 공익광고 스토리보드를 제작함.",
    "통합과학: 예복습을 철저히 하며, 수업할 때 자신이 아는 부분을 큰소리로 얘기하여 수업 진행이 부드럽게 이어질 수 있도록 \n고색고등학교 \n2025년 11월 20일 8/20 반 \n1 \n번호 6 이름 \n백민건 \ngov.kr \n정부24 \n과목",
    "문서확인번호: 1763-6399-9850-6483 (신청인 : 백민건) \n세부능력 및 특기사항 \n함. 과학 인포그래픽 그리기 활동에서 물체의 속도와 질량에 따라서 운동량이 달라지는 것을 인포그래픽으로 표현함. 인공지 능을 활용한 생활 속 플라스틱 줄이기 방안 프로젝트 활동에서 인공지능이 배출된 쓰레기들을 알아서 분류해주는 시스템을 제안함. 지구의 고체 물질과 생명체를 구성하는 원소가 어떻게 형성되었는지 별의 진화 과정과 연관지어 설명할 수 있음. 세 상에 존재하는 물질이 원소로 이루어져 있음을 이해하고, 금속 원소와 비금속 원소로 나누어 설명할 수 있음. 지구 시스템에 서 다양한 자연 현상을 일으키는 에너지원이 무엇인지 설명할 수 있음. 세포에서는 생명 현상을 유지하기 위해 세포막을 경계 로 물질 출입이 일어남을 설명할 수 있음. 지구와 생명의 역사에 큰 변화를 가져온 광합성, 화석 연료의 연소, 철의 제련 반응 에서 공통점을 찾을 수 있음. 변이와 자연 선택에 의한 진화의 원리를 설명할 수 있음. 열효율을 높이는 것이 사회, 경제적으 로 어떤 의미가 있는지 이해하게 됨. 간이 발전기의 작동 원리를 전자기 유도 현상을 이용해 설명할 수 있음.",
    "과학탐구실험: 수업 태도가 바르며 실험에 대한 이해도가 높아 실험을 주도함. 실험안전수칙 인포그래픽 그리기 활동에서 학 생들이 지켜야할 안전수칙을 만화 형태의 인포그래픽으로 제작함. 생활 제품 속 과학 원리 찾기 활동에서 보온병의 과학적 원 리를 조사하고 제품 기능에 대한 개선 방안을 제시함. 소화 효소가 사람 몸에서 어떤 작용을 하는지 설명할 수 있음. 음식물 에 들어 있는 단백질을 검출하는 방법에 대해 설명할 수 있음. 소화제의 효과를 알아보는 실험에서 실험 결과를 통해 어떤 소 화제에 탄수화물 분해 효소와 단백질 분해 효소가 각각 들어 있는지 설명할 수 있음. 정전식 터치펜이 작동하는 과학 원리를 설명할 수 있음. 우리 몸에서 미세 먼지에 의해 가장 큰 피해를 입는 기관과 그 피해 양상을 설명할 수 있음. 학교에서 활동할 때 미세 먼지 예보 등급에 따른 나만의 행동 요령을 만듦. 미세 먼지로 인한 각종 질병을 줄일 수 있는 방안을 조사하여 발표 함. 태양 전지판에 내리쬐는 빛의 세기와 태양 전지판이 만들어 내는 전류가 어떤 관계가 있는지 설명할 수 있음.",
    "정보: 알고리즘 설계 수행평가에서 주어진 문제의 분해 및 핵심요소를 몇 가지 찾아 순서도의 표기법을 부분적으로 지켜 작 성하였음. 문제를 분석하고 종합하는 과정에서 최선을 다하는 모습이 인상 깊음. 텍스트 기반 프로그래밍 실습 과정에서 적 극적인 태도와 논리적인 사고력이 돋보인 학생임. 선택 구조, 반복 구조, 입출력 명령어, 중첩 제어 구조를 이해하며 약수 출 력, 소수 판단, 윤년 판단, 구구단 출력 등 기본적인 문제를 해결함에 부족함이 없는 학생임. 자신의 학습이 끝난 후 어려움을 겪고 있는 친구들의 눈높이에 맞추어 자신의 지식을 공유하는 모습을 자주 보임. 피지컬 컴퓨팅 시스템 개발 과정에서 하드 웨어와 소프트웨어의 유기적인 동작 원리에 대하여 정확히 이해하였으며 초음파센서, 서보모터, LED를 사용하여 거리에 따 라 다양한 색상의 LED와 서보모터를 제어하여 주차장 차단기 시스템을 완벽히 구현함. \n한문 I: 자호 짓기 활동에서 '정성 성'과 '더울 열'을 활용하여 '성열'이라는 자신의 호를 지음. 성실하고 열정적인 사람이 되 겠다는 마음으로 이와 같이 호를 지었다고 설명함. 자기소개서 쓰기 활동을 통해 자신의 성장과정과 진로희망에 대하여 기술 하고 진로희망을 달성하기 위해 '백절불굴'의 자세로 노력하겠다는 내용을 작성함. 상형, 지사, 회의, 형성 등 한자가 만들어 진 원리에 대해 정확하게 이해하고 있으며 학습한 한자를 부수 단위로 구분할 수 있음. 한자 카드를 이용한 활동을 통해 한자 의 부수와 그 변형된 형태를 분명하게 구별하는 모습을 확인함. 문장의 구조에 대한 이해가 분명하며 주어진 한자를 활용하여 \n문법에 맞게 한문 문장을 지을 수 있음. 한시의 형식에 대해 이해하고 한자 대신 한글을 활용하여 한시의 형식에 맞추어 시 를 지을 수 있음. 한문 문장을 해석순서에 맞추어 바르게 풀이하는 모습을 관찰함. 한시에 사용된 시어를 바탕으로 한시의 시 간적 배경을 추론함. 한시를 풀이하며 그 맥락에 따라 시어가 상징하는 바를 정확하게 유추해 냄. 한시가 쓰인 시기, 작가 등 배경 지식과 한시의 내용을 통해 시에 등장하는 인물들의 상관관계를 유추함. \n수업량 유연화에 따른 학교 자율적 교육 활동으로 '뮤지컬 영화를 통해서 세상 들여다보기' 융합 프로젝트를 진행하며 '토끼 와 거북이'를 뮤지컬로 개작하여 영어로 공연함. 거북이 역할을 맡아 연기하였으며 '산토끼' 동요를 개사하여 영어로 노래하 는 참신함을 보임. 협동적인 자세로 임하며 무대에서 정확한 발음과 자신감 있는 발표 태도, 감정의 전달이 우수한 연기를 수 행함. 뮤지컬 '지킬 앤 하이드' 중 지킬 박사의 이중인격을 분석함. 선한 인격의 지킬 박사와 악한 인격의 하이드를 분리하여 캐리커처로 표현함. 영화 '헤어 스프레이'를 보고 토론하는 활동에서 영상에 등장한 인종 차별 외에 우리 사회에 있는 또 다른 차별로 장애인 차별을 꼽으며 방관하는 것이 아니라 차별 하는 사람들에게 일침을 가할 수 있는 자세를 갖춰야 한다는 주장 \n고색고등학교 \n2025년 11월 20일 9/20 반 \n1 \n번호 6 이름 \n백민건 \n(KOR \ngov.kr \n정부24",
    "문서확인번호: 1763-6399-9850-6483 (신청인 : 백민건) \n과목 \n세부능력 및 특기사항 \n을 논리적으로 펼침. \n<진로 선택 과목> \n성취도 \n성취도별 \n학기 \n교과 \n과목 \n단위수원점수/과목평균 \n비고 \n(수강자수) \n분포비율 \n이수단위 합계 \n과목 \n해당 사항 없음 \n<체육·예술> \n세부능력 및 특기사항 \n학기 \n교과 \n과목 \n단위수 \n성취도 \n비고 \n체육 \n체육 \n2 \nA \n1 \n예술 \n체육 \n미술 \n체육 \n3 \nB \n2 \n2 \n예술 \n음악 \n3 \nA A \n이수단위 합계 \n10 \n과목 \n세부능력 및 특기사항 \n체육 : 배구 경기 활동에서 경기력이 우수한 것은 아니지만 신체활동 가치의 중요성을 인식하고 노력하는 모습을 보임. 줄넘 기 1회선 2도약에서 탁월한 점프 능력과 안정감 있는 리듬감으로 우수한 수행을 보여줌으로써 학급 동료들에게 관찰학습이 이루어지도록 하여 학습활동에 도움을 줌. 플로어볼 경기에서 센터 포지션을 맡아 상대 슛을 차단하는 역할을 담당함. 또한 팀원이 패스하는 공을 잡는 기술인 캐치 동작이 정확하여 부드럽게 다음 동작을 연결하여 슛하는 능력이 우수함. 수비수를 속 이기 위해 자기편을 보지 않고 다른 방향을 보면서 패스하는 능력이 우수함. 평소 신체 움직임으로 표현하는 것에 관심을 두 고 신체를 다양한 모양과 움직임으로 표현하는 활동에 적극적인 모습을 보임. 이에 신체 관절뿐만 아니라 근육의 유연성이 탁 월하여 앉아 윗몸 앞으로 굽히기에서도 우수한 수행력을 보임.",
    "음악: 칼림바의 구조와 명칭, 발현 원리를 이해하며 악기를 조율할 수 있음. 칼림바 연주에서 '사랑을 했다' 악곡을 바른 자세 와 주법, 정확한 리듬과 음정으로 연주하는 능력이 뛰어남. 조원들과 협력하여 베토벤의 '그대를 사랑해' 악곡을 리듬을 살려 부를 수 있으며 독일 가곡의 특징과 악곡 특징을 설명할 수 있음. 작품의 배경지식에 대한 이해도가 높으며, 음악의 음색과 빠르기 변화를 비교하며 음악을 감상하는 능력이 뛰어남. 나만의 플레이리스트 발표 시간에 평소 즐겨 듣는 애니메이션 배경 음악을 선정하여 악곡의 특징을 설명하며 친구들을 즐겁게 함.",
    "미술: 자화상 표현에서는 하루 종일 공부만 하여 얼굴을 가린 책이 인상적임. 양쪽에 타인의 두 손을 그려 넣어 강제로 책을 보는 그림을 표현함. 해와 달은 밤낮없이 매일 공부를 한다는 의미이고, 새와 로켓은 새처럼 훨훨 날아 자유롭게 살고 싶다는 의미와 로켓을 타고 우주를 가고 싶다는 의미를 담았다고 설명함. 배경이 초록색이고 옷이 흰색이지만 약간 더러워진 이유에 대해 초록색 잔디밭에서 뛰어놀고 싶다는 의미와 새하얀 자신의 순수함을 나타낸 것이라고 밝힘. 전시 리플릿 만들기 활동에 \n고색고등학교 \n2025년 11월 20일 10/20 반 \n1 \n번호 6 이름 \n백민건 \n(KOR), \ngov.kr \n정부24 \n과목",
    "문서확인번호: 1763-6399-9850-6483 (신청인 : 백민건) \n세 부 능력 및 특기사항 \n서는 '프리다 칼로의 고통'을 주제로 부러진 기둥, 상처 입은 사슴의 그림을 드로잉으로 표현하여 작가에 대한 존경을 표현 함. 컷아웃 애니메이션 만들기 활동에서는 '졸음운전'을 주제로 하여 매체의 특성을 파악하고 눈이 감기는 모습을 효과적으로 표현하였으며 움직임이 자연스럽고, 전달하고자 하는 메시지가 분명하게 표현됨. 학습활동에 적극적이고 흥미를 가지고 수 업에 임함. 미술비평에서는 레오나르도 다빈치의 '모나리자'에 대해 조사를 하였으며 형식주의 비평 방법에 대한 높은 이해를 \n바탕으로 논리적인 글을 작성하여 자신의 생각을 뚜렷하게 보여줌. \n[2학년] \n원점수/과목평균 \n성취도 \n학기 \n교과 \n과목 \n단위수 \n석차등급 \n비고 \n(표준편차) \n(수강자수) \n국어 \n문학 \n4 \n92/69.7(18.6) \nA (251) \n3 \n수학 \n수학 I \n4 \n83/62.5(16.8) \nB(251) \n3 \n수학 \n확률과 통계 \n2 \n77/68.9(14.5) \nC(251) \n4 \n영어 \n영어 I \n4 \n94/62.3(19.9) \nA(251) \n2 \n과학 \n물리학 I \n3 \n71/61,5(19.6) \nC(116) \n4 \n1 \n과학 \n화학 I \n3 \n78/68.5(16.0) \nC(132) \n4 \n과학 \n생명과학I \n3 \n65/65.0(17.2) \nD(97) \n5 \n기술.가정/제2 외국어/한문/교 양 \n중국어 I \n3 \n81/73.3(14.9) \nB(125) \n4 \n국어 \n독서 \n4 \n93/65.6(21,3) \nA(248) \n2 \n수학 \n수학II \n4 \n82/63.3(19.1) \nB(248) \n수학 \n확률과 통계 \n2 \n84/64.7(18.1) \nB(248) \nwo co \n3 \n3 \n영어 \n영어 II \n4 \n93/59.7(21.6) \nA(248) \n2 \n과학 \n물리학 I \n3 \n80/62.8(20.4) \nB(115) \n4 \n2 \n과학 \n화학 I \n3 \n86/64,5(21.7) \nB(131) \n3 \n과학 \n생명과학 I \n3 \n71/58.9(18.5) \nC(96) \n4 \n기술.가정/제2 \n외국어/한문/교 중국어 I 양 \n3 \n69/62.4(18.3) \nD(125) \n4 \n이수단위 합계 \n과목 \n52 \n세부능력 및 특기사항",
    "독서: 수업 태도가 좋은 학생으로 독서를 즐겨하며 늘 성실하게 수업에 경청함. '인간의 운명도 말과 같을까' 지문 학습 후 수 행평가에서 상반된 관점을 포함한 요약하기 활동을 통일성 있게 작성하였으며, 인간의 운명은 말과 다를 것이라는 주장을 제 \n고색고등학교 \n2025년 11월 20일 11/20 반 \n1 \n번호 6 이름 \n백민건 \n이 \ngov.kr \n정부24 \n과목",
    "문서확인번호: 1763-6399-9850-6483 (신청인 : 백민건) \n세부능력 및 특기사항 \n시했으며 인공지능은 인간능력을 대체할 수 없고, 정서 지능 등의 인간의 능력이 필요한 일자리는 인공 지능에 의해 대체될 수 없을 것이라는 근거를 제시하여 한 편의 글로 완성함. '나홀로 문화' 학습 후 비판적 읽기 활동에서 남의 눈치를 보지 않고 간섭받지 않는 점에서 나홀로 문화에 대해 긍정적이라 서술함. '육지의 배설물은 바다에 쌓인다'에서 쓰레기 문제에 대한 창 의적 해결방안으로 국가적, 국제적 측면에서의 쓰레기 무단투기 금지를 주장함. '생태계의 다양성, 그리고 공존'에서 다윈의 진화론에 대해 공존으로 인해 생태계의 다양성이 유지되므로 공존은 꼭 필요한 가치라고 평가함. '로봇에도 인권이 있을까' 학습 후 미래사회에서는 로봇을 완전히 통제할 수 없고 역할의 확대로 인해 로봇에게도 권리가 있어야 한다고 서술함.",
    "문학: 교사의 질문에 열심히 손을 드는 학생으로 수업에 적극적으로 참여함. '호질'을 읽고 사회적 문제에 대해 발표하기 활 동에서 동물학대에 대해 발표했는데, 동물 학대를 해 본 적 있냐는 질문을 통해 청중의 반응을 유도하고, '호질'에서 '하늘이 명한 바로 본다면 인간과 범은 같은 존재이다'라는 부분을 통해 생명 존중에 대해 이야기하고, 동음이의어에 의한 언어유희적 표현을 사용하여 동물 학대를 하지말자는 주장을 펼침. 자율과제로 제시한 1학기 때 배운 작품과 관련된 문학작품 소개하기 활동에서 윤동주의 '자화상'을 선정하여 시인의 생애 설명과 시 내용의 해석을 하였으며 자아 성찰이라는 측면에서 이전에 배 웠던 '쉽게 씌어진 시'와 유사하다는 것을 발표함. \n수학I: 지수에 미지수를 포함하는 방정식과 부등식 관련 문제를 칠판에 적고 풀이과정을 급우들에게 설명함. 쉽다고 생각되 는 문제라도 하나하나 풀면서 난이도를 높여 나가야 된다는 것을 앎. 삼각함수의 부등식 문제를 풀이하고 급우들에게 설명 함. 그래프를 그려 문제를 설명하고 부등식의 조건을 만족하는 범위를 구하는데 어려움을 겪었지만 반복하여 풀이하고 발표 를 통하여 더 기억에 남는 문제였음을 소감으로 작성함. 주제탐구 활동에서 '상용로그를 활용한 수소이온농도 구하기'를 주제 로 보고서를 작성하고 ppt를 제작함. 화학 관련 분야에 관심을 갖고 있으며 상용로그를 학습한 후 수소이온농도를 구하는데 상용로그를 사용함을 알고 탐구 주제를 선정하였다는 이유를 밝힘. 수용액의 산성, 알카리성을 나타내는 척도인 수소이온농 도를 측정하는데 상용로그가 사용되고 있음을 설명함. 수소이온농도에 따라 산성과 염기성을 구분할 수 있음을 안내함. 탐구 활동을 통해 상용로그를 활용하여 실생활과 연관지을 수 있음을 알게 되었다는 자신의 생각을 정리하여 표현함. \n수학 II: 두 곡선으로 둘러싸인 도형의 넓이를 구하는 문제를 칠판 앞으로 나와 풀이하고 친구들에게 풀이과정을 설명함. 정 적분을 활용하는문제로 친구들에게 설명한 후, 개념 이해를 더욱 확실하게 할 수 있는 기회가 되었다는 소감을 밝힘. 미분계 수의 정의를 학습한 후 '영화 컴퓨터그래픽에 활용되는 미분방정식'을 주제로 보고서를 작성하고 ppt를 제작함. 평소 즐겨보 는 영화가 미분과 관련이 있고, 활용되고 있음을 알게 되어 주제를 선정하였다는 소감을 밝힘. 미분방정식의 활용으로 유체 의 흐름을 나타낼 수 있는 '나비에-스토크스 방정식'은 영화 컴퓨터그래픽에 사용되고 있음을 안내함. 세계 7대 수학 난제로 방정식의 해는 찾지 못했지만 근삿값을 사용하여 영화 컴퓨터그래픽을 제작함을 알게 됨. 탐구활동을 통해 영화를 볼 때 파도 나 불의 움직임이 당연하다고 생각하였는데 이를 표현하는 것이 어려운 작업이고 '나비에-스토크스 방정식'이 사용된다는 것 을 알게 되었다는 소감을 밝힘. \n확률과 통계: 생활 속 확률과 통계 주제 탐구 수행평가로 화학에서 사용되는 오비탈 및 전자 구름과 확률의 연관성, 통계 기 반 머신러닝에 대해 조사하고 그 내용을 소개함. 특히, 머신러닝의 학습법 및 기저함수에서 사용하는 확률변수에 대해 자세 히 소개함. 웹툰 그리기 및 주제탐구 수행평가에서 자료 조사를 막힘없이 해내었으며 조사한 자료를 신중하게 읽고 필요한 부 분을 선택하여 수평평가를 훌륭하게 이행함. \n영어 I: 인류를 위한 지속 가능 발전 홍보 자료 프로젝트 영어로 제작하기에서 생명의 빨대라는 주제로 글을 작성하여 비교 적 저렴한 비용으로 깨끗한 물을 마실 수 있는 정수 빨대의 사용을 강조하고 기회가 되면 인류에게 유익한 발명품을 제작하겠 다는 다짐을 함. 세계 문화 유산 조사 및 발표하기에서 프랑스 파리 에펠탑에 관한 많은 사람들에게 알려지지 않은 과학적 사 실을 화면과 사진을 제시하며 친구들에게 발표함. \n고색고등학교 \n2025년 11월 20일 12/20 반 \n1 \n번호 \nCO \n6 \n이름 \n백민건 \n(KOR \ngov.kr \n정부24",
    "문서확인번호: 1763-6399-9850-6483 (신청인 : 백민건) \n과목 \n세부능력 및 특기사항 \n영어II: 수업에 적극적으로 참여하고 주어진 과제를 제 시간에 완수함. 교사의 질문에 대답을 잘하고 요청이 있는 경우에는 솔선하여 발표하는 자발적인 면을 보임. 영어로 자신을 소개하는 시를 쓰는 활동에서 자신의 특성을 \"Honest, Kind and B rave\"로 묘사함. 가장 닮고 싶은 롤 모델을 소개하는 글쓰기 활동에서 스티브잡스를 선택하고 그를 존경하는 이유를 \"There are two reasons why he is my role model. One is that he created innovative product like i-phone, i-pa d. The other is he has spirit of challenge without being afraid of failure\"이라고 진술하며 자신도 아이폰과 같 은 멋진 제품을 개발하여 세상을 바꾸고 새로운 분야의 개척자가 되겠다는 꿈을 밝힘. 인공지능 관련 기사 \"Kinetic Consul ting launches Marky AI-the first AI business consulting platform for any business. \"를 읽고 주요 단어를 정 리하고 요약하여 발표수업을 수행함. \n물리학 I: 자동차에서 활용되는 물리 현상을 주제로 탐구함. 자동차 에어백과 안전벨트의 원리를 운동량-충격량 관계와 뉴 턴 법칙을 적용하여 설명함. 열역학 제1법칙을 이해하고, 이를 이용하여 열역학 과정에서 내부 에너지의 변화량을 외부와 주 고 받은 열과 일을 통해 구함. 모둠원과 협력하여 디젤 엔진의 작동 원리와 열효율, 사용 사례를 조사하여 발표함. 고체의 에 너지띠 이론으로 도체, 반도체, 절연체 등의 차이를 구분하여 설명함. 종류가 다른 원소를 이용하여 반도체 소자를 만들 수 있음을 pn 접합 다이오드를 이용하여 설명하고 다이오드가 한 쪽 방향으로만 전류를 흘리는 성질이 있음을 설명함. 전류에 \n의해 자기장이 발생하는 것을 관찰하여 자기장의 크기와 방향에 영향을 주는 요인을 찾고 전류에 의한 자기 작용이 일상생활 에서 적용되는 다양한 예를 찾아 그 원리를 설명함. 용수철을 이용한 역학적 에너지 시범실험을 도와 수업이 원활히 진행되도 록 도움. 전자기 유도 현상의 예시로 마이크에 대해 조사함. 실험을 통해 여러 가지 전반사 현상을 관찰하여 전반사 조건을 찾을 수 있음. 파동의 간섭 현상의 예시로 노이즈 캔슬링에 대해 조사함. \n화학I: 차분히 수업에 참여함. 화학의 유용성에 대한 논술형 수행평가에서 화학이 식량 문제, 의류 문제, 주거 문제 해결에 기여한 사례에 대해 기록하고, 화학의 발전 방향에 대한 자신의 생각을 논술함. 아보가드로 수와 몰의 의미를 설명할 수 있 고, NaCl 0.5몰의 질량을 측정하고, 비닐 봉지를 이용하여 기체의 부피가 몇 몰인지 알아냄. 용액의 농도를 몰 농도로 표현 할 수 있고, 모둠 활동으로 0. 1M NaCl 1L를 정확히 제조함. 또한 모둠원을 잘 이끌며 실험을 진행함. 배타 원리, 훈트 규칙, 쌓음 원리를 설명하고, 이에 따라 오비탈에 원자 및 이온의 바닥 상태 전자 배치를 바르게 나타냄. 또한 모둠원에게 각각의 내용을 설명해 줌. 이온 결합의 형성 과정을 KF을 예로 들어 설명함. 또한 공유 결합, 금속 결합의 특징에 대해서도 설명함. 전자쌍 반발 원리를 설명하고, 대표적인 5가지 분자 구조의 예를 바르게 제시함. 중화 적정 실험을 설계하고, 모둠원과 함께 미지의 식초 농도를 계산함. 또한 중화점을 찾는 3가지 방법을 설명함. CaO의 용해열 실험을 수행하여 CaO의 용해열을 계 산함. 또한 간이 열량계를 사용하므로 가정해야 하는 것에 대해서 발표를 함. \n생명과학I: 조용하게 수업을 경청하고 주어진 활동에 성실히 임함. 활동지 작성 시간을 통해 수업에서 배운 내용을 바탕으 로 탐구 과제를 스스로 검토하고 자신의 생각을 정리하여 제출함. 친구들과 토론하고 협동하는 학습을 즐김. 밝고 예의 바른 태도로 수업에 참여하며 학급의 수업 분위기를 좋게 유지하는데 많은 도움을 줌. 발표 수업을 통해 '생물의 특성'이라는 주제 를 선정하여 학생들에게 소개함. 생물이 무생물과 구분되는 영역을 6개로 나누고 각각의 개념과 역할을 그림 자료와 함께 자 세히 설명함. 특히 수업 시간에 배운 내용과 자신이 첨부한 내용을 학생들에게 질문하며 학생들 스스로가 현재의 이해 정도를 확인할 수 있도록 하는 모습을 보임. 또한 '군집 내 상호작용'에 대한 발표를 통해 생태계에서 군집의 개념과 역할을 설명하 고 개체군 사이에 일어나는 행동 양식에 대해 소개함. 특히 공생의 관계에 있는 다양한 생물의 예시를 그림으로 설명하고 흥 미로운 동영상 자료를 학생들에게 제공하여 학생들이 흥미를 가지고 수업에 참여할 수 있도록 유도하는 성실성을 보임. \n중국어 I: 수업시간에 중국의 시각표현, 하루일과 표현과 관련된 단어를 찾아 꼼꼼하게 학습지를 작성함, 취미, 능력표현과 관련된 한자 단어의 한어병음을 정확히 기입하였으며 진행, 경험을 나타내는 단어의 한자와 한어병음을 오류 없이 모두 완성 하여 제출함. 쓰기 활동을 통하여 다소 어렵게 느껴질 수 있는 중국어 쓰기 능력을 향상시킴. 중국의 색상문화에 대해 학습하 며 중국인이 선호하는 색상과 선호하지 않는 색상에 대해 알게 됨. 한국과 비슷한 듯 다른 중국 문화를 접하며 타 문화를 존 \n고색고등학교 \n2025년 11월 20일 13/20 반 \n1 \n번호 6 이름 \n백민건 \ngov.kr \n(KOR \n정부24 \n과목",
    "문서확인번호: 1763-6399-9850-6483 (신청인 : 백민건) \n세부능력 및 특기사항 \n중하는 태도를 향상시킴. 기회가 된다면 중국인과 원활한 교류를 위하여 색상문화에 대한 이해를 적용해 보겠다고 다짐함. 밝고 활달한 성격으로 매 수업시간 큰소리로 발음 하며 학습의 분위기를 활동적으로 만드는데 기여를 함. 가끔 학우들이 생각 지 못하는 생각을 자율적으로 발표하며 창의성을 나타냄. 이러한 외국어 학습능력은 나날이 발전할 수 있는 기틀을 마련해 줄 \n것이며 어휘를 빠르게 습득하는 능력이 있어 좀 더 집중력 있는 학습을 한다면 많은 향상이 있을 것으로 기대됨. \n학교 자율과정 기간 중 실시한 지역 연계 융합 수업 A(2023.12.26.-2023.12.27.) 중 '인공지능 메이커 융합' 프로그램에 서 자율과정 A 프로그램에서 사물인터넷을 활용한 스마트시티에 대하여 만들었으며 그것을 활용하여 2개의 도시를 구상하여 큐브 형태로 만들어 증강현실 멀지큐브로 체험할 수 있는 3D 가상현실 콘텐츠를 제작함. 코딩으로 오브젝트의 미세한 움직 임을 구현할 수 있음. 수업 B에서 지역 문화유산 현황을 담은 정형 데이터를 수집하여 위도, 경도 속성을 이용해 지도 위에 직접 산점도로 시각화함. 지역의 지리적 요소에 따른 문화유산 분포와의 연관성을 분석하고 다른 형태의 분석 결과들을 조사 및 공유하는 활동을 진행해 데이터 분석이 실생활에 활용되는 과정을 체험함. 수업 C에서 미래의 첨단기술과 관련하여 여러 도시에 적용된 사물인터넷(IoT) 기술의 사례를 조사하여 PPT로 발표함. 두 도시는 다양한 스마트시티 기술을 도입하고 있는 도시로 스마트 가로등, 스마트 파킹, 스마트 쓰레기통 등을 활용한 스마트시티 인프라를 구축하고 있다고 설명함. 이 과정에 서 사물인터넷 기술의 지속적인 발전과 함께 그만큼의 보안 이슈도 존재하기에 이에 대한 철저한 대비가 필요하다는 소감을 작성함. \n<진로 선택 과목> \n성취도 \n학기 \n교과 \n과목 \n단위수원점수/과목평균 \n(수강자수) \n성취도별 \n분포비율 \n1 \n예술 \n음악 연주 \n2 \n94/86.4 \nA(200) \nA(75.0) B(19.5) C(5.5) \n2 \n예술 \n음악 연주 \n2 \n88/78.9 \nA(198) \nA(59.6) B(28.3) C(12.1) \n이수단위 합계 \n과목 \n세부능력 및 특기사항 \n비고 \n음악 연주: 드럼의 악기의 구조와 명칭을 구분할 수 있고 악기별 소리의 특징을 이해하고 연주할 수 있음. 스네어의 8비트 스 트로크와 플로어탐의 16비트 스트로크를 경쾌하고 빠르게 표현함. 인공지능 융합수업에서 작곡과 편곡 플랫폼을 이용하여 다양한 비트를 사용하여 리듬과 박자의 개념을 이해할 수 있었으며, 자신의 생각과 느낌을 음악으로 표현할 수 있게 됨. 인공 지능 플랫폼의 모션인식을 활용하여 지휘법을 연습함. 이를 통해 오케스트라의 악기 구성과 소리의 특징을 이해하고 셈여림 과 빠르기 등 음악적인 역량이 향상됨. 통기타 수업에서 박자와 오른손 스트로크 리듬을 맞추는게 조금 어려웠으나 꾸준한 연 습으로 이를 극복하여 연주를 완성하게 되어 뿌듯했다는 소감을 발표함. 메타버스 플랫폼으로 자신이 표현하고자 하는 가상 의 공간을 구축하고 이를 표현하는 음악을 인공지능 작곡 플랫폼으로 창작하여 감상 공간을 완성함. 친구들과 자신의 창작물 을 공유하고 감상하는 활동을 통해 음악적 창의성과 융합역량을 신장할 수 있었다고 1학기 교과별 프로젝트 발표회에서 소감 을 발표함. \n<체육·예술> \n학기 \n교과 \n과목 \n단위수 \n성취도 \n비고 \n1 \n체육 \n운동과 건강 \n2 \nA \n2 \n체육 \n운동과 건강 \n2 \nA \n고색고등학교 \n2025년 11월 20일 14/20 \n반 \n1 \n번호 \n6 \n이름 \n백민건 \n(KOR \ngov.kr \n정부24",
    "문서확인번호: 1763-6399-9850-6483 (신청인 : 백민건) \n이수단위 합계 \n4 \n과목 \n세부능력 및 특기사항 \n운동과 건강: 신체 활동에 대한 흥미가 높아 체육 수업에 적극적으로 참여하는 성실함을 보였으며, 다양한 서브 연습에 열심 히 참여하여 백핸드 스트로크와 포핸드 스트로크를 이용한 서브를 구사할 수 있음. 빈 공간을 빠르게 파악하고 정확한 스트로 크를 이용하여 공격함으로써 경기를 자신에게 유리하게 이끌어 나가는 능력을 보임. 체력 운동으로 실시한 1도약 2회선 줄 넘기 활동과 1 도약 2회선 줄넘기 활동에 참여함. 공에 대한 높은 집중력을 바탕으로 골대 좌우를 번갈아가며 슛을 던지는 활동인 골밑 슛 활동에서 높은 성공률을 보임. \n[3학년] \n원점수/과목평균 \n성취도 \n학기 \n교과 \n과목 \n단위수 \n석차등급 \n비고 \n(표준편차) \n(수강자수) \n국어 \n화법과 작문 \n3 \n85/67.5(19.1) \nB(227) \n4 \n1 \n수학 \n미적분 \n3 \n83/70.1(16.1) \nB(132) \n4 \n영어 \n영어 독해와 작문 \n4 \n89/59.7(19.6) \nB(227) \n2 \n국어 \n화법과 작문 \n3 \n91/62.4(22.3) \nA(227) \n3 \n2 \n수학 \n미적분 \n3 \n75/55.5(21.1) \nC(132) \n3 \n이수단위 합계 \n16 \n과목 \n세부능력 및 특기사항 \n화법과 작문: 다양한 글의 목적을 해석한 후 이에 적절한 어조로 지문을 읽어 수업을 다채롭게 만듦. 자신의 진로 희망인 프 로그래머와 관련하여 자율주행자동차의 안전한 운행을 위해 도로교통법 개정을 건의하는 글을 작성함. 새로운 기술 도입에 따라 기존 법에 어떤 모순이 생기는지 구체적이고 논리정연하게 지적하였으며 실현가능성이 높은 대안을 제시함. 도로교통법 은 운전자가 사람인 것을 전제로 한 법률이므로 자율주행자동차로 주행할 경우 도로교통법 제151조, 제43조, 제49조 제1항 제6호에 모순이 발생한다는 문제점을 지적함. 이를 해결하기 위해 사고 원인에 따라 차량 제조사, 소프트웨어 제조사, 사람 등이 책임을 지게 하고, 운전면허 결격 사유에서 노약자·장애인 . 18세 미만의 사람 삭제, 제49조 제1항 제6호 삭제를 건의 함. 이러한 건의문의 내용을 친구들 앞에서 발표함. 긴장했음에도 당당하고 또박또박하게 말하여 전달력이 높았으며, 친구들 이 가장 집중하고 흥미로워하는 발표였음. 최근 사회 문제 중 게임 저작권 위반에 관한 기사문을 찾아본 후 비평문을 작성함. 저작권법을 어기며 게임을 만드는 것은 바람직하지 않다는 입장을 밝히고, 이는 나아가 한국 게임 산업의 발전을 저해할 수 있는 문제라고 지적함.",
    "미적분: 급수 문제를 칠판 앞으로 나와 풀이하고 아이들에게 설명함. 난이도 있는 문제를 해결하기 위해 꼼꼼히 살펴보고 식 을 전개하면서 풀이하면서 문제를 해결하는 과정에 보람을 느꼈음을 밝힘. 미적분 보고서 작성하기에서 '역전파 알고리즘'을 주제로 탐구함. 컴퓨터공학과 관련 있는 부분이고 미적분과 연관 지어 보고자 주제를 선정함. 역전파는 신경망의 각 노드가 가지고 있는 가중치와 편향을 학습시키기 위한 알고리즘으로 경사 하강법과 합성함수의 미분 법칙이 이용됨을 설명함. 탐구 활동을 통해 합성함수의 미분법이 역전파 알고리즘에 어떻게 이용되는지 알게 되었으며, 경사 하강법의 내용과 관련이 있음 을 알고, 미적분과 인공지능이 많은 연관성이 있음을 알게 되었다는 소감을 작성함. 도서 '미적분의 쓸모'를 읽고, 컴퓨터공 학과의 관련성을 찾아보고 인공지능과 빅데이터, 인공신경망과의 연관성을 찾아보고자 하였다는 이유를 밝힘. 최적화 알고리 즘 중 하나인 코시의 경사 하강법에 대한 개념과 공식 등의 내용을 확인할 수 있었으며 이를 이용하여 직접 알고리즘이나 인 공지능 및 프로그램을 만들어보고, 경사 하강법이 아닌 손실을 최소화하는 다른 최적화 알고리즘을 조사해봐야겠다는 다짐을 \n고색고등학교 \n2025년 11월 20일 15/20 반 \n1 \n번호 6 이름 \n백민건 \ngov.kr \n정부24 \n과목",
    "문서확인번호: 1763-6399-9850-6483 (신청인 : 백민건) \n세부능력 및 특기사항 \n작성함. \n영어 독해와 작문: 즐겁고 유쾌한 성격을 갖고 있어 언제나 긍정적인 마음 자세로 수업에 참여하는 모습이 돋보이는 학생임. 지문을 돌아가며 해석하는 모둠활동에서 쾌활한 분위기를 주도하며 모둠 친구들이 웃으면서 활동하도록 만듦. 친구들과 얘기 하다가도 자신이 해야 할 일이 있으면 높은 집중력으로 몰두함. 사람들에게 즐거움을 제공하는 게임 프로그래머가 되고 싶은 자신의 꿈을 담은 진로 로드맵 작성 활동에서 글의 상관관계를 나타내는 연결사를 효율적으로 사용하여 자연스러운 흐름의 글을 작성함. 중복되는 표현 없이 깔끔한 문장으로 자기 생각을 표현함. 관계대명사를 활용하여 하나의 긴 문장 안에서 자신 이 의도한 것을 모두 표현하는 수준 높은 작문 실력을 보여줌. to 부정사를 글의 흐름상 알맞은 곳에 활용하여 진로 계획의 목적 등을 유연하게 작성한 점이 우수함. \n<진로 선택 과목> \n성취도 \n성취도별 \n학기 \n교과 \n과목 \n단위수원점수/과목평균 \n비고 \n(수강자수) \n분포비율 \n수학 \n인공지능 수학 \n4 \n100/78.6 \nA(42) \nA(59.5) B(21.4) C(19.0) \n사회(역사/도 \n여행지리 \n3 \n89/82.7 \nA(132) \nA(71.2) B(22.0) C(6.8) \n덕포함) \n과학 \n물리학 II \n3 \n84/72.9 \nA(79) \nA(46.8) B(22.8) C(30.4) \n과학 \n화학 II \n3 \n83/69.1 \nA(82) \nA(39.0) B(20.7) C(40.2) \n1 \n과학 \n과학과제 연구 \n4 \n88/88.1 \nA(84) \n체육 \n스포츠 생활 \n1 \n82/83.5 \nA (227) \nA(86.9) B(6.0) C(7.1) \nA(74.4) B(22.0) C(3.5) \n기술·가정/ \n제2외국어/한인공지능 기초 문/교양 \n2 \n94/87.9 \nA(68) \nA(83.8) B(10.3) C(5.9) \n수학 \n인공지능 수학 \n4 \n83/61.0 \nA(42) \nA(28.6) B(19.0) C(52.4) \n영어 \n영미 문학 읽기 \n4 \n94/56.8 \nA(227) \nA(17.6) B(22.0) C(60.4) \n사회(역사/도 \n여행지리 \n3 \n90/72.2 \nA(132) \nA(45.5) B(26.5) C(28.0) \n덕포함) \n과학 \n물리학 II \n3 \n61/57.1 \nB(79) \nA(10.1) B(32.9) C(57.0) \n2 \n과학 \n화학II \n3 \n74/61.6 \nB(82) \nA(19.5) B(24.4) C(56.1) \n과학 \n과학과제 연구 \n4 \n96/81.9 \nA(84) \nA(66.7) B(19.0) C(14.3) \n체육 \n스포츠 생활 \n1 \n86/64.8 \nA(227) \nA(21.1) B(42.7) C(36.1) \n기술·가정/ \n제2외국어/한인공지능 기초 문/교양 \n2 \n79/79.8 \nB(68) \nA(54.4) B(33.8) C(11.8) \n이수단위 합계 \n44 \n고색고등학교 \n2025년 11월 20일 16/20 반 \n1 \n번호 \n6 \n이름 \n백민건 \ngov.kr \n정부24",
    "문서확인번호: 1763-6399-9850-6483 (신청인 : 백민건) \n과목 \n세부능력 및 특기사항 \n인공지능 수학: 인공지능에 대한 관심을 가지고 적극적으로 학습에 참여함. 수학 지식을 향상시키기 위해 노력하고 스스로 학습하는 모습을 보임. 인공지능이 게임에서 쓰이는 방법에 대해서 스스로 탐구함. 수집한 자료를 그래프로 나타내어 원하는 \n정보를 쉽게 찾아내는 방법을 잘 알고 있음. 스스로의 학습 목표를 설정하고 이를 달성하기 위해 노력함. 또한, 매 수업 전후 로 학습 내용을 복습하고 예습하여 학습 성취도를 높임. \n영미 문학 읽기: 영미 문학 작품 속 등장인물에 대한 자신의 감정을 깊이 있게 작문으로 표현하는 능력이 뛰어남. 문학 작품 을 읽을 때, 등장인물의 심리와 상황을 섬세하게 분석하고 이를 바탕으로 자신의 감정을 진솔하게 담아내는 작업을 잘 수행 함. 매 작품마다 다양한 관점에서 독창적인 의견을 제시하며 자신의 생각을 논리적으로 풀어내는 능력이 뛰어남. 문학 수업 을 통해 얻은 지식을 다른 과목에도 융합하여 학습에 대한 넓은 시야를 가지게 되었으며, 영어 실력 향상과 더불어 글로벌 시 민으로서의 소양을 갖추어 나가고 있음.",
    "여행지리: 다크 투어리즘 제대로 알기 활동에서 '서대문 형무소'를 선정하여 서대문 형무소의 역사를 시대 순으로 변천 과정 을 조사하여 작성한 점이 매우 돋보였음. 우리나라의 독립을 위해 목숨을 받친 애국지사를 반드시 기억해야 하며 자유와 독립 은 매우 소중함을 깨닫게 되었다고 소감을 작성함. 국가 홍보물 제작 활동에서 '미국을 상징하는 5가지 요소'라는 주제로 미 국의 백지도에 그랜드 캐니언, 자유 여신상, 골드게이트 브릿지, 미국의 프로 농구 협회, 세계 최초 테마 파크 등의 특징을 그 림으로 그려 홍보물을 디자인함. 본 활동을 통해 미국 본토와 더불어 알래스카, 크고 작은 섬들로 구성된 미국 영토에 대해 자세하게 알게 되었으며 자신이 선정한 5가지 요소 이외에 다양한 인문 및 자연 경관을 탐색하면서 자신의 지적 호기심을 충 족시킬 수 있는 좋은 계기가 되었다고 소감을 작성함. 적정 기술을 활용한 상품 개발 프로젝트 활동에서 개발도상국가에서 사 용하는 기존의 '소켓볼'상품에 대한 장점과 단점을 분석함. 또한 현재는 전등의 역할을 하지만 이를 다른 전자기기와 연계를 통해 충전할 수 있는 형태의 진화된 상품을 제시함. 남에게 도움을 주는 행위가 존경스러워 자신도 이타적인 삶을 살겠다는 의지를 보임. \n물리학 II: 항상 바른 자세로 성실하게 수업에 참여함. 포물선 운동 결과 분석하기에서 포물선 운동을 동영상으로 촬영하고 동영상 분석 프로그램을 이용하여 시간, 위치, 속도, 가속도를 표에 작성하고 그래프를 그림. 포물선 운동에서 수평 방향의 운동과 연직 방향의 운동을 알고 있음. 실험 결과에 만족하고 실험에서 오차가 발생하는 원인에 대해서 고민함. 단진자의 진 동 주기 실험에서 모둠원과 협동하고 실험 과정에 따라서 진행하여 표에 실험 자료를 잘 작성함. 주기와 실의 길이, 질량 사 이의 관계를 자료를 근거로 잘 확인함. 교과 관련 물리 뉴스에서 '트랜지스터를 활용한 CPU의 작동 원리'라는 주제로 잘 발 표함. 과학적 원리로 반도체와 트랜지스터의 구조 등을 조사하여 서술함. 트랜지스터가 CPU의 작동에 활용이 된다는 것과 스핀트랜지스터에 호기심을 느낌. \n화학II: 혈액 속에서 인산완충용액과 단백질 완충용액의 완충과정을 화학반응식을 이용하여 설명하고 관련 내용을 정리한 활동지를 작성하여 제출함. 시판용 산소기체를 사용하여 산소의 분자량을 측정하고 이론적인 값과 비교하여 차이가 나는 이 유를 측정 저울의 한계 및 메스실린더의 부피 측정의 부정확성에서 찾고 고찰한 내용들을 정리한 활동지를 제출함. 물에 녹은 비전해질 용액의 퍼센트 농도 값을 몰랄 농도로 변환하고 변환한 몰랄농도를 이용하여 어는점 내림 및 끓는점 오름 값을 계 산하였으며 시간에 따른 가열곡선 및 냉각곡선을 그림으로 나타냄. 수산화 나트륨과 염산과의 반응을 열화학 반응식을 이용 하여 나타내고 반응열 측정 실험에서 발생할 수 있는 오차를 실험과정에서 유추해 보았으며 엔탈피 변화 도표를 이용하여 헤 스의 법칙을 설명함. 염화칼슘, 염화나트륨의 기존 제설제와 친환경 제설제 중 유기산염(CMO), 칼슘 마그네슘 아세테이트( CMA) 제설제의 장점과 단점을 조사하여 발표함. \n과학과제 연구: 퇴비 속 구성 성분이 식물에 미치는 구체적 성장 영향을 확인하고자 '퇴비 구성 성분에 따른 식물의 성장 경 향'을 주제로 과제 연구를 진행함. 방울 토마토를 식물의 주체로 하고 깻묵, 계분을 이용하여 질산 퇴비를 만들고 12개의 화 분을 이용하여 실험군 및 대조군을 구성하였으며 줄기의 둘레, 열매의 세로 길이로 생장 과정을 관찰하여 기록함. 기록 결과 \n고색고등학교 \n2025년 11월 20일 17/20 반 \n1 \n번호 6 이름 \n백민건 \ngov.kr \n정부24",
    "문서확인번호: 1763-6399-9850-6483 (신청인 : 백민건) \n과목 \n세부능력 및 특기사항 \n를 분석하여 질산 퇴비가 열매에는 큰 영향을 미치지 않으나 줄기의 생장과 관련 있음을 확인한 보고서를 작성함. 연구 결과 토마토 보다 생육 기간이 긴 식물과 생육 기간이 짧은 식물을 재배, 비교하여 차이점을 확인하고 싶다는 생각을 밝힌 소감문 을 작성하여 제출함. \n스포츠 생활: 플라잉 디스크를 이용해 던지는 순서를 바로 알고 던지기의 과학적 원리를 경기에 응용하여 적용하였으며 다양 한 전략과 전술을 통해 경기의 흐름을 파악하는 능력을 보임. 플라잉 디스크 멀리 던지기에서 옆으로 플라잉 디스크를 던지는 사이드암 스로우 던지기를 잘하며 속도와 회전력을 조절할 줄 알고 이용하는 능력과 상황에 따라 적절한 속도와 회전을 결정 해 디스크를 빠르게 던질 수 있는 능력이 우수함. 체력과 건강이 우리의 일상 생활에 중요한 요소임을 인식하여 효과적인 체 력 방법에 대해 이해하고 있으며 실제 강한 체력을 키우기 위하여 규칙적으로 운동을 실천하고 있음. \n인공지능 기초: 교사가 제시한 과제를 성실히 수행하여 모든 활동을 마무리하는 학생임. 교사의 질문에 자신의 생각을 자신 감있게 대답하는 모습이 인상 깊음. 프로그래머로써 인공지능에 대한 깊은 탐구를 하기 위해 '이것이 인공지능이다' (김명락) 을 읽고 인공지능을 학습함에 있어 데이터가 매우 중요함을 깨달음. 데이터의 편향성이 미치는 영향에 대해 생각해보며 사람 들에게 긍정적인 영향을 줄 수 있는 프로그램을 개발하고자 함을 이야기함. 분류 모델의 성능 평가지표를 학습한 후 혼동행렬 을 표현하여 불량품 검사, 자율주행 자동차를 예시로 정밀도와 재현율을 설명함. 인공지능 사회 탐구 활동에서 '자율주행자동 차'를 주제로 자율주행자동차의 윤리적인 문제를 자신의 견해로 발표하는 모습을 보임. 텍스트 기반 프로그래밍 활동에서 최 근접이웃 모델을 구현하였으며 각 단계에서의 문제점을 찾아 해결하고자 하는 적극적인 모습을 보임. \n<체육·예술> \n학기 \n교과 \n과목 \n단위수 \n성취도 \n비고 \n이수단위 합계 \n과목 \n해당 사항 없음 \n세부능력 및 특기사항 \n7. 독서활동상황 \n학년 과목 또는 영역 \n1 \n2 \n3 \n독서 활동 상황 \n8. 행동특성 및 종합의견 \n학년 \n행동특성 및 종합의견 \n생각이 깊고 심성이 착하며 생활 태도가 우수하고 맡은 일을 능동적으로 잘 처리하고 성격도 명랑함. 언행이 바르고 1 모든 일에 적극적으로 나서므로 급우들의 모범이 되며, 예의 바르고 공손한 말씨로 어른을 대하는 장점을 많이 갖추 고 있는 학생임. 참을성이 많고 타인의 입장을 잘 이해함으로써 쉽게 공감대를 형성하여 친화력이 좋음. 특히, 공감 \n고색고등학교 \n2025년 11월 20일 18/20 반 \n1 \n번호 6 이름 \n백민건 \ngov.kr \n정부24 \n학년",
    "문서확인번호: 1763-6399-9850-6483 (신청인 : 백민건) \n행동특성 및 종합의견 \n2 \n3 \n능력이 뛰어나 친구들이 기쁜 일이나 힘든 일이 있을 때, 마치 자기 일처럼 생각하고 행동하여 교우 관계가 매우 돈 독함. '학급 칭찬 릴레이' 시간에 남을 잘 돕고 배려심이 깊으며 항상 활발하고 배려하는 학생이라는 문구를 받음. 명 랑한 성격의 학생으로 자신이 하고자 하는 일에 대해 뚜렷하고 명확한 생각을 가지고 있으며 과학 시간에 중화 반응 에 관해 조사한 내용을 발표하며 과학자에 대한 꿈을 더욱 공고히 함. 이후 학업 계획을 구체적으로 수립하며 적극적 으로 자신의 학습 환경을 통제하고 지속적으로 실천하는 자세를 키우고 있어 더 큰 발전이 기대됨. 특히, 과학 탐구 과목에 흥미를 가지고 기본 개념을 확실하게 정립하고 심화 내용까지 확장하고자 노력하며 개념 노트를 만들고 정리 하는 등 탐구적 학습 자세가 돋보임. \n마음이 착하고 매사에 긍정적인 사고를 함. 또한 평소 랩을 하며 흥이 넘치는 모습을 자주 보여주고 즐거운 마음으로 생활하는 학생임. 집이 가까워도 지각은 하지 않지만, 아슬아슬하게 교실에 입실함. 그래도 교복은 단정히 잘 입고 규칙을 지키며 생활함. 체육 한마당에서 각종 종목에 출전하여 좋은 성적을 얻도록 최선을 다하여 노력하는 열정이 넘치고 응원도 열정적으로 함. 제주도 체험학습에 참여하여 질서를 지키고, 한라산을 등반하며 체력과 정신력을 기 름. 또한 쓰레기를 버리지 않고 되가지고 와서 분리수거를 함. 학교 스포츠 클럽 농구에서 활약하여 준우승을 이끎. 학업 면에서 조금은 성장했으나 조금 더 욕심을 내서 공부하도록 자극해도 그 위치에 안주하려 했으나, 이제는 마음 을 고쳐서 변화하려 함. 학습 플래너를 활용하여 계획을 세워서 노력한다면 발전이 기대됨. \n2학기 학급자치회 부회장(2024.08.09. -2024. 11. 30.)으로 학급의 단합을 이끌어감. 예의가 바르고 겸손한 태도를 지녀 선생님들께 늘 예의를 갖추고, 심성이 착하며 겉으로는 조용한듯 하지만 명랑한 성격을 지녀 교우 관계가 원만 하며 자신이 맡은 바에 대한 책임을 다하는 학생임. 단정한 교복 차림과 마음가짐으로 학교 규칙을 잘 지키고 학생의 본분에 걸맞은 생활 태도로 생활하여 여러 친구들의 모범이 됨. 교실 청소의 1인 1역활을 성실히 수행하였으며 인터 넷 강의 수강과 문제풀이를 통해 심화학습을 진행하고 있어 앞으로 성적에도 많은 향상이 있을 것으로 생각됨. \n고색고등학교 \n2025년 11월 20일 19/20 반 \n1 \n번호 \n6 \n이름 \n백민건 \ngov.kr \n정부24",
    "문서확인번호: 1763-6399-9850-6483 (신청인 : 백민건) \n발급번호 : J100005653-2025-002165 \n학교생활기록 부 \n성 \n명 \n백민건 \n인적 \n사항 \n주민등록번호 060731-******* \n담당부서 고색고등학교 \n담당자 김미희 \n전화번호 \n031-8012-6806 \n위 사람의 학교생활기록부 사본임을 증명합니다. \n2025년 11월 20일 \n고색고등학교장 \n7S75 \n고색고등학교 \n2025년 11월 20일 20/20 반 \n1 \n번호 \nCo \n6 \n이름 \n백민건 \n(KOR, \ngov.kr \n정부24"
  ],
  "reading": "학년 과목 또는 영역 \n1 \n2 \n3 \n독서 활동 상황",
  "behavior": {
    "grade1": "2",
    "grade2": "구분 \n학년",
    "grade3": "1. 인적·학적사항 \n성명 : 백민건 \n학생정보 \n학과 \n반 번호 \n담임성명"
  },
  "raw_text": "점 \n확 \n인 \n'진본 \n2025/11/20 \n21:03:39 \nKST \n문서확인번호: 1763-6399-9850-6483 (신청인 : 백민건) \n학교생활세부사항기록부(학교생활기록부II) \n졸업대장번호 3442 \n구분 \n학년 \n1 \n2 \n3 \n1. 인적·학적사항 \n성명 : 백민건 \n학생정보 \n학과 \n반 번호 \n담임성명 \n7 \n12 \n백은정 \n9 \n8 \n백종진 \n1 \n6 \n심한계 \n성별 : 남 \n주민등록번호 : 060731-***** 같은 은 \n주소: 경기도 수원시 권선구 매송고색로 751-17, 103동 604호 (고색동, 상우아파트) \n2022년 1월 7일 수성중학교 제3학년 졸업 \n학적사항 2022년 3월 2일 고색고등학교 제1학년 입학 \n2025년 1월 3일 고색고등학교 제3학년 졸업 \n특기사항 \n2. 출결상황 \n결석일수 \n지각 \n학년 수업일수 \n조퇴 \n결과 \n질병 미인정 기타 질병 미인정 기타 질병 미인정 기타 질병 미인정 기타 \n1 \n191 \n3 \n1 \n2 \n190 \n1 \n1 \n3 \n190 \n4 \n3. 수상경력 \n학년 \n수상명 \n(학기) \n1 \n특기사항 \n원격수업일수 3일 \n원격수업일수 0일 \n참가대상 \n등급(위) \n수상연월일 \n수여기관 \n(참가인원) \n1 교과우수상(인공지능 수학) \n2024.07.19. \n고색고등학교장 \n수강자 \n3 \n2 \n모범상(선행부문) \n2024, 11, 22. \n고색고등학교장 \n3학년(247명) \n고색고등학교 \n2025년 11월 20일 1/20 반 \n1 \n번호 6 \n이름 \n백민건 \n(KOR), \ngov.kr \n정부24 \n문서확인번호: 1763-6399-9850-6483 (신청인 : 백민건) \n4. 자격증 및 인증 취득상황 \n<자격증 및 인증 취득상황> \n구분 \n명칭 또는 종류 \n번호 또는 내용 \n취득연월일 \n발급기관 \n<국가직무능력표준 이수상황> \n능력단위 \n학년 \n학기 \n세분류 \n이수시간 원점수 \n성취도 \n비고 \n(능력단위코드) \n해당 사항 없음 \n5. 창의적 체험활동상황 \n학년 \n영역 \n시간 \n1 \n자율활동 \n90 \n창의적체험활동상황 \n특기사항 \n동사형꿈 진로캠프(2022.03.18.)에 참여하여 자신의 본질과 긍정적인 자아 형성 과정 을 체험하고 이해함. \n사제동행 소백산 극기캠프(2022.05.14.)에 참여하여 호연지기를 키우고, 모험, 극 기, 봉사활동을 통해 자아정체성을 확보함. \n고교학점제 디자인 씽킹 2045 진로캠프 (2022.06.17.)에 참여하여 자기 주도적으로 진로와 연계한 학업 계획을 수립 이수할 수 있는 역량을 함양함. \n착한 지구인 프로젝트 환경 특강 (2022.08.26.)을 통해 탄소중립의 필요성과 우리나라 에서 탄소중립 실천을 위해 적극적으로 시행되고 있는 분리수거와 자원 순환에 대한 강 의를 듣고 국가적 차원, 사회적 차원, 개인적 차원에서 가능한 일 등을 정리하고 스스 로 실천가능한 방안을 제시함. \n착한 지구인 프로젝트 환경 특강(2022. 11. 11.)을 통해 기후 위기에 대응하기 위한 다 양한 정책과 실천 방안 교육을 통해 기후변화를 멈추기 위해 자기 주도적으로 실천할 수 있는 다양한 방법을 제시함. \n뮤지컬에서 조연 역할을 맡아 연기하였으며 연기에 대한 관심이 많아 흥미로워하고, 열심히 참여하는 모습을 보임. 대사 및 가사를 성실하게 암기하며 완벽한 결과물을 만 들어 냄. 매사에 열정적인 모습으로 수업에 임하며 배려심이 많아 친구들을 잘 챙겨주 며 리더십이 높음. \n고색고등학교 \n2025년 11월 20일 2/20 반 \n1 \n번호 6 이름 \n백민건 \ngov.kr \n정부24 \n1 \n문서확인번호: 1763-6399-9850-6483 (신청인 : 백민건) \n학년 \n영역 \n시간 \n동아리활동 \n31 \n진로활동 \n34 \n창의적체험활동상황 \n특기사항 \n(인공지능코딩반) (31시간) 자율주행 자동차 프로젝트를 실시함에 능동적이며 적극적 으로 프로젝트를 실시하는 모습이 인상 깊음. 어려운 상황에 마주하였을 때 친구와 함 께 협력하여 문제를 해결하는 과정이 돋보이며 이해가 되지 않는 프로그래밍 문법이나 명령어를 주변 친구들과 협력하여 해결하는 모습을 보임. 텍스트 기반 프로그래밍 언 어에 대한 이해도가 높은 학생이며 자동차 맵을 따라 자율주행을 하는 과정에서 수많 은 실패를 겪으면서도 포기하지 않고 끝까지 도전하여 성공해 내는 모습이 인상 깊음. \n희망분야 과학자 \n모방시 쓰기에서 나 자신을 사랑하는 마음을 잘 표현하였으며 타인을 잘 도와주는 이타 적 정신을 시로 작성하여 발표함. 차분하고 진지하며 수업 목표를 정확히 이해하여 수 업에 참여함. \n교내에서 실시한 전공흥미검사 결과 해당 전공과 연관된 직무활동과 직업에 대한 선호 도를 고려할 때, 주거·의류, 영상 · 공연, 미술·디자인에 가장 많은 흥미를 보이는 것 으로 나타남. 1순위인 주거(인테리어) · 의류 전공은 인간이 머리부터 발끝까지 몸에 걸 치는 의류와 생활하는 공간을 아름답고 효율적으로 기능하도록 디자인하여 제작하는 실용 학문으로, 본인이 선호하는 활동과 직업을 고려했을 때 가장 관련성이 높은 전공 임. 또한 선호직무유형은 아이디어형으로, 기획적 사고력을 바탕으로 창의적인 생각을 발전시키고 표현하는 활동을 선호함. 검사 결과를 통해 진로에 대한 현황을 전반적으 로 점검하고, 부족한 부분을 보완하는 계획서를 완성함. \n'나의 꿈 포트폴리오 만들기' 활동에서 대입 정보 포털을 활용하여 대학 및 학과를 탐색 \n하며 컴퓨터학부와 데이터 과학부에 대해 자세히 알아보고 정리하여 분석함. 곤충 채 집이나 식물 관찰 등 과학 실험과 새로운 아이디어로 발명품 만들기, 컴퓨터 프로그래 밍에 흥미가 많음. 해당 흥미 분야에 따른 직업 발표 활동에서 게임 기획자, 인공 지능 전문가, 가상현실 전문가의 3개 직업군을 선택하여 추가로 조사하며 흥미나 재미를 느 끼는 취미를 따라 직업을 선택하는 것의 중요성에 대해 발표하며 깊이 있는 진로 탐색 자세를 보여줌. 정형화된 과제보다는 자신만의 독창적인 생각을 실현할 수 있는 과제 에 더 흥미를 느끼고 정성을 쏟음. 자신의 관심 분야를 정확하게 파악하고 이에 따라 뚜렷한 진로 설계를 하는 점이 바람직함. \n고색고등학교 \n2025년 11월 20일 3/20 반 \n1 \n번호 \n6 이름 \n백민건 \ngov.kr \n정부24 \n2 \n문서확인번호: 1763-6399-9850-6483 (신청인 : 백민건) \n학년 \n영역 \n시간 \n자율활동 \n95 \n동아리활동 \n30 \n창의적체험활동상황 \n특기사항 \n학교 기본 교육 활동에 참여함. 체육 한마당에서 각종 종목에 출전하여 학급이 좋은 성 적을 얻도록 최선을 다함. 또한 공정한 스포츠맨십도 발휘하고 응원 장소도 깨끗하게 정리함. 학교 스포츠클럽 농구에서 센터를 맡아 학급이 준우승하는데 공헌함. 착한 지 구인프로젝트 (2023.06.23.)에서 환경 감수성 및 환경 인식 교육을 통해 기후 위기로 기후난민이 고통받는 것을 사례로 접하면서 기후 위기는 범지구적 문제임을 인식하고, 기후 변화를 멈추기 위해 자기 주도적으로 실천할 수 있는 다양한 방법을 제시함. 1회 용품 줄이기 학생 교육 (2023. 10.27.)에서 지구를 지키는 여러 가지 제안을 주제로 한 교육을 통해 1회용품을 줄일 수 있는 구체적인 실천 방안을 배우며 1회용품 줄이기 뿐 만 아니라 이메일함 비우기, 폐의약품 따로 거두기도 환경 보호 활동의 일원이라는 것 을 배움. 자신의 관심 대학을 설정하고 진학을 위해 갖추어야 할 조건에 대해 스스로 탐색하는 시간을 가짐. 진학 상담 카드를 작성하고 미래에 자신이 갖게 될 직업을 설정 하여 명함을 제작함. 또한 자신에게 쓰는 편지를 작성하는 과정을 통해 미래의 수험생 으로서의 마음가짐을 다시 한번 새롭게 다짐하는 계기가 됨. \n(수학집중탐구반) (30시간) 모든 활동에 적극적으로 참여하는학생임. 학생 주도적 문제 \n탐구 활동에 친구들이 준비해 온 문제를 함께 탐구하고 해결하기 위해 노력함. 혼자 고민할 때 어려웠던 것들이 친구와 함께하면서 좀 더 흥미롭게 재밌게 느껴졌다는 소감 을 이야기 함. 알지오매스의 작도 프로그램을 이용하여 각의 이등분선과 선분의 수직 이등분선을 작도해보고, 블록코딩을 이용하여 확률과 통계에서 학습한 조합의 성질을 코딩을 통해 확인해 봄. 인공지능에 관심이 많아 '인공지능을 위한 수학 (이시카와 아카 히코)'이란 도서를 선정하여 꾸준히 탐독함. 인공지능에서 사용하는 모델 중 하나인 ' 신경망'에서는 '가중치'라는 개념이 있는데, 컴퓨터가 이러한 가중치를 학습할 때는 가 중치가 '변수'의 역할을 하지만, 학습이 끝나고 해당 가중치를 학습 모델로 활용할 때는 \n'상수'의 역할을 한다는 내용을 읽고 '변수'와 '상수'는 문제 상황을 바라보는 관점에 따라 달라질 수 있다는 것이 매우 흥미로웠다고 친구들에게 책을 소개함. 학교 축제에 동아리 기획 회의에 적극적으로 아이디어를 제공하고 확률의 계산을 통해 손해보지 않 으며 즐겁게 할 수 있는 '확률게임' 부스를 운영함. \n고색고등학교 \n2025년 11월 20일 4/20 반 \n1 \n번호 \n6 \n이름 \n백민건 \ngov.kr \n정부24 \n문서확인번호: 1763-6399-9850-6483 (신청인 : 백민건) \n창의적체험활동상황 \n학년 \n영역 \n시간 \n특기사항 \n희망분야 프로그래머 \n2 \n진로활동 \n35 \n3 \n자율활동 \n58 \n진로연계 독서토론에서 '개인적 가치관'에 관한 글을 읽고, 다수결 원칙이 항상 합리적 인 의사결정 방법이 아님을 제시함. 나아가 도덕 과목에서 배운 배경지식을 동원하여 세상에는 옳은 소수의 의견도 중요하다는 의견을 내놓음. 알고리즘 챌린지에 참가하여 논리적 사고력을 바탕으로 문제를 해결할 때 높은 집중력을 보여주었으며, 문제를 분 석하고 핵심 요소를 추출하여 풀이하는 과정 자체를 즐기는 모습이 인상 깊음. 어려운 문제를 접할 때도 포기하지 않고 자신이 가진 역량을 충분히 발휘하는 모습을 보임. 앞 으로도 다양한 활동에 참여하여 창의력과 문제 해결력을 신장시키고 싶다는 의지를 밝 힘. 온라인 코딩파티 시즌2에 참가하여 자기 주도적 학습 태도로 코딩 미션 수행과정 을 이수함. 텍스트 코딩 '토끼의 당근 수집'에서 횟수에 따라 반복하는 반복문으로 토끼 와 함께 당근을 수집하고 조건문으로 당근밭을 찾아 더 멀리 가보기를 실습하였으며 조 건에 따라 반복하는 반복문으로 당근을 모두 찾아 집으로 돌아오기를 효과적으로 코딩 함. 활동을 통해 프로그래밍의 작동 원리를 파악하고 기본 지식을 함양할 수 있어 실력 이 향상됨을 느꼈다고 이야기함. 앞으로도 다양한 활동에 참여하여 능력을 키우고 싶 다고 이야기함. 자신의 진로 목표 설정과 실현에 대한 자신감이 부족한 진로 장벽으로 불안감이 있었으나, 기업가정신 진로캠프(2023.03.17.)으로 자신의 적성을 고려한 기 업인으로의 명확한 진로 목표를 설정하고 긍정적인 사고를 지니는 계기가 됨. 디자인 씽킹 생활기록부 2045 진로캠프(2023.05.01.)에서 배운 목표 설정과 계획 수립 기술 을 활용하여, 자신이 꿈꾸는 미래에 한 발짝 더 가까워질 수 있도록 생활기록부에 반영 하고 있음. \n2학기 학급자치회 부회장(2024.08.09. -2025.01.03.)으로 책임감과 봉사정신을 가 지고 궂은 일을 함에 있어 솔선수범하고 인화의 리더십으로 학급회의를 이끌어 나감. 학급자치 시간에 학급 구성원 모두가 함께 만들어가는 공동체를 만들기 위해 학급 협약 제정이 필요하다는 점을 인식하고 그 내용을 적극적으로 만들어 가는 모습을 보임. 학 교폭력 예방교육(2024.03.06)을 통해 학교폭력의 가해자가 그에 따른 책임을 져야 한다는 인식을 가졌으며 이를 통해 학생으로서 지켜야 할 5가지 실천 지침을 만들어 봄. 성매매 및 성폭력 예방교육 (2024.06.12.)을 통해 성매매의 역사적 변천, 성매매 방지를 위한 실천 방안을 배우고 성폭력의 연관성과 인권침해 그리고 피해자의 트라우 마 등을 알고 4대 폭력을 예방하는 방법의 중요성을 깨달음. 정보통신윤리교육 (2024. 06.12.)을 통하여 개인정보 보호에 대한 필요성을 깨닫고 개인정보 노출로 타인의 권 익을 침범하지 않도록 주의할 것을 다짐함. \n고색고등학교 \n2025년 11월 20일 5/20 반 \n1 \n번호 6 \n이름 \n백민건 \ngov.kr \n정부24 \n3 \n문서확인번호: 1763-6399-9850-6483 (신청인 : 백민건) \n학년 \n영역 \n시간 \n동아리활동 \n진로활동 \n26 \n창의적체험활동상황 \n특기사항 \n(딥러닝) (26시간) 모둠활동 프로젝트 발표하기에서 '몬테카를로 시뮬레이션을 이용한 게임'을 주제로 역할을 분배하고 프로그램을 만들어서 잘 발표함. 몬테카를로 시뮬레이 션의 개념, 개념을 설명하기 위한 예시, 시뮬레이션이 활용되는 곳, 행동 트리의 개념, 행동트리의 노드, 행동트리의 장단점, 몬테카를로 시뮬레이션의 장단점 등을 잘 설명 함. 프로그램은 100줄 정도의 기본 틀을 받아서 400줄 정도로 확장하여 구성함. 게임 은 플레이(사용자), 에너미 (컴퓨터)로 크게 구성되어 있고 서로 싸우는 게임임. 플레이 어는 어택, 디펜드, 힐이라는 단추를 가지고 있어서 3개의 단추 중에 하나를 선택하여 클릭하여 상대방의 에너지를 모두 없애면 끝나는 게임이었는데 발표 중에 설계한대로 실행시킴. 몬테카를로 시뮬레이션과 행동트리로 적AI를 구현하는 과정에서 수많은 오 류가 발생하고 원하는 결과가 나오지 않았으나 문제해결을 위해 관련 정보를 찾아보고 여러 번 오류를 검토하여 문제를 해결함. \n희망분야 프로그래며 \n36 \n2025학년도 대입 전형의 이해를 통해 대학 입시의 주요 구조인 수시전형과 정시전형 에 대한 전반적인 특징과 일정에 대한 이해를 함. 또한 우수 지원 사례들을 보면서 지 원자의 특성과 성공할 수 있었던 요인에 대해 이해를 하게 되었으며 자신만의 대입 전 략 수립의 필요성을 느낌. 정시전형의 분석을 통해 자신의 모의고사 성적과 교과목 학 습 방법과 습관을 분석해 보고 체계적인 학습 목표를 세워 학습할 것을 다짐함. 자신의 진로에 대해 끊임없이 생각하며 많은 상담을 함. 대학의 입시정보가 들어있는 책과 홈 페이지를 보며 관심 있는 학교별 입시전형과 등급 분포도를 살펴봄. 이를 통해 더 체계 적이고 실용적인 정보를 얻을 수 있었으며 자신의 입시 비전을 명확하게 함. 진학하고 자 하는 학교에 대한 목표를 세우고 목표 학교 및 학과 홈페이지를 방문하여 정보를 찾 는 적극성을 보임. 자신의 롤 모델 찾기 활동에서 소셜 미디어 창업자를 롤 모델로 선 정함. 성공에 안주하지 않고 위험을 감수하여 혁신적인 아이디어를 가져오는 모습을 보며 자신 또한 새로운 것에 도전하는 삶을 살고 싶다고 발표함. \n봉사활동실적 \n학년 \n일자 또는 기간 \n장소 또는 주관기관명 \n활동내용 \n시간 누계시간 \n2022.03.03. - 2022. 12. 26. \n(학교)고색고등학교 \n1 \n2022.03.11. \n(학교)고색고등학교 \n급식실 배식 지원 \n봉사활동 사전교육 \n5 \n5 \n1 \n6 \n2022.12.28. \n(학교)고색고등학교 \n교내환경정화활동 \n1 \n7 \n2023.03.10. \n(학교)고색고등학교 \n봉사활동 사전교육 \n1 \n1 \n2 \n2024.01. 04. \n(학교)고색고등학교 \n교내 환경 정화 활동 \n1 \n2 \n3 \n2024.03.13. \n(학교)고색고등학교 \n봉사활동 사전교육 \n1 \n1 \n고색고등학교 \n2025년 11월 20일 6/20 반 \n1 \n번호 \n6 \n이름 \n백민건 \ngov.kr \n정부24 \n문서확인번호: 1763-6399-9850-6483 (신청인 : 백민건) \n봉사활동실적 \n학년 \n일자 또는 기간 \n장소 또는 주관기관명 \n활동내용 \n시간 누계시간 \n3 \n2024.07.19. \n(학교)고색고등학교 \n교내 환경 정화 \n1 \n2 \n6. 교과학습발달상황 \n[1학년] \n원점수/과목평균 \n성취도 \n학기 \n교과 \n과목 \n단위수 \n석차등급 \n비고 \n(표준편차) \n(수강자수) \n국어 \n국어 \n4 \n85/70.5(15.6) \nB(262) \n3 \n수학 \n수학 \n4 \n80/67.0(15.3) \nB(262) \n3 \n영어 \n영어 \n4 \n96/68.2(17.0) \nA (262) \n2 \n한국사 \n한국사 \n3 \n94/74.5(14,9) \nA (262) \n3 \n사회(역사/도덕 \n통합사회 \n3 \n94/74.8(13.7) \nA (262) \n2 \n1 \n포함) \n과학 \n통합과학 \n3 85/70.4(18.1) \nB(262) \n4 \n과학 \n과학탐구실험 \n1 \n97/89.5(10.2) \nA(262) \n기술·가정/제2 외국어/한문/교 양 \n한문 I \n3 \n95/84.7(7,8) \nA(130) \n2 \n국어 \n국어 \n4 \n81/67.0(17.4) \nB(256) \n4 \n수학 \n수학 \n4 \n87/67.4(18.0) \nB(256) \n3 \n영어 \n영어 \n4 \n93/69.2(17.7) \nA(256) \n2 \n한국사 \n한국사 \n3 \n80/70.7(15.0) \nB(256) \n4 \n사회(역사/도덕 \n통합사회 \n3 \n88/71.5(17.1) \nB(256) \n3 \n2 \n포함) \n과학 \n통합과학 \n3 \n82/68.2(18.5) \nB(256) \n4 \n과학 \n과학탐구실험 \n1 \n95/90.3(8.8) \nA (256) \n기술·가정/제2 외국어/한문/교 \n양 \n정보 \n3 \n86/64.2(15.8) \nB(127) \n2 \n이수단위 합계 \n과목 \n50 \n세부능력 및 특기사항 \n국어: '장영실'을 주제로 미니 강연 활동에 참여함. 성량이 매우 좋으며 전달력을 높이기 위해 반언어 및 비언어적 표현 등을 \n고색고등학교 \n2025년 11월 20일 7/20 반 \n1 \n번호 6 이름 \n백민건 \ngov.kr \n정부24 \n문서확인번호: 1763-6399-9850-6483 (신청인 : 백민건) \n과목 \n세부능력 및 특기사항 \n적절히 활용하려고 노력하는 태도를 보임. 문제해결의 구조를 활용하고, 용어를 설명하는 등 청중의 이해를 돕기 위한 전략 을 활용함. 한 학기 한 권 읽기 활동에서 '문어 (김동식)'를 읽은 후 자신의 생각을 표현함. '아홉 켤레의 구두로 남은 사내(윤 흥길)'를 읽은 후 중심 내용을 정리하며, 문학 작품의 현실 반영에 대해 모둠원들과 의견을 공유함. 다양한 사례를 통해 맞춤 법규정 적용 원리에 대해 학습함. \n수학: 항상 유쾌함으로 수업 분위기를 주도하며 집중력이 강해 학습에 있어 높은 성과를 나타내는 학생임. 자신이 아는 문제 를 친구들에게 알려주며 함께 성장해 나가기를 도모하는 모범적인 면이 돋보임. 자발적인 발표로 월등한 발표횟수를 기록하 였으며 문제 해결과정 또한 논리적이고 분석적 이어서 높은 수학적 역량을 드러냄. 풀이과정에서 토론거리가 될만한 요소를 잘 찾아내어 그 논리에 대해 토론하는 과정을 통해 친구들과 함께 수학적 사고력을 향상함. 교과와 진로연계 발표에서 화학공 학에 사용되는 수학의 예를 들어 발표하며 실생활 문제를 수학적 방법으로 풀어내는 사고의 유연성을 보여줌. 발표 중 풀이과 정에 실수가 있었으나 당황하지 않고 차분히 다시 풀어내는 모습에서 수학적 의사소통 영역의 강점이 보임. \n영어: 영어 과목에 흥미가 높고 어휘와 구문 학습을 꾸준히 실천하며 매사에 적극적이고 지적 호기심이 높은 학생임. 조별 활 동에서 자신이 가진 능력을 다른 친구를 위해 쓸 줄 아는 모습을 보이며 필요한 것이 있거나 질문 사항이 있으면 묻고 해결해 가는 과정에서 능동적인 상황 대처 능력을 보임. 과학자의 꿈을 가지고 있는 학생으로, 발명 아이디어 제안하기 활동에서' 내비게이션 자전거'라는 실용적이고 현실적인 아이템을 제안하여 조원들로부터 번뜩이는 생각이라는 칭찬을 받음. 휴대전화 로 내비게이션을 켜며 자전거를 타서 불편했던 자기 경험을 바탕으로 청중들의 공감을 자아내어 이목을 끎. 자전거의 핸들 가 운데에 내비게이션이 장착되어 페달을 밟아 나오는 운동에너지로 작동하는 원리를 밝히며 적절한 연결어를 사용하여 글의 전 개가 응집성이 높은 설명문을 완성하여 발표한 점이 주목할 만함. 독서 서평 활동에서는 '허생전'을 골라 한 사람에 의해 조선 의 경제가 좌지우지되는 상황을 풍자하는 글의 핵심을 잘 짚어내고 내용을 간략히 요약하는 과정에서 적절한 어휘로 잘 번역 함. 발표 시간에 자신감 있는 모습으로 여유롭게 친구들의 눈을 맞추며 자기 생각을 적극적으로 전달하는 모습을 보임. \n한국사: 교사의 질문에 적극적으로 대답하고 수업 분위기를 밝게 만드는 학생임. 문화재 홍보물 제작하기 활동에서 거중기에 관하여 조사한 다양한 자료가 적재적소에 사용되어 도르래의 원리를 활용한 조선 시대 과학 기술의 발전을 보여준다는 내용 으로 문화재의 우수성이 잘 나타나도록 리플릿을 내용 전달이 효과적이고 미적 완성도가 높게 제작함. 역사 속 진로 탐구 활 동에서 조선 시대와 현재의 과학자라는 직업에 대하여 주요 활동, 취업 방법, 필요한 역량 등을 조사하여 비교한 내용을 활동 지에 정리함. 인터뷰 형식으로 과거와 현재 과학자를 만나서 직업에 대한 설명을 해주는 인공지능 웹툰을 만듦. 역사 신문 제 작하기 활동에서 '조선인의 삶을 바꾼 개혁'이라는 제목으로 을미사변을 계기로 추진된 을미개혁이 조선의 사회체제를 일본 과 동일하게 만들려는 의도가 있었다는 기사를 작성함. 광고 홍보물 지면을 구성하여 인물 사진을 첨부하고 명성황후의 죽음 에 대한 정보를 전달함. 역사 인물 평전 쓰기 활동에서 안창호에 주목하여 프로필과 그가 주로 활동했던 시대 상황을 살펴보 며 신민회에 참여하여 대성학교 설립, 한국독립당 창당 등 인물의 업적을 긍정적으로 평가한다는 생각을 표현함. \n통합사회: 진로 여행지 홍보하기 활동에서 '과학이 살아 숨 쉬는 런던 박물관'을 주제로 박물관에서 할 수 있는 진로 체험 활 동을 소개하는 여행 팸플릿을 프레젠테이션으로 제작함. 인권 캠페인 활동에서 장애인 특수학급에 대한 차별 사건의 원인, 전개 과정, 결과 및 영향을 분석, 정리하여 스토리텔링 형식의 카드뉴스로 제작하였으며 이를 웹툰으로 재구성하는 등 창의 성을 보임. 개인적 차원의 해결 방안으로 장애인 인권 개선 서명 운동에 참여하기, 사회적 차원의 해결 방안으로 평등권을 보 장하는 법 정비하기를 제시함. 청소년 노동 인권 홍보물 제작 활동에서 청소년 연소자 표준 근로 계약서를 작성하는 활동을 한 후 청소년 급여 규정을 알려주는 웹툰을 제작함. 지속가능발전목표 캠페인 활동에서 깨끗한 에너지 부문의 목표 달성을 위 해 탄소 배출과 신재생에너지 문제를 다룬 뉴스 기사를 분석하여 해결 방안을 모색함. 미래에서 과거로 온 사람이 에너지 문 제를 해결한다는 내용의 웹툰 공익광고 스토리보드를 제작함. \n통합과학: 예복습을 철저히 하며, 수업할 때 자신이 아는 부분을 큰소리로 얘기하여 수업 진행이 부드럽게 이어질 수 있도록 \n고색고등학교 \n2025년 11월 20일 8/20 반 \n1 \n번호 6 이름 \n백민건 \ngov.kr \n정부24 \n과목 \n문서확인번호: 1763-6399-9850-6483 (신청인 : 백민건) \n세부능력 및 특기사항 \n함. 과학 인포그래픽 그리기 활동에서 물체의 속도와 질량에 따라서 운동량이 달라지는 것을 인포그래픽으로 표현함. 인공지 능을 활용한 생활 속 플라스틱 줄이기 방안 프로젝트 활동에서 인공지능이 배출된 쓰레기들을 알아서 분류해주는 시스템을 제안함. 지구의 고체 물질과 생명체를 구성하는 원소가 어떻게 형성되었는지 별의 진화 과정과 연관지어 설명할 수 있음. 세 상에 존재하는 물질이 원소로 이루어져 있음을 이해하고, 금속 원소와 비금속 원소로 나누어 설명할 수 있음. 지구 시스템에 서 다양한 자연 현상을 일으키는 에너지원이 무엇인지 설명할 수 있음. 세포에서는 생명 현상을 유지하기 위해 세포막을 경계 로 물질 출입이 일어남을 설명할 수 있음. 지구와 생명의 역사에 큰 변화를 가져온 광합성, 화석 연료의 연소, 철의 제련 반응 에서 공통점을 찾을 수 있음. 변이와 자연 선택에 의한 진화의 원리를 설명할 수 있음. 열효율을 높이는 것이 사회, 경제적으 로 어떤 의미가 있는지 이해하게 됨. 간이 발전기의 작동 원리를 전자기 유도 현상을 이용해 설명할 수 있음. \n과학탐구실험: 수업 태도가 바르며 실험에 대한 이해도가 높아 실험을 주도함. 실험안전수칙 인포그래픽 그리기 활동에서 학 생들이 지켜야할 안전수칙을 만화 형태의 인포그래픽으로 제작함. 생활 제품 속 과학 원리 찾기 활동에서 보온병의 과학적 원 리를 조사하고 제품 기능에 대한 개선 방안을 제시함. 소화 효소가 사람 몸에서 어떤 작용을 하는지 설명할 수 있음. 음식물 에 들어 있는 단백질을 검출하는 방법에 대해 설명할 수 있음. 소화제의 효과를 알아보는 실험에서 실험 결과를 통해 어떤 소 화제에 탄수화물 분해 효소와 단백질 분해 효소가 각각 들어 있는지 설명할 수 있음. 정전식 터치펜이 작동하는 과학 원리를 설명할 수 있음. 우리 몸에서 미세 먼지에 의해 가장 큰 피해를 입는 기관과 그 피해 양상을 설명할 수 있음. 학교에서 활동할 때 미세 먼지 예보 등급에 따른 나만의 행동 요령을 만듦. 미세 먼지로 인한 각종 질병을 줄일 수 있는 방안을 조사하여 발표 함. 태양 전지판에 내리쬐는 빛의 세기와 태양 전지판이 만들어 내는 전류가 어떤 관계가 있는지 설명할 수 있음. \n정보: 알고리즘 설계 수행평가에서 주어진 문제의 분해 및 핵심요소를 몇 가지 찾아 순서도의 표기법을 부분적으로 지켜 작 성하였음. 문제를 분석하고 종합하는 과정에서 최선을 다하는 모습이 인상 깊음. 텍스트 기반 프로그래밍 실습 과정에서 적 극적인 태도와 논리적인 사고력이 돋보인 학생임. 선택 구조, 반복 구조, 입출력 명령어, 중첩 제어 구조를 이해하며 약수 출 력, 소수 판단, 윤년 판단, 구구단 출력 등 기본적인 문제를 해결함에 부족함이 없는 학생임. 자신의 학습이 끝난 후 어려움을 겪고 있는 친구들의 눈높이에 맞추어 자신의 지식을 공유하는 모습을 자주 보임. 피지컬 컴퓨팅 시스템 개발 과정에서 하드 웨어와 소프트웨어의 유기적인 동작 원리에 대하여 정확히 이해하였으며 초음파센서, 서보모터, LED를 사용하여 거리에 따 라 다양한 색상의 LED와 서보모터를 제어하여 주차장 차단기 시스템을 완벽히 구현함. \n한문 I: 자호 짓기 활동에서 '정성 성'과 '더울 열'을 활용하여 '성열'이라는 자신의 호를 지음. 성실하고 열정적인 사람이 되 겠다는 마음으로 이와 같이 호를 지었다고 설명함. 자기소개서 쓰기 활동을 통해 자신의 성장과정과 진로희망에 대하여 기술 하고 진로희망을 달성하기 위해 '백절불굴'의 자세로 노력하겠다는 내용을 작성함. 상형, 지사, 회의, 형성 등 한자가 만들어 진 원리에 대해 정확하게 이해하고 있으며 학습한 한자를 부수 단위로 구분할 수 있음. 한자 카드를 이용한 활동을 통해 한자 의 부수와 그 변형된 형태를 분명하게 구별하는 모습을 확인함. 문장의 구조에 대한 이해가 분명하며 주어진 한자를 활용하여 \n문법에 맞게 한문 문장을 지을 수 있음. 한시의 형식에 대해 이해하고 한자 대신 한글을 활용하여 한시의 형식에 맞추어 시 를 지을 수 있음. 한문 문장을 해석순서에 맞추어 바르게 풀이하는 모습을 관찰함. 한시에 사용된 시어를 바탕으로 한시의 시 간적 배경을 추론함. 한시를 풀이하며 그 맥락에 따라 시어가 상징하는 바를 정확하게 유추해 냄. 한시가 쓰인 시기, 작가 등 배경 지식과 한시의 내용을 통해 시에 등장하는 인물들의 상관관계를 유추함. \n수업량 유연화에 따른 학교 자율적 교육 활동으로 '뮤지컬 영화를 통해서 세상 들여다보기' 융합 프로젝트를 진행하며 '토끼 와 거북이'를 뮤지컬로 개작하여 영어로 공연함. 거북이 역할을 맡아 연기하였으며 '산토끼' 동요를 개사하여 영어로 노래하 는 참신함을 보임. 협동적인 자세로 임하며 무대에서 정확한 발음과 자신감 있는 발표 태도, 감정의 전달이 우수한 연기를 수 행함. 뮤지컬 '지킬 앤 하이드' 중 지킬 박사의 이중인격을 분석함. 선한 인격의 지킬 박사와 악한 인격의 하이드를 분리하여 캐리커처로 표현함. 영화 '헤어 스프레이'를 보고 토론하는 활동에서 영상에 등장한 인종 차별 외에 우리 사회에 있는 또 다른 차별로 장애인 차별을 꼽으며 방관하는 것이 아니라 차별 하는 사람들에게 일침을 가할 수 있는 자세를 갖춰야 한다는 주장 \n고색고등학교 \n2025년 11월 20일 9/20 반 \n1 \n번호 6 이름 \n백민건 \n(KOR \ngov.kr \n정부24 \n문서확인번호: 1763-6399-9850-6483 (신청인 : 백민건) \n과목 \n세부능력 및 특기사항 \n을 논리적으로 펼침. \n<진로 선택 과목> \n성취도 \n성취도별 \n학기 \n교과 \n과목 \n단위수원점수/과목평균 \n비고 \n(수강자수) \n분포비율 \n이수단위 합계 \n과목 \n해당 사항 없음 \n<체육·예술> \n세부능력 및 특기사항 \n학기 \n교과 \n과목 \n단위수 \n성취도 \n비고 \n체육 \n체육 \n2 \nA \n1 \n예술 \n체육 \n미술 \n체육 \n3 \nB \n2 \n2 \n예술 \n음악 \n3 \nA A \n이수단위 합계 \n10 \n과목 \n세부능력 및 특기사항 \n체육 : 배구 경기 활동에서 경기력이 우수한 것은 아니지만 신체활동 가치의 중요성을 인식하고 노력하는 모습을 보임. 줄넘 기 1회선 2도약에서 탁월한 점프 능력과 안정감 있는 리듬감으로 우수한 수행을 보여줌으로써 학급 동료들에게 관찰학습이 이루어지도록 하여 학습활동에 도움을 줌. 플로어볼 경기에서 센터 포지션을 맡아 상대 슛을 차단하는 역할을 담당함. 또한 팀원이 패스하는 공을 잡는 기술인 캐치 동작이 정확하여 부드럽게 다음 동작을 연결하여 슛하는 능력이 우수함. 수비수를 속 이기 위해 자기편을 보지 않고 다른 방향을 보면서 패스하는 능력이 우수함. 평소 신체 움직임으로 표현하는 것에 관심을 두 고 신체를 다양한 모양과 움직임으로 표현하는 활동에 적극적인 모습을 보임. 이에 신체 관절뿐만 아니라 근육의 유연성이 탁 월하여 앉아 윗몸 앞으로 굽히기에서도 우수한 수행력을 보임. \n음악: 칼림바의 구조와 명칭, 발현 원리를 이해하며 악기를 조율할 수 있음. 칼림바 연주에서 '사랑을 했다' 악곡을 바른 자세 와 주법, 정확한 리듬과 음정으로 연주하는 능력이 뛰어남. 조원들과 협력하여 베토벤의 '그대를 사랑해' 악곡을 리듬을 살려 부를 수 있으며 독일 가곡의 특징과 악곡 특징을 설명할 수 있음. 작품의 배경지식에 대한 이해도가 높으며, 음악의 음색과 빠르기 변화를 비교하며 음악을 감상하는 능력이 뛰어남. 나만의 플레이리스트 발표 시간에 평소 즐겨 듣는 애니메이션 배경 음악을 선정하여 악곡의 특징을 설명하며 친구들을 즐겁게 함. \n미술: 자화상 표현에서는 하루 종일 공부만 하여 얼굴을 가린 책이 인상적임. 양쪽에 타인의 두 손을 그려 넣어 강제로 책을 보는 그림을 표현함. 해와 달은 밤낮없이 매일 공부를 한다는 의미이고, 새와 로켓은 새처럼 훨훨 날아 자유롭게 살고 싶다는 의미와 로켓을 타고 우주를 가고 싶다는 의미를 담았다고 설명함. 배경이 초록색이고 옷이 흰색이지만 약간 더러워진 이유에 대해 초록색 잔디밭에서 뛰어놀고 싶다는 의미와 새하얀 자신의 순수함을 나타낸 것이라고 밝힘. 전시 리플릿 만들기 활동에 \n고색고등학교 \n2025년 11월 20일 10/20 반 \n1 \n번호 6 이름 \n백민건 \n(KOR), \ngov.kr \n정부24 \n과목 \n문서확인번호: 1763-6399-9850-6483 (신청인 : 백민건) \n세 부 능력 및 특기사항 \n서는 '프리다 칼로의 고통'을 주제로 부러진 기둥, 상처 입은 사슴의 그림을 드로잉으로 표현하여 작가에 대한 존경을 표현 함. 컷아웃 애니메이션 만들기 활동에서는 '졸음운전'을 주제로 하여 매체의 특성을 파악하고 눈이 감기는 모습을 효과적으로 표현하였으며 움직임이 자연스럽고, 전달하고자 하는 메시지가 분명하게 표현됨. 학습활동에 적극적이고 흥미를 가지고 수 업에 임함. 미술비평에서는 레오나르도 다빈치의 '모나리자'에 대해 조사를 하였으며 형식주의 비평 방법에 대한 높은 이해를 \n바탕으로 논리적인 글을 작성하여 자신의 생각을 뚜렷하게 보여줌. \n[2학년] \n원점수/과목평균 \n성취도 \n학기 \n교과 \n과목 \n단위수 \n석차등급 \n비고 \n(표준편차) \n(수강자수) \n국어 \n문학 \n4 \n92/69.7(18.6) \nA (251) \n3 \n수학 \n수학 I \n4 \n83/62.5(16.8) \nB(251) \n3 \n수학 \n확률과 통계 \n2 \n77/68.9(14.5) \nC(251) \n4 \n영어 \n영어 I \n4 \n94/62.3(19.9) \nA(251) \n2 \n과학 \n물리학 I \n3 \n71/61,5(19.6) \nC(116) \n4 \n1 \n과학 \n화학 I \n3 \n78/68.5(16.0) \nC(132) \n4 \n과학 \n생명과학I \n3 \n65/65.0(17.2) \nD(97) \n5 \n기술.가정/제2 외국어/한문/교 양 \n중국어 I \n3 \n81/73.3(14.9) \nB(125) \n4 \n국어 \n독서 \n4 \n93/65.6(21,3) \nA(248) \n2 \n수학 \n수학II \n4 \n82/63.3(19.1) \nB(248) \n수학 \n확률과 통계 \n2 \n84/64.7(18.1) \nB(248) \nwo co \n3 \n3 \n영어 \n영어 II \n4 \n93/59.7(21.6) \nA(248) \n2 \n과학 \n물리학 I \n3 \n80/62.8(20.4) \nB(115) \n4 \n2 \n과학 \n화학 I \n3 \n86/64,5(21.7) \nB(131) \n3 \n과학 \n생명과학 I \n3 \n71/58.9(18.5) \nC(96) \n4 \n기술.가정/제2 \n외국어/한문/교 중국어 I 양 \n3 \n69/62.4(18.3) \nD(125) \n4 \n이수단위 합계 \n과목 \n52 \n세부능력 및 특기사항 \n독서: 수업 태도가 좋은 학생으로 독서를 즐겨하며 늘 성실하게 수업에 경청함. '인간의 운명도 말과 같을까' 지문 학습 후 수 행평가에서 상반된 관점을 포함한 요약하기 활동을 통일성 있게 작성하였으며, 인간의 운명은 말과 다를 것이라는 주장을 제 \n고색고등학교 \n2025년 11월 20일 11/20 반 \n1 \n번호 6 이름 \n백민건 \n이 \ngov.kr \n정부24 \n과목 \n문서확인번호: 1763-6399-9850-6483 (신청인 : 백민건) \n세부능력 및 특기사항 \n시했으며 인공지능은 인간능력을 대체할 수 없고, 정서 지능 등의 인간의 능력이 필요한 일자리는 인공 지능에 의해 대체될 수 없을 것이라는 근거를 제시하여 한 편의 글로 완성함. '나홀로 문화' 학습 후 비판적 읽기 활동에서 남의 눈치를 보지 않고 간섭받지 않는 점에서 나홀로 문화에 대해 긍정적이라 서술함. '육지의 배설물은 바다에 쌓인다'에서 쓰레기 문제에 대한 창 의적 해결방안으로 국가적, 국제적 측면에서의 쓰레기 무단투기 금지를 주장함. '생태계의 다양성, 그리고 공존'에서 다윈의 진화론에 대해 공존으로 인해 생태계의 다양성이 유지되므로 공존은 꼭 필요한 가치라고 평가함. '로봇에도 인권이 있을까' 학습 후 미래사회에서는 로봇을 완전히 통제할 수 없고 역할의 확대로 인해 로봇에게도 권리가 있어야 한다고 서술함. \n문학: 교사의 질문에 열심히 손을 드는 학생으로 수업에 적극적으로 참여함. '호질'을 읽고 사회적 문제에 대해 발표하기 활 동에서 동물학대에 대해 발표했는데, 동물 학대를 해 본 적 있냐는 질문을 통해 청중의 반응을 유도하고, '호질'에서 '하늘이 명한 바로 본다면 인간과 범은 같은 존재이다'라는 부분을 통해 생명 존중에 대해 이야기하고, 동음이의어에 의한 언어유희적 표현을 사용하여 동물 학대를 하지말자는 주장을 펼침. 자율과제로 제시한 1학기 때 배운 작품과 관련된 문학작품 소개하기 활동에서 윤동주의 '자화상'을 선정하여 시인의 생애 설명과 시 내용의 해석을 하였으며 자아 성찰이라는 측면에서 이전에 배 웠던 '쉽게 씌어진 시'와 유사하다는 것을 발표함. \n수학I: 지수에 미지수를 포함하는 방정식과 부등식 관련 문제를 칠판에 적고 풀이과정을 급우들에게 설명함. 쉽다고 생각되 는 문제라도 하나하나 풀면서 난이도를 높여 나가야 된다는 것을 앎. 삼각함수의 부등식 문제를 풀이하고 급우들에게 설명 함. 그래프를 그려 문제를 설명하고 부등식의 조건을 만족하는 범위를 구하는데 어려움을 겪었지만 반복하여 풀이하고 발표 를 통하여 더 기억에 남는 문제였음을 소감으로 작성함. 주제탐구 활동에서 '상용로그를 활용한 수소이온농도 구하기'를 주제 로 보고서를 작성하고 ppt를 제작함. 화학 관련 분야에 관심을 갖고 있으며 상용로그를 학습한 후 수소이온농도를 구하는데 상용로그를 사용함을 알고 탐구 주제를 선정하였다는 이유를 밝힘. 수용액의 산성, 알카리성을 나타내는 척도인 수소이온농 도를 측정하는데 상용로그가 사용되고 있음을 설명함. 수소이온농도에 따라 산성과 염기성을 구분할 수 있음을 안내함. 탐구 활동을 통해 상용로그를 활용하여 실생활과 연관지을 수 있음을 알게 되었다는 자신의 생각을 정리하여 표현함. \n수학 II: 두 곡선으로 둘러싸인 도형의 넓이를 구하는 문제를 칠판 앞으로 나와 풀이하고 친구들에게 풀이과정을 설명함. 정 적분을 활용하는문제로 친구들에게 설명한 후, 개념 이해를 더욱 확실하게 할 수 있는 기회가 되었다는 소감을 밝힘. 미분계 수의 정의를 학습한 후 '영화 컴퓨터그래픽에 활용되는 미분방정식'을 주제로 보고서를 작성하고 ppt를 제작함. 평소 즐겨보 는 영화가 미분과 관련이 있고, 활용되고 있음을 알게 되어 주제를 선정하였다는 소감을 밝힘. 미분방정식의 활용으로 유체 의 흐름을 나타낼 수 있는 '나비에-스토크스 방정식'은 영화 컴퓨터그래픽에 사용되고 있음을 안내함. 세계 7대 수학 난제로 방정식의 해는 찾지 못했지만 근삿값을 사용하여 영화 컴퓨터그래픽을 제작함을 알게 됨. 탐구활동을 통해 영화를 볼 때 파도 나 불의 움직임이 당연하다고 생각하였는데 이를 표현하는 것이 어려운 작업이고 '나비에-스토크스 방정식'이 사용된다는 것 을 알게 되었다는 소감을 밝힘. \n확률과 통계: 생활 속 확률과 통계 주제 탐구 수행평가로 화학에서 사용되는 오비탈 및 전자 구름과 확률의 연관성, 통계 기 반 머신러닝에 대해 조사하고 그 내용을 소개함. 특히, 머신러닝의 학습법 및 기저함수에서 사용하는 확률변수에 대해 자세 히 소개함. 웹툰 그리기 및 주제탐구 수행평가에서 자료 조사를 막힘없이 해내었으며 조사한 자료를 신중하게 읽고 필요한 부 분을 선택하여 수평평가를 훌륭하게 이행함. \n영어 I: 인류를 위한 지속 가능 발전 홍보 자료 프로젝트 영어로 제작하기에서 생명의 빨대라는 주제로 글을 작성하여 비교 적 저렴한 비용으로 깨끗한 물을 마실 수 있는 정수 빨대의 사용을 강조하고 기회가 되면 인류에게 유익한 발명품을 제작하겠 다는 다짐을 함. 세계 문화 유산 조사 및 발표하기에서 프랑스 파리 에펠탑에 관한 많은 사람들에게 알려지지 않은 과학적 사 실을 화면과 사진을 제시하며 친구들에게 발표함. \n고색고등학교 \n2025년 11월 20일 12/20 반 \n1 \n번호 \nCO \n6 \n이름 \n백민건 \n(KOR \ngov.kr \n정부24 \n문서확인번호: 1763-6399-9850-6483 (신청인 : 백민건) \n과목 \n세부능력 및 특기사항 \n영어II: 수업에 적극적으로 참여하고 주어진 과제를 제 시간에 완수함. 교사의 질문에 대답을 잘하고 요청이 있는 경우에는 솔선하여 발표하는 자발적인 면을 보임. 영어로 자신을 소개하는 시를 쓰는 활동에서 자신의 특성을 \"Honest, Kind and B rave\"로 묘사함. 가장 닮고 싶은 롤 모델을 소개하는 글쓰기 활동에서 스티브잡스를 선택하고 그를 존경하는 이유를 \"There are two reasons why he is my role model. One is that he created innovative product like i-phone, i-pa d. The other is he has spirit of challenge without being afraid of failure\"이라고 진술하며 자신도 아이폰과 같 은 멋진 제품을 개발하여 세상을 바꾸고 새로운 분야의 개척자가 되겠다는 꿈을 밝힘. 인공지능 관련 기사 \"Kinetic Consul ting launches Marky AI-the first AI business consulting platform for any business. \"를 읽고 주요 단어를 정 리하고 요약하여 발표수업을 수행함. \n물리학 I: 자동차에서 활용되는 물리 현상을 주제로 탐구함. 자동차 에어백과 안전벨트의 원리를 운동량-충격량 관계와 뉴 턴 법칙을 적용하여 설명함. 열역학 제1법칙을 이해하고, 이를 이용하여 열역학 과정에서 내부 에너지의 변화량을 외부와 주 고 받은 열과 일을 통해 구함. 모둠원과 협력하여 디젤 엔진의 작동 원리와 열효율, 사용 사례를 조사하여 발표함. 고체의 에 너지띠 이론으로 도체, 반도체, 절연체 등의 차이를 구분하여 설명함. 종류가 다른 원소를 이용하여 반도체 소자를 만들 수 있음을 pn 접합 다이오드를 이용하여 설명하고 다이오드가 한 쪽 방향으로만 전류를 흘리는 성질이 있음을 설명함. 전류에 \n의해 자기장이 발생하는 것을 관찰하여 자기장의 크기와 방향에 영향을 주는 요인을 찾고 전류에 의한 자기 작용이 일상생활 에서 적용되는 다양한 예를 찾아 그 원리를 설명함. 용수철을 이용한 역학적 에너지 시범실험을 도와 수업이 원활히 진행되도 록 도움. 전자기 유도 현상의 예시로 마이크에 대해 조사함. 실험을 통해 여러 가지 전반사 현상을 관찰하여 전반사 조건을 찾을 수 있음. 파동의 간섭 현상의 예시로 노이즈 캔슬링에 대해 조사함. \n화학I: 차분히 수업에 참여함. 화학의 유용성에 대한 논술형 수행평가에서 화학이 식량 문제, 의류 문제, 주거 문제 해결에 기여한 사례에 대해 기록하고, 화학의 발전 방향에 대한 자신의 생각을 논술함. 아보가드로 수와 몰의 의미를 설명할 수 있 고, NaCl 0.5몰의 질량을 측정하고, 비닐 봉지를 이용하여 기체의 부피가 몇 몰인지 알아냄. 용액의 농도를 몰 농도로 표현 할 수 있고, 모둠 활동으로 0. 1M NaCl 1L를 정확히 제조함. 또한 모둠원을 잘 이끌며 실험을 진행함. 배타 원리, 훈트 규칙, 쌓음 원리를 설명하고, 이에 따라 오비탈에 원자 및 이온의 바닥 상태 전자 배치를 바르게 나타냄. 또한 모둠원에게 각각의 내용을 설명해 줌. 이온 결합의 형성 과정을 KF을 예로 들어 설명함. 또한 공유 결합, 금속 결합의 특징에 대해서도 설명함. 전자쌍 반발 원리를 설명하고, 대표적인 5가지 분자 구조의 예를 바르게 제시함. 중화 적정 실험을 설계하고, 모둠원과 함께 미지의 식초 농도를 계산함. 또한 중화점을 찾는 3가지 방법을 설명함. CaO의 용해열 실험을 수행하여 CaO의 용해열을 계 산함. 또한 간이 열량계를 사용하므로 가정해야 하는 것에 대해서 발표를 함. \n생명과학I: 조용하게 수업을 경청하고 주어진 활동에 성실히 임함. 활동지 작성 시간을 통해 수업에서 배운 내용을 바탕으 로 탐구 과제를 스스로 검토하고 자신의 생각을 정리하여 제출함. 친구들과 토론하고 협동하는 학습을 즐김. 밝고 예의 바른 태도로 수업에 참여하며 학급의 수업 분위기를 좋게 유지하는데 많은 도움을 줌. 발표 수업을 통해 '생물의 특성'이라는 주제 를 선정하여 학생들에게 소개함. 생물이 무생물과 구분되는 영역을 6개로 나누고 각각의 개념과 역할을 그림 자료와 함께 자 세히 설명함. 특히 수업 시간에 배운 내용과 자신이 첨부한 내용을 학생들에게 질문하며 학생들 스스로가 현재의 이해 정도를 확인할 수 있도록 하는 모습을 보임. 또한 '군집 내 상호작용'에 대한 발표를 통해 생태계에서 군집의 개념과 역할을 설명하 고 개체군 사이에 일어나는 행동 양식에 대해 소개함. 특히 공생의 관계에 있는 다양한 생물의 예시를 그림으로 설명하고 흥 미로운 동영상 자료를 학생들에게 제공하여 학생들이 흥미를 가지고 수업에 참여할 수 있도록 유도하는 성실성을 보임. \n중국어 I: 수업시간에 중국의 시각표현, 하루일과 표현과 관련된 단어를 찾아 꼼꼼하게 학습지를 작성함, 취미, 능력표현과 관련된 한자 단어의 한어병음을 정확히 기입하였으며 진행, 경험을 나타내는 단어의 한자와 한어병음을 오류 없이 모두 완성 하여 제출함. 쓰기 활동을 통하여 다소 어렵게 느껴질 수 있는 중국어 쓰기 능력을 향상시킴. 중국의 색상문화에 대해 학습하 며 중국인이 선호하는 색상과 선호하지 않는 색상에 대해 알게 됨. 한국과 비슷한 듯 다른 중국 문화를 접하며 타 문화를 존 \n고색고등학교 \n2025년 11월 20일 13/20 반 \n1 \n번호 6 이름 \n백민건 \ngov.kr \n(KOR \n정부24 \n과목 \n문서확인번호: 1763-6399-9850-6483 (신청인 : 백민건) \n세부능력 및 특기사항 \n중하는 태도를 향상시킴. 기회가 된다면 중국인과 원활한 교류를 위하여 색상문화에 대한 이해를 적용해 보겠다고 다짐함. 밝고 활달한 성격으로 매 수업시간 큰소리로 발음 하며 학습의 분위기를 활동적으로 만드는데 기여를 함. 가끔 학우들이 생각 지 못하는 생각을 자율적으로 발표하며 창의성을 나타냄. 이러한 외국어 학습능력은 나날이 발전할 수 있는 기틀을 마련해 줄 \n것이며 어휘를 빠르게 습득하는 능력이 있어 좀 더 집중력 있는 학습을 한다면 많은 향상이 있을 것으로 기대됨. \n학교 자율과정 기간 중 실시한 지역 연계 융합 수업 A(2023.12.26.-2023.12.27.) 중 '인공지능 메이커 융합' 프로그램에 서 자율과정 A 프로그램에서 사물인터넷을 활용한 스마트시티에 대하여 만들었으며 그것을 활용하여 2개의 도시를 구상하여 큐브 형태로 만들어 증강현실 멀지큐브로 체험할 수 있는 3D 가상현실 콘텐츠를 제작함. 코딩으로 오브젝트의 미세한 움직 임을 구현할 수 있음. 수업 B에서 지역 문화유산 현황을 담은 정형 데이터를 수집하여 위도, 경도 속성을 이용해 지도 위에 직접 산점도로 시각화함. 지역의 지리적 요소에 따른 문화유산 분포와의 연관성을 분석하고 다른 형태의 분석 결과들을 조사 및 공유하는 활동을 진행해 데이터 분석이 실생활에 활용되는 과정을 체험함. 수업 C에서 미래의 첨단기술과 관련하여 여러 도시에 적용된 사물인터넷(IoT) 기술의 사례를 조사하여 PPT로 발표함. 두 도시는 다양한 스마트시티 기술을 도입하고 있는 도시로 스마트 가로등, 스마트 파킹, 스마트 쓰레기통 등을 활용한 스마트시티 인프라를 구축하고 있다고 설명함. 이 과정에 서 사물인터넷 기술의 지속적인 발전과 함께 그만큼의 보안 이슈도 존재하기에 이에 대한 철저한 대비가 필요하다는 소감을 작성함. \n<진로 선택 과목> \n성취도 \n학기 \n교과 \n과목 \n단위수원점수/과목평균 \n(수강자수) \n성취도별 \n분포비율 \n1 \n예술 \n음악 연주 \n2 \n94/86.4 \nA(200) \nA(75.0) B(19.5) C(5.5) \n2 \n예술 \n음악 연주 \n2 \n88/78.9 \nA(198) \nA(59.6) B(28.3) C(12.1) \n이수단위 합계 \n과목 \n세부능력 및 특기사항 \n비고 \n음악 연주: 드럼의 악기의 구조와 명칭을 구분할 수 있고 악기별 소리의 특징을 이해하고 연주할 수 있음. 스네어의 8비트 스 트로크와 플로어탐의 16비트 스트로크를 경쾌하고 빠르게 표현함. 인공지능 융합수업에서 작곡과 편곡 플랫폼을 이용하여 다양한 비트를 사용하여 리듬과 박자의 개념을 이해할 수 있었으며, 자신의 생각과 느낌을 음악으로 표현할 수 있게 됨. 인공 지능 플랫폼의 모션인식을 활용하여 지휘법을 연습함. 이를 통해 오케스트라의 악기 구성과 소리의 특징을 이해하고 셈여림 과 빠르기 등 음악적인 역량이 향상됨. 통기타 수업에서 박자와 오른손 스트로크 리듬을 맞추는게 조금 어려웠으나 꾸준한 연 습으로 이를 극복하여 연주를 완성하게 되어 뿌듯했다는 소감을 발표함. 메타버스 플랫폼으로 자신이 표현하고자 하는 가상 의 공간을 구축하고 이를 표현하는 음악을 인공지능 작곡 플랫폼으로 창작하여 감상 공간을 완성함. 친구들과 자신의 창작물 을 공유하고 감상하는 활동을 통해 음악적 창의성과 융합역량을 신장할 수 있었다고 1학기 교과별 프로젝트 발표회에서 소감 을 발표함. \n<체육·예술> \n학기 \n교과 \n과목 \n단위수 \n성취도 \n비고 \n1 \n체육 \n운동과 건강 \n2 \nA \n2 \n체육 \n운동과 건강 \n2 \nA \n고색고등학교 \n2025년 11월 20일 14/20 \n반 \n1 \n번호 \n6 \n이름 \n백민건 \n(KOR \ngov.kr \n정부24 \n문서확인번호: 1763-6399-9850-6483 (신청인 : 백민건) \n이수단위 합계 \n4 \n과목 \n세부능력 및 특기사항 \n운동과 건강: 신체 활동에 대한 흥미가 높아 체육 수업에 적극적으로 참여하는 성실함을 보였으며, 다양한 서브 연습에 열심 히 참여하여 백핸드 스트로크와 포핸드 스트로크를 이용한 서브를 구사할 수 있음. 빈 공간을 빠르게 파악하고 정확한 스트로 크를 이용하여 공격함으로써 경기를 자신에게 유리하게 이끌어 나가는 능력을 보임. 체력 운동으로 실시한 1도약 2회선 줄 넘기 활동과 1 도약 2회선 줄넘기 활동에 참여함. 공에 대한 높은 집중력을 바탕으로 골대 좌우를 번갈아가며 슛을 던지는 활동인 골밑 슛 활동에서 높은 성공률을 보임. \n[3학년] \n원점수/과목평균 \n성취도 \n학기 \n교과 \n과목 \n단위수 \n석차등급 \n비고 \n(표준편차) \n(수강자수) \n국어 \n화법과 작문 \n3 \n85/67.5(19.1) \nB(227) \n4 \n1 \n수학 \n미적분 \n3 \n83/70.1(16.1) \nB(132) \n4 \n영어 \n영어 독해와 작문 \n4 \n89/59.7(19.6) \nB(227) \n2 \n국어 \n화법과 작문 \n3 \n91/62.4(22.3) \nA(227) \n3 \n2 \n수학 \n미적분 \n3 \n75/55.5(21.1) \nC(132) \n3 \n이수단위 합계 \n16 \n과목 \n세부능력 및 특기사항 \n화법과 작문: 다양한 글의 목적을 해석한 후 이에 적절한 어조로 지문을 읽어 수업을 다채롭게 만듦. 자신의 진로 희망인 프 로그래머와 관련하여 자율주행자동차의 안전한 운행을 위해 도로교통법 개정을 건의하는 글을 작성함. 새로운 기술 도입에 따라 기존 법에 어떤 모순이 생기는지 구체적이고 논리정연하게 지적하였으며 실현가능성이 높은 대안을 제시함. 도로교통법 은 운전자가 사람인 것을 전제로 한 법률이므로 자율주행자동차로 주행할 경우 도로교통법 제151조, 제43조, 제49조 제1항 제6호에 모순이 발생한다는 문제점을 지적함. 이를 해결하기 위해 사고 원인에 따라 차량 제조사, 소프트웨어 제조사, 사람 등이 책임을 지게 하고, 운전면허 결격 사유에서 노약자·장애인 . 18세 미만의 사람 삭제, 제49조 제1항 제6호 삭제를 건의 함. 이러한 건의문의 내용을 친구들 앞에서 발표함. 긴장했음에도 당당하고 또박또박하게 말하여 전달력이 높았으며, 친구들 이 가장 집중하고 흥미로워하는 발표였음. 최근 사회 문제 중 게임 저작권 위반에 관한 기사문을 찾아본 후 비평문을 작성함. 저작권법을 어기며 게임을 만드는 것은 바람직하지 않다는 입장을 밝히고, 이는 나아가 한국 게임 산업의 발전을 저해할 수 있는 문제라고 지적함. \n미적분: 급수 문제를 칠판 앞으로 나와 풀이하고 아이들에게 설명함. 난이도 있는 문제를 해결하기 위해 꼼꼼히 살펴보고 식 을 전개하면서 풀이하면서 문제를 해결하는 과정에 보람을 느꼈음을 밝힘. 미적분 보고서 작성하기에서 '역전파 알고리즘'을 주제로 탐구함. 컴퓨터공학과 관련 있는 부분이고 미적분과 연관 지어 보고자 주제를 선정함. 역전파는 신경망의 각 노드가 가지고 있는 가중치와 편향을 학습시키기 위한 알고리즘으로 경사 하강법과 합성함수의 미분 법칙이 이용됨을 설명함. 탐구 활동을 통해 합성함수의 미분법이 역전파 알고리즘에 어떻게 이용되는지 알게 되었으며, 경사 하강법의 내용과 관련이 있음 을 알고, 미적분과 인공지능이 많은 연관성이 있음을 알게 되었다는 소감을 작성함. 도서 '미적분의 쓸모'를 읽고, 컴퓨터공 학과의 관련성을 찾아보고 인공지능과 빅데이터, 인공신경망과의 연관성을 찾아보고자 하였다는 이유를 밝힘. 최적화 알고리 즘 중 하나인 코시의 경사 하강법에 대한 개념과 공식 등의 내용을 확인할 수 있었으며 이를 이용하여 직접 알고리즘이나 인 공지능 및 프로그램을 만들어보고, 경사 하강법이 아닌 손실을 최소화하는 다른 최적화 알고리즘을 조사해봐야겠다는 다짐을 \n고색고등학교 \n2025년 11월 20일 15/20 반 \n1 \n번호 6 이름 \n백민건 \ngov.kr \n정부24 \n과목 \n문서확인번호: 1763-6399-9850-6483 (신청인 : 백민건) \n세부능력 및 특기사항 \n작성함. \n영어 독해와 작문: 즐겁고 유쾌한 성격을 갖고 있어 언제나 긍정적인 마음 자세로 수업에 참여하는 모습이 돋보이는 학생임. 지문을 돌아가며 해석하는 모둠활동에서 쾌활한 분위기를 주도하며 모둠 친구들이 웃으면서 활동하도록 만듦. 친구들과 얘기 하다가도 자신이 해야 할 일이 있으면 높은 집중력으로 몰두함. 사람들에게 즐거움을 제공하는 게임 프로그래머가 되고 싶은 자신의 꿈을 담은 진로 로드맵 작성 활동에서 글의 상관관계를 나타내는 연결사를 효율적으로 사용하여 자연스러운 흐름의 글을 작성함. 중복되는 표현 없이 깔끔한 문장으로 자기 생각을 표현함. 관계대명사를 활용하여 하나의 긴 문장 안에서 자신 이 의도한 것을 모두 표현하는 수준 높은 작문 실력을 보여줌. to 부정사를 글의 흐름상 알맞은 곳에 활용하여 진로 계획의 목적 등을 유연하게 작성한 점이 우수함. \n<진로 선택 과목> \n성취도 \n성취도별 \n학기 \n교과 \n과목 \n단위수원점수/과목평균 \n비고 \n(수강자수) \n분포비율 \n수학 \n인공지능 수학 \n4 \n100/78.6 \nA(42) \nA(59.5) B(21.4) C(19.0) \n사회(역사/도 \n여행지리 \n3 \n89/82.7 \nA(132) \nA(71.2) B(22.0) C(6.8) \n덕포함) \n과학 \n물리학 II \n3 \n84/72.9 \nA(79) \nA(46.8) B(22.8) C(30.4) \n과학 \n화학 II \n3 \n83/69.1 \nA(82) \nA(39.0) B(20.7) C(40.2) \n1 \n과학 \n과학과제 연구 \n4 \n88/88.1 \nA(84) \n체육 \n스포츠 생활 \n1 \n82/83.5 \nA (227) \nA(86.9) B(6.0) C(7.1) \nA(74.4) B(22.0) C(3.5) \n기술·가정/ \n제2외국어/한인공지능 기초 문/교양 \n2 \n94/87.9 \nA(68) \nA(83.8) B(10.3) C(5.9) \n수학 \n인공지능 수학 \n4 \n83/61.0 \nA(42) \nA(28.6) B(19.0) C(52.4) \n영어 \n영미 문학 읽기 \n4 \n94/56.8 \nA(227) \nA(17.6) B(22.0) C(60.4) \n사회(역사/도 \n여행지리 \n3 \n90/72.2 \nA(132) \nA(45.5) B(26.5) C(28.0) \n덕포함) \n과학 \n물리학 II \n3 \n61/57.1 \nB(79) \nA(10.1) B(32.9) C(57.0) \n2 \n과학 \n화학II \n3 \n74/61.6 \nB(82) \nA(19.5) B(24.4) C(56.1) \n과학 \n과학과제 연구 \n4 \n96/81.9 \nA(84) \nA(66.7) B(19.0) C(14.3) \n체육 \n스포츠 생활 \n1 \n86/64.8 \nA(227) \nA(21.1) B(42.7) C(36.1) \n기술·가정/ \n제2외국어/한인공지능 기초 문/교양 \n2 \n79/79.8 \nB(68) \nA(54.4) B(33.8) C(11.8) \n이수단위 합계 \n44 \n고색고등학교 \n2025년 11월 20일 16/20 반 \n1 \n번호 \n6 \n이름 \n백민건 \ngov.kr \n정부24 \n문서확인번호: 1763-6399-9850-6483 (신청인 : 백민건) \n과목 \n세부능력 및 특기사항 \n인공지능 수학: 인공지능에 대한 관심을 가지고 적극적으로 학습에 참여함. 수학 지식을 향상시키기 위해 노력하고 스스로 학습하는 모습을 보임. 인공지능이 게임에서 쓰이는 방법에 대해서 스스로 탐구함. 수집한 자료를 그래프로 나타내어 원하는 \n정보를 쉽게 찾아내는 방법을 잘 알고 있음. 스스로의 학습 목표를 설정하고 이를 달성하기 위해 노력함. 또한, 매 수업 전후 로 학습 내용을 복습하고 예습하여 학습 성취도를 높임. \n영미 문학 읽기: 영미 문학 작품 속 등장인물에 대한 자신의 감정을 깊이 있게 작문으로 표현하는 능력이 뛰어남. 문학 작품 을 읽을 때, 등장인물의 심리와 상황을 섬세하게 분석하고 이를 바탕으로 자신의 감정을 진솔하게 담아내는 작업을 잘 수행 함. 매 작품마다 다양한 관점에서 독창적인 의견을 제시하며 자신의 생각을 논리적으로 풀어내는 능력이 뛰어남. 문학 수업 을 통해 얻은 지식을 다른 과목에도 융합하여 학습에 대한 넓은 시야를 가지게 되었으며, 영어 실력 향상과 더불어 글로벌 시 민으로서의 소양을 갖추어 나가고 있음. \n여행지리: 다크 투어리즘 제대로 알기 활동에서 '서대문 형무소'를 선정하여 서대문 형무소의 역사를 시대 순으로 변천 과정 을 조사하여 작성한 점이 매우 돋보였음. 우리나라의 독립을 위해 목숨을 받친 애국지사를 반드시 기억해야 하며 자유와 독립 은 매우 소중함을 깨닫게 되었다고 소감을 작성함. 국가 홍보물 제작 활동에서 '미국을 상징하는 5가지 요소'라는 주제로 미 국의 백지도에 그랜드 캐니언, 자유 여신상, 골드게이트 브릿지, 미국의 프로 농구 협회, 세계 최초 테마 파크 등의 특징을 그 림으로 그려 홍보물을 디자인함. 본 활동을 통해 미국 본토와 더불어 알래스카, 크고 작은 섬들로 구성된 미국 영토에 대해 자세하게 알게 되었으며 자신이 선정한 5가지 요소 이외에 다양한 인문 및 자연 경관을 탐색하면서 자신의 지적 호기심을 충 족시킬 수 있는 좋은 계기가 되었다고 소감을 작성함. 적정 기술을 활용한 상품 개발 프로젝트 활동에서 개발도상국가에서 사 용하는 기존의 '소켓볼'상품에 대한 장점과 단점을 분석함. 또한 현재는 전등의 역할을 하지만 이를 다른 전자기기와 연계를 통해 충전할 수 있는 형태의 진화된 상품을 제시함. 남에게 도움을 주는 행위가 존경스러워 자신도 이타적인 삶을 살겠다는 의지를 보임. \n물리학 II: 항상 바른 자세로 성실하게 수업에 참여함. 포물선 운동 결과 분석하기에서 포물선 운동을 동영상으로 촬영하고 동영상 분석 프로그램을 이용하여 시간, 위치, 속도, 가속도를 표에 작성하고 그래프를 그림. 포물선 운동에서 수평 방향의 운동과 연직 방향의 운동을 알고 있음. 실험 결과에 만족하고 실험에서 오차가 발생하는 원인에 대해서 고민함. 단진자의 진 동 주기 실험에서 모둠원과 협동하고 실험 과정에 따라서 진행하여 표에 실험 자료를 잘 작성함. 주기와 실의 길이, 질량 사 이의 관계를 자료를 근거로 잘 확인함. 교과 관련 물리 뉴스에서 '트랜지스터를 활용한 CPU의 작동 원리'라는 주제로 잘 발 표함. 과학적 원리로 반도체와 트랜지스터의 구조 등을 조사하여 서술함. 트랜지스터가 CPU의 작동에 활용이 된다는 것과 스핀트랜지스터에 호기심을 느낌. \n화학II: 혈액 속에서 인산완충용액과 단백질 완충용액의 완충과정을 화학반응식을 이용하여 설명하고 관련 내용을 정리한 활동지를 작성하여 제출함. 시판용 산소기체를 사용하여 산소의 분자량을 측정하고 이론적인 값과 비교하여 차이가 나는 이 유를 측정 저울의 한계 및 메스실린더의 부피 측정의 부정확성에서 찾고 고찰한 내용들을 정리한 활동지를 제출함. 물에 녹은 비전해질 용액의 퍼센트 농도 값을 몰랄 농도로 변환하고 변환한 몰랄농도를 이용하여 어는점 내림 및 끓는점 오름 값을 계 산하였으며 시간에 따른 가열곡선 및 냉각곡선을 그림으로 나타냄. 수산화 나트륨과 염산과의 반응을 열화학 반응식을 이용 하여 나타내고 반응열 측정 실험에서 발생할 수 있는 오차를 실험과정에서 유추해 보았으며 엔탈피 변화 도표를 이용하여 헤 스의 법칙을 설명함. 염화칼슘, 염화나트륨의 기존 제설제와 친환경 제설제 중 유기산염(CMO), 칼슘 마그네슘 아세테이트( CMA) 제설제의 장점과 단점을 조사하여 발표함. \n과학과제 연구: 퇴비 속 구성 성분이 식물에 미치는 구체적 성장 영향을 확인하고자 '퇴비 구성 성분에 따른 식물의 성장 경 향'을 주제로 과제 연구를 진행함. 방울 토마토를 식물의 주체로 하고 깻묵, 계분을 이용하여 질산 퇴비를 만들고 12개의 화 분을 이용하여 실험군 및 대조군을 구성하였으며 줄기의 둘레, 열매의 세로 길이로 생장 과정을 관찰하여 기록함. 기록 결과 \n고색고등학교 \n2025년 11월 20일 17/20 반 \n1 \n번호 6 이름 \n백민건 \ngov.kr \n정부24 \n문서확인번호: 1763-6399-9850-6483 (신청인 : 백민건) \n과목 \n세부능력 및 특기사항 \n를 분석하여 질산 퇴비가 열매에는 큰 영향을 미치지 않으나 줄기의 생장과 관련 있음을 확인한 보고서를 작성함. 연구 결과 토마토 보다 생육 기간이 긴 식물과 생육 기간이 짧은 식물을 재배, 비교하여 차이점을 확인하고 싶다는 생각을 밝힌 소감문 을 작성하여 제출함. \n스포츠 생활: 플라잉 디스크를 이용해 던지는 순서를 바로 알고 던지기의 과학적 원리를 경기에 응용하여 적용하였으며 다양 한 전략과 전술을 통해 경기의 흐름을 파악하는 능력을 보임. 플라잉 디스크 멀리 던지기에서 옆으로 플라잉 디스크를 던지는 사이드암 스로우 던지기를 잘하며 속도와 회전력을 조절할 줄 알고 이용하는 능력과 상황에 따라 적절한 속도와 회전을 결정 해 디스크를 빠르게 던질 수 있는 능력이 우수함. 체력과 건강이 우리의 일상 생활에 중요한 요소임을 인식하여 효과적인 체 력 방법에 대해 이해하고 있으며 실제 강한 체력을 키우기 위하여 규칙적으로 운동을 실천하고 있음. \n인공지능 기초: 교사가 제시한 과제를 성실히 수행하여 모든 활동을 마무리하는 학생임. 교사의 질문에 자신의 생각을 자신 감있게 대답하는 모습이 인상 깊음. 프로그래머로써 인공지능에 대한 깊은 탐구를 하기 위해 '이것이 인공지능이다' (김명락) 을 읽고 인공지능을 학습함에 있어 데이터가 매우 중요함을 깨달음. 데이터의 편향성이 미치는 영향에 대해 생각해보며 사람 들에게 긍정적인 영향을 줄 수 있는 프로그램을 개발하고자 함을 이야기함. 분류 모델의 성능 평가지표를 학습한 후 혼동행렬 을 표현하여 불량품 검사, 자율주행 자동차를 예시로 정밀도와 재현율을 설명함. 인공지능 사회 탐구 활동에서 '자율주행자동 차'를 주제로 자율주행자동차의 윤리적인 문제를 자신의 견해로 발표하는 모습을 보임. 텍스트 기반 프로그래밍 활동에서 최 근접이웃 모델을 구현하였으며 각 단계에서의 문제점을 찾아 해결하고자 하는 적극적인 모습을 보임. \n<체육·예술> \n학기 \n교과 \n과목 \n단위수 \n성취도 \n비고 \n이수단위 합계 \n과목 \n해당 사항 없음 \n세부능력 및 특기사항 \n7. 독서활동상황 \n학년 과목 또는 영역 \n1 \n2 \n3 \n독서 활동 상황 \n8. 행동특성 및 종합의견 \n학년 \n행동특성 및 종합의견 \n생각이 깊고 심성이 착하며 생활 태도가 우수하고 맡은 일을 능동적으로 잘 처리하고 성격도 명랑함. 언행이 바르고 1 모든 일에 적극적으로 나서므로 급우들의 모범이 되며, 예의 바르고 공손한 말씨로 어른을 대하는 장점을 많이 갖추 고 있는 학생임. 참을성이 많고 타인의 입장을 잘 이해함으로써 쉽게 공감대를 형성하여 친화력이 좋음. 특히, 공감 \n고색고등학교 \n2025년 11월 20일 18/20 반 \n1 \n번호 6 이름 \n백민건 \ngov.kr \n정부24 \n학년 \n문서확인번호: 1763-6399-9850-6483 (신청인 : 백민건) \n행동특성 및 종합의견 \n2 \n3 \n능력이 뛰어나 친구들이 기쁜 일이나 힘든 일이 있을 때, 마치 자기 일처럼 생각하고 행동하여 교우 관계가 매우 돈 독함. '학급 칭찬 릴레이' 시간에 남을 잘 돕고 배려심이 깊으며 항상 활발하고 배려하는 학생이라는 문구를 받음. 명 랑한 성격의 학생으로 자신이 하고자 하는 일에 대해 뚜렷하고 명확한 생각을 가지고 있으며 과학 시간에 중화 반응 에 관해 조사한 내용을 발표하며 과학자에 대한 꿈을 더욱 공고히 함. 이후 학업 계획을 구체적으로 수립하며 적극적 으로 자신의 학습 환경을 통제하고 지속적으로 실천하는 자세를 키우고 있어 더 큰 발전이 기대됨. 특히, 과학 탐구 과목에 흥미를 가지고 기본 개념을 확실하게 정립하고 심화 내용까지 확장하고자 노력하며 개념 노트를 만들고 정리 하는 등 탐구적 학습 자세가 돋보임. \n마음이 착하고 매사에 긍정적인 사고를 함. 또한 평소 랩을 하며 흥이 넘치는 모습을 자주 보여주고 즐거운 마음으로 생활하는 학생임. 집이 가까워도 지각은 하지 않지만, 아슬아슬하게 교실에 입실함. 그래도 교복은 단정히 잘 입고 규칙을 지키며 생활함. 체육 한마당에서 각종 종목에 출전하여 좋은 성적을 얻도록 최선을 다하여 노력하는 열정이 넘치고 응원도 열정적으로 함. 제주도 체험학습에 참여하여 질서를 지키고, 한라산을 등반하며 체력과 정신력을 기 름. 또한 쓰레기를 버리지 않고 되가지고 와서 분리수거를 함. 학교 스포츠 클럽 농구에서 활약하여 준우승을 이끎. 학업 면에서 조금은 성장했으나 조금 더 욕심을 내서 공부하도록 자극해도 그 위치에 안주하려 했으나, 이제는 마음 을 고쳐서 변화하려 함. 학습 플래너를 활용하여 계획을 세워서 노력한다면 발전이 기대됨. \n2학기 학급자치회 부회장(2024.08.09. -2024. 11. 30.)으로 학급의 단합을 이끌어감. 예의가 바르고 겸손한 태도를 지녀 선생님들께 늘 예의를 갖추고, 심성이 착하며 겉으로는 조용한듯 하지만 명랑한 성격을 지녀 교우 관계가 원만 하며 자신이 맡은 바에 대한 책임을 다하는 학생임. 단정한 교복 차림과 마음가짐으로 학교 규칙을 잘 지키고 학생의 본분에 걸맞은 생활 태도로 생활하여 여러 친구들의 모범이 됨. 교실 청소의 1인 1역활을 성실히 수행하였으며 인터 넷 강의 수강과 문제풀이를 통해 심화학습을 진행하고 있어 앞으로 성적에도 많은 향상이 있을 것으로 생각됨. \n고색고등학교 \n2025년 11월 20일 19/20 반 \n1 \n번호 \n6 \n이름 \n백민건 \ngov.kr \n정부24 \n문서확인번호: 1763-6399-9850-6483 (신청인 : 백민건) \n발급번호 : J100005653-2025-002165 \n학교생활기록 부 \n성 \n명 \n백민건 \n인적 \n사항 \n주민등록번호 060731-******* \n담당부서 고색고등학교 \n담당자 김미희 \n전화번호 \n031-8012-6806 \n위 사람의 학교생활기록부 사본임을 증명합니다. \n2025년 11월 20일 \n고색고등학교장 \n7S75 \n고색고등학교 \n2025년 11월 20일 20/20 반 \n1 \n번호 \nCo \n6 \n이름 \n백민건 \n(KOR, \ngov.kr \n정부24 \n"
}