{
  "student_info": {
    "name": "서현승",
    "gender": "남",
    "birth": "020610",
    "address": "서울특별시 성북구 돌곶이로8길 22, 109동 1303호 (석관동, 래미안아트리치)",
    "school_history": [
      "2018년 2월 8일 경희중학교 제3학년 졸업",
      "2018년 3월 2일 경희고등학교 제1학년 입학",
      "2021년 2월 3일 경희고등학교 제3학년 졸업"
    ]
  },
  "attendance": "출결 구간 전체 raw 저장됨",
  "awards": [
    {
      "grade": "4",
      "award_name": "차 산업혁명 시대에는 창의적으로 사고하는 능력이 코딩 학습에 매우 중요한 영향을 미칠 것이라고 예상",
      "date": ""
    },
    {
      "grade": "2",
      "award_name": "는 코딩이였기에 이해가 되지 않는 부분이 상",
      "date": ""
    },
    {
      "grade": "3",
      "award_name": "창의적체험활동상",
      "date": ""
    },
    {
      "grade": "2",
      "award_name": "년에 소프트웨어의 비중이 계속 높아지면서 상",
      "date": ""
    },
    {
      "grade": "1",
      "award_name": "학년 전체를 대상",
      "date": ""
    },
    {
      "grade": "0",
      "award_name": "점 이상",
      "date": ""
    },
    {
      "grade": "9",
      "award_name": "상황에서 관심을 가지고 살펴본 현상",
      "date": ""
    },
    {
      "grade": "9",
      "award_name": "은 인류의 일상",
      "date": ""
    },
    {
      "grade": "6",
      "award_name": "년 노벨 화학상",
      "date": ""
    },
    {
      "grade": "9",
      "award_name": "상",
      "date": ""
    },
    {
      "grade": "1",
      "award_name": "학기) 일상",
      "date": ""
    },
    {
      "grade": "3",
      "award_name": "항상",
      "date": ""
    }
  ],
  "certificates": [],
  "creative_activities": {
    "grade1": "2",
    "grade2": "3 \n1. 인적사항 \n성명: 서현승 \n학생 \n학과 \n반 번호 \n담임성명",
    "grade3": "1. 인적사항 \n성명: 서현승 \n학생 \n학과 \n반 번호 \n담임성명"
  },
  "academic_records": [
    "문서확인번호: 1763-6098-4150-6899 (신청인: 서현승) \n학교생활세부사항기록부(학교생활기록부 II) \n졸업 대장 번호 2020-19334 \n구분 \n학년 \n1 \n2 \n3 \n1. 인적사항",
    "성명: 서현승 \n학생 \n학과 \n반 번호 \n담임성명 \n4 \n19 \n남현진 \n8 \n18 \n장준혁 \n6 \n17 \n허승환 \n성별 : 남",
    "주소 : 서울특별시 성북구 돌곶이로8길 22, 109동 1303호 (석관동, 래미안아트리치) \n가족 부 \n성명 :",
    "생년월일: \n상황 모 \n성명 :",
    "생년월일: \n특기사항 \n2. 학적사항 \n2018년 2월 8일 경희중학교 제3학년 졸업 \n2018년 3월 2일 경희고등학교 제1학년 입학 \n2021년 2월 3일 경희고등학교 제3학년 졸업 \n특기사항 \n3. 출결상황 \n학년 수업일수 \n결석일수 \n지각 \n조퇴 \n결과 \n특기사항 \n질병 미인정 기타 질병 미인정 기타 질병 미인정 기타 질병 미인정 기타 \n1 \n190 \n개근 \n2 \n191 \n1 \n경희고등학교 \n2025년 11월 20일 1/26 반 \n6 \n번호 17 이름 \n서현승 \nKOR \ngov.kr \n정부24",
    "문서확인번호: 1763-6098-4150-6899 (신청인: 서현승) \n결석일수 \n지각 \n학년 수업일수 \n3 \n179 \n결과 \n질병 미인정 기타 질병 미인정 기타 질병 미인정 기타 질병 미인정 기타 \n1 \n조퇴 \n특기사항 \n원격수업일수 75일 \n4. 수상경력 \n수상명 \n등급(위) \n수상연월일 \n수여기관 \n참가대상(참가인원) \n영어경시대회 \n대상(1위) \n2018.04.23. \n학업능력경진대회 (영어) \n동상(4위) \n2018.06.11. \n경희고등학교장 \n경희고등학교장 \n1학년 (276명) \nEnglish Essay대회 \n동상(4위) \n2018. 07.09. \n경희고등학교장 \n영어 청취 대회 \n학업능력경진대회 (영어) \n동상(3위) \n2018.09.14. \n경희고등학교장 \n금상(2위) \n2018. 11. 28. \n교과우수상(영어, 과학탐구실험) \n2018. 12. 28. \n경희고등학교장 \n경희고등학교장 \n영어경시대회 \n은상(2위) \n2019. 04. 24. \n경희고등학교장 \n1학년 중 참가자(253 (명) \n1학년(253명) \n1. 2학년 중 참가자(48 3명) \n1학년(241명) \n1학년 \n2학년 중 참가자(245 \n명) \n학업능력경진대회(영어) \n은상(2위) \n2019.06.24. \n교과우수상(영어 I) \n2019.07.19. \n학업능력경진대회 (영어) \n금상(1위) \n2019.11.04. \n독서경시대회 \n동상(4위) \n2019. 11. 18. \n경희고등학교장 \n경희고등학교장 \n경희고등학교장 \n경희고등학교장 \n2학년 (227명) \n수강자 \n2학년 (210명) \n2학년 (246명) \n과학 탐구대회 (물리학 I) \n금상(2위) \n2019. 12. 23. \n경희고등학교장 \n과학 사고력 경진대회 (지구과학) \n장려상(5위) \n2020.02.05. \n경희고등학교장 \n교과우수상(영어 독해와 작문) \n영어경시대회 (독해부문) \n2020.02.05. \n금상(1위) \n2020.06.23. \n밝은사회 선행상 \n2021, 01, 29. \n교과우수상(스포츠 생활) \n2021, 02.03. \n정근상 \n2021. 02.03. \n경희고등학교장 \n경희고등학교장 \n경희고등학교장 \n경희고등학교장 \n경희고등학교장 \n2학년 중 참가자(143 명) \n2학년 중 참가자(242 명) \n수강자 \n3학년 (245명) \n전교생 (723명) \n수강자 \n3학년(245명) \n경희고등학교 \n2025년 11월 20일 \n2/26 반 \n6 \n번호 17 \n이름 \n서현승 \ngov.kr \n(KOR \n정부24",
    "문서확인번호: 1763-6098-4150-6899 (신청인: 서현승) \n5. 자격증 및 인증 취득상황 \n<자격증 및 인증 취득상황> \n구분 \n명칭 또는 종류 \n번호 또는 내용 \n취득연월일 \n발급기관 \n해당 사항 없음 \n<국가직무능력표준 이수상황> \n능력단위 \n학년 \n학기 \n세분류 \n이수시간 원점수성취도 \n비고 \n(능력단위코드) \n해당 사항 없음 \n6. 진로희망사항 \n학년 \n진로 희망 \n1 \n로봇공학자 \n2 공학자, 프로그래머 \n3 앱 프로그래머 \n7. 창의적 체험활동상황 \n희망 사유 \n봉사활동에서 지체장애인 분들을 보며 '이분들의 삶을 조금이나마 편리 하게 만들 순 없을까'라는 생각이 들었고, 가사로봇과 같은 로봇에 관심 이 생김. 신체적 한계로 인해 생활에 제약을 받는 분들을 도울 수 있는 로봇 개발에 욕심이 생겼으며, 신체 보조 기구 역할을 하는 로봇, 의수, 의족 등을 개발하거나 사람에게 한계가 있는 구조 현장에서 활동하는 구조 로봇 등도 만들고 싶다는 포부가 생김. \n기계 조립하는 것을 좋아함. 그래서 그 분야의 지식을 쌓아 새로운 것을 만드는 것을 좋아함. 요즘은 무엇을 만들기 위해서는 기계만 알아야 하 는 것이 아니라 기계를 움직이는 소프트웨어도 중요하다는 것을 알게 됨. 이에 IT전문과정, 전공심화 등 관련 지식을 쌓기 위해 노력하고 있 으며 프로그래밍 분야에 대한 매력도 많이 느끼고 있음. 앞으로 기계와 소프트웨어 두 분야를 접목해서 생활을 더욱 풍족하게 해줄 수 있는 것 을 만들어보고 싶어함. \n고등학교 3학년 동안 프로그램과 앱을 만들면서 프로그래밍 자격증을 취득하거나 프로그램과 관련된 연구를 해왔으며, 직접 기계를 만든 후 자신의 프로그램을 적용해보는 등 프로그래머에게 필요한 활동을 하며 실력을 길러옴. 달력, 메모, 알람 등 생활에 소소하게 필요한 기능을 한 곳에 모은 앱을 만들어 많은 사람이 쓰도록 해보고 싶다는 포부를 보임. \n경희고등학교 \n2025년 11월 20일 \n3/26 반 \n6 \n번호 17 이름 서현승 \ngov.kr \n정부24 \n경희고등학교",
    "문서확인번호: 1763-6098-4150-6899 (신청인: 서현승) \n창의적체험활동상황 \n학년 \n영역 \n시간 \n특기사항 \n자율활동 \n88 \n1 \n동아리활동 \n30 \n2학기 영어 교과반장 (2018.08.13.-2019.02.28.)으로서 매 수업시간 전에 교사 수업 준비를 도왔으며, 수행평가의 예문을 번역하는 일, 교사의 전달사항을 학급에 전달하는 등 교사와 학생들의 연계역할을 성실히 수 행하고, 수행평가와 수업 활동에 있어서 준비물을 챙기거나 수업 운영을 도움. 수업활동에 어려운 친구들을 도와주고 활발하고 밝은 수업 분위리 조성에 힘썼으며, 드러나지 않게 교사와 학생의 편의를 도와서 좋은 평가 를 받음. \n우리나라 민주화 운동의 역사를 바로알기 위하여 학급별 테마소풍 (2018. 04.06)으로 광화문 일대의 민주화 운동과 관련된 장소를 탐방함. 이를 위 하여 사전에 4.19혁명과 6월 민주항쟁의 배경과 과정을 조사하고 광화문 지역의 4.19혁명 기념탑, 세종대로 사거리, 서울시의회 본관, 대한민국 역사 박물관 등의 경로를 지정하여 탐방함. 수업시간에 지식적으로 접했 던 민주화 사건들에 대하여 직접 장소를 둘러보고 사료를 접하며 당시의 상황과 민주화 운동의 의미에 생각하는 시간을 갖음. 역사의 현장을 찾아 다니면서 과거와 현재를 비교하며 민주주의의 소중함을 느꼈고 민주주의 에서 참여의 의미와 책임감에 대하여 성찰하는 계기가 됨. \n학급별 테마 소풍으로 덕수궁을 체험하면서 우리나라 고궁에 관심이 커졌 고 일제 시대의 우리 역사를 더 깊이있게 알아봐야 겠다는 각성을 가지고 광화문 일대의 8군데의 역사 유적지 중에서 몇 군데를 선택하여 탐방하는 체험 프로그램인 '궁사다망(2018.10.10.)'에서 창덕궁과 창경궁, 종묘를 둘러보는 일정을 직접 기획함. 임진왜란 이후 소실과 재건의 반복으로 고 충을 겪고 일제강점기에는 궁궐의 위엄마저도 추락해버린 우리 고궁의 역 사를 대면하면서 수업시간에 단순히 지식적으로 다루었던 자신의 모습에 깊이 반성함. 우리 문화재와 고궁의 소중함을 느끼게 되었고 왕들의 업적 과 함께 건축물의 화려한 모습을 후손에게 온전한 모습으로 물려주어야겠 다고 다짐함. 무엇보다도 역사에 대해 진심으로 관심을 갖고 애착을 가져 야겠다고 다짐함. \n심폐소생술 교육 (2018.08.29)에 참여하여 이론수업뿐만 아니라 실제 체 험실습을 진행함. 주위에 갑작스럽게 심정지 환자들이 발생할 수 있다는 것과 제대로 된 응급 처치가 이루어지면 많은 생명을 살릴 수 있다는 점에 서 심폐소생술의 중요성을 알게 됨. 가슴압박부터 인공호흡까지 심폐소생 술의 절차와 제세동기의 사용법을 알게 되었고, 심폐소생술 이외에 다양 한 응급상황에서의 응급 처치에 대해 배울 수 있었으며 생명의 소중함을 느낌. \n(수학세미나동아리) (30시간) 수학세미나 동아리 활동의 일환으로 '서울에 서 빚을 지고 집을 빌렸을 때 몇 년 안에 갚을 수 있는가'를 작성함. 이 보 \n2025년 11월 20일 4/26 반 \n6 \n번호 17 이름 \n서현승 \n(KOR \ngov.kr \n정부24 \n1",
    "문서확인번호: 1763-6098-4150-6899 (신청인: 서현승) \n창의적체험활동상황 \n학년 \n영역 \n시간 \n특기사항 \n진로활동 \n봉사활동 \n52 \n고서의 작성 동기는 서울의 집값이 계속해서 오르고 있다는 인터넷 기사 를 보고 흥미를 가지게 되었기 때문임. 보고서의 주된 내용은 서울에 집을 사기 위해 지는 빚과 생계유지를 위한 여러 가지 지출, 그리고 그를 메우 는 소득의 값 설정, 빚의 이자를 고려했을 때 갚는 데 걸리는 시간 계산임. 학생은 보고서 작성을 통해 서울의 집값이 다른 지역들과 비교하였을 때 지나치게 높다는 것과 빚을 갚는 시간을 단축하기 위해 생계유지를 위한 지출을 줄이는 경우가 많아 관련 대책이 시급하다는 것을 알게 됨. 이 보 고서의 한계점은 계산에 들어가는 요소들의 값이 고정되어 있고, 어떤 요 소들은 계산에서 생략되어 실제 경우와의 오차가 예상되는 것임. 통계청 에 기록되어 있는 자료들을 주로 참고함. \n도서관에서 도서정리및 환경정화 활동을 함. 활동을 통해 책을 정리하며 책이 남녀노소 여러 사람들에게 실제로 읽혀지는 모습들을 많이 보면서 책이 상상에 나래를 펼쳐주는 소중한 존재라는 것을 느껴 소설, 동화책 등 에 대한 관심이 커졌음. \n초등학생 학습 지도 봉사 활동을 함. 아이들의 순수한 말과 행동들을 보며 이런 아이들이 올바르게 자랄 수 있도록 미래에 어른으로서 지켜주어야 겠다는 생각이 듬. 뿐만 아니라, 아이들을 가르쳐주면서 선생님들이 느낄 어려움에 공감하였으며, 반면 누군가를 가르쳐주는 기쁨과 행복 또한 느 낄 수 있었음. \n~ \n• 201 \n1학기 미래 인재 프로그램(소프트웨어 인재, 2018.03.30.-07.27./30 시간), 2학기 미래 인재 프로그램(소프트웨어 인재, 2018. 08. 31. 9.01.02./30시간)에 참여함. 1학기에는 '스크래치' 프로그램을 학습하 면서 코딩과 프로그래밍 언어에 대한 기초 과정을 공부하였으며, 처음에 는 코딩이 어렵게 느껴졌지만 설정한 대로 실행하고 계산값을 내놓는 과 정이 신기하였고, 코드 하나를 어떻게 활용하는지에 따라 결과가 완전히 달라진다는 점에서 흥미를 느낌. 코딩에서 중요한 건 특정 명령어의 기능 을 외우는 것보다 어떻게 그 기능들을 이어서 원하는 결과를 도출해내는 것이라는 걸 알 수 있었음. 2학기에는 '마이크로소프트 비주얼 스튜디오' 라는 프로그램을 접하면서 코딩과 C언어에 대한 심화 과정을 공부하였으 며, 프로그래밍 언어 중에서도 C언어에 대해서 자세히 학습함. 창의적으 로 활용하여 프로그램의 적은 명령으로도 많은 프로그램을 담을 수 있음 을 깨달았고, 4차 산업혁명 시대에는 창의적으로 사고하는 능력이 코딩 학습에 매우 중요한 영향을 미칠 것이라고 예상함. \n학교특색사업인 IT전문과정 프로그램 코어 교과 과정 (2018. 03. 26.-201 8.07.28./강의 72시간, 2018.08.25.-2018.12.29. /강의 72시간)에 참 여하여 Eclipse를 통한 Java 코딩을 하는 법을 배움. 처음으로 접해 보 \n경희고등학교 \n2025년 11월 20일 5/26 반 \n6 \n번호 17 이름 서현승 \n(KOR \ngov.kr \n정부24 \n2 \n1",
    "문서확인번호: 1763-6098-4150-6899 (신청인: 서현승) \n창의적체험활동상황 \n학년 \n영역 \n시간 \n특기사항 \n자율활동 \n92 \n동아리활동 \n32 \n는 코딩이였기에 이해가 되지 않는 부분이 상당히 있었으나, 수업에서 중 요한 것들을 필기하고, 보고서를 쓰면서 그동안 배운 것들을 정리해보며 배운 것을 복습하면서 코딩에 대한 이해도가 높아지게 됨. 다른 공부에도 이와 비슷한 방법을 적용하면 효과적일 것이라는 점도 배울 수 있었음. J ava 외에 다른 언어들이 어떤 까닭으로 존재하고 있는지가 궁금해지기도 하여 미래인재 프로그램에서 배운 코딩 언어들과 Java의 공통점과 차이 점, 장단점들에 대해 알아봄 (컴퓨터 메모리에 접근하는 정도 등). \n'4차 산업혁명과 소프트웨어'(2018.12.13.) 특강에 참여함. 셀프 주유소 의 그림자 노동이나 왓슨의 환자 진단 등 현실에 이미 실현된 것들이 많다 는 것을 깨달았고, 동시에 4차 산업혁명으로 인한 변화를 겪을 때가 얼마 남지 않았다는 것을 느낌. 미래에 사라지거나 새로 생겨날 직업들에 대해 알아보고 현재 자신의 진로가 이러한 사회 변화에 어떤 영향을 받을지 생 각해보는 계기가 되었으며, 체계적으로 계획해야 겠다고 다짐함. \n2년 동안 IT 전문 과정을 성실히 이수함. 학생은 자신이 배운 지식들을 활 용하여 멋진 작품을 만들고자 4박 5일간 특정장소에서 진행하는 IT 캠프 에 참여함. 학생은 조원들과 협업해서 만들고 싶은 것으로 리듬게임을 생 각함. 리듬게임을 아두이노를 기반으로 JAVA로 코딩을 하여 노래가 나 오면 박자에 맞춰 버튼을 누르는 방식이었음. 그리고 타이밍에 따라 점수 를 차등 배정함. 학생은 주로 프로그래밍을 담당함. 완성된 결과물을 보고 교수님께서 호평을 하심. 학생은 IT 캠프에 참여하며 다음과 같은 것을 느꼈다고 함. 먼저는 무엇을 만들지 같이 공유를 하고 각자가 잘 할 수 있 는 것을 분담해서 하게 되면 적은 시간에 빠른 속도로 정확히 목표를 달성 할 수 있다는 것임. 그리고 다음은 1년 6개월 넘게 배워 온 지식들을 실제 로 적용해서 결과물을 만들어낼 때의 성취감은 그 어떤 것보다 강렬했다 는 것임. \n학생은 영어 능력이 우수하며, 이는 친구들뿐만 아니라 영어 교사까지도 칭찬을 하는 부분임. 따라서 학생은 학급의 영어 독해와 작문 교과반장을 역임함. 학생은 독해와 작문 교과반장으로서 영어 독해를 어려워하고 과 제를 귀찮아 하는 친구들을 위해 그들에게 때로는 멘토로서, 때로는 친구 로서 알려주고 격려해줌. \n(P. E. (PhysicsEssay))(32시간) 평소 기계를 좋아하여 기계를 움직이는 기술에 물리학이 필요하다는 사실을 알게 된 후 물리학을 자세히 배우고 싶어 이 동아리에 참여하게 됨. 동아리 활동 중 박물관을 구경하면서 여러 동식물의 구조를 살펴보며 물리학적으로 왜 그런 구조를 가지게 되었는 가 생각해봄. 그중 특히 단풍나무 씨앗의 형태가 씨앗이 멀리 퍼지는 것에 \n경희고등학교 \n2025년 11월 20일 6/26 반 \n6 \n번호 17 이름 \n서현승 \ngov.kr \n정부24 \n2",
    "문서확인번호: 1763-6098-4150-6899 (신청인: 서현승) \n학년 \n영역 \n시간 \n창의적체험활동상황 \n특기사항 \n봉사활동 \n진로활동 \n45 \n얼마나 도움을 주는지 호기심을 가지게 되어 관련 실험을 직접 해봄. 조 원을 구성하여 총과 관련된 물리학에 대해 조사해보는 활동도 함. 이를 통 해 총알이 물에서는 밀도로 인해 공기 중에서보다 느리고 짧게 나아간다 는 사실 등을 배울 수 있었음. 활동을 마친 후 다른 사람이 진행한 실험을 참고하는 것보다 직접 실험하는 것이 자신이 원하는 여러 가정에서 실험 해볼 수 있고 예상치 못한 오차 요소를 발견할 수도 있다는 점에서 더 좋 다고 느낌. 또한 조별 활동에서 자신이 먼저 적극적으로 참여하는 것이 다 른 조원들도 적극적으로 참여하게 도와준다는 것도 배움. \nIT 전문과정 중 앱트랙 과정을 선택해서 1년 간 수강함. 1학기에는 앱 만 드는 프로그램 안드로이드 스튜디오에 대해 배움. 주로 기초지식과 실습 을 활용하여 프로그램에 대해 익힘. 그리고 2학기에는 1학기 때 배운 내 용을 바탕으로 앱을 실제로 만들어 봄. 학생은 친구들과 함께 퀴즈앱을 만 들어 보기로 함. 인터넷으로 조사해 퀴즈 500개를 만듦. 그리고 이를 분 야별, 또는 랜덤으로 풀 수 있게 구성함. 앱을 만든 후 자신감이 생겨 다음 에는 앱 공유 사이트에 올릴 수 있는 상용앱을 만들고 싶어함. \n학생은 프로그램 제작을 좋아함. 그리고 실력을 키워서 실용적인 프로그 램을 만들고 싶어함. 하지만 프로그램만 만든다고 해서 끝나는 것이 아니 라 시대가 어떻게 변하고 있고, 무엇을 원하고 있는지 등 트렌드를 잘 파 악해야 하기 때문에 이에 대해 탐구하고자 전공심화 프로그램 '4차 산업 혁명과 ICT 트렌드'(2019. 7. 29. -2019. 8. 1. (12시간))에 참여함. 강의를 들으며 4차 산업혁명의 주요 기술인 인공지능, 빅데이터, 보안, 드론, V R, AR 등에 대해 배움. 이번 강의를 들으며 과학 기술의 발전 속도가 빨 라짐에 따라 끊임없이 스스로 학습하는 노력을 기울여야 하고 트렌드의 변화를 주시해야 한다는 것을 깨달음. 그리고 4차 산업혁명의 전망을 생 각하면서 지금부터 무엇을 준비해야 할지를 고민함. \n융합과학실험 캠프 (태양광 자동차 만들기)에 참여하여 반도체와 전동기 의 물리적인 원리를 탐구함. 특히 발전기와 전동기의 차이를 정확하게 발 표하여 친구들의 큰 호응을 얻음. 물리적인 탐구능력이 뛰어나 원활한 실 험을 진행하는 모습이 기특함. \n[학급학술제] \n3 \n자율활동 \n48 \n평소 관심이 많았던 AI가 우리의 삶에 어떤 영향을 미치는지를 서적과 논 문, 인터넷으로 탐색한 후 보고서를 작성하여 발표함. 'AI의 미래: 생각 하는 기계'란 책을 통해 인공지능의 종류와 활용되는 분야, 또 미래에 어 \n경희고등학교 \n2025년 11월 20일 7/26 반 \n6 \n번호 17 이름 서현승 \ngov.kr \n정부24 \n3",
    "문서확인번호: 1763-6098-4150-6899 (신청인: 서현승) \n학년 \n영역 \n시간 \n동아리활동 \n봉사활동 \n창의적체험활동상황 \n특기사항 \n7 \n떤 직업이 유지되고 사라질지 알아봄. 과거 산업혁명이 일자리를 증가시 킨 것에 반해 4차산업혁명은 감소시킴을 알게 됨. 또 논문 'AI가 인간을 '해치는 날'과 영어원서 'AI Superpowers'를 통해 AI가 삶의 질을 향상 시켜주는 장점이 많은 반면, 자율주행 자동차 등의 오작동과 같이 사고 발 생 위험이 있고 그 사고의 책임자는 AI 제작자인가 AI 자체인가에 대해 윤리적 논란이 있음을 파악함. 이러한 AI가 불러올 부작용을 최소화하는 등 인간과 인공지능이 조화롭게 공존하는 방법을 연구, 개발하고자 하는 포부를 가짐. \n[그들은 왜 노벨상을 탔을까?] \n트랜지스터 발명으로 노벨상을 받은 사람들의 발명 과정을 조사해 발표 함. 트랜지스터의 발명은 기계들의 소형화와 저전력 소비로 이어져 다양 한 전자 제품의 발달로 이어졌음을 알게 됨. \n[한걸음 더] \n3D 프린터가 시간이 오래 걸리고 비싼 탓에 기계가 적어 여러 명이 쓰다가 지체된다는 단점을 3D펜으로 극복할 수 있다는 사실을 깨달음. \n(물리학토론과토의 및문제해결) (7시간) 물리학 동아리 내 IT 분야에 관심 있는 학생들이 모인 조에서 '물리와 IT산업'을 대주제로 하여 토의를 진행 하였음. 그 중 '5G WiFi는 왜 지원 거리가 짧은가'라는 주제를 평소에 경 험한 적이 많아 관심이 갔기에 선정한 후 연구하여 발표함. 연구를 위해 조사하던 중 5G 전파에는 3.5GHz 주파수와 28GHz 주파수의 두 종류가 있으나 한국은 28GHz보다 속도가 느린 3.5GHz만 존재한다는 사실에 의아하였다고 함. 탐구를 통해 고속 주행하는 자동차와 비슷하게 5G 전파 는 빠른 속도로 인해 장애물을 만나면 회절이 잘 일어나지 않아 꺾여 들어 오기 힘들다는 문제가 있다는 것과 28GHz는 문제가 더 심해 한국에 없다 는 사실을 알게 됨. 이로 인해 지금보다 기지국을 조밀하게 설치해야 한다 는 문제와 28GHz 주파수는 원활한 지원을 가능하게 하는 기계 부품의 연 구도 필요하다는 문제 또한 인식함. 이를 통해 물리적 제약이 기술 발전을 억제하는 요인이 될 수 있다는 사실을 알았고, 향후 이러한 제약을 뛰어 넘는 5G 기술을 개발해보고자 함. \n[청소년 자원봉사학교 캠페인] \n지역사회에 꾸준히 기부를 한 나눔가게들이 코로나로 형편이 좋지 않다는 것을 알게 되어 반려식물 키트를 제작하고 응원 편지를 작성해 상인에게 전달하는 봉사활동에 참여함. 활동 중 나눔가게 상인과 같이 자신이 힘든 것을 감수하고 봉사하는 사람들의 이야기를 들으면서 어려운 상황에서도 \n경희고등학교 \n2025년 11월 20일 8/26 반 \n6 \n번호 17 이름 서현승 \ngov.kr \n정부24 \n3",
    "문서확인번호: 1763-6098-4150-6899 (신청인: 서현승) \n학년 \n영역 \n시간 \n진로활동 \n3 \n창의적체험활동상황 \n특기사항 \n나눔을 실천하는 일이 존재해야 하는 이유를 이해할 수 있었다고 함. 응원 편지를 쓰면서 상인들이 어떤 반응을 보일지 쑥스러워하였는데, 가게를 방문하여 식물과 편지를 드렸을 때 상인들이 기뻐하는 모습을 보고 뿌듯 해함. 봉사자들을 격려하고 지원해주는 봉사도 필요하다 느낌. \n[환경교육 및 환경보호 캠페인] \n오늘날 오염되고 있는 지구의 환경에 관해 교육받은 후 지구의 대기, 토 양, 수질 오염을 표현한 포스터를 만듦. 환경보호를 알리는 방안을 직접 생각해볼 수 있었기에 주체적으로 해결 방법을 찾는 능력을 기를 수 있었 다함. \n[전공심화프로그램] \n1학년 때부터 IT전문과정 (총 288시간)을 통해 실력을 키우기 위해 노력 해왔고, IT를 더 깊이 알고자 전공심화프로그램인 코딩수학 : RSA 암호 알고리즘(총 12시간)을 수강함. 이 프로그램을 통해 암호 알고리즘의 원 리를 이해하고 나만의 암호를 만들어보면서 수학, 컴퓨터, 정보보호를 융 합하여 해커들로부터 안전한 암호를 만드는 방법을 탐구함. Octave라는 프로그램으로 최대공약수, 유클리드 호제법, 소수 판별법 등 암호 코딩에 쓰이는 수학 지식을 공부한 후 RSA 암호에 관해 연구함. RSA 암호 알고 리즘을 이용하여 노래 가사 등 장문의 글을 암호화하고 해독하는 활동을 함으로써 암호의 원리를 파악해봄. 또한, 다른 전공심화인 '4차산업혁명 과 ICT트렌드'로부터 ICT가 장점이 많으나 사이버범죄나 개인정보보호 에 취약할 수 있다는 단점을 알게 되었고, 더 나아가 악용되기 어려운 프 로그램을 자신이 개발해보겠다고 다짐함. \n[한걸음 더] \n'한 걸음 더' 활동으로 근래에 소프트웨어가 급성장한 것에 대해 알아보고 자 문헌들을 조사한 후 발표함. 1980년대 세계 ICT기업 TOP10에 주로 하드웨어 기업이 포진해 있었으나 2002년에 소프트웨어의 비중이 계속 높아지면서 상황이 역전되었고, 2011년에 이르러서는 전 세계 ICT시장에 서 소프트웨어가 약 30.4%를 차지할 정도로 부상함을 알게 됨. 오늘날 스 마트폰이나 가전제품, 자율주행 자동차 등 일상 속 거의 모든 사물에 소프 트웨어가 존재하며, 미래에 IoT로 사람과 사물이 연결되는 초연결 시대에 는 소프트웨어 비중이 더 커진다는 걸 깨달아 프로그래밍이 얼마나 중요 한지 알게 됨. 또한, 그만큼 코딩교육도 중요해지기에 앞으로 누구나 재미 있고 쉽게 이해할 수 있는 코딩프로그램을 만들어보고자 다짐함. \n경희고등학교 \n2025년 11월 20일 \n9/26 반 \n6 \n번호 17 이름 서현승 \ngov.kr \n정부24",
    "문서확인번호: 1763-6098-4150-6899 (신청인: 서현승) \n학년 \n봉사활동실적 \n일자 또는 기간 \n2018.05.09. \n장소 또는 주관기관명 \n(개인)삼청공원숲속도서관 \n활동내용 \n시간 누계시간 \n2018. 05. 21. \n(개인)성북구마을사회적경제 \n센터 \n도서정리및 환경정화 활동 \n성북구사회적경제특구 장 위동 초등틈새돌봄교실 학 습지도 봉사 \n4 \n4 \n4 \n8 \n1 \n초등학생 학습 보조 및 지 \n2018. 07.11. \n(개인)비전트리지역아동센터 \n4 \n12 \n도 \n2018. 10. 24. \n(개인)서울미양초등학교병설 유치원 \n유치원 교육활동 지원 \n4 \n16 \n2018. 12. 19. \n(개인)종로도서관 \n2019. 07.10. \n(개인)글로벌한상드림 \n도서관봉사(도서정리) \n한상인턴기업자료정리- 해외청년인턴사업 \n4 \n20 \n3 \n3 \n2 \n2019. 10.09. \n(개인) (사)겨레얼살리기국민 운동본부 \n개천절 기념 단군 영정 전 시회에서 질서유지와 환경 정리 등 안내 보조 등 \n4 \n7 \n2019, 12, 18. \n(개인)다솜재가노인복지센터 \n환경정리 및 어르신 활동 지원 \n3 \n10 \n[노원1종합사회복지관] 방 \n2020.08.11. \n(개인)노원1종합사회복지관 구석 활동 Part.1 / 청소 \n2 \n2 \n1년 자원봉사학교 캠페인 \n[노원1종합사회복지관] 방 \n3 \n2020.08.12. - 2020.08.13. \n(개인)노원1종합사회복지관 구석 활동 Part.1 / 청소 \n년 자원봉사학교 캠페인 \n6 \n8 \n2020.08.12. \n(개인)동대문구자원봉사센터 \n환경교육 및 환경보호 캠 페인 \n2 \n10 \n8. 교과학습발달상황 \n[1학년] \n경희고등학교 \n2025년 11월 20일 10/26 반 \n6 \n번호 17 \n이름 \n서현승 \n이 \ngov.kr \n정부24",
    "문서확인번호: 1763-6098-4150-6899 (신청인: 서현승) \n1학기 \n2학기 \n교과 \n과목 \n단위 원점수/과목평균 성취도 석차 단위 원점수/과목평균 \n수 (표준편차) (수강자수) 등급 수 (표준편차) \n성취도 석차 (이수자수) 등급 \n사회 (역사/도 \n한국사 \n3 \n65/58.6(24.1) A(273) 5 3 \n57/58.1(24,0) \nA (262) 5 \n덕포함) \n국어 \n국어 \n4 \n58/62,4(20.5) C(273) \nCO \n6 \n4 \n64/68.0(21.6) \nB(262) 6 \n수학 \n수학 \n3 \n43/36.8(21.4) C(273) 4 \n3 \n44/44.2 (23,5) \nD(262) \n5 \n영어 \n영어 \n3 \n82/58.9(24.2) A(273) 3 \n3 \n90/61.4(24.8) \nA (262) \n2 \n사회(역사/도 \n[통합사회 \n4 \n78/73.6(15.1) B(273) 5 \n4 \n88/77.1(19.7) \nA (262) \n4 \n덕포함) \n과학 \n통합과학 \n4 \n66/61.3(23.9) A(273) 5 \n4 80/69.5(22,0) \nA (262) \n5 \n과학 \n과학탐구실험 \n1 88/76.4(14.3) A(273) \n3 1 98/78.5(19.4) \nA(262) 1 \n기술·가정/제 \n2외국어/한문/ 진로와 직업 교양 \n1 \nP \nP \n1 \nP \nP \n기술·가정/제 \n2외국어/한문/ 중국어 I 교양 \n2 61/65, 5(24.7) C(123) \n이수단위 합계 \n25 \n25 \n과목 \n세부능력 및 특기사항 \nсл \n5 \n2 77/60, 3(25,4) B(116) 4",
    "한국사: (1학기) 장영실에 대한 보고서를 작성함. 자격루와 같은 장영실의 발명품에 대해서 탐구하기 위해 다양함 참고 자료 를 활용하여 자격루가 그 이전의 조선 물시계의 단점을 해결한 방법을 다른 나라의 물시계가 해결한 방법과 비교하고, 혼천의 가 어떤 우주관을 기반으로 만들어졌는지, 측우기의 특이한 형태가 무슨 이유에서 탄생하게 된 것인지 조사함. (2학기) 김홍 집을 주제로 설정한 모의재판 활동에 증인 역할로 참여함. '번역 오하기문' 등 다양한 책을 참조하여 김홍집 내각이 어떻게 붕 괴되었는지, 김홍집이 여러 나라의 신문물들을 들여오려 한 행적들과 단발령을 실시한 것에 대해 관련 내용을 탐색함. 검사 가 증인을 반대 심문하는 내용이 앞에서 증언한 바와 연관성이 있게 만들기 위해 먼저 혼자서 반대 심문 내용을 짜본 후 조원 들과 같이 그 내용을 검토하여 완성하는 등 활동에 적극적으로 참여함. 활동 후 역사적 인물을 파악하기 위해서는 계보적 접 근이 필요함을 이해함.",
    "국어: 수업에 참여하려고 열심히 노력한 학생임. 문학의 갈래 단원에서 서정, 서사, 극, 교술 갈래의 특징들을 배운 후, 특정 갈래의 작품을 다른 갈래로 바꿔 쓰는 수행평가에서 성실한 자세로 임하였음. 또한 설득하는 글쓰기 수업에 관심을 많이 보였 음. 이 수업 전까지, 어떤 주제에 대한 자신의 의견을 주장함에 있어 직관적인 느낌을 위주로 글쓰기를 하던 버릇이 있었음. 그러나 이 수업을 통해 좀 더 논리적인 의견을 내기 위해서는 충분한 자료 조사가 필요하다는 것을 깨닫게 되었음. 이에 신문 기사, 유튜브 동영상, 인터넷 백과사전 등을 참고하여 관련 자료를 찾아 보고 자신의 생각을 가다듬었음. 이에 전보다 훨씬 좋은 논증 구조를 세울 수 있었음. \n경희고등학교 \n2025년 11월 20일 11/26 반 \n6 \n번호 17 이름 서현승 \n비고 \n(KOR \ngov.kr \n정부24",
    "문서확인번호: 1763-6098-4150-6899 (신청인: 서현승) \n과목 \n세부능력 및 특기사항",
    "수학: '00수학저널 활동 (2018.3.2.-2018.7.23.)'의 일환으로, 통계활용보고서 '고등학교 1학년의 책 분야 선호도 조사'를 연구함. \n(평가) \n이 학생의 보고서 연구 동기는 요즘 학생들의 삶에 책이 차지하는 공간이 줄어들어, 학생들에게 관심을 받으면서도 유익할 종 류의 책을 학교에 비치하기 위해 책의 분야를 정리하고 싶었던 것임. 보고서 연구내용은 학생들의 각 진로 과정에 따라 선호 하는 특정 분야의 책, 교사들이 학생들에게 권하는 특정 분야의 책, 앞의 두 내용의 결과의 비교임. 설문대상은 인근지역 K고 등학교 학생들(남자: 약 80명)임. 연구 방법은 설문조사임. 학생이 배운 주된 내용은 진로과정과 책의 관심분야 간의 연관성 이 절대적이지 않다는 것과 자신이 원하는 책만 읽는 것이 아닌 다른 책들도 필요한 만큼은 읽는 것이 좋다는 것임. 보고서 연구의 한계점은 설문조사지의 관리가 힘들었고 조사 당시 학생들의 부재가 많았기에 1학년 전체를 대상으로 설문조사를 하 지 못하여 자료의 부정확성의 우려가 있다는 것임.",
    "영어: 2학기 영어교과반장으로서 교사의 수업준비 및 수업의 면학분위기 조성에 앞장섬. 질문을 던졌을 때 나오는 학생의 대 답을 통해 이 학생이 영어기초실력이 탄탄하다는 것을 느낄 수 있었음. 호기심이 있어 모르는 내용은 수업 중에 꼭 손을 들고 질문하는 기특한 학생임. '나이와 뇌 건강의 관계'에 관한 지문을 읽고, 관련 내용을 주제로 영문 보고서를 작성하여 발표함. 주제를 뒷받침하는 사례를 풍부하게 제시함으로써 자신의 의견을 설득력 있게 전달하는 한편, 이후의 토론에서 각자의 의견 을 종합하여 유의미한 결론을 도출함. 보고서 작성 및 토론 과정 전반에 걸쳐 '문장 구성'과 '내용 전달'의 측면에서 특히 두드 러짐. 이러한 능력을 꾸준히 연마한다면, 보다 영어다운 글을 완성하는 데 탁월한 실력을 발휘할 수 있을 것으로 전망함. 아 울러 어려운 내용은 선생님에게 질문하거나 친구들과 함께 토의하여 완벽히 이해하고자 노력하는 등, 학습에 대한 열의와 수 업 태도에 비추어 장래의 발전 가능성 또한 매우 높음. \n(1학기)통합사회 : 모둠활동으로 주어진 창업 프로젝트에 참여하여 포터 매니지먼트 사업에 대해 제안함. 히말라야와 같은 험 난한 산악지대에 안전하게 등반하기 위해서는 포터의 도움이 절실한데, 전문성 있는 포터들을 하나의 회사에 소속시켜 체계 적으로 관리하며 소비자들에게 포터 이용에의 접근성을 높이고자 함. 기존 사업의 문제점을 분석하고, 아이템을 구체화할 때 의 상용화 가능성에 대해 생각해보고 창업 비용을 마련하기 위한 방법에 대해 조사하는 등 창업 절차의 복잡성을 알고 기업가 정신을 발휘해 보는 계기가 됨. \n(2학기)통합사회 : 국제 사회에서 나타나는 갈등과 협력의 사례를 통해 국제 사회 행위 주체의 역할을 이해함. 특히 모둠별로 국제 분쟁을 알리는 뉴스 만들기 (쿠르드족 분쟁)를 진행하며 다양한 국제분쟁의 원인과 전개 과정, 해결 방안 등에 대해 알게 \n됨. 지구촌 구성원으로서 평화의 중요성을 알고 외교적 관점에서 바람직한 국제 관계의 방향을 탐구하는 계기가 됨.",
    "통합과학: 태양광발전기가 작은 공간에서 요긴하게 쓰일 수 있음에도 불구하고 태양광발전기가 설치되어 있는 건물들이 많이 보이지 않는 것에 호기심을 가지게 됨. 어떤 이유에서 많이 활용되지 않는 것인지 알아보기 위하여 논문 '태양광발전 시스템 이 설치된 학교건물의 신재생에너지 공급비율 증가방안에 관한 연구'와 '건축물 신재생에너지원의 이용 현황 및 문제점 분석' 을 읽고 보고서 '태양광 발전을 가장 효율적으로 하는 방법'을 작성함. 이를 통해 태양광 발전을 더욱 효율적으로 만드는 방법 에 대해 알 수 있었고, 그러한 발전에 있어 가장 좋은 태양광발전기 배치는 무엇일지에 대해 발표하였음. 이후 기존에 태양광 발전을 관리하는 시스템을 개선하여 태양광발전의 관리를 효율적으로 할 수 있도록 연구해보고 싶다는 생각을 함.",
    "과학탐구실험: 일반적으로 물에 진한 커피 원액을 넣을 때 커피가 퍼지는 속도가 달랐던 기억이 생각나 커피 원액이 퍼지는 속도가 물의 온도에 따라 다른 것인지 궁금해져 탐구활동을 수행함. 탐구활동 과정을 통해 기체의 확산 속도는 매질이 기체일 때 가장 빠르고 액체, 고체순으로 느리고, 또한 온도가 높을수록 확산속도는 빨라진다는 조사 결과로 부터 동일한 매질인 액 체속에서 온도가 높을수록 퍼져나가는 확산 속도는 점점 빠르기 때문에 물의 온도가 높을수록 커피는 빠르게 퍼져나갈 것이 라는 사실을 알고, 이를 논리적으로 설명할 수 있는 학생임. \n경희고등학교 \n2025년 11월 20일 12/26 \n반 \n6 \n번호 17 이름 서현승 \ngov.kr \n정부24 \n과목",
    "문서확인번호: 1763-6098-4150-6899 (신청인: 서현승) \n세부능력 및 특기사항 \n진로와 직업: '나만의 선거 포스터 만들기', '나를 객관적으로 알아보기(직업 흥미 검사와 직업 적성 검사를 실시하여 각각의 결과에 따른 추천 직업들을 보고 그 중 마음에 드는 직업 세 개를 선택 이유와 같이 뽑아보는 활동)', '감정을 통해 보는 나’ 등의 활동들을 통해 나를 전체적으로 이해할 수 있게 되어 후의 활동들을 하는 데에 도움이 됨. \n(1학기)중국어 I: 수업 내용을 경청하고, 발표를 많이 하려고 노력함. 중국어를 처음 배우는 것이라 많이 힘들어 할 것이라 는 예상과 달리 수업에 집중하여 중국어에 관한 지식을 넓히고 있음. 매 시간마다 바른 자세로 다른 학생들의 모범이 됨. (2학기)중국어 I: <중국 IT 사업 내가 먼저 덤벼 보기>를 읽고 IT 시장에 대해 더 깊은 지식을 쌓고자 하는 자신의 동기와 감 상, 그리고 앞으로의 계획에 대해 상세하고 성실하게 작성함. 중국인들의 관계 형성의 중요성을 깨닫고 시장 성장과의 연관 성에 대해 생각함. 다양한 외국 IT 회사들을 살펴보며 배경지식을 쌓을 계획을 세움. \n중국어에 대한 이해도와 흥미, 관심이 상당히 높은 수준임. 중국어 수업에서 항상 진중하고 착실한 태도로 임하는 모습이 인 상적임. 모르는 부분에 대하여 질문하는 것을 두려워하지 않고 교사의 상호작용에 적극적으로 임하는 모습이 돋보임. 중국어 \n자기소개에서 발음 중 성조 부분을 어려워하는 듯 했으나 노력하여 점차 개선되는 모습을 보여줌. \n성실한 자세로 진로 독서 수업에 참여하며 진로탐색의 중요성을 인식함. 함께 읽기 활동에 적극적으로 참여하며 자신의 생각 을 논리적으로 표현하기 위해 노력함. 읽기 활동 후 주어진 문제에 대해 스스로 답을 찾기 위해 고민하였으며 이를 한 편의 완성된 글로 종합하여 제시하였음. \n<체육 · 예술〉 \n1학기 \n2학기 \n교과 \n과목 \n비고 \n단위수 \n성취도 \n단위수 \n성취도 \n체육 \n체육 \n2 \n2 \nA \n예술 \n음악 \n2 \nA \n2 \nA \n예술 \n미술 \n1 \nA \n1 \nA \n이수단위 합계 \n5 \n5 \n과목 \n특기사항 \n(1학기)체육: 동료학생들과 헬스모임을 만들어 파워고무밴드, 매트 및 아령등을 갖고 나와 상하체 및 복근 운동을 꾸준하게 하고 있으며 단단해 지고 건강해 지는 자신의 몸을 보고 매우 만족해 함. \n(2학기)체육: 농구 골밑슛과 레이업슛 성공률을 높이기 위해 부단한 연습을 하였으며 체력을 아끼지 않고 최선을 다해 경기 에 임하는 모습을 보임. 심폐소생술을 연습하면서 심장의 압박위치 및 자세를 정확하게 할 수 있으며 잘 해냄. \n(1학기)음악: 음악 장르의 구분이 없이 여러 장르의 음악을 듣는 것이 음악을 이해하는 능력을 높인다고 생각하기 때문에 아 리스토텔레스의 에토스 이론은 잘 못된것이라고 자신의 의견을 발표함. 이 과정에서 타인에 의해 음악을 감상하는 것이 아닌 자신이 직접 고른 음악을 듣고 생활할 수 있는 자유가 있어야 한다고 이야기 함. \n교가, 응원가를 정확한 박자와 음정으로 자신있게 노래했으며 이태리의 칸초네인 O sole mio를 원어로 노래할 수 있음. 모둠활동인 '컵타 만들기'에서 음악 선정, 리듬 창작, 악보 제작, 실제 연주까지의 모든 과정에 참여함. 이 모둠 활동을 통해 \n경희고등학교 \n2025년 11월 20일 13/26 반 \n6 \n번호 17 이름 서현승 \ngov.kr \n정부24 \n과목",
    "문서확인번호: 1763-6098-4150-6899 (신청인: 서현승) \n협동심과 리듬감이 향상됨. \n특기사항 \n학급단위 교내음악행사에서 리코더로 '샹젤리제'를 연주함. \n(2학기)음악: 이 학생은 고등학생을 가르친다는 느낌보다는 대학생을 가르친다는 생각이 듦. 음악적인 지식이 또래보다 풍부 하고 말을 할 때도 예의바르며 상대방의 말을 잘 경청하기 때문임. 수업 시간에 늘 열심히 참여하며 모범적인 모습을 보임. 음악적인 지식 뿐 아니라 음악사에 관심이 많고 음악사를 하며 그 시기의 우리나라 역사와 연관지어 폭넓게 이해하는 모습이 눈에 띔. \n(1학기) 미술: 팝아트 자화상 작품 제작 시, 인물얼굴의 비례에 있어 얼굴 좌우의 1:1의 법칙과 이마, 눈썹, 코끝, 턱 사이의 1 :1:1의 법칙에 대한 교사의 질문에 적극적인 발표력을 보임(2018.03.16.). 팝아트의 작품특징에 대한 자신의 의견을 적극적 으로 발표하는 자기주도적 미술학습능력이 뛰어나며, 팝아트자화상 작품 제작 시, 팝아트의 특징을 살려서 인물 눈의 홍채, 동공, 빛반사 되는 하이라이트 부분, 코의 콧구멍과 콧망울을 잘 표현함 (2018.03.23.). 흙판 테두리의 틀을 벗어난 전통문 양을 조형미를 살려서 창의적으로 표현하였으며, 상황에 따른 점토의 특성을 이해함으로써 평면상의 형상을 입체적으로 조각 하는 테라코타 부조를 완성함 (2018.06.22.). \n(2학기) 미술: 사물공감 일러스트 작품계획서 작성 시, 자신이 대신 목소리를 내주고 싶은 사물을 선택하여 보는 사람으로 하 여금 공감을 일으키도록 사물의 사연을 창의적으로 상상하여 표현하였고, 도화지 화면에서 '사물'이 '목소리'와 어울릴 수 있 도록 구도를 깊이 생각하고 배치하여 스케치함으로써 작품제작을 꼼꼼히 계획함 (2018.09.07.). 스트링아트 제작 시, 실을 이용하여 자신만의 패턴을 아름답게 만들어 감으로써 직관적인 사고를 창의적인 사고로 발전시킴 (2018.12.14.). \n[2학년] \n교과 \n과목 \n1학기 \n2학기 \n단위 원점수/과목평균 성취도 석차 단위 원점수/과목평균 성취도 석차 비고 \n수 (표준편차) (수강자수) 등급 수 (표준편차) (이수자수) 등급 \n국어 \n언어와 매체 \n5 \n79/68.9(23.0) B(245) 5 \n국어 \n문학 \n5 75/70.3(22.0) \nB(245) 5 \n수학 \n[수학 I \n4 49/39.2(18.9) B (245) \n4 \n수학 \n수학II \n4 34/37.4(20.6) B(245) 5 \n수학 \n미적분 \n50/39.5(22.5) B(168) 4 \n수학 \n확률과 통계 \n4 \n51/37.7(22.2) B(245) 4 \n영어 \n영어 I \n94/65,2(24.0)| A(245) \n2 \n영어 \n영어 독해와 작 \n문 \n4 92/51.1(26.0) A(245) 2 \n과학 \n물리학 I \n과학 \n화학 I \n3 \n과학 \n지구과학 I \n3 52/58.1(17.2) B(145) 6 \n69/62.6(18.5) A(166) 5 \n3 74/64, 4(19.5) B(113) 4 \n3 \n68/58.5(18.7) A(143) 4 \n3 \n68/59,2(23.5) A(164) 5 \n3 67/57.4(22.7) C(113) 4 \n경희고등학교 \n2025년 11월 20일 14/26 반 \n6 \n번호 17 이름 \n서현승 \n이 \ngov.kr \n정부24",
    "문서확인번호: 1763-6098-4150-6899 (신청인: 서현승) \n1학기 \n2학기 \n교과 \n과목 \n단위 원점수/과목평균 성취도 석차 단위 원점수/과목평균 성취도 석차 수 (표준편차) (수강자수) 등급 수 (표준편차) (이수자수) 등급 \n비고 \n기술.가정/제 \n2외국어/한문/ 정보 교양 \n2 91/81.8(12.3) B(245) 3 2 87/77.3(13.9) B(245) 4 \n이수단위 합계 \n28 \n28 \n과목 \n세부능력 및 특기사항 \n언어와 매체: 변화하는 시대에 자신만의 방식으로 자기소개를 함으로써 자신만의 표현 방법을 살릴 수 있다는 점, 자신의 진 로를 명확히 설정할 수 있고 또한 자신의 진로에 적합한 매체를 선택해서 제작하면 그 분야에 대한 이해도가 더욱 생긴다는 점의 의미가 있기 때문에 글이 아닌 자기소개서 만들기 수행평가를 제안함. 글만 작성하는 일반적인 자기소개서가 아니라 광 고형태의 자기소개서를 만들자는 것임. 즉 포스터, 사진, 영상, 그림이 들어 있는 일상의 광고와 같은 형태로 제작하자는 내 용이었음. 상상력이 기발한 의견을 제안함. \n결국 수행평가 제안 내용을 모두 아우르는 방법을 택함. 그것은 주제를 정하고 그것을 잘 드러낼 수 있는 매체를 활용하여 결 과물을 만드는 것임. 이후 각자가 원하는 주제에 맞게 조를 재편성해서 진행함.",
    "문학: 김훈의 '남한산성'을 한 학기 한 권 책읽기로 함. 40분의 수업시간 동안 읽고 10분 간 정리하는 시간을 가짐. 학생은 추 위로부터 고통을 받으면서도 희망을 바라보는 김상헌의 모습에서 깊은 인상을 받음. 설령 돌파구가 없는 경우라고 하더라도 김상헌과 같이 희망을 품고 사는 것이 모든 사람들에게 필요하다고 생각함. 그리고 책을 읽으면서 다음과 같은 것에 궁금증이 생겨 스스로 찾아보고 생각함. 그것은 당시 남한산성의 피해는 어느 정도였을까임. 독서를 완료한 후 영화 남한산성과 소설 남한산성의 내용을 비교함. 마지막으로 나비효과처럼 병자호란의 결과를 변화시킬 수 있는 역사적 가정에 대해 말해보는 시 간을 가짐. \n수학 I: 수학저널활동 (2019.3.1.-2019.7.19)의 일환으로 수학I 논문 분석 보고서 '수학적 귀납법에 대한 학생들의 이해 에 관하여'를 작성함. 이 학생의 보고서의 연구 동기는 학교에서 수학적 귀납법을 배울 때 왜 이러한 증명 과정을 거치는 것인 지 이해하지 못했기 때문임. 보고서의 주된 내용은 수학적 귀납법의 문제점을 비추는 선행 연구들, 연구 과정, 결과, 느낀 점 임. 작성 방법은 문헌연구이며, 보고서 작성을 통해 알게 된 점은 오랫동안 문제가 있었음에도 해결되지 않은 문제들이 존재 하고, 그런 문제들이 해결방안이 현재 보이지 않는다고 하여서 연구할 가치가 없는 것은 아니라는 점임. \n수학II: 수학저널활동(2019. 3. 1.-2019.7.19)의 일환으로, 미적분을 익히는 것에 어려움을 느껴 '고등학교 미적분에서의 수학화 교수·학습에 관한 연구'라는 문헌에서 프로이덴탈의 수학화 교수·학습론을 토대로 현행 고등학교 미적분 교수·학 습의 문제점을 찾고, 그 해결 방안을 찾는 활동을 함. \n학생들이 미적분의 개념을 익히고 활용하는 것에 어려움을 느낀다는 결과가 나와 학생들을 돕기 위해 미적분 개념의 역사적 근원 문제와 프로이덴탈의 수학화 과정, 딘즈의 다양성의 원리를 통해 알아낸 수학화 교수·학습 단계를 통해 분석 관점을 추 출함. 또한 7차 수학과 교육과정 고등학교 수학II 교과서의 미분 영역을 교육부가 제시한 미적분 교육의 목적을 기반으로 분 석한 후, 두 분석을 적용한 수I 미적분 영역의 교수·학습 자료 개발 방향을 정리함. \n해외 교과서를 표본으로 삼지 않아 국내의 상황과 비교하지 못한 것이 한계였음.",
    "미적분: 수학저널활동(2019. 8. 12.-2019.12.27.)의 일환으로, 미적분보고서 '소프트웨어를 이용해 적분 계산의 정확도 및 \n경희고등학교 \n2025년 11월 20일 15/26 반 \n6 \n번호 17 이름 서현승 \n(KOR) \ngov.kr \n정부24",
    "문서확인번호: 1763-6098-4150-6899 (신청인: 서현승) \n과목 \n시간 분석하기'를 작성함. \n세부능력 및 특기사항 \n(평가)이 보고서의 작성 동기는 소프트웨어로 계산한 적분의 정확도와 계산 시간이 적분 방법과 데이터 타입에 따라 달라지 는가에 대한 호기심에서 출발함. 학생의 보고서의 주된 내용은 적분할 방정식 선정 및 예상되는 프로그램 오류 예방, 적분 구 간 설정과 3가지 적분 방식에 따른 방정식의 적분, 한계점에 관해 서술함. 학생이 보고서 작성을 통해 알게 된 점은 적분에도 여러 가지 계산법이 있고 그에 따른 오차 범위, 계산 시간도 달라지기에 전문 작업 등에 필요한 적분 방식은 신중히 택해야 할 필요가 있다는 것에 관해 서술함. 학생은 보고서의 연구의 한계점으로 처음에 설정한 적분 구간이 부족해 보여 구간을 늘 린 다음 해 보았는데, 구간을 옮기거나 크거나 작게 하였을 때 결과가 어떻게 나오는지에 대해 연구하지 못한 점을 제시함. \n확률과 통계: 통계활용활동 (2019. 8. 12.-2019.12.27.)의 일환으로, 통계보고서 '투표 사전 조사의 정확도를 높이는 방법'을 \n작성함. \n(평가)이 보고서의 작성 동기는 어떻게 투표 사전 조사가 실제 결과와 비슷하게 나오는지에 대한 궁금증을 제시함. 학생의 보고서의 주된 내용은 과거 조사가 어떤 방식으로 진행되었는지, 그 방식의 문제점은 무엇이고 그것을 해결할 수 있는 다른 방식들에 대한 것임을 제시함. 학생이 보고서 작성을 통해 알게 된 점은 인명 전화번호부를 이용한 1번의 조사 대신 RDD 방 식으로 3번 시간대를 다르게 조사하는 것이 참여율이 높다는 점과 읍면동만 출구조사를 하는 방식보다 한 시도 내 지역을 지 난 총선 때 한나라당 비례대표 득표율 순으로 정렬해 투표소를 추출하는 방식이 더욱 고른 결과가 나온다는 점이라고 서술함. 보고서의 연구의 한계점으로는 2010년도 투표 사전 조사 때만 연구가 진행되어 이후의 사전 조사에 이러한 방식이 보일 수 있는 단점에 관해 연구를 진행하지 못했다는 점을 제시함. \n영어 I: A Spark in You를 읽고 더욱 넓은 교우 관계를 유지하고 친구들에게 도움이 되는 사람이 되고자 노력했던 일에 대 해 영작함. 도움이 필요한 친구들에게 먼저 다가가고 주변 사람들에게 친절하게 대하면서 스스로도 마음이 따뜻해졌던 경험 을 to부정사의 다양한 용법을 정확하게 사용하여 표현함. Make Rules for a Happier Classroom 활동에서 교실 내 쓰레 기통 등 위생 문제를 발견하고 이를 해결하기 위한 방법을 제시함. 명령문을 적절히 사용하여 자신의 의견을 명확히 나타냄. Green Cities around the World를 읽은 후, 세계 각 도시의 환경 정책에 궁금증을 가지고 심층적으로 조사하여 발표함. 독일의 프라이부르크에서 보도, 자전거, 대중교통과 같은 친환경적 이동 수단을 장려하는 정책을 시행하여 자가용 소유 비율 이 낮아진 사례를 잘 설명함. 환경 관련 어휘를 숙지하고 있고 문맥상 알맞은 위치에 적절히 사용함. Making a Better Wo rld의 방법으로 차별 금지, 상호 협조, 타인 존중 등의 가치에 대해 관계대명사를 사용하여 표현하였고, 선행사와 동사의 수 일치가 정확함. \n영어 독해와 작문: Paulo Coelho의 글을 읽고 등위접속사 and로 연결된 병렬구조와 생략된 어구에 대해 잘 이해하고 설명 함. Noam Chomsky의 글을 읽고 지문에 나온 어휘의 파생어/유의어/반의어를 찾아 연상작용을 활용하는 방법으로 어휘력 을 향상시켰으며 상황에 따른 단어의 다양한 쓰임을 이해함으로써 글의 내용을 정확하게 파악하는 능력을 키움. Dispute R esolution에 관한 지문을 읽고 문장의 성분을 잘 파악하여 분석하였으며 목적어를 취하는 동사를 구분하여 설명함. 큰 그림 만을 목표로 하는 것보다 목표에 차근차근 다가가는 것이 현재의 성과를 위한 동기 부여에 긴요하다는 글을 읽고 장래 희망하 는 공학자로서의 자세에 대해 생각하는 계기가 됨. 학급의 영어부장으로서 학생들의 영어능력 향상을 위한 학습 지원 뿐 아니 라 필요한 제반 행정적 봉사를 성실히 수행하는 모습이 인상적임. 한결같은 자세로 학습 활동에 적극적으로 참여하여 학급의 학습 분위기를 제고하는데 많은 도움을 줌. 꼼꼼하게 필기하고 정리하여 복습하는 등 영어 능력 향상을 위한 꾸준한 자세가 돋보임. \n물리학 I: 공기 저항이 있을 때 물체의 두 요소가 낙하 속도에 어떠한 차이를 만들 수 있을지 궁금해 실험을 직접 기획하고 물리 자율탐구 보고서를 작성함. 실험 설계 과정은 A4 용지 1장과 A4 클리어 파일의 한 면에 동전을 덧댄 후 따라 오려낸 다 음, 파일의 다른 한 면은 A4 크기 그대로 잘라낸 후 그리고 동전 면적으로 된 종이, 플라스틱, 금속(동전)의 세 물질을 2m \n경희고등학교 \n2025년 11월 20일 16/26 반 \n6 \n번호 17 이름 서현승 \ngov.kr \n(KOR) \n정부24 \n과목",
    "문서확인번호: 1763-6098-4150-6899 (신청인: 서현승) \n세부능력 및 특기사항 \n높이에서의 낙하 시간을 5번 측정하고, A4 용지 면적인 종이, 플라스틱(A4 파일)의 두 물질도 같은 조건으로 측정함. 실험 결과 동전 면적의 경우 금속과 플라스틱은 떨어지는 시간이 같았고, 종이는 그보다 느렸음. A4 용지 면적의 경우도 마찬가지 였음. 플라스틱의 경우 크기가 달라져도 차이가 없었으나 종이의 경우 차이가 컸음. 꺾이기 쉬운 재질일수록(종이〉플라스틱= 금속) 공기 저항에 영향을 크게 받아 낙하 시간이 더 길고 잘 꺾이지 않는 재질(플라스틱, 금속)은 면적이 바뀌어도 받는 영 향의 차이가 크지 않으나, 잘 꺾이는 재질(종이)은 크다는 것으로 결론지음. 물리학 [에서 배웠던 가속도의 개념을 실험을 통 해 복습해볼 수 있었고 향후 A4 용지 크기의 금속판이 2m 높이에서 떨어지는 시간을 구하여 이 실험의 결과와 비교하는 실 험을 하고자함. \n화학 I: 탄소 동소체 풀러렌의 구조를 직접 만들어보는 시간을 가짐. 책으로만 배우던 미시의 세계인 탄소화합물을 직접 만 들어 보면서 화합물의 구조에 대한 이해력을 높일 수 있었으며, 현대 사회에 사용되고 있는 다양한 탄소 화합물에 대하여 관 심을 갖게 되는 계기가 되었으며 앞으로 탄소 화합물을 연구해 보고 싶다는 포부를 갖게 됨. \n알칼리 금속인 나트륨을 물과 반응시켜 금속의 반응성을 직접 관찰해 보는 실험을 수행함. 눈으로 직접 나트륨 금속의 뛰어난 반응성을 보며 매우 놀람. 또한 금속이 녹아들어간 용액에 페놀프탈레인 용액을 넣고 색 변화 관찰을 통하여 수용액의 액성 도 파악하는 시간을 갖게 됨. 폭발적인 반응 실험을 수행하며 화학 실험은 재밌지만 안전한 실험을 위해 항상 집중해야 한다 는 것을 배움. \n물의 전기분해 실험을 수행함. 물이 수소와 산소가 되어 나오는 모습을 보며 매우 신기해하는 모습을 보임. 생각보다 간단한 방법으로 물을 분해 할 수 있다는 것에 화학실험이란 것이 본인과 멀리 있는 것이 아니라고 생각함. 수소기체와 산소기체를 확인하는 과정에서는 순간적으로 해야 하는 과정에 실수하여 정확하게 확인하지는 못했지만 실험에 열정적으로 참여하고 즐 거워하는 모습을 보임. \n지구과학I: 수업을 경청하고 참여하는 자세가 남다른 학생으로 수업 시작전에 배울 내용이 무엇인지 전체 개요를 교과서로 예습하는 모습이 보기가 좋았음. \n우리나라의 지진발생 정도가 적지 않음에도 불구하고 지진 교육 및 건물설계의 취약성에 대해 궁금증을 느끼고 탐구보고서를 \n작성함. 지진 발생과정과 역사적 지진발생사건 및 현재 우리나라의 지진 관련 방침과 보완점에 대해 설명함. \n최근 우리나라에서 나타나는 이상기후 현상인 폭염에 대해 탐구함. 2018년 폭염과 열대야로 인한 우리나라의 기록적인 전기 사용량을 태양광발전을 이용한 전기생산으로 충당한것으로 분석함. 하지만 태양광발전은 25°C의 온도에서 가장 효율적이므 로 폭염이 일반화될수있는 현시점에서 태양광발전이 안전한 폭염전력소모량 대비책으로 보기 어려울것으로 보았으며, 학생 은 이러한 태양광발전의 어려움을 극복하기 위해 태양의 궤도에 따라 위치와 각도를 조정하는 발전기를 개발하고자함. 은하의 모양이 다양하다는 것을 배운 후 여러 은하를 관찰하여 형태, 색, 광도 등에 따라 분류함. 절대 연령을 방사성 동위 원 소의 반감기로 측정하는 것에 흥미를 갖고 유물이나 지질의 절대 연령 측정에 쓸 수 있는 반감기를 가진 원소들에 대해 조사 함.",
    "정보: '정보과학 분야의 여러가지 직업 알아보기' 활동에서 미래 사회의 자동화 시스템은 로봇이 주도하게 될 것이라고 예상 하며 로봇 공학자를 조사하여 발표함. 로봇이 지배하는 미래가 아닌, 로봇을 활용하는 미래를 만들기 위해 노력이 하는 것이 중요하다고 주장함. 몸이 불편한 장애인들의 거동과 생활을 보조하는 기계를 만들고 싶다는 포부를 밝힘. 사이버 폭력의 문 제점으로 익명성을 주장하고 예방하는 방법으로는 가해자를 신고할 경우 빠르게 찾을 수 있는 클린한 사이트에서 활동함을 대안으로 제시함. 또한 우베 부제 기자가 진행한 해킹 실험의 동영상을 보고 실천 가능한 개인 정보 보안 방법에 대해 알아보 고 실천하려고 노력함. 'Python 프로그램 만들기'에서 While 문으로 다트 게임 점수 합이 20점 이상이 될 때까지 얻은 점수 를 출력하는 반복 구조 프로그램을 만듦. Python으로 음식 칼로리와 영양분과 섭취량 칼로리 소비를 위해 운동량을 알려주 \n경희고등학교 \n2025년 11월 20일 17/26 반 \n6 \n번호 17 이름 서현승 \ngov.kr \n정부24 \n과목",
    "문서확인번호: 1763-6098-4150-6899 (신청인: 서현승) \n세부능력 및 특기사항 \n는 앱만들기를 추후 활동으로 제시함. 드론 코딩 애플리케이션을 이용한 '드론 장애물 통과하기' 활동에서도 모둠 구성원과 협력하여 실제 비행에서의 오차를 수정하는 등 성실하게 참여함. \n<체육 · 예술〉 \n1학기 \n2학기 \n교과 \n과목 \n비고 \n단위수 \n성취도 \n단위수 \n성취도 \n체육 \n운동과 건강 \n2 \nA \n2 \nA \n예술 \n미술 \n1 \nA \n1 \nA \n이수단위 합계 \n3 \n3 \n과목 \n특기사항 \n(1학기) 운동과 건강: 체육 수업에 적극적으로 참여 하였으며, 플라잉디스크 경기에서는 팀원들과 팀웍을 바탕으로 인화 단결 하여 최선을 다한 결과 개인의 성과보다 팀과 팀원을 먼저 생각하고 팀의 의미와 소중함을 깨달은 학생임. (2학기) 운동과 건강: 플로어 볼 조별 경기 시 본인이 직접 골을 넣는 것에 집착하지 않고 패스 플레이를 적극 펼침으로써 팀 원들이 함께 경기를 즐기고 서로 협동할 수 있도록 솔선수범한 학생임. \n(1학기)미술: 페이퍼 레이어링 아트 작품 제작 시, 작품의 완성보다 작품을 완성해나가는 과정이 더 중요함을 깨닫고, 차시별 로 스스로 진행계획을 세워서 높은 집중력으로 작품의 제작과정을 즐기는 자세를 보여주었고, 작품의 구성 및 칼질 등의 과정 에서 예상치 못한 어려운 상황이 닥쳐도 문제를 인식하고 스스로 고민하여 해결하려는 자기주도적인 진행 모습이 인상적이었 으며, 입체조형능력 및 배색의 효과적 활용능력이 우수한 작품으로 완성하여 타의 모범이 됨. 풍경 점묘화 아이디어 선정에 있어 적극적으로 자기주장을 표현하면서도 다른 의견을 수렴하고 조율하여 다 함께 만족할 수 있는 방법을 모색하려는 모습 이 인상적이었음. 작품 제작 시, 풍경 사진을 토대로 대상을 추가하고 수정하는 편집 과정을 거쳐서 투시화법을 이용하여 화 면구성 능력이 돋보인 스케치를 하였고, 물감을 활용하여 면봉과 붓으로 점을 찍어 색감을 다양하게 표현함으로써 계절감을 잘 살림. \n(2학기) 미술: 스탬프화 작품 제작 시, 조각한 스탬프 이미지에 어울리는 색의 잉크를 미적감각을 통해 선택하였고, 켄트지 위에 표현된 색들이 서로 상호작용을 함으로써 색상 대비가 다양하게 나타남. 완성된 작품 안에 자신의 아이디어와 제작 의도 가 잘 구현되었음. \n[3학년] \n1학기 \n교과 \n과목 \n국어 \n화법과 작문 \n2 \n국어 \n독서 \n2 \n수학 \n기하 \n3 \n단위 원점수/과목평균 성취도 석차 단위 원점수/과목평균 \n수 (표준편차) (수강자수) 등급 수 (표준편차) (이수자수) 등급 \n74/67,3(20.6) \nA(244) 5 2 \n32/60.1(29.2) \nC(245) 6 \n91/76.4 (21,1) A(244) 4 2 76/61.0(31.7) A(245) 5 \n77/71,2(21.1) B(149) 5 3 \n2학기 \n성취도 석차 \n비고 \n44/43.7(33.4) C(149) 5 \n경희고등학교 \n2025년 11월 20일 18/26 반 \n6 \n번호 17 이름 \n서현승 \ngov.kr \n정부24",
    "문서확인번호: 1763-6098-4150-6899 (신청인: 서현승) \n1학기 \n2학기 \n교과 \n과목 \n단위 원점수/과목평균 성취도 석차 단위 원점수/과목평균 성취도 석차 수 (표준편차) (수강자수) 등급 수 (표준편차) (이수자수) 등급 \n비고 \n수학 \n영어 \n수학과제 탐구 2 \n영어II \n76/66.9(19.0) B(244) 4 2 \n73/50.6(27.2) \nB(245) 4 \n4 \n92/71,8(20,2) A(244) 3 \n영어 \n진로 영어 \n62/44,9 (27.9) \nB(245) 4 \n사회(역사/도 \n생활과 윤리 \n3 \n58/64.2(20.5) B(232) \nCO \n6 \n3 \n30/40.7(20.2) \nD(233) \nсл \n5 \n덕포함) \n과학 \n물리학 II \n3 \n68/59.2(22,2) B(85) \n5 \n3 58/42.9(26.4) \nC(85) 4 \n과학 \n화학II \n3 \n54/60,0(16.7) \nC(116) \n5 \n3 \n28/32,9 (23.5) \nC(116) 5 \n과학 \n화학 실험 \n2 \n51/64, 3(17.8) \nC(64) \nCO \n6 \n2 \n14/45.0(29.1) \nC(64) 7 \n체육 \n스포츠 생활 \n2 \n89/90.6(7.7) \nA(245) 5 \n2 \n91/77.5(9.4) \nA(245) 2 \n기술·가정/제 \n2외국어/한문/|논술 교양 \n1 \nP \nP 1 \nP \nP \n기술·가정/제 \n2외국어/한문/ 프로그래밍 교양 \n2 91/83.3(15.4) A(73) \n4 \n2 54/36.6(23,1) C(73) 3 \n이수단위 합계 \n29 \n과목 \n29 \n세부능력 및 특기사항 \n화법과 작문: IT기술 및 프로그래밍에 관심이 많은 학생임. 이번 COVID-19의 확산에 따라 IT기술 및 로봇, 인공지능 분야 가 발전하는 모습을 목격함. 따라서 COVID-19 상황에서 관심을 가지고 살펴본 현상 발표하기에서 'COVID-19 이후의 산 업변화'를 주제로 삼음. 발표의 내용은 다음과 같음. 인간은 외부환경의 변화에 적극적으로 대응해왔음. 이번 COVID-19의 경우도 마찬가지임. COVID-19은 인류의 일상을 낯설게 바꾸었고, 낯섦을 일상으로 바꿨음. 그리고 산업 전반의 변화를 야 기시킴. 대표적인 것이 온라인 서비스 산업의 급격한 성장을 들 수 있음. 그리고 무인 시스템, E-Sports, 스마트팩토리도 빼놓을 수 없음. 이러한 산업의 변화는 COVID-19이 종식이 되더라도 시속될 것임. 왜냐하면 한 번 방향이 정해지고 그것에 \n익숙하다보면 관성이 유지될 것이기 때문임. 발표를 보면서 관련분야에 대한 학생의 생각과 열정을 확인할 수 있었음.",
    "독서: '우리'를 위한 기술, 적정 기술'을 읽고 비용의 문제로 여러 편리한 기술의 혜택을 받지 못하는 사람들이 있다는 사실 을 알게 됨. 저소득층을 위해 매우 적은 가격에 효과를 볼 수 있는 기술들이 발달해야 한다는 중요성을 느낌. 또한 적정 기술 의 개발 사례 중 놀이기구와 펌프를 접목시켜 일반 펌프보다 효율은 낮지만 놀이와 물을 둘 다 잡으려는 시도가 좋았으나 아 이들이 노는 것을 생각 못 하고 물을 기르는 데만 집중하여 적정 기술을 고안할 때 유의해야 될 사항들에 대해 생각해 봄. '로봇에도 인권이 있을까'를 읽고 우리가 로봇을 완벽히 통제할 수 있는지와 로봇도 인권을 가질 수 있는지에 대해 조사한 언 론, 연구 등을 탐색해 봄. 탐색활동 후 인간의 권리와 로봇을 권리를 둘 다 인정하려면 상충되는 부분이 생긴다는 문제가 있 음을 알게 됨. 또한 로봇에게 인권을 주는 것이 로봇의 인공지능이 직접 문제를 일으켰을 때 책임을 물을 수 있으니 찬성한다 \n경희고등학교 \n2025년 11월 20일 19/26 반 \n6 \n번호 17 이름 서현승 \n이 \ngov.kr \n정부24",
    "문서확인번호: 1763-6098-4150-6899 (신청인: 서현승) \n과목 \n세 부 능력 및 특 기 사 항 \n는 시각과 로봇 제작자가 책임을 회피할 수 있으니 반대한다는 시각이 나뉘는 것을 보고 로봇 관련 윤리 논쟁은 쉽게 끝나는 이야기가 아니라는 것을 깨달음.",
    "기하: 과거에는 카메라로 사진을 찍으면 사진이 조금 왜곡되었다는 사실에 왜 그런지 의문을 가지게 됨. 이를 탐구해보고자 어떤 이유로 사진에 왜곡이 일어날 수 있는지와 왜곡을 보정하는 방법을 팀 프로젝트의 주제로 선정함. 특히, 오늘날의 카메 라에도 왜곡 현상이 일어나는 경우가 있어 왜곡의 근본적인 이유와 해결 방법이 무엇인지 자세히 알아보는 것이 필요하다며 연구의 필요성을 강조하는 모습을 보임. 먼저 렌즈의 왜곡 현상의 발생 원인을 이해한 후, 선행연구들 중 이차곡선을 활용하 여 카메라의 렌즈의 왜곡 현상을 조사한 연구들을 분석함. 또한 포토샵을 통한 이차곡선이 활용된 보정을 직접 시연해봄. 카 메라와 사진 보정에도 수학이 빠지지 않는다는 사실에 일상 속에 수학이 있다는 것을 느끼는 모습을 보임. 교과서나 도서에 단편적으로 실려있는 교과개념과 실생활과의 관계를 살펴보며 성취감을 느꼈음을 밝힘. 추후 왜곡 보정 방법 중에 여러 종류 의 렌즈를 겹쳐 왜곡을 최소화하는 방법을 조사하는 것에 의지를 보임. \n수학과제 탐구 : 학생들이 수학 교육을 이해하기 쉽게 하는 방법을 알아보고자 시도한 사례가 기존에 많이 없었다는 것을 알 게 되어 관심을 가짐. 이에 '수학 교육과 프로그래밍의 융합 효과'를 주제로 삼아 수학 보고서를 작성함. 현대에 소프트웨어 분야가 크게 발전했음에도 불구하고 오늘날 수학교육에는 과거와 다름없이 단방향적인 교육을 유도하는 PPT 같은 발표 자료 제작용 소프트웨어만 사용되고 있다는 걸 깨달음. 여러 프로그래밍 언어를 수학 교육에 접목한 연구들을 통해 학생들이 프로 그래밍으로 수학교육을 진행했을 때 학생들의 문제 해결력과 풀이 검증 능력이 향상될 수 있다는 사실과 학생과 교육자가 서 로 묻고 답하는 쌍방향적 교육 환경이 만들어진다는 사실을 증명하여 프로그래밍을 접목한 수학교육이 효과가 있음을 보여 줌. \n영어 II: Role Model Research 활동으로 롤모델인 '오빌 라이트'에 대한 에세이를 작성함. 위키피디아 인물사전을 참고한 후, 롤모델의 어린 시절과 역경을 극복한 사례, 비행기 발명에 성공할 수 있었던 이유에 대해 개요를 작성함. 이를 기초로 In tro, Main body, Conclusion이 유기적으로 연결된 에세이를 완성함. 특히 롤모델의 부딪친 또 다른 역경에 대해 추가로 내용을 작성하는 적극적인 태도로 교사에게 강한 인상을 남김. '오빌 라이트'의 일생을 문법 오류없이 영어로 나타내는 데 어 려움이 있었으나, 영문 사이트의 문장을 참고하여 단어 및 어법의 적절성을 판단함. 성공을 위해선 아이디어뿐만 아니라 실 천 · 노력 · 끈기가 필요하다는 점을 느끼고 영어 능력 면에서 성장했다는 소감문을 제출함. \n. \nReading&Comprehension 활동으로 어휘 지식을 쌓고, 긴 문장을 선별하여 주어, 서술어, 목적어 부분을 표시하며 독해연 습을 하는 등 독해 속도를 늘리려고 노력함. \n프로그래밍 분야 진학을 희망하는 학생으로 '과학만능주의의 문제점'을 주제로 한 영어지문을 읽고 사람이 만든 과학이론도 결함이 있을 수 있다는 점을 깨닫고 여러 학문적 관점을 포용해야 한다는 점을 배웠다는 소감을 밝힘. \n진로 영어: 탄탄한 문법지식을 바탕으로 어법상 틀린 부분을 찾는 유형의 지문을 풀이하는 수업시간에 그 누구보다도 정확하 게 정답과 정답인 이유를 설명함. \nWrite your SOP(Statement Of Purpose) 활동으로 영문 자기소개서를 작성함. Brainstorming 단계에서 본인을 묘사 하는 영어단어로 tenacious(끈질긴), motivated(의욕적인) 등을 정리하고, 3년간의 교내활동 중 주요 업적을 정리함. Wr iting 단계에서는 입학사정관의 마음을 사로잡는 Hook으로 도입문단을 작성하고, 프로그래밍 분야에서 요구하는 Comput er literacy(프로그래밍 언어 활용 능력), Leadership (리더십)이 잘 드러나는 교내활동, 위기극복 사례를 중심으로 본론을 \n작성함. Revision 단계에서는 이렇게 작성한 초안(draft)을 진학지도 선생님과 담임선생님, 영어교과선생님과 함께 읽어 보고 피드백을 반영해 수정함. \n생활과 윤리 : 인공지능 분야에서 발생할 수 있는 과학 기술의 사회적 책임에 대해 관심을 보임. 인공지능의 발달로 인간의 삶 \n경희고등학교 \n2025년 11월 20일 20/26 반 \n번호 17 이름 서현승 \n6 \ngov.kr \n정부24 \n과목",
    "문서확인번호: 1763-6098-4150-6899 (신청인: 서현승) \n세부능력 및 특기사항 \n이 편리해졌으나 로봇이 반란을 일으킨다는 내용을 담은 영화 '아이, 로봇'을 접함. 이후 영화에서 제시된 것처럼 과학 기술 에 대해서 두려워해야만 하는가에 대한 의문을 갖게 됨. 이를 주제로 보고서를 작성함. 과학 기술 지상주의와 과학 기술 혐오 주의에 대한 내용을 중심으로 자신의 의견을 전개함. 과학 기술 지상주의에 대한 사례로 1학년 때 읽었던 '멋진 신세계'의 내 용을 제시함. 과학 기술 혐오주의에 대한 내용으로 기계 파괴 운동인 '러다이트 운동'의 내용을 제시함. 두 사례를 제시 후 과 학 기술 지상주의와 과학 기술 혐오주의 모두 한쪽 측면만 강조하는 치우친 주장이라는 것을 알게 됨. 이에 생활과 윤리 시간 에 배웠던 과학 기술에 대한 중립적 접근이 요청됨을 떠올림. 이때의 중립은 산술적 중립이 아님을 바탕으로 과학 기술에 대 한 성찰에 근거한 과학 기술의 사용이 필요함을 강조함. \n물리학 II: 물리학시간에 집중력이 높은 상태로 수업에 참여하는 학생 중 한명임. 모르는 것이 있을 때에는 항상 질문을 통해 해결하며 반복적인 학습으로 자기 것으로 만드는 역량을 보유함. 프로그래머가 되기 위해 부단히 노력중이며 뛰어난 물리적 문제해결력, 사고력, 탐구능력은 이를 이루는데 큰 강점이 될 것임. \n수업시간에 유리관에 연결한 고무마개의 회전운동에 대해 발표함. 등속원운동에 대한 내용을 운동방정식을 활용하여 명쾌하 게 설명함. 등가속도 운동 실험에서 자료 분석자의 역할을 충실히 수행함. 자료들을 검토하고 누락된 부분을 추가하거나 오 류를 수정하는 등 마무리 작업에 힘씀. 전기용량 측정 실험에서 자료 분석의 임무를 이행함. 결과로 나온 값들을 세심하게 정 리하고 표와 그래프로 나타내는 등 모둠원들을 도왔음. \n물리학탐구시간에 게임에서 물리학의 필요성에 대해 발표함. 가상공간을 만들기 위해서는 물리 법칙이 필수적이라는 것을 다 양한 예시들을 통해 설명하여 친구들의 흥미를 자극함. 썰매를 타는 게임에서 물리법칙을 고려하여 렌더링을 하고 파티클을 생성하는 상황을 집중 탐구함. 전문적인 내용들도 알기 쉽게 설명하여 친구들의 호응을 얻어 냈으며 앞으로의 행보가 대단히 기대됨. \n화학II: 교과서에서 액정이 어떻게 화면을 원하는 대로 표현할 수 있는지에 대해 설명하는 글을 읽고 화학 기술이 오늘날의 기계에서 중요한 역할을 할 수 있다는 것을 깨달음. 이에 액정 외에도 기계에 활용될 수 있는 화학 기술들이 궁금해져 조사해 봄. 조사를 통해 2016년 노벨 화학상이 '분자 기계'라는 것을 개발한 사람들에게 주어졌음을 알게 됨. 분자 기계라는 주제에 흥미를 가지게 되어 탐구해보고자 하였으나 관련 논문이 부족하여 기계가 만들어지는 방법과 작동 원리를 이해하는 것에 어 려움이 있었음. 이 문제를 인터넷에 올라와 있는 각종 관련 기사, 지식백과 등을 통해 이해할 수 있었음. 분자 단위로 간단한 자동차와 인공 근육, 심지어 승강기까지 만들 수 있다는 것에 놀랐고 수상자들의 연구를 통해 해당 기술이 점점 발달하고 있 다는 걸 알 수 있었기에 미래에는 이를 활용해 얼마나 작은 기계를 만들 수 있을지, 또 그것이 우리의 삶에 어떠한 영향을 줄 지 생각해봄. \n알콜의 연소열을 측정하는 활동을 하였음. 같은 질량의 알콜도 종류에 따라서 연소열이 다르게 측정됨을 알 수 있었고, 실험 에는 다양한 오차가 존재한다는 것을 알고 실험 오차를 줄일 수 있는 다양한 방법에 대한 조사를 하게 되는 계기가 됨. \n화학 실험 : 화학 전지 실험에 대해 배우면서 다른 종류의 전지에 대해 호기심을 가지게 되어 각각의 특징과 발전에 대해 탐구 해봄. 처음에는 전지의 종류가 예상외로 많아 구별하는 데에 어려움이 있었으나 키트를 이용해 기계를 조립해본 경험과 자동 차 정비소에서 자동차 내부 구조를 파악해본 경험들을 통해 접했던 전지들을 떠올리며 구별할 수 있었음. 탐구를 통해 전지가 아직 현대에 엄청난 발전을 이루진 못하였다는 것을 알게 되어 혁신적인 휴대기기 기술을 위해서는 전기 사용량을 최소화하 는 프로그래밍이 필요하다는 것을 느낌. \n프로그래머를 꿈꾸고 있어 화학실험을 배우면서 프로그래밍과 연관된 화학 분야가 있을지 궁금해져 탐색해봄. 그러한 화학 \n경희고등학교 \n2025년 11월 20일 21/26 반 \n6 \n번호 17 이름 서현승 \ngov.kr \n정부24",
    "문서확인번호: 1763-6098-4150-6899 (신청인: 서현승) \n과목 \n세부능력 및 특기사항 \n분야에 계산화학이 있다는 것을 알게 됨. 컴퓨터를 이용하여 복잡한 화학 반응을 계산하고 연구하는 분야였기에 미래에는 컴 퓨터로 현실의 물리, 화학 법칙 등을 거의 똑같이 구현한 가상 세계가 나올 수도 있겠다는 생각이 듦. \n스포츠 생활: COVID-19 상황에 따른 교육청의 지침으로 수행평가 하나만으로 평가를 봄. 체육수업에 부지런히 참여하는 학생으로 수행평가인 축구리프팅 실력이 저조하였으나 부단한 노력을 통해 좋은 성과를 보임. 8자드리블을 하면서 수차례 땀 을 흘리며 연습하여 인사이드 아웃사이드 드리블 터치감을 익혔으며 리듬감있게 잘하여 등급가산점을 받아서 매우 만족해 함. 또한 축구를 잘하는 동료 학생들에게 잘하는 방법을 코칭받고 지속적으로 노력하는 태도가 칭찬할 만함.",
    "논술: 평소 IT 산업에 관심이 많은 학생으로 오늘날 간편 결제 산업이 폭발적으로 성장하고 있음에 주목함. 스마트폰으로 간 편 결제를 하게 되면서 생활이 매우 편리성이 높아졌다고 생각하고 이에 대해 더 이해해보고자 하여 간편 결제의 역사와 장단 점들을 조사해봄. 현대 여러 나라들이 간편 결제로 편리함을 누리고 있고 그 중 중국은 간편 결제가 생활에 필수가 될 정도로 발달한 것을 알게 됨. 한국의 경우 한동안 공인인증서로 인해 다른 나라와 비교하여 불편한 전자거래 체계를 유지하다가 스 마트폰이 급부상하면서 간편 결제 활성화의 길이 뒤늦게 열림. 이러한 상황에서 여러 업체가 간편 결제 시장에 우후죽순 진출 하여 다른 나라들에 비해 통일성이 없어져 간편함이 무색해지는 문제가 생겼음을 알게 됨. 우리나라에서 간편 결제의 통일성 이 어떻게 이루어질지, 또 어떤 신기술이 간편 결제 시장에 혁신을 일으켜 판도를 바꿀지 예측하여 글을 씀.",
    "프로그래밍: C 언어에 대한 사전지식이 이미 있었으나 기초문법부터 다시 배우는 것에 대해 지루한 내색 한 번 없이 수업에 참여하였고, 잊었던 부분은 없는지 확인해 볼 기회로 여기는 긍정적인 모습이 인상적임. 복잡한 내용에 대해서도 작동 원리 도 더욱더 깊이 이해할 수 있게 되었다는 소감을 제출함. 작동 원리를 이해한 것을 바탕으로 새로운 프로그램을 만들어보면서 코딩 실력이 성장하는 모습을 보임. 수업을 통해 배운 내용을 모두 이해하고 활용도 해 보았기에 수행평가에서 높은 성적을 기대했으나, 활용 과정에서 실수를 한 문제들이 보였음. 이후 학생에게 해당 문제를 틀린 이유를 물어보고 토론하는 과정에 서, 학생은 프로그래밍 수업이 프로그램이 무엇인지를 알아보는 것에서 시작했던 것과 같이 개념과 같은 기초 실력을 다져두 는 것이 전체적인 실력 향상에 도움이 된다는 걸 느꼈다고 함. 또한, 컴퓨터공학과에서는 프로그래밍 언어를 다양하게 활용 할 줄 아는 능력이 매우 중요하기 때문에 여러 활용 방법과 작동 원리를 이해하고 직접 코딩해보고자 노력해야 한다는 것을 깨달았다고 함. 초심을 잃지 않고 지식의 폭을 넓혀갈 미래가 기대되는 학생임. \n<체육 예술 > \n1학기 \n2학기 \n교과 \n과목 \n비고 \n단위수 \n성취도 \n단위수 \n성취도 \n이수단위 합계 \n0 \n0 \n과목 \n특기사항 \n해당 사항 없음 \n9. 독서활동상황 \n경희고등학교 \n2025년 11월 20일 22/26 반 \nCO \n6 \n번호 17 이름 \n서현승 \ngov.kr \n정부24",
    "문서확인번호: 1763-6098-4150-6899 (신청인: 서현승) \n학년 \n과목 또는 영역 \n한국사 \n국어 \n국어 \n영어 \n영어 \n1 \n통합사회 \n통합사회 \n통합과학 \n공통 \n공통 \n문학 \n수학 I \n수학II \n독서활동 상황 \n(1학기) 조선왕조실록(박영규), 한국사 편지 3(박은봉), 우리 문화유산에는 어떤 비밀이 담겨 있을까(한창수) \n(1학기) 달려라 애비(김애란), 눈길(이청준) \n(2학기) 갑을고시원 체류기(박민규), 삼포 가는 길(황석영) \n(1학기) The Old Man and the Sea(Ernest Hemingway), The Secret Garden(Fr ances Hodgson Burnett) \n(2학기) The Outsiders(S. E. Hinton), A Wrinkle in Time(Madeleine L'engle) \n(1학기) 동물농장 (조지 오웰), 멋진 신세계 (올더스 헉슬리) \n(2학기) 개인주의자 선언(문유석), 위대하고 찌질한 경제학의 슈퍼스타들(브누아 시마) \n(1학기) 이중나선(제임스 D. 왓슨), 역사를 바꾼 17가지 화학이야기(페니르 쿠터, 제이 버레슨) \n(1학기) 유클리드가 들려주는 공간도형 이야기 (이지현) \n(2학기) 아프리카의 성자 슈바이처(정지아), 수학 귀신(H. 엔첸스베르거) \n(1학기) 남한산성 (김훈) \n(1학기) 도형이 쉬워지는 인도 베다수학(마키노 다케후미) \n(1학기) 우리 역사 속 수학 이야기 (이장주) \n2 \n확률과 통계 \n(2학기) 30분 통계학(구라타 히로시) \n물리학 I \n지구과학I \n독서 \n영어 I \n생활과 윤리 \n(1학기) 아인슈타인의 생각 실험실(송은영) \n(1학기) 지진(앤드루 로빈슨) \n(1학기) AI의 미래 : 생각하는 기계 (토비 월시), AI Superpowers(Kai-Fu Lee) \n(1학기) A Long Walk to Water(Linda Sue Park) \n(1학기) 대안 없는 대안 원자력 발전(신부용) \n3 \n물리학 II \n(2학기) 물리학 클래식(이종필) \n화학II \n화학 실험 \n(1학기) 공기의 연금술(토머스 헤이거) \n(1학기) 일상적이지만 절대적인 화학지식 50 (헤일리 버치) \n경희고등학교 \n2025년 11월 20일 23/26 반 \n6 \n번호 \n17 이름 \n서현승 \ngov.kr \n정부24",
    "문서확인번호: 1763-6098-4150-6899 (신청인: 서현승) \n10. 행동특성 및 종합의견 \n학년 \n행동 특성 및 종합의견 \n1 \n2 \n3 \n항상 성실하고 강한 책임감을 바탕으로 주어진 모든 일을 성실하고 완벽하게 처리하려고 노력하며, 일 년 동 안 학급에서 정한 등교시간에 한 번의 지각도 없었음. 또한 약속한 일에 대해서는 항상 최선을 다하며 각종 숙 제나 제출사항, 해야 할 일에 대해서 약속한 시일을 어긴 적이 없음. 준법의식이 강해서 학교에서 정한 교칙에 \n어긋남이 없이 착실하고 모범적으로 생활하여, 벌점 없이 학기를 마침. \n굉장히 착실하고 꼼꼼한 학생임. 작은 이야기도 흘려듣지 않고 학교에서 요구하거나 자신이 해야할 일이나 과 제를 매우 꼼꼼하게 관리함. 담임교사가 학급 운영과 관련된 유인물이나 전달사항 등에 대하여 잊어버리거나 빠트리는게 있을 때 마다 이 친구가 항상 알려주고 챙겨주어 도움이 되었음. \n또한, 자기 관리 능력이 뛰어나고 계획성이 있으며 책임감이 강하여 정해진 원칙에 따라 목표를 성실히 추진 해나감. 자신의 주관과 생각이 뚜렷하고 이성적이고 논리적으로 생각함. 공부에 있어서도 자신이 무엇을 원하 는지, 어떤 공부 방식이 맞는지, 어느 부분이 부족한지 등을 명확하게 파악하고 계획적으로 공부하므로 믿고 맡기게 되는 믿음을 주는 학생이었음. \n특히 영어에서 높은 학업성취도와 재능을 보이고 점차 성적이 더 상승하는 모습을 보임. 스스로 영어를 좋아 하고 그래서 열심히 하였으며 그에 상응하는 결과들을 보여줌. 특히 이렇듯 영어분야에서 두드러지는 본인의 실력을 바탕으로 친구들의 부족한 학업을 적극적으로 도와주고, 영작을 해주거나 질문에 대한 답을 조리 있고 명쾌하게 알려주어서, 학급 친구들이 '영어'하면 이 친구를 떠올릴 정도였음. 이러한 학업적 능력을 고려하였 을 때, 외국어 분야에서의 장래성이 매우 높다고 판단함. \n영어를 아주 잘 하는 학생임. 이는 학교의 학생들뿐만 아니라 영어 교사도 인정함. 학생이 영어를 잘하는 것은 \n순수한 학생의 노력임. 학생의 성향을 보면 요령을 피우지 않고 무엇이든 성실히 하는 모습을 볼 수가 있음. 영어 공부에는 왕도가 없다는 말처럼 성실히 하루하루 영어 공부를 한 것이 오늘의 학생을 만든 것임. 학생은 프로그래밍을 잘 함. \n학교 특색 프로그램인 IT 전문 과정을 2년 동안 성실하게 이수함. 따라서 시간이 쌓임에 따라 실력도 차곡차 곡 쌓임. 학생은 이런 실력을 바탕으로 도전하는 것도 즐김. 앱을 만든다든지, 리듬 게임을 만드는 것도 이러 한 도전의 결과물임. 학생은 더 나은 프로그램을 만들기 위해 노력함. 그래서 앞으로의 IT 기술의 변화를 알고 \n싶어 전공심화 프로그램에도 참여함. \n학생은 진로에 대한 소신이 있으며 이를 더욱 구체화하기 위해 진로 탐색을 게을리 하지 않음. 대학탐방을 가 서 직접 체험하기도 하고 최신 전기전자전에 가서 현재의 트렌드와 기술 개발의 정도를 체크하기도 함. 학생은 진솔하고 담백한 성향을 갖고 있음. 그리고 자신이 하는 일에 성실함. 앞으로 진로에 대한 노력과 학생 의 이런 성향은 학생을 더욱 발전할 수 있는 길로 이끌 것임. \n온순하고 밝으며 긍정적인 학생으로 때론 꼼꼼한 모습을 보여주는 착한 아이임. 궁금한 것이 있을 때 항상 질 문을 통해 해결하며 학급운영에도 많은 도움이 되었음. 교사를 신뢰하고 존경하며 교우관계도 매우 좋음. 컴 퓨터 소프트웨어에 대한 열정으로 가득하여 반드시 우수한 프로그래머가 될 수 있을 것 같은 학생임. 컴퓨터 를 통해 무언가 뚝딱뚝딱 만들고 있는 모습이 보기 좋았음. \n학급에서 가장 많은 시간을 IT과정 프로그램에 할애한 소프트웨어 에이스 중 에이스임. 프로그래머로서의 역 량을 기르고자 교과, 비교과 활동에 적극적으로 참여함. 다방면의 교과에서 좋은 성과를 얻었고 특히 돋보이 는 것은 영어실력임. 영어능력이 우수하여 프로그래밍에도 큰 도움이 될 것으로 사료됨. 이는 영어교사도 인 정할 정도임. 예의가 바르고 경청하는 자세를 가지고 있으며 자세가 남다르다는 평가가 있음. \n경희고등학교 \n2025년 11월 20일 24/26 반 \n6 \n번호 17 이름 서현승 \n(KOR) \ngov.kr \n정부24",
    "문서확인번호: 1763-6098-4150-6899 (신청인: 서현승) \n학년 \n행동 특성 및 종합의견 \n3 \n도서관에서 꾸준히 봉사활동을 하여 배려심과 이타심을 기름. 학급에서 강조하는 인성, 성실, 신뢰의 3박자 를 가장 잘 실천하고 있는 학생으로 사소한 일도 꼼꼼하게 끝까지 마무리 지어 믿을 만 함. 다방면의 독서도 \n열심히 하여 배경지식을 쌓았으므로 앞으로 프로그래머로서의 행보가 기대됨. \n경희고등학교 \n2025년 11월 20일 25/26 반 \n6 \n번호 17 이름 \n서현승 \ngov.kr \n정부24",
    "문서확인번호: 1763-6098-4150-6899 (신청인: 서현승)",
    "발급번호: B100000384-2025-002507 \n학교생활기록부 \n성 \n명 \n서현승 \n인적 \n사항 \n주민등록번호 \n020610-******* \n담당부서 \n경희고등학교 \n담당자 전화번호 \n이상걸 \n02-3299-3794 \n위 사람의 학교생활기록부 사본임을 증명합니다. \n2025년 11월 20일 \n烏 \n경희고등학교장 \n경희고등학교 \n2025년 11월 20일 26/26 반 \n6 \n번호 17 이름 \n서현승 \ngov.kr \n정부24"
  ],
  "reading": [],
  "behavior": {
    "grade1": "2",
    "grade2": "3",
    "grade3": "1. 인적사항 \n성명: 서현승 \n학생 \n학과 \n반 번호 \n담임성명"
  },
  "raw_text": "점 \n확 \n인 \n'진본 \n2025/11/20 \n12:37:44 \nKST \n문서확인번호: 1763-6098-4150-6899 (신청인: 서현승) \n학교생활세부사항기록부(학교생활기록부 II) \n졸업 대장 번호 2020-19334 \n구분 \n학년 \n1 \n2 \n3 \n1. 인적사항 \n성명: 서현승 \n학생 \n학과 \n반 번호 \n담임성명 \n4 \n19 \n남현진 \n8 \n18 \n장준혁 \n6 \n17 \n허승환 \n성별 : 남 \n주민등록번호:020610-**** * * \n주소 : 서울특별시 성북구 돌곶이로8길 22, 109동 1303호 (석관동, 래미안아트리치) \n가족 부 \n성명 : \n생년월일: \n상황 모 \n성명 : \n생년월일: \n특기사항 \n2. 학적사항 \n2018년 2월 8일 경희중학교 제3학년 졸업 \n2018년 3월 2일 경희고등학교 제1학년 입학 \n2021년 2월 3일 경희고등학교 제3학년 졸업 \n특기사항 \n3. 출결상황 \n학년 수업일수 \n결석일수 \n지각 \n조퇴 \n결과 \n특기사항 \n질병 미인정 기타 질병 미인정 기타 질병 미인정 기타 질병 미인정 기타 \n1 \n190 \n개근 \n2 \n191 \n1 \n경희고등학교 \n2025년 11월 20일 1/26 반 \n6 \n번호 17 이름 \n서현승 \nKOR \ngov.kr \n정부24 \n문서확인번호: 1763-6098-4150-6899 (신청인: 서현승) \n결석일수 \n지각 \n학년 수업일수 \n3 \n179 \n결과 \n질병 미인정 기타 질병 미인정 기타 질병 미인정 기타 질병 미인정 기타 \n1 \n조퇴 \n특기사항 \n원격수업일수 75일 \n4. 수상경력 \n수상명 \n등급(위) \n수상연월일 \n수여기관 \n참가대상(참가인원) \n영어경시대회 \n대상(1위) \n2018.04.23. \n학업능력경진대회 (영어) \n동상(4위) \n2018.06.11. \n경희고등학교장 \n경희고등학교장 \n1학년 (276명) \nEnglish Essay대회 \n동상(4위) \n2018. 07.09. \n경희고등학교장 \n영어 청취 대회 \n학업능력경진대회 (영어) \n동상(3위) \n2018.09.14. \n경희고등학교장 \n금상(2위) \n2018. 11. 28. \n교과우수상(영어, 과학탐구실험) \n2018. 12. 28. \n경희고등학교장 \n경희고등학교장 \n영어경시대회 \n은상(2위) \n2019. 04. 24. \n경희고등학교장 \n1학년 중 참가자(253 (명) \n1학년(253명) \n1. 2학년 중 참가자(48 3명) \n1학년(241명) \n1학년 \n2학년 중 참가자(245 \n명) \n학업능력경진대회(영어) \n은상(2위) \n2019.06.24. \n교과우수상(영어 I) \n2019.07.19. \n학업능력경진대회 (영어) \n금상(1위) \n2019.11.04. \n독서경시대회 \n동상(4위) \n2019. 11. 18. \n경희고등학교장 \n경희고등학교장 \n경희고등학교장 \n경희고등학교장 \n2학년 (227명) \n수강자 \n2학년 (210명) \n2학년 (246명) \n과학 탐구대회 (물리학 I) \n금상(2위) \n2019. 12. 23. \n경희고등학교장 \n과학 사고력 경진대회 (지구과학) \n장려상(5위) \n2020.02.05. \n경희고등학교장 \n교과우수상(영어 독해와 작문) \n영어경시대회 (독해부문) \n2020.02.05. \n금상(1위) \n2020.06.23. \n밝은사회 선행상 \n2021, 01, 29. \n교과우수상(스포츠 생활) \n2021, 02.03. \n정근상 \n2021. 02.03. \n경희고등학교장 \n경희고등학교장 \n경희고등학교장 \n경희고등학교장 \n경희고등학교장 \n2학년 중 참가자(143 명) \n2학년 중 참가자(242 명) \n수강자 \n3학년 (245명) \n전교생 (723명) \n수강자 \n3학년(245명) \n경희고등학교 \n2025년 11월 20일 \n2/26 반 \n6 \n번호 17 \n이름 \n서현승 \ngov.kr \n(KOR \n정부24 \n문서확인번호: 1763-6098-4150-6899 (신청인: 서현승) \n5. 자격증 및 인증 취득상황 \n<자격증 및 인증 취득상황> \n구분 \n명칭 또는 종류 \n번호 또는 내용 \n취득연월일 \n발급기관 \n해당 사항 없음 \n<국가직무능력표준 이수상황> \n능력단위 \n학년 \n학기 \n세분류 \n이수시간 원점수성취도 \n비고 \n(능력단위코드) \n해당 사항 없음 \n6. 진로희망사항 \n학년 \n진로 희망 \n1 \n로봇공학자 \n2 공학자, 프로그래머 \n3 앱 프로그래머 \n7. 창의적 체험활동상황 \n희망 사유 \n봉사활동에서 지체장애인 분들을 보며 '이분들의 삶을 조금이나마 편리 하게 만들 순 없을까'라는 생각이 들었고, 가사로봇과 같은 로봇에 관심 이 생김. 신체적 한계로 인해 생활에 제약을 받는 분들을 도울 수 있는 로봇 개발에 욕심이 생겼으며, 신체 보조 기구 역할을 하는 로봇, 의수, 의족 등을 개발하거나 사람에게 한계가 있는 구조 현장에서 활동하는 구조 로봇 등도 만들고 싶다는 포부가 생김. \n기계 조립하는 것을 좋아함. 그래서 그 분야의 지식을 쌓아 새로운 것을 만드는 것을 좋아함. 요즘은 무엇을 만들기 위해서는 기계만 알아야 하 는 것이 아니라 기계를 움직이는 소프트웨어도 중요하다는 것을 알게 됨. 이에 IT전문과정, 전공심화 등 관련 지식을 쌓기 위해 노력하고 있 으며 프로그래밍 분야에 대한 매력도 많이 느끼고 있음. 앞으로 기계와 소프트웨어 두 분야를 접목해서 생활을 더욱 풍족하게 해줄 수 있는 것 을 만들어보고 싶어함. \n고등학교 3학년 동안 프로그램과 앱을 만들면서 프로그래밍 자격증을 취득하거나 프로그램과 관련된 연구를 해왔으며, 직접 기계를 만든 후 자신의 프로그램을 적용해보는 등 프로그래머에게 필요한 활동을 하며 실력을 길러옴. 달력, 메모, 알람 등 생활에 소소하게 필요한 기능을 한 곳에 모은 앱을 만들어 많은 사람이 쓰도록 해보고 싶다는 포부를 보임. \n경희고등학교 \n2025년 11월 20일 \n3/26 반 \n6 \n번호 17 이름 서현승 \ngov.kr \n정부24 \n경희고등학교 \n문서확인번호: 1763-6098-4150-6899 (신청인: 서현승) \n창의적체험활동상황 \n학년 \n영역 \n시간 \n특기사항 \n자율활동 \n88 \n1 \n동아리활동 \n30 \n2학기 영어 교과반장 (2018.08.13.-2019.02.28.)으로서 매 수업시간 전에 교사 수업 준비를 도왔으며, 수행평가의 예문을 번역하는 일, 교사의 전달사항을 학급에 전달하는 등 교사와 학생들의 연계역할을 성실히 수 행하고, 수행평가와 수업 활동에 있어서 준비물을 챙기거나 수업 운영을 도움. 수업활동에 어려운 친구들을 도와주고 활발하고 밝은 수업 분위리 조성에 힘썼으며, 드러나지 않게 교사와 학생의 편의를 도와서 좋은 평가 를 받음. \n우리나라 민주화 운동의 역사를 바로알기 위하여 학급별 테마소풍 (2018. 04.06)으로 광화문 일대의 민주화 운동과 관련된 장소를 탐방함. 이를 위 하여 사전에 4.19혁명과 6월 민주항쟁의 배경과 과정을 조사하고 광화문 지역의 4.19혁명 기념탑, 세종대로 사거리, 서울시의회 본관, 대한민국 역사 박물관 등의 경로를 지정하여 탐방함. 수업시간에 지식적으로 접했 던 민주화 사건들에 대하여 직접 장소를 둘러보고 사료를 접하며 당시의 상황과 민주화 운동의 의미에 생각하는 시간을 갖음. 역사의 현장을 찾아 다니면서 과거와 현재를 비교하며 민주주의의 소중함을 느꼈고 민주주의 에서 참여의 의미와 책임감에 대하여 성찰하는 계기가 됨. \n학급별 테마 소풍으로 덕수궁을 체험하면서 우리나라 고궁에 관심이 커졌 고 일제 시대의 우리 역사를 더 깊이있게 알아봐야 겠다는 각성을 가지고 광화문 일대의 8군데의 역사 유적지 중에서 몇 군데를 선택하여 탐방하는 체험 프로그램인 '궁사다망(2018.10.10.)'에서 창덕궁과 창경궁, 종묘를 둘러보는 일정을 직접 기획함. 임진왜란 이후 소실과 재건의 반복으로 고 충을 겪고 일제강점기에는 궁궐의 위엄마저도 추락해버린 우리 고궁의 역 사를 대면하면서 수업시간에 단순히 지식적으로 다루었던 자신의 모습에 깊이 반성함. 우리 문화재와 고궁의 소중함을 느끼게 되었고 왕들의 업적 과 함께 건축물의 화려한 모습을 후손에게 온전한 모습으로 물려주어야겠 다고 다짐함. 무엇보다도 역사에 대해 진심으로 관심을 갖고 애착을 가져 야겠다고 다짐함. \n심폐소생술 교육 (2018.08.29)에 참여하여 이론수업뿐만 아니라 실제 체 험실습을 진행함. 주위에 갑작스럽게 심정지 환자들이 발생할 수 있다는 것과 제대로 된 응급 처치가 이루어지면 많은 생명을 살릴 수 있다는 점에 서 심폐소생술의 중요성을 알게 됨. 가슴압박부터 인공호흡까지 심폐소생 술의 절차와 제세동기의 사용법을 알게 되었고, 심폐소생술 이외에 다양 한 응급상황에서의 응급 처치에 대해 배울 수 있었으며 생명의 소중함을 느낌. \n(수학세미나동아리) (30시간) 수학세미나 동아리 활동의 일환으로 '서울에 서 빚을 지고 집을 빌렸을 때 몇 년 안에 갚을 수 있는가'를 작성함. 이 보 \n2025년 11월 20일 4/26 반 \n6 \n번호 17 이름 \n서현승 \n(KOR \ngov.kr \n정부24 \n1 \n문서확인번호: 1763-6098-4150-6899 (신청인: 서현승) \n창의적체험활동상황 \n학년 \n영역 \n시간 \n특기사항 \n진로활동 \n봉사활동 \n52 \n고서의 작성 동기는 서울의 집값이 계속해서 오르고 있다는 인터넷 기사 를 보고 흥미를 가지게 되었기 때문임. 보고서의 주된 내용은 서울에 집을 사기 위해 지는 빚과 생계유지를 위한 여러 가지 지출, 그리고 그를 메우 는 소득의 값 설정, 빚의 이자를 고려했을 때 갚는 데 걸리는 시간 계산임. 학생은 보고서 작성을 통해 서울의 집값이 다른 지역들과 비교하였을 때 지나치게 높다는 것과 빚을 갚는 시간을 단축하기 위해 생계유지를 위한 지출을 줄이는 경우가 많아 관련 대책이 시급하다는 것을 알게 됨. 이 보 고서의 한계점은 계산에 들어가는 요소들의 값이 고정되어 있고, 어떤 요 소들은 계산에서 생략되어 실제 경우와의 오차가 예상되는 것임. 통계청 에 기록되어 있는 자료들을 주로 참고함. \n도서관에서 도서정리및 환경정화 활동을 함. 활동을 통해 책을 정리하며 책이 남녀노소 여러 사람들에게 실제로 읽혀지는 모습들을 많이 보면서 책이 상상에 나래를 펼쳐주는 소중한 존재라는 것을 느껴 소설, 동화책 등 에 대한 관심이 커졌음. \n초등학생 학습 지도 봉사 활동을 함. 아이들의 순수한 말과 행동들을 보며 이런 아이들이 올바르게 자랄 수 있도록 미래에 어른으로서 지켜주어야 겠다는 생각이 듬. 뿐만 아니라, 아이들을 가르쳐주면서 선생님들이 느낄 어려움에 공감하였으며, 반면 누군가를 가르쳐주는 기쁨과 행복 또한 느 낄 수 있었음. \n~ \n• 201 \n1학기 미래 인재 프로그램(소프트웨어 인재, 2018.03.30.-07.27./30 시간), 2학기 미래 인재 프로그램(소프트웨어 인재, 2018. 08. 31. 9.01.02./30시간)에 참여함. 1학기에는 '스크래치' 프로그램을 학습하 면서 코딩과 프로그래밍 언어에 대한 기초 과정을 공부하였으며, 처음에 는 코딩이 어렵게 느껴졌지만 설정한 대로 실행하고 계산값을 내놓는 과 정이 신기하였고, 코드 하나를 어떻게 활용하는지에 따라 결과가 완전히 달라진다는 점에서 흥미를 느낌. 코딩에서 중요한 건 특정 명령어의 기능 을 외우는 것보다 어떻게 그 기능들을 이어서 원하는 결과를 도출해내는 것이라는 걸 알 수 있었음. 2학기에는 '마이크로소프트 비주얼 스튜디오' 라는 프로그램을 접하면서 코딩과 C언어에 대한 심화 과정을 공부하였으 며, 프로그래밍 언어 중에서도 C언어에 대해서 자세히 학습함. 창의적으 로 활용하여 프로그램의 적은 명령으로도 많은 프로그램을 담을 수 있음 을 깨달았고, 4차 산업혁명 시대에는 창의적으로 사고하는 능력이 코딩 학습에 매우 중요한 영향을 미칠 것이라고 예상함. \n학교특색사업인 IT전문과정 프로그램 코어 교과 과정 (2018. 03. 26.-201 8.07.28./강의 72시간, 2018.08.25.-2018.12.29. /강의 72시간)에 참 여하여 Eclipse를 통한 Java 코딩을 하는 법을 배움. 처음으로 접해 보 \n경희고등학교 \n2025년 11월 20일 5/26 반 \n6 \n번호 17 이름 서현승 \n(KOR \ngov.kr \n정부24 \n2 \n1 \n문서확인번호: 1763-6098-4150-6899 (신청인: 서현승) \n창의적체험활동상황 \n학년 \n영역 \n시간 \n특기사항 \n자율활동 \n92 \n동아리활동 \n32 \n는 코딩이였기에 이해가 되지 않는 부분이 상당히 있었으나, 수업에서 중 요한 것들을 필기하고, 보고서를 쓰면서 그동안 배운 것들을 정리해보며 배운 것을 복습하면서 코딩에 대한 이해도가 높아지게 됨. 다른 공부에도 이와 비슷한 방법을 적용하면 효과적일 것이라는 점도 배울 수 있었음. J ava 외에 다른 언어들이 어떤 까닭으로 존재하고 있는지가 궁금해지기도 하여 미래인재 프로그램에서 배운 코딩 언어들과 Java의 공통점과 차이 점, 장단점들에 대해 알아봄 (컴퓨터 메모리에 접근하는 정도 등). \n'4차 산업혁명과 소프트웨어'(2018.12.13.) 특강에 참여함. 셀프 주유소 의 그림자 노동이나 왓슨의 환자 진단 등 현실에 이미 실현된 것들이 많다 는 것을 깨달았고, 동시에 4차 산업혁명으로 인한 변화를 겪을 때가 얼마 남지 않았다는 것을 느낌. 미래에 사라지거나 새로 생겨날 직업들에 대해 알아보고 현재 자신의 진로가 이러한 사회 변화에 어떤 영향을 받을지 생 각해보는 계기가 되었으며, 체계적으로 계획해야 겠다고 다짐함. \n2년 동안 IT 전문 과정을 성실히 이수함. 학생은 자신이 배운 지식들을 활 용하여 멋진 작품을 만들고자 4박 5일간 특정장소에서 진행하는 IT 캠프 에 참여함. 학생은 조원들과 협업해서 만들고 싶은 것으로 리듬게임을 생 각함. 리듬게임을 아두이노를 기반으로 JAVA로 코딩을 하여 노래가 나 오면 박자에 맞춰 버튼을 누르는 방식이었음. 그리고 타이밍에 따라 점수 를 차등 배정함. 학생은 주로 프로그래밍을 담당함. 완성된 결과물을 보고 교수님께서 호평을 하심. 학생은 IT 캠프에 참여하며 다음과 같은 것을 느꼈다고 함. 먼저는 무엇을 만들지 같이 공유를 하고 각자가 잘 할 수 있 는 것을 분담해서 하게 되면 적은 시간에 빠른 속도로 정확히 목표를 달성 할 수 있다는 것임. 그리고 다음은 1년 6개월 넘게 배워 온 지식들을 실제 로 적용해서 결과물을 만들어낼 때의 성취감은 그 어떤 것보다 강렬했다 는 것임. \n학생은 영어 능력이 우수하며, 이는 친구들뿐만 아니라 영어 교사까지도 칭찬을 하는 부분임. 따라서 학생은 학급의 영어 독해와 작문 교과반장을 역임함. 학생은 독해와 작문 교과반장으로서 영어 독해를 어려워하고 과 제를 귀찮아 하는 친구들을 위해 그들에게 때로는 멘토로서, 때로는 친구 로서 알려주고 격려해줌. \n(P. E. (PhysicsEssay))(32시간) 평소 기계를 좋아하여 기계를 움직이는 기술에 물리학이 필요하다는 사실을 알게 된 후 물리학을 자세히 배우고 싶어 이 동아리에 참여하게 됨. 동아리 활동 중 박물관을 구경하면서 여러 동식물의 구조를 살펴보며 물리학적으로 왜 그런 구조를 가지게 되었는 가 생각해봄. 그중 특히 단풍나무 씨앗의 형태가 씨앗이 멀리 퍼지는 것에 \n경희고등학교 \n2025년 11월 20일 6/26 반 \n6 \n번호 17 이름 \n서현승 \ngov.kr \n정부24 \n2 \n문서확인번호: 1763-6098-4150-6899 (신청인: 서현승) \n학년 \n영역 \n시간 \n창의적체험활동상황 \n특기사항 \n봉사활동 \n진로활동 \n45 \n얼마나 도움을 주는지 호기심을 가지게 되어 관련 실험을 직접 해봄. 조 원을 구성하여 총과 관련된 물리학에 대해 조사해보는 활동도 함. 이를 통 해 총알이 물에서는 밀도로 인해 공기 중에서보다 느리고 짧게 나아간다 는 사실 등을 배울 수 있었음. 활동을 마친 후 다른 사람이 진행한 실험을 참고하는 것보다 직접 실험하는 것이 자신이 원하는 여러 가정에서 실험 해볼 수 있고 예상치 못한 오차 요소를 발견할 수도 있다는 점에서 더 좋 다고 느낌. 또한 조별 활동에서 자신이 먼저 적극적으로 참여하는 것이 다 른 조원들도 적극적으로 참여하게 도와준다는 것도 배움. \nIT 전문과정 중 앱트랙 과정을 선택해서 1년 간 수강함. 1학기에는 앱 만 드는 프로그램 안드로이드 스튜디오에 대해 배움. 주로 기초지식과 실습 을 활용하여 프로그램에 대해 익힘. 그리고 2학기에는 1학기 때 배운 내 용을 바탕으로 앱을 실제로 만들어 봄. 학생은 친구들과 함께 퀴즈앱을 만 들어 보기로 함. 인터넷으로 조사해 퀴즈 500개를 만듦. 그리고 이를 분 야별, 또는 랜덤으로 풀 수 있게 구성함. 앱을 만든 후 자신감이 생겨 다음 에는 앱 공유 사이트에 올릴 수 있는 상용앱을 만들고 싶어함. \n학생은 프로그램 제작을 좋아함. 그리고 실력을 키워서 실용적인 프로그 램을 만들고 싶어함. 하지만 프로그램만 만든다고 해서 끝나는 것이 아니 라 시대가 어떻게 변하고 있고, 무엇을 원하고 있는지 등 트렌드를 잘 파 악해야 하기 때문에 이에 대해 탐구하고자 전공심화 프로그램 '4차 산업 혁명과 ICT 트렌드'(2019. 7. 29. -2019. 8. 1. (12시간))에 참여함. 강의를 들으며 4차 산업혁명의 주요 기술인 인공지능, 빅데이터, 보안, 드론, V R, AR 등에 대해 배움. 이번 강의를 들으며 과학 기술의 발전 속도가 빨 라짐에 따라 끊임없이 스스로 학습하는 노력을 기울여야 하고 트렌드의 변화를 주시해야 한다는 것을 깨달음. 그리고 4차 산업혁명의 전망을 생 각하면서 지금부터 무엇을 준비해야 할지를 고민함. \n융합과학실험 캠프 (태양광 자동차 만들기)에 참여하여 반도체와 전동기 의 물리적인 원리를 탐구함. 특히 발전기와 전동기의 차이를 정확하게 발 표하여 친구들의 큰 호응을 얻음. 물리적인 탐구능력이 뛰어나 원활한 실 험을 진행하는 모습이 기특함. \n[학급학술제] \n3 \n자율활동 \n48 \n평소 관심이 많았던 AI가 우리의 삶에 어떤 영향을 미치는지를 서적과 논 문, 인터넷으로 탐색한 후 보고서를 작성하여 발표함. 'AI의 미래: 생각 하는 기계'란 책을 통해 인공지능의 종류와 활용되는 분야, 또 미래에 어 \n경희고등학교 \n2025년 11월 20일 7/26 반 \n6 \n번호 17 이름 서현승 \ngov.kr \n정부24 \n3 \n문서확인번호: 1763-6098-4150-6899 (신청인: 서현승) \n학년 \n영역 \n시간 \n동아리활동 \n봉사활동 \n창의적체험활동상황 \n특기사항 \n7 \n떤 직업이 유지되고 사라질지 알아봄. 과거 산업혁명이 일자리를 증가시 킨 것에 반해 4차산업혁명은 감소시킴을 알게 됨. 또 논문 'AI가 인간을 '해치는 날'과 영어원서 'AI Superpowers'를 통해 AI가 삶의 질을 향상 시켜주는 장점이 많은 반면, 자율주행 자동차 등의 오작동과 같이 사고 발 생 위험이 있고 그 사고의 책임자는 AI 제작자인가 AI 자체인가에 대해 윤리적 논란이 있음을 파악함. 이러한 AI가 불러올 부작용을 최소화하는 등 인간과 인공지능이 조화롭게 공존하는 방법을 연구, 개발하고자 하는 포부를 가짐. \n[그들은 왜 노벨상을 탔을까?] \n트랜지스터 발명으로 노벨상을 받은 사람들의 발명 과정을 조사해 발표 함. 트랜지스터의 발명은 기계들의 소형화와 저전력 소비로 이어져 다양 한 전자 제품의 발달로 이어졌음을 알게 됨. \n[한걸음 더] \n3D 프린터가 시간이 오래 걸리고 비싼 탓에 기계가 적어 여러 명이 쓰다가 지체된다는 단점을 3D펜으로 극복할 수 있다는 사실을 깨달음. \n(물리학토론과토의 및문제해결) (7시간) 물리학 동아리 내 IT 분야에 관심 있는 학생들이 모인 조에서 '물리와 IT산업'을 대주제로 하여 토의를 진행 하였음. 그 중 '5G WiFi는 왜 지원 거리가 짧은가'라는 주제를 평소에 경 험한 적이 많아 관심이 갔기에 선정한 후 연구하여 발표함. 연구를 위해 조사하던 중 5G 전파에는 3.5GHz 주파수와 28GHz 주파수의 두 종류가 있으나 한국은 28GHz보다 속도가 느린 3.5GHz만 존재한다는 사실에 의아하였다고 함. 탐구를 통해 고속 주행하는 자동차와 비슷하게 5G 전파 는 빠른 속도로 인해 장애물을 만나면 회절이 잘 일어나지 않아 꺾여 들어 오기 힘들다는 문제가 있다는 것과 28GHz는 문제가 더 심해 한국에 없다 는 사실을 알게 됨. 이로 인해 지금보다 기지국을 조밀하게 설치해야 한다 는 문제와 28GHz 주파수는 원활한 지원을 가능하게 하는 기계 부품의 연 구도 필요하다는 문제 또한 인식함. 이를 통해 물리적 제약이 기술 발전을 억제하는 요인이 될 수 있다는 사실을 알았고, 향후 이러한 제약을 뛰어 넘는 5G 기술을 개발해보고자 함. \n[청소년 자원봉사학교 캠페인] \n지역사회에 꾸준히 기부를 한 나눔가게들이 코로나로 형편이 좋지 않다는 것을 알게 되어 반려식물 키트를 제작하고 응원 편지를 작성해 상인에게 전달하는 봉사활동에 참여함. 활동 중 나눔가게 상인과 같이 자신이 힘든 것을 감수하고 봉사하는 사람들의 이야기를 들으면서 어려운 상황에서도 \n경희고등학교 \n2025년 11월 20일 8/26 반 \n6 \n번호 17 이름 서현승 \ngov.kr \n정부24 \n3 \n문서확인번호: 1763-6098-4150-6899 (신청인: 서현승) \n학년 \n영역 \n시간 \n진로활동 \n3 \n창의적체험활동상황 \n특기사항 \n나눔을 실천하는 일이 존재해야 하는 이유를 이해할 수 있었다고 함. 응원 편지를 쓰면서 상인들이 어떤 반응을 보일지 쑥스러워하였는데, 가게를 방문하여 식물과 편지를 드렸을 때 상인들이 기뻐하는 모습을 보고 뿌듯 해함. 봉사자들을 격려하고 지원해주는 봉사도 필요하다 느낌. \n[환경교육 및 환경보호 캠페인] \n오늘날 오염되고 있는 지구의 환경에 관해 교육받은 후 지구의 대기, 토 양, 수질 오염을 표현한 포스터를 만듦. 환경보호를 알리는 방안을 직접 생각해볼 수 있었기에 주체적으로 해결 방법을 찾는 능력을 기를 수 있었 다함. \n[전공심화프로그램] \n1학년 때부터 IT전문과정 (총 288시간)을 통해 실력을 키우기 위해 노력 해왔고, IT를 더 깊이 알고자 전공심화프로그램인 코딩수학 : RSA 암호 알고리즘(총 12시간)을 수강함. 이 프로그램을 통해 암호 알고리즘의 원 리를 이해하고 나만의 암호를 만들어보면서 수학, 컴퓨터, 정보보호를 융 합하여 해커들로부터 안전한 암호를 만드는 방법을 탐구함. Octave라는 프로그램으로 최대공약수, 유클리드 호제법, 소수 판별법 등 암호 코딩에 쓰이는 수학 지식을 공부한 후 RSA 암호에 관해 연구함. RSA 암호 알고 리즘을 이용하여 노래 가사 등 장문의 글을 암호화하고 해독하는 활동을 함으로써 암호의 원리를 파악해봄. 또한, 다른 전공심화인 '4차산업혁명 과 ICT트렌드'로부터 ICT가 장점이 많으나 사이버범죄나 개인정보보호 에 취약할 수 있다는 단점을 알게 되었고, 더 나아가 악용되기 어려운 프 로그램을 자신이 개발해보겠다고 다짐함. \n[한걸음 더] \n'한 걸음 더' 활동으로 근래에 소프트웨어가 급성장한 것에 대해 알아보고 자 문헌들을 조사한 후 발표함. 1980년대 세계 ICT기업 TOP10에 주로 하드웨어 기업이 포진해 있었으나 2002년에 소프트웨어의 비중이 계속 높아지면서 상황이 역전되었고, 2011년에 이르러서는 전 세계 ICT시장에 서 소프트웨어가 약 30.4%를 차지할 정도로 부상함을 알게 됨. 오늘날 스 마트폰이나 가전제품, 자율주행 자동차 등 일상 속 거의 모든 사물에 소프 트웨어가 존재하며, 미래에 IoT로 사람과 사물이 연결되는 초연결 시대에 는 소프트웨어 비중이 더 커진다는 걸 깨달아 프로그래밍이 얼마나 중요 한지 알게 됨. 또한, 그만큼 코딩교육도 중요해지기에 앞으로 누구나 재미 있고 쉽게 이해할 수 있는 코딩프로그램을 만들어보고자 다짐함. \n경희고등학교 \n2025년 11월 20일 \n9/26 반 \n6 \n번호 17 이름 서현승 \ngov.kr \n정부24 \n문서확인번호: 1763-6098-4150-6899 (신청인: 서현승) \n학년 \n봉사활동실적 \n일자 또는 기간 \n2018.05.09. \n장소 또는 주관기관명 \n(개인)삼청공원숲속도서관 \n활동내용 \n시간 누계시간 \n2018. 05. 21. \n(개인)성북구마을사회적경제 \n센터 \n도서정리및 환경정화 활동 \n성북구사회적경제특구 장 위동 초등틈새돌봄교실 학 습지도 봉사 \n4 \n4 \n4 \n8 \n1 \n초등학생 학습 보조 및 지 \n2018. 07.11. \n(개인)비전트리지역아동센터 \n4 \n12 \n도 \n2018. 10. 24. \n(개인)서울미양초등학교병설 유치원 \n유치원 교육활동 지원 \n4 \n16 \n2018. 12. 19. \n(개인)종로도서관 \n2019. 07.10. \n(개인)글로벌한상드림 \n도서관봉사(도서정리) \n한상인턴기업자료정리- 해외청년인턴사업 \n4 \n20 \n3 \n3 \n2 \n2019. 10.09. \n(개인) (사)겨레얼살리기국민 운동본부 \n개천절 기념 단군 영정 전 시회에서 질서유지와 환경 정리 등 안내 보조 등 \n4 \n7 \n2019, 12, 18. \n(개인)다솜재가노인복지센터 \n환경정리 및 어르신 활동 지원 \n3 \n10 \n[노원1종합사회복지관] 방 \n2020.08.11. \n(개인)노원1종합사회복지관 구석 활동 Part.1 / 청소 \n2 \n2 \n1년 자원봉사학교 캠페인 \n[노원1종합사회복지관] 방 \n3 \n2020.08.12. - 2020.08.13. \n(개인)노원1종합사회복지관 구석 활동 Part.1 / 청소 \n년 자원봉사학교 캠페인 \n6 \n8 \n2020.08.12. \n(개인)동대문구자원봉사센터 \n환경교육 및 환경보호 캠 페인 \n2 \n10 \n8. 교과학습발달상황 \n[1학년] \n경희고등학교 \n2025년 11월 20일 10/26 반 \n6 \n번호 17 \n이름 \n서현승 \n이 \ngov.kr \n정부24 \n문서확인번호: 1763-6098-4150-6899 (신청인: 서현승) \n1학기 \n2학기 \n교과 \n과목 \n단위 원점수/과목평균 성취도 석차 단위 원점수/과목평균 \n수 (표준편차) (수강자수) 등급 수 (표준편차) \n성취도 석차 (이수자수) 등급 \n사회 (역사/도 \n한국사 \n3 \n65/58.6(24.1) A(273) 5 3 \n57/58.1(24,0) \nA (262) 5 \n덕포함) \n국어 \n국어 \n4 \n58/62,4(20.5) C(273) \nCO \n6 \n4 \n64/68.0(21.6) \nB(262) 6 \n수학 \n수학 \n3 \n43/36.8(21.4) C(273) 4 \n3 \n44/44.2 (23,5) \nD(262) \n5 \n영어 \n영어 \n3 \n82/58.9(24.2) A(273) 3 \n3 \n90/61.4(24.8) \nA (262) \n2 \n사회(역사/도 \n[통합사회 \n4 \n78/73.6(15.1) B(273) 5 \n4 \n88/77.1(19.7) \nA (262) \n4 \n덕포함) \n과학 \n통합과학 \n4 \n66/61.3(23.9) A(273) 5 \n4 80/69.5(22,0) \nA (262) \n5 \n과학 \n과학탐구실험 \n1 88/76.4(14.3) A(273) \n3 1 98/78.5(19.4) \nA(262) 1 \n기술·가정/제 \n2외국어/한문/ 진로와 직업 교양 \n1 \nP \nP \n1 \nP \nP \n기술·가정/제 \n2외국어/한문/ 중국어 I 교양 \n2 61/65, 5(24.7) C(123) \n이수단위 합계 \n25 \n25 \n과목 \n세부능력 및 특기사항 \nсл \n5 \n2 77/60, 3(25,4) B(116) 4 \n한국사: (1학기) 장영실에 대한 보고서를 작성함. 자격루와 같은 장영실의 발명품에 대해서 탐구하기 위해 다양함 참고 자료 를 활용하여 자격루가 그 이전의 조선 물시계의 단점을 해결한 방법을 다른 나라의 물시계가 해결한 방법과 비교하고, 혼천의 가 어떤 우주관을 기반으로 만들어졌는지, 측우기의 특이한 형태가 무슨 이유에서 탄생하게 된 것인지 조사함. (2학기) 김홍 집을 주제로 설정한 모의재판 활동에 증인 역할로 참여함. '번역 오하기문' 등 다양한 책을 참조하여 김홍집 내각이 어떻게 붕 괴되었는지, 김홍집이 여러 나라의 신문물들을 들여오려 한 행적들과 단발령을 실시한 것에 대해 관련 내용을 탐색함. 검사 가 증인을 반대 심문하는 내용이 앞에서 증언한 바와 연관성이 있게 만들기 위해 먼저 혼자서 반대 심문 내용을 짜본 후 조원 들과 같이 그 내용을 검토하여 완성하는 등 활동에 적극적으로 참여함. 활동 후 역사적 인물을 파악하기 위해서는 계보적 접 근이 필요함을 이해함. \n국어: 수업에 참여하려고 열심히 노력한 학생임. 문학의 갈래 단원에서 서정, 서사, 극, 교술 갈래의 특징들을 배운 후, 특정 갈래의 작품을 다른 갈래로 바꿔 쓰는 수행평가에서 성실한 자세로 임하였음. 또한 설득하는 글쓰기 수업에 관심을 많이 보였 음. 이 수업 전까지, 어떤 주제에 대한 자신의 의견을 주장함에 있어 직관적인 느낌을 위주로 글쓰기를 하던 버릇이 있었음. 그러나 이 수업을 통해 좀 더 논리적인 의견을 내기 위해서는 충분한 자료 조사가 필요하다는 것을 깨닫게 되었음. 이에 신문 기사, 유튜브 동영상, 인터넷 백과사전 등을 참고하여 관련 자료를 찾아 보고 자신의 생각을 가다듬었음. 이에 전보다 훨씬 좋은 논증 구조를 세울 수 있었음. \n경희고등학교 \n2025년 11월 20일 11/26 반 \n6 \n번호 17 이름 서현승 \n비고 \n(KOR \ngov.kr \n정부24 \n문서확인번호: 1763-6098-4150-6899 (신청인: 서현승) \n과목 \n세부능력 및 특기사항 \n수학: '00수학저널 활동 (2018.3.2.-2018.7.23.)'의 일환으로, 통계활용보고서 '고등학교 1학년의 책 분야 선호도 조사'를 연구함. \n(평가) \n이 학생의 보고서 연구 동기는 요즘 학생들의 삶에 책이 차지하는 공간이 줄어들어, 학생들에게 관심을 받으면서도 유익할 종 류의 책을 학교에 비치하기 위해 책의 분야를 정리하고 싶었던 것임. 보고서 연구내용은 학생들의 각 진로 과정에 따라 선호 하는 특정 분야의 책, 교사들이 학생들에게 권하는 특정 분야의 책, 앞의 두 내용의 결과의 비교임. 설문대상은 인근지역 K고 등학교 학생들(남자: 약 80명)임. 연구 방법은 설문조사임. 학생이 배운 주된 내용은 진로과정과 책의 관심분야 간의 연관성 이 절대적이지 않다는 것과 자신이 원하는 책만 읽는 것이 아닌 다른 책들도 필요한 만큼은 읽는 것이 좋다는 것임. 보고서 연구의 한계점은 설문조사지의 관리가 힘들었고 조사 당시 학생들의 부재가 많았기에 1학년 전체를 대상으로 설문조사를 하 지 못하여 자료의 부정확성의 우려가 있다는 것임. \n영어: 2학기 영어교과반장으로서 교사의 수업준비 및 수업의 면학분위기 조성에 앞장섬. 질문을 던졌을 때 나오는 학생의 대 답을 통해 이 학생이 영어기초실력이 탄탄하다는 것을 느낄 수 있었음. 호기심이 있어 모르는 내용은 수업 중에 꼭 손을 들고 질문하는 기특한 학생임. '나이와 뇌 건강의 관계'에 관한 지문을 읽고, 관련 내용을 주제로 영문 보고서를 작성하여 발표함. 주제를 뒷받침하는 사례를 풍부하게 제시함으로써 자신의 의견을 설득력 있게 전달하는 한편, 이후의 토론에서 각자의 의견 을 종합하여 유의미한 결론을 도출함. 보고서 작성 및 토론 과정 전반에 걸쳐 '문장 구성'과 '내용 전달'의 측면에서 특히 두드 러짐. 이러한 능력을 꾸준히 연마한다면, 보다 영어다운 글을 완성하는 데 탁월한 실력을 발휘할 수 있을 것으로 전망함. 아 울러 어려운 내용은 선생님에게 질문하거나 친구들과 함께 토의하여 완벽히 이해하고자 노력하는 등, 학습에 대한 열의와 수 업 태도에 비추어 장래의 발전 가능성 또한 매우 높음. \n(1학기)통합사회 : 모둠활동으로 주어진 창업 프로젝트에 참여하여 포터 매니지먼트 사업에 대해 제안함. 히말라야와 같은 험 난한 산악지대에 안전하게 등반하기 위해서는 포터의 도움이 절실한데, 전문성 있는 포터들을 하나의 회사에 소속시켜 체계 적으로 관리하며 소비자들에게 포터 이용에의 접근성을 높이고자 함. 기존 사업의 문제점을 분석하고, 아이템을 구체화할 때 의 상용화 가능성에 대해 생각해보고 창업 비용을 마련하기 위한 방법에 대해 조사하는 등 창업 절차의 복잡성을 알고 기업가 정신을 발휘해 보는 계기가 됨. \n(2학기)통합사회 : 국제 사회에서 나타나는 갈등과 협력의 사례를 통해 국제 사회 행위 주체의 역할을 이해함. 특히 모둠별로 국제 분쟁을 알리는 뉴스 만들기 (쿠르드족 분쟁)를 진행하며 다양한 국제분쟁의 원인과 전개 과정, 해결 방안 등에 대해 알게 \n됨. 지구촌 구성원으로서 평화의 중요성을 알고 외교적 관점에서 바람직한 국제 관계의 방향을 탐구하는 계기가 됨. \n통합과학: 태양광발전기가 작은 공간에서 요긴하게 쓰일 수 있음에도 불구하고 태양광발전기가 설치되어 있는 건물들이 많이 보이지 않는 것에 호기심을 가지게 됨. 어떤 이유에서 많이 활용되지 않는 것인지 알아보기 위하여 논문 '태양광발전 시스템 이 설치된 학교건물의 신재생에너지 공급비율 증가방안에 관한 연구'와 '건축물 신재생에너지원의 이용 현황 및 문제점 분석' 을 읽고 보고서 '태양광 발전을 가장 효율적으로 하는 방법'을 작성함. 이를 통해 태양광 발전을 더욱 효율적으로 만드는 방법 에 대해 알 수 있었고, 그러한 발전에 있어 가장 좋은 태양광발전기 배치는 무엇일지에 대해 발표하였음. 이후 기존에 태양광 발전을 관리하는 시스템을 개선하여 태양광발전의 관리를 효율적으로 할 수 있도록 연구해보고 싶다는 생각을 함. \n과학탐구실험: 일반적으로 물에 진한 커피 원액을 넣을 때 커피가 퍼지는 속도가 달랐던 기억이 생각나 커피 원액이 퍼지는 속도가 물의 온도에 따라 다른 것인지 궁금해져 탐구활동을 수행함. 탐구활동 과정을 통해 기체의 확산 속도는 매질이 기체일 때 가장 빠르고 액체, 고체순으로 느리고, 또한 온도가 높을수록 확산속도는 빨라진다는 조사 결과로 부터 동일한 매질인 액 체속에서 온도가 높을수록 퍼져나가는 확산 속도는 점점 빠르기 때문에 물의 온도가 높을수록 커피는 빠르게 퍼져나갈 것이 라는 사실을 알고, 이를 논리적으로 설명할 수 있는 학생임. \n경희고등학교 \n2025년 11월 20일 12/26 \n반 \n6 \n번호 17 이름 서현승 \ngov.kr \n정부24 \n과목 \n문서확인번호: 1763-6098-4150-6899 (신청인: 서현승) \n세부능력 및 특기사항 \n진로와 직업: '나만의 선거 포스터 만들기', '나를 객관적으로 알아보기(직업 흥미 검사와 직업 적성 검사를 실시하여 각각의 결과에 따른 추천 직업들을 보고 그 중 마음에 드는 직업 세 개를 선택 이유와 같이 뽑아보는 활동)', '감정을 통해 보는 나’ 등의 활동들을 통해 나를 전체적으로 이해할 수 있게 되어 후의 활동들을 하는 데에 도움이 됨. \n(1학기)중국어 I: 수업 내용을 경청하고, 발표를 많이 하려고 노력함. 중국어를 처음 배우는 것이라 많이 힘들어 할 것이라 는 예상과 달리 수업에 집중하여 중국어에 관한 지식을 넓히고 있음. 매 시간마다 바른 자세로 다른 학생들의 모범이 됨. (2학기)중국어 I: <중국 IT 사업 내가 먼저 덤벼 보기>를 읽고 IT 시장에 대해 더 깊은 지식을 쌓고자 하는 자신의 동기와 감 상, 그리고 앞으로의 계획에 대해 상세하고 성실하게 작성함. 중국인들의 관계 형성의 중요성을 깨닫고 시장 성장과의 연관 성에 대해 생각함. 다양한 외국 IT 회사들을 살펴보며 배경지식을 쌓을 계획을 세움. \n중국어에 대한 이해도와 흥미, 관심이 상당히 높은 수준임. 중국어 수업에서 항상 진중하고 착실한 태도로 임하는 모습이 인 상적임. 모르는 부분에 대하여 질문하는 것을 두려워하지 않고 교사의 상호작용에 적극적으로 임하는 모습이 돋보임. 중국어 \n자기소개에서 발음 중 성조 부분을 어려워하는 듯 했으나 노력하여 점차 개선되는 모습을 보여줌. \n성실한 자세로 진로 독서 수업에 참여하며 진로탐색의 중요성을 인식함. 함께 읽기 활동에 적극적으로 참여하며 자신의 생각 을 논리적으로 표현하기 위해 노력함. 읽기 활동 후 주어진 문제에 대해 스스로 답을 찾기 위해 고민하였으며 이를 한 편의 완성된 글로 종합하여 제시하였음. \n<체육 · 예술〉 \n1학기 \n2학기 \n교과 \n과목 \n비고 \n단위수 \n성취도 \n단위수 \n성취도 \n체육 \n체육 \n2 \n2 \nA \n예술 \n음악 \n2 \nA \n2 \nA \n예술 \n미술 \n1 \nA \n1 \nA \n이수단위 합계 \n5 \n5 \n과목 \n특기사항 \n(1학기)체육: 동료학생들과 헬스모임을 만들어 파워고무밴드, 매트 및 아령등을 갖고 나와 상하체 및 복근 운동을 꾸준하게 하고 있으며 단단해 지고 건강해 지는 자신의 몸을 보고 매우 만족해 함. \n(2학기)체육: 농구 골밑슛과 레이업슛 성공률을 높이기 위해 부단한 연습을 하였으며 체력을 아끼지 않고 최선을 다해 경기 에 임하는 모습을 보임. 심폐소생술을 연습하면서 심장의 압박위치 및 자세를 정확하게 할 수 있으며 잘 해냄. \n(1학기)음악: 음악 장르의 구분이 없이 여러 장르의 음악을 듣는 것이 음악을 이해하는 능력을 높인다고 생각하기 때문에 아 리스토텔레스의 에토스 이론은 잘 못된것이라고 자신의 의견을 발표함. 이 과정에서 타인에 의해 음악을 감상하는 것이 아닌 자신이 직접 고른 음악을 듣고 생활할 수 있는 자유가 있어야 한다고 이야기 함. \n교가, 응원가를 정확한 박자와 음정으로 자신있게 노래했으며 이태리의 칸초네인 O sole mio를 원어로 노래할 수 있음. 모둠활동인 '컵타 만들기'에서 음악 선정, 리듬 창작, 악보 제작, 실제 연주까지의 모든 과정에 참여함. 이 모둠 활동을 통해 \n경희고등학교 \n2025년 11월 20일 13/26 반 \n6 \n번호 17 이름 서현승 \ngov.kr \n정부24 \n과목 \n문서확인번호: 1763-6098-4150-6899 (신청인: 서현승) \n협동심과 리듬감이 향상됨. \n특기사항 \n학급단위 교내음악행사에서 리코더로 '샹젤리제'를 연주함. \n(2학기)음악: 이 학생은 고등학생을 가르친다는 느낌보다는 대학생을 가르친다는 생각이 듦. 음악적인 지식이 또래보다 풍부 하고 말을 할 때도 예의바르며 상대방의 말을 잘 경청하기 때문임. 수업 시간에 늘 열심히 참여하며 모범적인 모습을 보임. 음악적인 지식 뿐 아니라 음악사에 관심이 많고 음악사를 하며 그 시기의 우리나라 역사와 연관지어 폭넓게 이해하는 모습이 눈에 띔. \n(1학기) 미술: 팝아트 자화상 작품 제작 시, 인물얼굴의 비례에 있어 얼굴 좌우의 1:1의 법칙과 이마, 눈썹, 코끝, 턱 사이의 1 :1:1의 법칙에 대한 교사의 질문에 적극적인 발표력을 보임(2018.03.16.). 팝아트의 작품특징에 대한 자신의 의견을 적극적 으로 발표하는 자기주도적 미술학습능력이 뛰어나며, 팝아트자화상 작품 제작 시, 팝아트의 특징을 살려서 인물 눈의 홍채, 동공, 빛반사 되는 하이라이트 부분, 코의 콧구멍과 콧망울을 잘 표현함 (2018.03.23.). 흙판 테두리의 틀을 벗어난 전통문 양을 조형미를 살려서 창의적으로 표현하였으며, 상황에 따른 점토의 특성을 이해함으로써 평면상의 형상을 입체적으로 조각 하는 테라코타 부조를 완성함 (2018.06.22.). \n(2학기) 미술: 사물공감 일러스트 작품계획서 작성 시, 자신이 대신 목소리를 내주고 싶은 사물을 선택하여 보는 사람으로 하 여금 공감을 일으키도록 사물의 사연을 창의적으로 상상하여 표현하였고, 도화지 화면에서 '사물'이 '목소리'와 어울릴 수 있 도록 구도를 깊이 생각하고 배치하여 스케치함으로써 작품제작을 꼼꼼히 계획함 (2018.09.07.). 스트링아트 제작 시, 실을 이용하여 자신만의 패턴을 아름답게 만들어 감으로써 직관적인 사고를 창의적인 사고로 발전시킴 (2018.12.14.). \n[2학년] \n교과 \n과목 \n1학기 \n2학기 \n단위 원점수/과목평균 성취도 석차 단위 원점수/과목평균 성취도 석차 비고 \n수 (표준편차) (수강자수) 등급 수 (표준편차) (이수자수) 등급 \n국어 \n언어와 매체 \n5 \n79/68.9(23.0) B(245) 5 \n국어 \n문학 \n5 75/70.3(22.0) \nB(245) 5 \n수학 \n[수학 I \n4 49/39.2(18.9) B (245) \n4 \n수학 \n수학II \n4 34/37.4(20.6) B(245) 5 \n수학 \n미적분 \n50/39.5(22.5) B(168) 4 \n수학 \n확률과 통계 \n4 \n51/37.7(22.2) B(245) 4 \n영어 \n영어 I \n94/65,2(24.0)| A(245) \n2 \n영어 \n영어 독해와 작 \n문 \n4 92/51.1(26.0) A(245) 2 \n과학 \n물리학 I \n과학 \n화학 I \n3 \n과학 \n지구과학 I \n3 52/58.1(17.2) B(145) 6 \n69/62.6(18.5) A(166) 5 \n3 74/64, 4(19.5) B(113) 4 \n3 \n68/58.5(18.7) A(143) 4 \n3 \n68/59,2(23.5) A(164) 5 \n3 67/57.4(22.7) C(113) 4 \n경희고등학교 \n2025년 11월 20일 14/26 반 \n6 \n번호 17 이름 \n서현승 \n이 \ngov.kr \n정부24 \n문서확인번호: 1763-6098-4150-6899 (신청인: 서현승) \n1학기 \n2학기 \n교과 \n과목 \n단위 원점수/과목평균 성취도 석차 단위 원점수/과목평균 성취도 석차 수 (표준편차) (수강자수) 등급 수 (표준편차) (이수자수) 등급 \n비고 \n기술.가정/제 \n2외국어/한문/ 정보 교양 \n2 91/81.8(12.3) B(245) 3 2 87/77.3(13.9) B(245) 4 \n이수단위 합계 \n28 \n28 \n과목 \n세부능력 및 특기사항 \n언어와 매체: 변화하는 시대에 자신만의 방식으로 자기소개를 함으로써 자신만의 표현 방법을 살릴 수 있다는 점, 자신의 진 로를 명확히 설정할 수 있고 또한 자신의 진로에 적합한 매체를 선택해서 제작하면 그 분야에 대한 이해도가 더욱 생긴다는 점의 의미가 있기 때문에 글이 아닌 자기소개서 만들기 수행평가를 제안함. 글만 작성하는 일반적인 자기소개서가 아니라 광 고형태의 자기소개서를 만들자는 것임. 즉 포스터, 사진, 영상, 그림이 들어 있는 일상의 광고와 같은 형태로 제작하자는 내 용이었음. 상상력이 기발한 의견을 제안함. \n결국 수행평가 제안 내용을 모두 아우르는 방법을 택함. 그것은 주제를 정하고 그것을 잘 드러낼 수 있는 매체를 활용하여 결 과물을 만드는 것임. 이후 각자가 원하는 주제에 맞게 조를 재편성해서 진행함. \n문학: 김훈의 '남한산성'을 한 학기 한 권 책읽기로 함. 40분의 수업시간 동안 읽고 10분 간 정리하는 시간을 가짐. 학생은 추 위로부터 고통을 받으면서도 희망을 바라보는 김상헌의 모습에서 깊은 인상을 받음. 설령 돌파구가 없는 경우라고 하더라도 김상헌과 같이 희망을 품고 사는 것이 모든 사람들에게 필요하다고 생각함. 그리고 책을 읽으면서 다음과 같은 것에 궁금증이 생겨 스스로 찾아보고 생각함. 그것은 당시 남한산성의 피해는 어느 정도였을까임. 독서를 완료한 후 영화 남한산성과 소설 남한산성의 내용을 비교함. 마지막으로 나비효과처럼 병자호란의 결과를 변화시킬 수 있는 역사적 가정에 대해 말해보는 시 간을 가짐. \n수학 I: 수학저널활동 (2019.3.1.-2019.7.19)의 일환으로 수학I 논문 분석 보고서 '수학적 귀납법에 대한 학생들의 이해 에 관하여'를 작성함. 이 학생의 보고서의 연구 동기는 학교에서 수학적 귀납법을 배울 때 왜 이러한 증명 과정을 거치는 것인 지 이해하지 못했기 때문임. 보고서의 주된 내용은 수학적 귀납법의 문제점을 비추는 선행 연구들, 연구 과정, 결과, 느낀 점 임. 작성 방법은 문헌연구이며, 보고서 작성을 통해 알게 된 점은 오랫동안 문제가 있었음에도 해결되지 않은 문제들이 존재 하고, 그런 문제들이 해결방안이 현재 보이지 않는다고 하여서 연구할 가치가 없는 것은 아니라는 점임. \n수학II: 수학저널활동(2019. 3. 1.-2019.7.19)의 일환으로, 미적분을 익히는 것에 어려움을 느껴 '고등학교 미적분에서의 수학화 교수·학습에 관한 연구'라는 문헌에서 프로이덴탈의 수학화 교수·학습론을 토대로 현행 고등학교 미적분 교수·학 습의 문제점을 찾고, 그 해결 방안을 찾는 활동을 함. \n학생들이 미적분의 개념을 익히고 활용하는 것에 어려움을 느낀다는 결과가 나와 학생들을 돕기 위해 미적분 개념의 역사적 근원 문제와 프로이덴탈의 수학화 과정, 딘즈의 다양성의 원리를 통해 알아낸 수학화 교수·학습 단계를 통해 분석 관점을 추 출함. 또한 7차 수학과 교육과정 고등학교 수학II 교과서의 미분 영역을 교육부가 제시한 미적분 교육의 목적을 기반으로 분 석한 후, 두 분석을 적용한 수I 미적분 영역의 교수·학습 자료 개발 방향을 정리함. \n해외 교과서를 표본으로 삼지 않아 국내의 상황과 비교하지 못한 것이 한계였음. \n미적분: 수학저널활동(2019. 8. 12.-2019.12.27.)의 일환으로, 미적분보고서 '소프트웨어를 이용해 적분 계산의 정확도 및 \n경희고등학교 \n2025년 11월 20일 15/26 반 \n6 \n번호 17 이름 서현승 \n(KOR) \ngov.kr \n정부24 \n문서확인번호: 1763-6098-4150-6899 (신청인: 서현승) \n과목 \n시간 분석하기'를 작성함. \n세부능력 및 특기사항 \n(평가)이 보고서의 작성 동기는 소프트웨어로 계산한 적분의 정확도와 계산 시간이 적분 방법과 데이터 타입에 따라 달라지 는가에 대한 호기심에서 출발함. 학생의 보고서의 주된 내용은 적분할 방정식 선정 및 예상되는 프로그램 오류 예방, 적분 구 간 설정과 3가지 적분 방식에 따른 방정식의 적분, 한계점에 관해 서술함. 학생이 보고서 작성을 통해 알게 된 점은 적분에도 여러 가지 계산법이 있고 그에 따른 오차 범위, 계산 시간도 달라지기에 전문 작업 등에 필요한 적분 방식은 신중히 택해야 할 필요가 있다는 것에 관해 서술함. 학생은 보고서의 연구의 한계점으로 처음에 설정한 적분 구간이 부족해 보여 구간을 늘 린 다음 해 보았는데, 구간을 옮기거나 크거나 작게 하였을 때 결과가 어떻게 나오는지에 대해 연구하지 못한 점을 제시함. \n확률과 통계: 통계활용활동 (2019. 8. 12.-2019.12.27.)의 일환으로, 통계보고서 '투표 사전 조사의 정확도를 높이는 방법'을 \n작성함. \n(평가)이 보고서의 작성 동기는 어떻게 투표 사전 조사가 실제 결과와 비슷하게 나오는지에 대한 궁금증을 제시함. 학생의 보고서의 주된 내용은 과거 조사가 어떤 방식으로 진행되었는지, 그 방식의 문제점은 무엇이고 그것을 해결할 수 있는 다른 방식들에 대한 것임을 제시함. 학생이 보고서 작성을 통해 알게 된 점은 인명 전화번호부를 이용한 1번의 조사 대신 RDD 방 식으로 3번 시간대를 다르게 조사하는 것이 참여율이 높다는 점과 읍면동만 출구조사를 하는 방식보다 한 시도 내 지역을 지 난 총선 때 한나라당 비례대표 득표율 순으로 정렬해 투표소를 추출하는 방식이 더욱 고른 결과가 나온다는 점이라고 서술함. 보고서의 연구의 한계점으로는 2010년도 투표 사전 조사 때만 연구가 진행되어 이후의 사전 조사에 이러한 방식이 보일 수 있는 단점에 관해 연구를 진행하지 못했다는 점을 제시함. \n영어 I: A Spark in You를 읽고 더욱 넓은 교우 관계를 유지하고 친구들에게 도움이 되는 사람이 되고자 노력했던 일에 대 해 영작함. 도움이 필요한 친구들에게 먼저 다가가고 주변 사람들에게 친절하게 대하면서 스스로도 마음이 따뜻해졌던 경험 을 to부정사의 다양한 용법을 정확하게 사용하여 표현함. Make Rules for a Happier Classroom 활동에서 교실 내 쓰레 기통 등 위생 문제를 발견하고 이를 해결하기 위한 방법을 제시함. 명령문을 적절히 사용하여 자신의 의견을 명확히 나타냄. Green Cities around the World를 읽은 후, 세계 각 도시의 환경 정책에 궁금증을 가지고 심층적으로 조사하여 발표함. 독일의 프라이부르크에서 보도, 자전거, 대중교통과 같은 친환경적 이동 수단을 장려하는 정책을 시행하여 자가용 소유 비율 이 낮아진 사례를 잘 설명함. 환경 관련 어휘를 숙지하고 있고 문맥상 알맞은 위치에 적절히 사용함. Making a Better Wo rld의 방법으로 차별 금지, 상호 협조, 타인 존중 등의 가치에 대해 관계대명사를 사용하여 표현하였고, 선행사와 동사의 수 일치가 정확함. \n영어 독해와 작문: Paulo Coelho의 글을 읽고 등위접속사 and로 연결된 병렬구조와 생략된 어구에 대해 잘 이해하고 설명 함. Noam Chomsky의 글을 읽고 지문에 나온 어휘의 파생어/유의어/반의어를 찾아 연상작용을 활용하는 방법으로 어휘력 을 향상시켰으며 상황에 따른 단어의 다양한 쓰임을 이해함으로써 글의 내용을 정확하게 파악하는 능력을 키움. Dispute R esolution에 관한 지문을 읽고 문장의 성분을 잘 파악하여 분석하였으며 목적어를 취하는 동사를 구분하여 설명함. 큰 그림 만을 목표로 하는 것보다 목표에 차근차근 다가가는 것이 현재의 성과를 위한 동기 부여에 긴요하다는 글을 읽고 장래 희망하 는 공학자로서의 자세에 대해 생각하는 계기가 됨. 학급의 영어부장으로서 학생들의 영어능력 향상을 위한 학습 지원 뿐 아니 라 필요한 제반 행정적 봉사를 성실히 수행하는 모습이 인상적임. 한결같은 자세로 학습 활동에 적극적으로 참여하여 학급의 학습 분위기를 제고하는데 많은 도움을 줌. 꼼꼼하게 필기하고 정리하여 복습하는 등 영어 능력 향상을 위한 꾸준한 자세가 돋보임. \n물리학 I: 공기 저항이 있을 때 물체의 두 요소가 낙하 속도에 어떠한 차이를 만들 수 있을지 궁금해 실험을 직접 기획하고 물리 자율탐구 보고서를 작성함. 실험 설계 과정은 A4 용지 1장과 A4 클리어 파일의 한 면에 동전을 덧댄 후 따라 오려낸 다 음, 파일의 다른 한 면은 A4 크기 그대로 잘라낸 후 그리고 동전 면적으로 된 종이, 플라스틱, 금속(동전)의 세 물질을 2m \n경희고등학교 \n2025년 11월 20일 16/26 반 \n6 \n번호 17 이름 서현승 \ngov.kr \n(KOR) \n정부24 \n과목 \n문서확인번호: 1763-6098-4150-6899 (신청인: 서현승) \n세부능력 및 특기사항 \n높이에서의 낙하 시간을 5번 측정하고, A4 용지 면적인 종이, 플라스틱(A4 파일)의 두 물질도 같은 조건으로 측정함. 실험 결과 동전 면적의 경우 금속과 플라스틱은 떨어지는 시간이 같았고, 종이는 그보다 느렸음. A4 용지 면적의 경우도 마찬가지 였음. 플라스틱의 경우 크기가 달라져도 차이가 없었으나 종이의 경우 차이가 컸음. 꺾이기 쉬운 재질일수록(종이〉플라스틱= 금속) 공기 저항에 영향을 크게 받아 낙하 시간이 더 길고 잘 꺾이지 않는 재질(플라스틱, 금속)은 면적이 바뀌어도 받는 영 향의 차이가 크지 않으나, 잘 꺾이는 재질(종이)은 크다는 것으로 결론지음. 물리학 [에서 배웠던 가속도의 개념을 실험을 통 해 복습해볼 수 있었고 향후 A4 용지 크기의 금속판이 2m 높이에서 떨어지는 시간을 구하여 이 실험의 결과와 비교하는 실 험을 하고자함. \n화학 I: 탄소 동소체 풀러렌의 구조를 직접 만들어보는 시간을 가짐. 책으로만 배우던 미시의 세계인 탄소화합물을 직접 만 들어 보면서 화합물의 구조에 대한 이해력을 높일 수 있었으며, 현대 사회에 사용되고 있는 다양한 탄소 화합물에 대하여 관 심을 갖게 되는 계기가 되었으며 앞으로 탄소 화합물을 연구해 보고 싶다는 포부를 갖게 됨. \n알칼리 금속인 나트륨을 물과 반응시켜 금속의 반응성을 직접 관찰해 보는 실험을 수행함. 눈으로 직접 나트륨 금속의 뛰어난 반응성을 보며 매우 놀람. 또한 금속이 녹아들어간 용액에 페놀프탈레인 용액을 넣고 색 변화 관찰을 통하여 수용액의 액성 도 파악하는 시간을 갖게 됨. 폭발적인 반응 실험을 수행하며 화학 실험은 재밌지만 안전한 실험을 위해 항상 집중해야 한다 는 것을 배움. \n물의 전기분해 실험을 수행함. 물이 수소와 산소가 되어 나오는 모습을 보며 매우 신기해하는 모습을 보임. 생각보다 간단한 방법으로 물을 분해 할 수 있다는 것에 화학실험이란 것이 본인과 멀리 있는 것이 아니라고 생각함. 수소기체와 산소기체를 확인하는 과정에서는 순간적으로 해야 하는 과정에 실수하여 정확하게 확인하지는 못했지만 실험에 열정적으로 참여하고 즐 거워하는 모습을 보임. \n지구과학I: 수업을 경청하고 참여하는 자세가 남다른 학생으로 수업 시작전에 배울 내용이 무엇인지 전체 개요를 교과서로 예습하는 모습이 보기가 좋았음. \n우리나라의 지진발생 정도가 적지 않음에도 불구하고 지진 교육 및 건물설계의 취약성에 대해 궁금증을 느끼고 탐구보고서를 \n작성함. 지진 발생과정과 역사적 지진발생사건 및 현재 우리나라의 지진 관련 방침과 보완점에 대해 설명함. \n최근 우리나라에서 나타나는 이상기후 현상인 폭염에 대해 탐구함. 2018년 폭염과 열대야로 인한 우리나라의 기록적인 전기 사용량을 태양광발전을 이용한 전기생산으로 충당한것으로 분석함. 하지만 태양광발전은 25°C의 온도에서 가장 효율적이므 로 폭염이 일반화될수있는 현시점에서 태양광발전이 안전한 폭염전력소모량 대비책으로 보기 어려울것으로 보았으며, 학생 은 이러한 태양광발전의 어려움을 극복하기 위해 태양의 궤도에 따라 위치와 각도를 조정하는 발전기를 개발하고자함. 은하의 모양이 다양하다는 것을 배운 후 여러 은하를 관찰하여 형태, 색, 광도 등에 따라 분류함. 절대 연령을 방사성 동위 원 소의 반감기로 측정하는 것에 흥미를 갖고 유물이나 지질의 절대 연령 측정에 쓸 수 있는 반감기를 가진 원소들에 대해 조사 함. \n정보: '정보과학 분야의 여러가지 직업 알아보기' 활동에서 미래 사회의 자동화 시스템은 로봇이 주도하게 될 것이라고 예상 하며 로봇 공학자를 조사하여 발표함. 로봇이 지배하는 미래가 아닌, 로봇을 활용하는 미래를 만들기 위해 노력이 하는 것이 중요하다고 주장함. 몸이 불편한 장애인들의 거동과 생활을 보조하는 기계를 만들고 싶다는 포부를 밝힘. 사이버 폭력의 문 제점으로 익명성을 주장하고 예방하는 방법으로는 가해자를 신고할 경우 빠르게 찾을 수 있는 클린한 사이트에서 활동함을 대안으로 제시함. 또한 우베 부제 기자가 진행한 해킹 실험의 동영상을 보고 실천 가능한 개인 정보 보안 방법에 대해 알아보 고 실천하려고 노력함. 'Python 프로그램 만들기'에서 While 문으로 다트 게임 점수 합이 20점 이상이 될 때까지 얻은 점수 를 출력하는 반복 구조 프로그램을 만듦. Python으로 음식 칼로리와 영양분과 섭취량 칼로리 소비를 위해 운동량을 알려주 \n경희고등학교 \n2025년 11월 20일 17/26 반 \n6 \n번호 17 이름 서현승 \ngov.kr \n정부24 \n과목 \n문서확인번호: 1763-6098-4150-6899 (신청인: 서현승) \n세부능력 및 특기사항 \n는 앱만들기를 추후 활동으로 제시함. 드론 코딩 애플리케이션을 이용한 '드론 장애물 통과하기' 활동에서도 모둠 구성원과 협력하여 실제 비행에서의 오차를 수정하는 등 성실하게 참여함. \n<체육 · 예술〉 \n1학기 \n2학기 \n교과 \n과목 \n비고 \n단위수 \n성취도 \n단위수 \n성취도 \n체육 \n운동과 건강 \n2 \nA \n2 \nA \n예술 \n미술 \n1 \nA \n1 \nA \n이수단위 합계 \n3 \n3 \n과목 \n특기사항 \n(1학기) 운동과 건강: 체육 수업에 적극적으로 참여 하였으며, 플라잉디스크 경기에서는 팀원들과 팀웍을 바탕으로 인화 단결 하여 최선을 다한 결과 개인의 성과보다 팀과 팀원을 먼저 생각하고 팀의 의미와 소중함을 깨달은 학생임. (2학기) 운동과 건강: 플로어 볼 조별 경기 시 본인이 직접 골을 넣는 것에 집착하지 않고 패스 플레이를 적극 펼침으로써 팀 원들이 함께 경기를 즐기고 서로 협동할 수 있도록 솔선수범한 학생임. \n(1학기)미술: 페이퍼 레이어링 아트 작품 제작 시, 작품의 완성보다 작품을 완성해나가는 과정이 더 중요함을 깨닫고, 차시별 로 스스로 진행계획을 세워서 높은 집중력으로 작품의 제작과정을 즐기는 자세를 보여주었고, 작품의 구성 및 칼질 등의 과정 에서 예상치 못한 어려운 상황이 닥쳐도 문제를 인식하고 스스로 고민하여 해결하려는 자기주도적인 진행 모습이 인상적이었 으며, 입체조형능력 및 배색의 효과적 활용능력이 우수한 작품으로 완성하여 타의 모범이 됨. 풍경 점묘화 아이디어 선정에 있어 적극적으로 자기주장을 표현하면서도 다른 의견을 수렴하고 조율하여 다 함께 만족할 수 있는 방법을 모색하려는 모습 이 인상적이었음. 작품 제작 시, 풍경 사진을 토대로 대상을 추가하고 수정하는 편집 과정을 거쳐서 투시화법을 이용하여 화 면구성 능력이 돋보인 스케치를 하였고, 물감을 활용하여 면봉과 붓으로 점을 찍어 색감을 다양하게 표현함으로써 계절감을 잘 살림. \n(2학기) 미술: 스탬프화 작품 제작 시, 조각한 스탬프 이미지에 어울리는 색의 잉크를 미적감각을 통해 선택하였고, 켄트지 위에 표현된 색들이 서로 상호작용을 함으로써 색상 대비가 다양하게 나타남. 완성된 작품 안에 자신의 아이디어와 제작 의도 가 잘 구현되었음. \n[3학년] \n1학기 \n교과 \n과목 \n국어 \n화법과 작문 \n2 \n국어 \n독서 \n2 \n수학 \n기하 \n3 \n단위 원점수/과목평균 성취도 석차 단위 원점수/과목평균 \n수 (표준편차) (수강자수) 등급 수 (표준편차) (이수자수) 등급 \n74/67,3(20.6) \nA(244) 5 2 \n32/60.1(29.2) \nC(245) 6 \n91/76.4 (21,1) A(244) 4 2 76/61.0(31.7) A(245) 5 \n77/71,2(21.1) B(149) 5 3 \n2학기 \n성취도 석차 \n비고 \n44/43.7(33.4) C(149) 5 \n경희고등학교 \n2025년 11월 20일 18/26 반 \n6 \n번호 17 이름 \n서현승 \ngov.kr \n정부24 \n문서확인번호: 1763-6098-4150-6899 (신청인: 서현승) \n1학기 \n2학기 \n교과 \n과목 \n단위 원점수/과목평균 성취도 석차 단위 원점수/과목평균 성취도 석차 수 (표준편차) (수강자수) 등급 수 (표준편차) (이수자수) 등급 \n비고 \n수학 \n영어 \n수학과제 탐구 2 \n영어II \n76/66.9(19.0) B(244) 4 2 \n73/50.6(27.2) \nB(245) 4 \n4 \n92/71,8(20,2) A(244) 3 \n영어 \n진로 영어 \n62/44,9 (27.9) \nB(245) 4 \n사회(역사/도 \n생활과 윤리 \n3 \n58/64.2(20.5) B(232) \nCO \n6 \n3 \n30/40.7(20.2) \nD(233) \nсл \n5 \n덕포함) \n과학 \n물리학 II \n3 \n68/59.2(22,2) B(85) \n5 \n3 58/42.9(26.4) \nC(85) 4 \n과학 \n화학II \n3 \n54/60,0(16.7) \nC(116) \n5 \n3 \n28/32,9 (23.5) \nC(116) 5 \n과학 \n화학 실험 \n2 \n51/64, 3(17.8) \nC(64) \nCO \n6 \n2 \n14/45.0(29.1) \nC(64) 7 \n체육 \n스포츠 생활 \n2 \n89/90.6(7.7) \nA(245) 5 \n2 \n91/77.5(9.4) \nA(245) 2 \n기술·가정/제 \n2외국어/한문/|논술 교양 \n1 \nP \nP 1 \nP \nP \n기술·가정/제 \n2외국어/한문/ 프로그래밍 교양 \n2 91/83.3(15.4) A(73) \n4 \n2 54/36.6(23,1) C(73) 3 \n이수단위 합계 \n29 \n과목 \n29 \n세부능력 및 특기사항 \n화법과 작문: IT기술 및 프로그래밍에 관심이 많은 학생임. 이번 COVID-19의 확산에 따라 IT기술 및 로봇, 인공지능 분야 가 발전하는 모습을 목격함. 따라서 COVID-19 상황에서 관심을 가지고 살펴본 현상 발표하기에서 'COVID-19 이후의 산 업변화'를 주제로 삼음. 발표의 내용은 다음과 같음. 인간은 외부환경의 변화에 적극적으로 대응해왔음. 이번 COVID-19의 경우도 마찬가지임. COVID-19은 인류의 일상을 낯설게 바꾸었고, 낯섦을 일상으로 바꿨음. 그리고 산업 전반의 변화를 야 기시킴. 대표적인 것이 온라인 서비스 산업의 급격한 성장을 들 수 있음. 그리고 무인 시스템, E-Sports, 스마트팩토리도 빼놓을 수 없음. 이러한 산업의 변화는 COVID-19이 종식이 되더라도 시속될 것임. 왜냐하면 한 번 방향이 정해지고 그것에 \n익숙하다보면 관성이 유지될 것이기 때문임. 발표를 보면서 관련분야에 대한 학생의 생각과 열정을 확인할 수 있었음. \n독서: '우리'를 위한 기술, 적정 기술'을 읽고 비용의 문제로 여러 편리한 기술의 혜택을 받지 못하는 사람들이 있다는 사실 을 알게 됨. 저소득층을 위해 매우 적은 가격에 효과를 볼 수 있는 기술들이 발달해야 한다는 중요성을 느낌. 또한 적정 기술 의 개발 사례 중 놀이기구와 펌프를 접목시켜 일반 펌프보다 효율은 낮지만 놀이와 물을 둘 다 잡으려는 시도가 좋았으나 아 이들이 노는 것을 생각 못 하고 물을 기르는 데만 집중하여 적정 기술을 고안할 때 유의해야 될 사항들에 대해 생각해 봄. '로봇에도 인권이 있을까'를 읽고 우리가 로봇을 완벽히 통제할 수 있는지와 로봇도 인권을 가질 수 있는지에 대해 조사한 언 론, 연구 등을 탐색해 봄. 탐색활동 후 인간의 권리와 로봇을 권리를 둘 다 인정하려면 상충되는 부분이 생긴다는 문제가 있 음을 알게 됨. 또한 로봇에게 인권을 주는 것이 로봇의 인공지능이 직접 문제를 일으켰을 때 책임을 물을 수 있으니 찬성한다 \n경희고등학교 \n2025년 11월 20일 19/26 반 \n6 \n번호 17 이름 서현승 \n이 \ngov.kr \n정부24 \n문서확인번호: 1763-6098-4150-6899 (신청인: 서현승) \n과목 \n세 부 능력 및 특 기 사 항 \n는 시각과 로봇 제작자가 책임을 회피할 수 있으니 반대한다는 시각이 나뉘는 것을 보고 로봇 관련 윤리 논쟁은 쉽게 끝나는 이야기가 아니라는 것을 깨달음. \n기하: 과거에는 카메라로 사진을 찍으면 사진이 조금 왜곡되었다는 사실에 왜 그런지 의문을 가지게 됨. 이를 탐구해보고자 어떤 이유로 사진에 왜곡이 일어날 수 있는지와 왜곡을 보정하는 방법을 팀 프로젝트의 주제로 선정함. 특히, 오늘날의 카메 라에도 왜곡 현상이 일어나는 경우가 있어 왜곡의 근본적인 이유와 해결 방법이 무엇인지 자세히 알아보는 것이 필요하다며 연구의 필요성을 강조하는 모습을 보임. 먼저 렌즈의 왜곡 현상의 발생 원인을 이해한 후, 선행연구들 중 이차곡선을 활용하 여 카메라의 렌즈의 왜곡 현상을 조사한 연구들을 분석함. 또한 포토샵을 통한 이차곡선이 활용된 보정을 직접 시연해봄. 카 메라와 사진 보정에도 수학이 빠지지 않는다는 사실에 일상 속에 수학이 있다는 것을 느끼는 모습을 보임. 교과서나 도서에 단편적으로 실려있는 교과개념과 실생활과의 관계를 살펴보며 성취감을 느꼈음을 밝힘. 추후 왜곡 보정 방법 중에 여러 종류 의 렌즈를 겹쳐 왜곡을 최소화하는 방법을 조사하는 것에 의지를 보임. \n수학과제 탐구 : 학생들이 수학 교육을 이해하기 쉽게 하는 방법을 알아보고자 시도한 사례가 기존에 많이 없었다는 것을 알 게 되어 관심을 가짐. 이에 '수학 교육과 프로그래밍의 융합 효과'를 주제로 삼아 수학 보고서를 작성함. 현대에 소프트웨어 분야가 크게 발전했음에도 불구하고 오늘날 수학교육에는 과거와 다름없이 단방향적인 교육을 유도하는 PPT 같은 발표 자료 제작용 소프트웨어만 사용되고 있다는 걸 깨달음. 여러 프로그래밍 언어를 수학 교육에 접목한 연구들을 통해 학생들이 프로 그래밍으로 수학교육을 진행했을 때 학생들의 문제 해결력과 풀이 검증 능력이 향상될 수 있다는 사실과 학생과 교육자가 서 로 묻고 답하는 쌍방향적 교육 환경이 만들어진다는 사실을 증명하여 프로그래밍을 접목한 수학교육이 효과가 있음을 보여 줌. \n영어 II: Role Model Research 활동으로 롤모델인 '오빌 라이트'에 대한 에세이를 작성함. 위키피디아 인물사전을 참고한 후, 롤모델의 어린 시절과 역경을 극복한 사례, 비행기 발명에 성공할 수 있었던 이유에 대해 개요를 작성함. 이를 기초로 In tro, Main body, Conclusion이 유기적으로 연결된 에세이를 완성함. 특히 롤모델의 부딪친 또 다른 역경에 대해 추가로 내용을 작성하는 적극적인 태도로 교사에게 강한 인상을 남김. '오빌 라이트'의 일생을 문법 오류없이 영어로 나타내는 데 어 려움이 있었으나, 영문 사이트의 문장을 참고하여 단어 및 어법의 적절성을 판단함. 성공을 위해선 아이디어뿐만 아니라 실 천 · 노력 · 끈기가 필요하다는 점을 느끼고 영어 능력 면에서 성장했다는 소감문을 제출함. \n. \nReading&Comprehension 활동으로 어휘 지식을 쌓고, 긴 문장을 선별하여 주어, 서술어, 목적어 부분을 표시하며 독해연 습을 하는 등 독해 속도를 늘리려고 노력함. \n프로그래밍 분야 진학을 희망하는 학생으로 '과학만능주의의 문제점'을 주제로 한 영어지문을 읽고 사람이 만든 과학이론도 결함이 있을 수 있다는 점을 깨닫고 여러 학문적 관점을 포용해야 한다는 점을 배웠다는 소감을 밝힘. \n진로 영어: 탄탄한 문법지식을 바탕으로 어법상 틀린 부분을 찾는 유형의 지문을 풀이하는 수업시간에 그 누구보다도 정확하 게 정답과 정답인 이유를 설명함. \nWrite your SOP(Statement Of Purpose) 활동으로 영문 자기소개서를 작성함. Brainstorming 단계에서 본인을 묘사 하는 영어단어로 tenacious(끈질긴), motivated(의욕적인) 등을 정리하고, 3년간의 교내활동 중 주요 업적을 정리함. Wr iting 단계에서는 입학사정관의 마음을 사로잡는 Hook으로 도입문단을 작성하고, 프로그래밍 분야에서 요구하는 Comput er literacy(프로그래밍 언어 활용 능력), Leadership (리더십)이 잘 드러나는 교내활동, 위기극복 사례를 중심으로 본론을 \n작성함. Revision 단계에서는 이렇게 작성한 초안(draft)을 진학지도 선생님과 담임선생님, 영어교과선생님과 함께 읽어 보고 피드백을 반영해 수정함. \n생활과 윤리 : 인공지능 분야에서 발생할 수 있는 과학 기술의 사회적 책임에 대해 관심을 보임. 인공지능의 발달로 인간의 삶 \n경희고등학교 \n2025년 11월 20일 20/26 반 \n번호 17 이름 서현승 \n6 \ngov.kr \n정부24 \n과목 \n문서확인번호: 1763-6098-4150-6899 (신청인: 서현승) \n세부능력 및 특기사항 \n이 편리해졌으나 로봇이 반란을 일으킨다는 내용을 담은 영화 '아이, 로봇'을 접함. 이후 영화에서 제시된 것처럼 과학 기술 에 대해서 두려워해야만 하는가에 대한 의문을 갖게 됨. 이를 주제로 보고서를 작성함. 과학 기술 지상주의와 과학 기술 혐오 주의에 대한 내용을 중심으로 자신의 의견을 전개함. 과학 기술 지상주의에 대한 사례로 1학년 때 읽었던 '멋진 신세계'의 내 용을 제시함. 과학 기술 혐오주의에 대한 내용으로 기계 파괴 운동인 '러다이트 운동'의 내용을 제시함. 두 사례를 제시 후 과 학 기술 지상주의와 과학 기술 혐오주의 모두 한쪽 측면만 강조하는 치우친 주장이라는 것을 알게 됨. 이에 생활과 윤리 시간 에 배웠던 과학 기술에 대한 중립적 접근이 요청됨을 떠올림. 이때의 중립은 산술적 중립이 아님을 바탕으로 과학 기술에 대 한 성찰에 근거한 과학 기술의 사용이 필요함을 강조함. \n물리학 II: 물리학시간에 집중력이 높은 상태로 수업에 참여하는 학생 중 한명임. 모르는 것이 있을 때에는 항상 질문을 통해 해결하며 반복적인 학습으로 자기 것으로 만드는 역량을 보유함. 프로그래머가 되기 위해 부단히 노력중이며 뛰어난 물리적 문제해결력, 사고력, 탐구능력은 이를 이루는데 큰 강점이 될 것임. \n수업시간에 유리관에 연결한 고무마개의 회전운동에 대해 발표함. 등속원운동에 대한 내용을 운동방정식을 활용하여 명쾌하 게 설명함. 등가속도 운동 실험에서 자료 분석자의 역할을 충실히 수행함. 자료들을 검토하고 누락된 부분을 추가하거나 오 류를 수정하는 등 마무리 작업에 힘씀. 전기용량 측정 실험에서 자료 분석의 임무를 이행함. 결과로 나온 값들을 세심하게 정 리하고 표와 그래프로 나타내는 등 모둠원들을 도왔음. \n물리학탐구시간에 게임에서 물리학의 필요성에 대해 발표함. 가상공간을 만들기 위해서는 물리 법칙이 필수적이라는 것을 다 양한 예시들을 통해 설명하여 친구들의 흥미를 자극함. 썰매를 타는 게임에서 물리법칙을 고려하여 렌더링을 하고 파티클을 생성하는 상황을 집중 탐구함. 전문적인 내용들도 알기 쉽게 설명하여 친구들의 호응을 얻어 냈으며 앞으로의 행보가 대단히 기대됨. \n화학II: 교과서에서 액정이 어떻게 화면을 원하는 대로 표현할 수 있는지에 대해 설명하는 글을 읽고 화학 기술이 오늘날의 기계에서 중요한 역할을 할 수 있다는 것을 깨달음. 이에 액정 외에도 기계에 활용될 수 있는 화학 기술들이 궁금해져 조사해 봄. 조사를 통해 2016년 노벨 화학상이 '분자 기계'라는 것을 개발한 사람들에게 주어졌음을 알게 됨. 분자 기계라는 주제에 흥미를 가지게 되어 탐구해보고자 하였으나 관련 논문이 부족하여 기계가 만들어지는 방법과 작동 원리를 이해하는 것에 어 려움이 있었음. 이 문제를 인터넷에 올라와 있는 각종 관련 기사, 지식백과 등을 통해 이해할 수 있었음. 분자 단위로 간단한 자동차와 인공 근육, 심지어 승강기까지 만들 수 있다는 것에 놀랐고 수상자들의 연구를 통해 해당 기술이 점점 발달하고 있 다는 걸 알 수 있었기에 미래에는 이를 활용해 얼마나 작은 기계를 만들 수 있을지, 또 그것이 우리의 삶에 어떠한 영향을 줄 지 생각해봄. \n알콜의 연소열을 측정하는 활동을 하였음. 같은 질량의 알콜도 종류에 따라서 연소열이 다르게 측정됨을 알 수 있었고, 실험 에는 다양한 오차가 존재한다는 것을 알고 실험 오차를 줄일 수 있는 다양한 방법에 대한 조사를 하게 되는 계기가 됨. \n화학 실험 : 화학 전지 실험에 대해 배우면서 다른 종류의 전지에 대해 호기심을 가지게 되어 각각의 특징과 발전에 대해 탐구 해봄. 처음에는 전지의 종류가 예상외로 많아 구별하는 데에 어려움이 있었으나 키트를 이용해 기계를 조립해본 경험과 자동 차 정비소에서 자동차 내부 구조를 파악해본 경험들을 통해 접했던 전지들을 떠올리며 구별할 수 있었음. 탐구를 통해 전지가 아직 현대에 엄청난 발전을 이루진 못하였다는 것을 알게 되어 혁신적인 휴대기기 기술을 위해서는 전기 사용량을 최소화하 는 프로그래밍이 필요하다는 것을 느낌. \n프로그래머를 꿈꾸고 있어 화학실험을 배우면서 프로그래밍과 연관된 화학 분야가 있을지 궁금해져 탐색해봄. 그러한 화학 \n경희고등학교 \n2025년 11월 20일 21/26 반 \n6 \n번호 17 이름 서현승 \ngov.kr \n정부24 \n문서확인번호: 1763-6098-4150-6899 (신청인: 서현승) \n과목 \n세부능력 및 특기사항 \n분야에 계산화학이 있다는 것을 알게 됨. 컴퓨터를 이용하여 복잡한 화학 반응을 계산하고 연구하는 분야였기에 미래에는 컴 퓨터로 현실의 물리, 화학 법칙 등을 거의 똑같이 구현한 가상 세계가 나올 수도 있겠다는 생각이 듦. \n스포츠 생활: COVID-19 상황에 따른 교육청의 지침으로 수행평가 하나만으로 평가를 봄. 체육수업에 부지런히 참여하는 학생으로 수행평가인 축구리프팅 실력이 저조하였으나 부단한 노력을 통해 좋은 성과를 보임. 8자드리블을 하면서 수차례 땀 을 흘리며 연습하여 인사이드 아웃사이드 드리블 터치감을 익혔으며 리듬감있게 잘하여 등급가산점을 받아서 매우 만족해 함. 또한 축구를 잘하는 동료 학생들에게 잘하는 방법을 코칭받고 지속적으로 노력하는 태도가 칭찬할 만함. \n논술: 평소 IT 산업에 관심이 많은 학생으로 오늘날 간편 결제 산업이 폭발적으로 성장하고 있음에 주목함. 스마트폰으로 간 편 결제를 하게 되면서 생활이 매우 편리성이 높아졌다고 생각하고 이에 대해 더 이해해보고자 하여 간편 결제의 역사와 장단 점들을 조사해봄. 현대 여러 나라들이 간편 결제로 편리함을 누리고 있고 그 중 중국은 간편 결제가 생활에 필수가 될 정도로 발달한 것을 알게 됨. 한국의 경우 한동안 공인인증서로 인해 다른 나라와 비교하여 불편한 전자거래 체계를 유지하다가 스 마트폰이 급부상하면서 간편 결제 활성화의 길이 뒤늦게 열림. 이러한 상황에서 여러 업체가 간편 결제 시장에 우후죽순 진출 하여 다른 나라들에 비해 통일성이 없어져 간편함이 무색해지는 문제가 생겼음을 알게 됨. 우리나라에서 간편 결제의 통일성 이 어떻게 이루어질지, 또 어떤 신기술이 간편 결제 시장에 혁신을 일으켜 판도를 바꿀지 예측하여 글을 씀. \n프로그래밍: C 언어에 대한 사전지식이 이미 있었으나 기초문법부터 다시 배우는 것에 대해 지루한 내색 한 번 없이 수업에 참여하였고, 잊었던 부분은 없는지 확인해 볼 기회로 여기는 긍정적인 모습이 인상적임. 복잡한 내용에 대해서도 작동 원리 도 더욱더 깊이 이해할 수 있게 되었다는 소감을 제출함. 작동 원리를 이해한 것을 바탕으로 새로운 프로그램을 만들어보면서 코딩 실력이 성장하는 모습을 보임. 수업을 통해 배운 내용을 모두 이해하고 활용도 해 보았기에 수행평가에서 높은 성적을 기대했으나, 활용 과정에서 실수를 한 문제들이 보였음. 이후 학생에게 해당 문제를 틀린 이유를 물어보고 토론하는 과정에 서, 학생은 프로그래밍 수업이 프로그램이 무엇인지를 알아보는 것에서 시작했던 것과 같이 개념과 같은 기초 실력을 다져두 는 것이 전체적인 실력 향상에 도움이 된다는 걸 느꼈다고 함. 또한, 컴퓨터공학과에서는 프로그래밍 언어를 다양하게 활용 할 줄 아는 능력이 매우 중요하기 때문에 여러 활용 방법과 작동 원리를 이해하고 직접 코딩해보고자 노력해야 한다는 것을 깨달았다고 함. 초심을 잃지 않고 지식의 폭을 넓혀갈 미래가 기대되는 학생임. \n<체육 예술 > \n1학기 \n2학기 \n교과 \n과목 \n비고 \n단위수 \n성취도 \n단위수 \n성취도 \n이수단위 합계 \n0 \n0 \n과목 \n특기사항 \n해당 사항 없음 \n9. 독서활동상황 \n경희고등학교 \n2025년 11월 20일 22/26 반 \nCO \n6 \n번호 17 이름 \n서현승 \ngov.kr \n정부24 \n문서확인번호: 1763-6098-4150-6899 (신청인: 서현승) \n학년 \n과목 또는 영역 \n한국사 \n국어 \n국어 \n영어 \n영어 \n1 \n통합사회 \n통합사회 \n통합과학 \n공통 \n공통 \n문학 \n수학 I \n수학II \n독서활동 상황 \n(1학기) 조선왕조실록(박영규), 한국사 편지 3(박은봉), 우리 문화유산에는 어떤 비밀이 담겨 있을까(한창수) \n(1학기) 달려라 애비(김애란), 눈길(이청준) \n(2학기) 갑을고시원 체류기(박민규), 삼포 가는 길(황석영) \n(1학기) The Old Man and the Sea(Ernest Hemingway), The Secret Garden(Fr ances Hodgson Burnett) \n(2학기) The Outsiders(S. E. Hinton), A Wrinkle in Time(Madeleine L'engle) \n(1학기) 동물농장 (조지 오웰), 멋진 신세계 (올더스 헉슬리) \n(2학기) 개인주의자 선언(문유석), 위대하고 찌질한 경제학의 슈퍼스타들(브누아 시마) \n(1학기) 이중나선(제임스 D. 왓슨), 역사를 바꾼 17가지 화학이야기(페니르 쿠터, 제이 버레슨) \n(1학기) 유클리드가 들려주는 공간도형 이야기 (이지현) \n(2학기) 아프리카의 성자 슈바이처(정지아), 수학 귀신(H. 엔첸스베르거) \n(1학기) 남한산성 (김훈) \n(1학기) 도형이 쉬워지는 인도 베다수학(마키노 다케후미) \n(1학기) 우리 역사 속 수학 이야기 (이장주) \n2 \n확률과 통계 \n(2학기) 30분 통계학(구라타 히로시) \n물리학 I \n지구과학I \n독서 \n영어 I \n생활과 윤리 \n(1학기) 아인슈타인의 생각 실험실(송은영) \n(1학기) 지진(앤드루 로빈슨) \n(1학기) AI의 미래 : 생각하는 기계 (토비 월시), AI Superpowers(Kai-Fu Lee) \n(1학기) A Long Walk to Water(Linda Sue Park) \n(1학기) 대안 없는 대안 원자력 발전(신부용) \n3 \n물리학 II \n(2학기) 물리학 클래식(이종필) \n화학II \n화학 실험 \n(1학기) 공기의 연금술(토머스 헤이거) \n(1학기) 일상적이지만 절대적인 화학지식 50 (헤일리 버치) \n경희고등학교 \n2025년 11월 20일 23/26 반 \n6 \n번호 \n17 이름 \n서현승 \ngov.kr \n정부24 \n문서확인번호: 1763-6098-4150-6899 (신청인: 서현승) \n10. 행동특성 및 종합의견 \n학년 \n행동 특성 및 종합의견 \n1 \n2 \n3 \n항상 성실하고 강한 책임감을 바탕으로 주어진 모든 일을 성실하고 완벽하게 처리하려고 노력하며, 일 년 동 안 학급에서 정한 등교시간에 한 번의 지각도 없었음. 또한 약속한 일에 대해서는 항상 최선을 다하며 각종 숙 제나 제출사항, 해야 할 일에 대해서 약속한 시일을 어긴 적이 없음. 준법의식이 강해서 학교에서 정한 교칙에 \n어긋남이 없이 착실하고 모범적으로 생활하여, 벌점 없이 학기를 마침. \n굉장히 착실하고 꼼꼼한 학생임. 작은 이야기도 흘려듣지 않고 학교에서 요구하거나 자신이 해야할 일이나 과 제를 매우 꼼꼼하게 관리함. 담임교사가 학급 운영과 관련된 유인물이나 전달사항 등에 대하여 잊어버리거나 빠트리는게 있을 때 마다 이 친구가 항상 알려주고 챙겨주어 도움이 되었음. \n또한, 자기 관리 능력이 뛰어나고 계획성이 있으며 책임감이 강하여 정해진 원칙에 따라 목표를 성실히 추진 해나감. 자신의 주관과 생각이 뚜렷하고 이성적이고 논리적으로 생각함. 공부에 있어서도 자신이 무엇을 원하 는지, 어떤 공부 방식이 맞는지, 어느 부분이 부족한지 등을 명확하게 파악하고 계획적으로 공부하므로 믿고 맡기게 되는 믿음을 주는 학생이었음. \n특히 영어에서 높은 학업성취도와 재능을 보이고 점차 성적이 더 상승하는 모습을 보임. 스스로 영어를 좋아 하고 그래서 열심히 하였으며 그에 상응하는 결과들을 보여줌. 특히 이렇듯 영어분야에서 두드러지는 본인의 실력을 바탕으로 친구들의 부족한 학업을 적극적으로 도와주고, 영작을 해주거나 질문에 대한 답을 조리 있고 명쾌하게 알려주어서, 학급 친구들이 '영어'하면 이 친구를 떠올릴 정도였음. 이러한 학업적 능력을 고려하였 을 때, 외국어 분야에서의 장래성이 매우 높다고 판단함. \n영어를 아주 잘 하는 학생임. 이는 학교의 학생들뿐만 아니라 영어 교사도 인정함. 학생이 영어를 잘하는 것은 \n순수한 학생의 노력임. 학생의 성향을 보면 요령을 피우지 않고 무엇이든 성실히 하는 모습을 볼 수가 있음. 영어 공부에는 왕도가 없다는 말처럼 성실히 하루하루 영어 공부를 한 것이 오늘의 학생을 만든 것임. 학생은 프로그래밍을 잘 함. \n학교 특색 프로그램인 IT 전문 과정을 2년 동안 성실하게 이수함. 따라서 시간이 쌓임에 따라 실력도 차곡차 곡 쌓임. 학생은 이런 실력을 바탕으로 도전하는 것도 즐김. 앱을 만든다든지, 리듬 게임을 만드는 것도 이러 한 도전의 결과물임. 학생은 더 나은 프로그램을 만들기 위해 노력함. 그래서 앞으로의 IT 기술의 변화를 알고 \n싶어 전공심화 프로그램에도 참여함. \n학생은 진로에 대한 소신이 있으며 이를 더욱 구체화하기 위해 진로 탐색을 게을리 하지 않음. 대학탐방을 가 서 직접 체험하기도 하고 최신 전기전자전에 가서 현재의 트렌드와 기술 개발의 정도를 체크하기도 함. 학생은 진솔하고 담백한 성향을 갖고 있음. 그리고 자신이 하는 일에 성실함. 앞으로 진로에 대한 노력과 학생 의 이런 성향은 학생을 더욱 발전할 수 있는 길로 이끌 것임. \n온순하고 밝으며 긍정적인 학생으로 때론 꼼꼼한 모습을 보여주는 착한 아이임. 궁금한 것이 있을 때 항상 질 문을 통해 해결하며 학급운영에도 많은 도움이 되었음. 교사를 신뢰하고 존경하며 교우관계도 매우 좋음. 컴 퓨터 소프트웨어에 대한 열정으로 가득하여 반드시 우수한 프로그래머가 될 수 있을 것 같은 학생임. 컴퓨터 를 통해 무언가 뚝딱뚝딱 만들고 있는 모습이 보기 좋았음. \n학급에서 가장 많은 시간을 IT과정 프로그램에 할애한 소프트웨어 에이스 중 에이스임. 프로그래머로서의 역 량을 기르고자 교과, 비교과 활동에 적극적으로 참여함. 다방면의 교과에서 좋은 성과를 얻었고 특히 돋보이 는 것은 영어실력임. 영어능력이 우수하여 프로그래밍에도 큰 도움이 될 것으로 사료됨. 이는 영어교사도 인 정할 정도임. 예의가 바르고 경청하는 자세를 가지고 있으며 자세가 남다르다는 평가가 있음. \n경희고등학교 \n2025년 11월 20일 24/26 반 \n6 \n번호 17 이름 서현승 \n(KOR) \ngov.kr \n정부24 \n문서확인번호: 1763-6098-4150-6899 (신청인: 서현승) \n학년 \n행동 특성 및 종합의견 \n3 \n도서관에서 꾸준히 봉사활동을 하여 배려심과 이타심을 기름. 학급에서 강조하는 인성, 성실, 신뢰의 3박자 를 가장 잘 실천하고 있는 학생으로 사소한 일도 꼼꼼하게 끝까지 마무리 지어 믿을 만 함. 다방면의 독서도 \n열심히 하여 배경지식을 쌓았으므로 앞으로 프로그래머로서의 행보가 기대됨. \n경희고등학교 \n2025년 11월 20일 25/26 반 \n6 \n번호 17 이름 \n서현승 \ngov.kr \n정부24 \n문서확인번호: 1763-6098-4150-6899 (신청인: 서현승) \n발급번호: B100000384-2025-002507 \n학교생활기록부 \n성 \n명 \n서현승 \n인적 \n사항 \n주민등록번호 \n020610-******* \n담당부서 \n경희고등학교 \n담당자 전화번호 \n이상걸 \n02-3299-3794 \n위 사람의 학교생활기록부 사본임을 증명합니다. \n2025년 11월 20일 \n烏 \n경희고등학교장 \n경희고등학교 \n2025년 11월 20일 26/26 반 \n6 \n번호 17 이름 \n서현승 \ngov.kr \n정부24 \n"
}