{
  "student_info": {
    "name": "주남영",
    "gender": "남",
    "birth": "060422",
    "address": "전라남도 목포시 삼향천로91번길 21, 202동 704호 (옥암동, 현대2차아파트)",
    "school_history": [
      "2022년 2월 10일 목포하당중학교 제3학년 졸업",
      "2022년 3월 2일 목포덕인고등학교 제1학년 입학",
      "2025년 2월 5일 목포덕인고등학교 제3학년 졸업"
    ]
  },
  "attendance": "출결 구간 전체 raw 저장됨",
  "awards": [
    {
      "grade": "2",
      "award_name": "교과우수상",
      "date": ""
    },
    {
      "grade": "2",
      "award_name": "교과우수상",
      "date": ""
    },
    {
      "grade": "3",
      "award_name": "년 개근상",
      "date": "2025. 02.05."
    },
    {
      "grade": "3",
      "award_name": "창의적체험활동상",
      "date": ""
    },
    {
      "grade": "3",
      "award_name": "창의적체험활동상",
      "date": ""
    },
    {
      "grade": "9",
      "award_name": "창의적체험활동상",
      "date": ""
    },
    {
      "grade": "1",
      "award_name": "명 을 대상",
      "date": ""
    },
    {
      "grade": "2",
      "award_name": "학기) 나는 수학으로 세상",
      "date": ""
    }
  ],
  "certificates": "및 인증 취득상황 \n<자격증 및 인증 취득상황> \n구분 \n명칭 또는 종류 \n번호 또는 내용 \n취득연월일 \n발급기관 \n<국가직무능력표준 이수상황> \n능력단위 \n학년 학기 \n세분류 \n이수시간 \n원점수 \n성취도 \n비고 \n(능력단위코드) \n해당 사항 없음",
  "creative_activities": {
    "grade1": "2",
    "grade2": "KST \n정부시절 \n문서확인번호: 1763-6194-8644-5012 (신청인 : 주남영) \n학교생활세부사항기록부(학교생활기록부II) \n졸업대장번호 20420 \n구분 \n학년",
    "grade3": "1. 인적·학적사항 \n성명 : 주남영 \n학생정보 \n학과 \n반 번호 \n담임성명"
  },
  "academic_records": [
    "문서확인번호: 1763-6194-8644-5012 (신청인 : 주남영) \n학교생활세부사항기록부(학교생활기록부II) \n졸업대장번호 20420 \n구분 \n학년 \n1 \n2 \n3 \n1. 인적·학적사항 \n성명 : 주남영 \n학생정보 \n학과 \n반 번호 \n담임성명 \n2 \n21 \n최석원 \n2 \n20 \n고영학 \n1 \n22 \n김은정 \n성별 : 남 \n주민등록번호 : 060422-*******",
    "주소: 전라남도 목포시 삼향천로91번길 21, 202동 704호 (옥암동, 현대2차아파트) \n2022년 2월 10일 목포하당중학교 제3학년 졸업 \n학적사항 2022년 3월 2일 목포덕인고등학교 제1학년 입학 \n2025년 2월 5일 목포덕인고등학교 제3학년 졸업 \n특기사항 \n2. 출결상황 \n결석일수 \n지각 \n학년 수업일수 \n1 \n191 \n2 \n190 \n3 \n190 \n3. 수상경력 \n조퇴 \n결과 \n질병 미인정 기타 질병 미인정 기타 질병 미인정 기타 질병 미인정 기타 \n특기사항 \n개근, 원격수업일수 \n5일 \n개근, 원격수업일수 \n0일 \n개근 \n목포덕인고등학교 \n2025년 11월 20일 1/28 반 \n1 \n번호 22 이름 \n주남영 \n(KOR \ngov.kr \n정부24",
    "문서확인번호: 1763-6194-8644-5012 (신청인 : 주남영) \n학년 \n수상명 \n등급(위) \n수상연월일 \n수여기관 \n(학기) \n수학 창의문제 해결 경진대 회 \n장려상(5위) \n2022. 05.11. \n목포덕인고등학교장 \n참가대상 \n(참가인원) \n1학년(162명) \n통계포스터 제작 경진대회 \n동상(4위) \n2022.05.13. \n목포덕인고등학교장 \n1학년(162명) \n1 \n수학 심화문제 해결 경진대 회 \n동상(4위) \n2022, 11, 29. \n목포덕인고등학교장 \n1학년(160명) \n2 \n교과우수상(미술) \n2022.12.30. \n1 \n수학 창의문제 해결 \n장려상(5위) \n2023.05.17. \n2 \n수학 심화문제 해결 \n장려상(5위) \n2023, 11, 29. \n2 \n교과우수상(운동과 건강) \n2023. 12. 29. \n목포덕인고등학교장 \n목포덕인고등학교장 \n목포덕인고등학교장 \n목포덕인고등학교장 \n수강자 \n2학년(162명) \n2학년(157명) \n영어 콘텐츠 제작 \n장려상(4위) \n2024.06.28. \n목포덕인고등학교장 \n수강자 \n3학년 전체(156 명) \n교과우수상(융합과학) \n2024.07.19. \n3 \n3년 개근상 \n2025. 02.05. \n목포덕인고등학교장 \n목포덕인고등학교장 \n수강자 \n3학년(156명) \n교과우수상(융합과학, 스포 \n2 \n2025.02.05. \n목포덕인고등학교장 \n수강자 \n츠 생활) \n표창장(봉사부문) \n2025.02.05. \n목포덕인고등학교장 \n3학년(156명) \n4. 자격증 및 인증 취득상황 \n<자격증 및 인증 취득상황> \n구분 \n명칭 또는 종류 \n번호 또는 내용 \n취득연월일 \n발급기관 \n<국가직무능력표준 이수상황> \n능력단위 \n학년 학기 \n세분류 \n이수시간 \n원점수 \n성취도 \n비고 \n(능력단위코드) \n해당 사항 없음 \n5. 창의적 체험활동상황 \n목포덕인고등학교 \n2025년 11월 20일 2/28 반 \n1 \n번호 22 이름 \n주남영 \n(KOR), \ngov.kr \n정부24 \n1",
    "문서확인번호: 1763-6194-8644-5012 (신청인 : 주남영) \n학년 \n영역 \n시간 \n자율활동 \n75 \n동아리활동 \n43 \n창의적체험활동상황 \n특기사항 \n평소 인공지능을 활용한 문제 해결에 관해 관심을 지닌 학생으로 해커톤 모둠 활동(20 22.10.31./8시간)에 참여함. 수질검사를 위해 업체를 부르는 번거로움을 줄이고, 사 람이 직접 하는 수질검사의 대안으로 수시로 검사하여 오염도를 빠르게 감지할 수 있도 록 아두이노를 통한 수질검사 자동화 시스템을 고안하여 제안함. 3D 프린터를 활용하 여 외관을 만들고 태양광 발전기를 통해 배터리를 충전하며 GPS를 사용하여 위치를 파악하고 초음파 센서를 통하여 사고를 방지, 아두이노용 아날로그 TDS 센서와 카메 라를 통해 수질을 감지, NRF 통신 모듈을 사용하여 양방향 통신하는 프로토타입을 제 작하여 모둠 활동에 참여한 친구들에게 소개함. 최근 일어났던 강남 홍수 사태의 원인 중 하나로 배수구가 쓰레기로 막혀 빗물이 잘 내려가지 않았다는 기사를 접하고 '스팀 PBL 활동'에서 이를 해결하려는 방법을 모색함. 태양광 발전기를 통해 비영구적인 에 너지 제공이 가능하며 평소에는 중간에 대각선의 쓰레기 거름망을 설치한 일반 하수구 상태이다가 습도 감지 센서가 습기를 감지하였을 때 모터를 이용하여 쓰레기를 올려 배 출하는 형태의 프로토타입을 제작함. 이러한 활동을 수행하면서 창의적 문제 해결 능 력과 응용 능력을 키움. \n(Hacker (융합, 컴퓨터)) (43시간) 자율주행 자동차 탐구를 바탕으로 아두이노를 활용 한 RC카를 전진, 후진을 비롯한 다양한 방향 전환의 프로그래밍을 구현하면서 RC카 앞에 있는 장애물을 피하기 위해 적외선 센서를 사용하여 일정 거리가 되면 바퀴를 회 전시키는 코딩 프로그램을 작성하는 등 창의적 사고력이 돋보임. 제작한 RC카를 동아 리 체험 부스에 선보이며 학우들이 자유롭게 이용할 수 있도록 소프트웨어 체험 부스를 운영하고 아울러 학우들에게 RC카가 구동되는 원리와 제작 과정을 직접 나서 설명하 는 등 소프트웨어의 중요성을 전달하고 적극적인 참여가 돋보이는 학생임. 또한 학교 에서 석식을 먹는 학생들을 구별할 수 있도록 아두이노로 작성된 코드를 수정해보면서 텍스트 프로그래밍에 관심을 가짐. 코드를 수정하는 과정에서 일일이 바꿔야 한다는 점에서 불편함을 느끼고 이를 더 편하게 수정할 수 있도록 동아리 친구들과 파이썬으로 테스트를 해보면서 프로그래밍에 대한 부족한 점을 깨닫고 자신이 나아갈 방향성을 다 짐함. 컴퓨터를 조립, 분해하며 하드웨어 시스템에 관한 이해도를 높이고 선배에게 네 트워크와 윈도우 관련 서비스 시스템에 관해 설명을 듣고 컴퓨터를 고칠 수 있는 능력 을 키움. \n목포덕인고등학교 \n2025년 11월 20일 3/28 반 \n1 \n번호 22 이름 \n주남영 \ngov.kr \n정부24",
    "문서확인번호: 1763-6194-8644-5012 (신청인 : 주남영) \n창의적체험활동상황 \n학년 \n영역 \n시간 \n특기사항 \n희망분야 공학계열 \n1 \n진로활동 \n2 \n자율활동 \n7 \n93 \n대학교 학과 체험 (2022. 5. 18.) 중 컴퓨터공학과의 강연을 들으며 컴퓨터에 대한 지식 과 기술을 배우고 다양한 분야에 적용할 수 있는 컴퓨터공학과에 관한 흥미와 관심을 키움. 이후 간단한 연산 프로그램을 직접 프로그래밍하며 컴퓨터를 이용한 문제 해결 에 흥미를 느낌. 이를 계기로 진로에 대해 깊게 고민해 보는 시간을 가짐. 또 00대학교 학과 강연 (2022. 7. 13.)에 참여하여 컴퓨터공학과와 관련된 다양한 부문에서 대학 입 시 관련 내용을 살펴봄. \n대학 전공 알림 아리(2022.9.8.)에서 AI 융합 대학과 '공업과 기술 및 공학 관련 학과 에 대한 설명을 들음. 처음 강연에서는 4차산업혁명 시대를 선도하는 창의적인 융합 인재 양성을 위해 기존 학과의 틀 속에서 진행되는 교육에서 벗어나 융합적이고 복합적 인 지식을 교육하며 인공지능학부, 빅데이터 융합 학과 등 여러 분야를 학습할 수 있다 는 사실과 두 번째 강연에서 소프트웨어 공학과 컴퓨터 정보통신 공학과, 화학 공학부 등에 대해 알게 됨. 이를 통해 인공지능에 관한 관심을 더욱 키웠으며 도서 '인공지능 의 현재와 미래’를 읽으며 인공지능의 기술을 탐구하고, 미래에는 인공지능이 많은 분 야에 활용되어 사용될 것으로 예측함. 이후 컴퓨터 게임에 흥미를 느끼고 컴퓨터 게임 을 직접 만들어 보고 싶다는 포부를 밝힘. 또, 게임을 컴퓨터로 구현하기 위해서는 프 로그래밍을 배워야 함을 알고 현직 컴퓨터 프로그래머와 전화 통화로 인터뷰를 진행하 여 4차 산업 분야에서는 빠질 수 없는 것이 코딩이라는 이야기를 통해 프로그래머의 밝 은 비전을 이해함. 이를 계기로 컴퓨터 프로그래머를 목표로 정하고, 관련 과목인 정보 와 수학 등의 학습에 더욱 매진하는 등 목표를 위하여 꾸준히 노력하는 모습을 보임. \n국어 교과에서 책 '정의란 무엇인가'(마이클 샌델)을 독서함. 특히, '소수가 희생해 다 수가 행복하다면 정의인가?'라는 물음에 깊은 사색을 함. 이후, 이와 관련된 자율주행 자동차의 문제점인 트롤리 딜레마에 대한 관심을 가지고 탐구를 진행함. 특히, 실질적 해결책을 주도적으로 제시하겠다는 목표를 세움. 아이디어 구상 단계에서 MBTI 키워 드에 영감을 받고, 차량을 구매하기 전 사고 상황에 대한 판단 경향 조사를 통해 운전 자의 기준을 AI에 학습시켜 사용자 맞춤화 소프트웨어를 제공하는 해결책을 제시함. 작년 활동에서 트롤리딜레마 내의 학생들의 판단 기준을 설문조사한 결과를 바탕으로 조사집단(185명)은 나이가 어리고 사람의 수가 많을수록 안전을 우선시하는 경향이 있 음을 파악한 후, 8개의 유형으로 이를 나눈 TDTI(트롤리딜레마 MBTI)를 제시함. Py thon을 활용하여 데이터를 정리한 후 학생들의 TDTI를 확인한 뒤 노인, 어른, 어린이 로 이루어진 사고 상황에서의 선택을 제시하는 프로그램을 완성한 후, 일련의 과정을 심화탐구제에서 발표하며 자율주행자동차의 실현 가능성을 한층 더 높일 수 있음을 주 장함. 독서에서 비롯된 의문에 대해 주도적으로 해결책을 제시하는 모습과 프로그램을 \n제작하는 탐구력이 탁월함 \n목포덕인고등학교 \n2025년 11월 20일 4/28 반 \n1 \n번호 22 이름 주남영 \ngov.kr \n정부24 \n2",
    "문서확인번호: 1763-6194-8644-5012 (신청인 : 주남영) \n학년 \n영역 \n시간 \n동아리활동 \n53 \n창의적체험활동상황 \n특기사항 \n(Hacker (융합, 컴퓨터)) (53시간) 담임선생님이 두 손에 물건을 들고 학년실로 들어가 기 불편한 모습을 보고 머신러닝을 활용하여 자동문 앞 카메라가 얼굴을 인식해 자동으 로 문을 여는 프로그램을 만들어 보고자 계획함. 3D 프린터로 직사각형 모양의 틀을 만들어 그 안에 카메라와 모터, 플라스틱 블록을 넣은 뒤 라즈베리파이 카메라 센서로 얼굴을 인식하면 신호를 받아 모터가 움직여 블록이 자동문 버튼을 누르는 장치를 설계 하고 3D 모델링을 통해 테스트를 거침. 또한 자신과 친구의 얼굴을 사진으로 촬영한 얼굴인식 모델을 tensorflow로 로드한 후 python 물체 인식 라이브러리인 opencv 의 CascadeClassifier와 VideoCapture를 사용하여 얼굴을 인식하고 검출된 얼굴 이미지를 추출 및 전처리 후 예측 결과에 따라 일치하면 신호를 보내고 일치하지 않 으면 X 신호를 보내 모터를 작동시키는 코드를 작성함. 수학II 시간에 배웠던 미분을 활용하여 오차율을 줄이는 머신러닝의 경사하강법을 활용하면서 얼굴 이미지 학습 정 확도를 높이는 결과를 얻게 됨. 이후 프로그램을 통해 무리하게 문을 열다 다치거나 무 단 침입자가 발생하는 경우를 대비할 수 있을 것이라 기대함. 일상생활에서 문제를 찾 아 능동적인 자세로 해결하는 능력이 뛰어남. \n희망분야 컴퓨터공학 \n진로활동 \n인공지능의 종류, 간단한 원리, 생활 속의 인공지능에 관해 설명을 듣고, 티처블머신을 \n활용해 개와 고양이를 분류하는 프로젝트를 진행함. 사진을 하나하나 가져오는데 불 편함을 느끼고 python과 Selenium 라이브러리를 활용해 크롤링을 통해 사진을 가져 오고 에포크를 50번 진행 시킴. 이러한 활동을 통해 머신러닝 프로세스의 반복적인 특 성에 대해 이해하고 인공지능에 대해 흥미를 가짐. NVIDIA Jet Bot과 python을 활 용해 충돌을 방지하는 자동차의 코드 설명을 듣고, 충돌할 때와 충돌하지 않을 때를 사 진을 찍어 학습시킴. 창의성과 전문성을 활용하기 위해 해커톤 캠프에 참여함. 평소 피 로함을 느끼고, 이를 해결하기 위한 방법은 영양소 불균형을 해결하는 것으로 생각하 고 맞춤형 영양 공급 시스템 C. N. S를 고안해 냄. 신원 확인하기 위해 학생증을 아두이 노 RFID 센서에 태그하고 학생증에 있는 정보를 통해 신체 정보를 분석하고 채혈을 통 해 학생증으로 인식된 정보를 토대로 그 사람의 영양소 상태를 분석한 후 섭취한 식단 분석을 통해 영양소 결핍의 오차 범위를 최소화하는 방식으로 부족한 영양소를 선택하 여 알약을 공급하는 알고리즘을 제작함. python을 활용해 입력받은 키, 몸무게 등 신 체 정보와 식단을 분석하고, 아두이노 LCD 디스플레이와 LED를 활용해 부족한 영양 소와 과도하게 섭취된 영양소를 표시하는 코드를 제작한 후 ppt를 제작해 발표함. 시 스템이 상용화가 된다면 부족한 영양소를 채워 건강한 사회를 만들고, 금전적인 문제 로 인해 식사를 하지 못해 영양소가 부족한 학생들에게 도움을 주는 등 미래 전망을 설 명하며 발표를 마침. 이후 이 아이디어를 실현하고자 하는 의지를 갖추고 OO대학교 창 업 인재 양성을 위한 스타트업 튜터링 프로그램에 참여함. \n목포덕인고등학교 \n2025년 11월 20일 5/28 반 \n1 \n번호 22 이름 \n주남영 \ngov.kr \n정부24 \n3",
    "문서확인번호: 1763-6194-8644-5012 (신청인 : 주남영) \n학년 \n영역 \n시간 \n자율활동 \n69 \n창의적체험활동상황 \n특기사항 \n자세 교정 보정 기구에 과도하게 의존하는 친구들을 보고, 자세 교정의 필요성을 인식 하여 학술제에서 '건강한 학교생활을 위한 자세 교정 의자 제작'을 주제로 발표하고, 이 론적 배경으로 빅데이터와 머신러닝을 제시함. 정확한 자세 인식을 위해 많은 양의 데 이터가 필요하지만 적절한 데이터셋을 찾을 수 없어 직접 촬영하여 적합한 데이터를 대 량으로 생산함. 적절한 자세와 부적절한 자세를 구별하기 위해 티처블머신의 포즈 프 로젝트를 활용함. 적절한 자세, 부적절한 자세, 매우 부적절한 자세 3가지 클래스로 구 별하고, 이를 p5.js로 인식하여 아두이노에 신호를 보내는 코드를 작성함. 이후 2개의 LED와 1개의 부저를 활용하여 부적절한 자세에서는 LED 1개가 켜지고 매우 부적절한 자세에서는 LED 2개와 부저가 울리도록 코딩하여 프로토타입 제작에 성공함. 실시간 으로 사용자의 자세를 관찰하여 교정할 수 있고, 사물 인터넷을 활용하여 스마트폰과 결합하여 사용자의 자세를 분석 및 조정할 수 있어 높은 활용도를 보일 수 있다고 발표 함. 이 과정에서 데이터 수집 및 분석, 프로그래밍과 하드웨어 제작 기술을 익히며 융 합적 문제 해결 능력과 창의적 사고력을 발휘함. \n(Hacker (공학, 컴퓨터)) (53시간) 혼자 거주하는 집에 비밀번호를 뚫고 침입한 가구 배 달원 뉴스를 접하면서, 일상 속에서 발생하는 범죄의 위험성과 학교에서 사용되는 사 물함 보안 장치가 친구들에 의해 쉽게 해제되는 상황을 목격하고 보안의 중요성을 절감 함. 이를 계기로 보안 문제 해결 방안을 모색하여 OTP 방식을 활용한 도어락 시스템을 고안하고, 아두이노 통신 모듈을 이용해 OTP 보안 번호를 생성하는 코드를 개발함. F lutter 앱을 통해 비밀번호를 수신하고 스마트폰에서 확인할 수 있도록 구현함. Flutt er 앱에서 아두이노의 시리얼 통신을 통해 OTP 보안 번호를 받아 사용자에게 표시하 고, 사용자가 입력한 OTP 번호를 아두이노로 다시 송신하는 코드를 작성하여 화면 터 치시 메서드가 호출되도록 설계함. 4x4 키패드를 통해 올바른 비밀번호를 입력하면 서보모터가 반 바퀴 회전하도록 코딩함. 이후, 폼 보드를 활용해 실제 프로토타입을 제 작하고 잠금 해제 과정을 시연함. 이러한 보안 강화 조치를 통해 사회 안전과 개인정보 보호의 중요성을 강조하였고, 향후 본인 인증 API를 활용해 스마트폰과 연결하여 사 물인터넷으로 제어할 수 있는 보안 방안을 끊임없이 탐구하며, 일상의 문제를 해결하 려고 노력하겠다는 포부를 밝힘. \n동아리활동 \n53 \n목포덕인고등학교 \n2025년 11월 20일 6/28 반 \n1 \n번호 22 이름 \n주남영 \n(KOR \ngov.kr \n정부24",
    "문서확인번호: 1763-6194-8644-5012 (신청인 : 주남영) \n창의적체험활동상황 \n학년 \n영역 \n시간 \n특기사항 \n희망분야 컴퓨터 공학 분야 \n3 \n진로활동 \n24 \n인공지능에 대한 관심이 많은 학생으로 로봇 제작 및 프로그래밍 활동에서 라인 추적 로봇을 제작함. 바닥 판, 바퀴, 모터를 장착하여 로봇의 기본 구조를 만들고, 적외선 센 서를 로봇의 앞쪽에 2개 장착시킨 후 아두이노 프로그래밍을 통해 왼쪽에 있는 적외선 센서의 값이 오른쪽에 있는 적외선 센서의 값보다 크면 왼쪽 바퀴 모터값을 130, 오른 쪽 바퀴 모터값을 0으로 설정하여 오른쪽으로 회전할 수 있도록 코딩하고, 왼쪽으로의 회전은 반대로, 나머지 상황에서는 직진하도록 두 모터의 값을 130으로 설정함. 테스 트를 통해 흰색 바닥에서 검은색 선을 로봇이 잘 따라가는 것을 확인함. 로봇 제작 과 정에서 하드웨어와 소프트웨어 기술에 대한 이해도를 높이고, 관련 분야에 대한 흥미 와 열정을 더욱 키우게 되었음. \n인공지능 특강에 참여하여 인공지능의 역사, Chat GPT의 활용, 인공지능의 다양한 응용 분야에 대한 강연에 참여함. '세상의 모든 직업' 프로그램을 통해 인공지능 전문가 와의 채팅 인터뷰를 진행하며 전문가의 비전과 인공지능 관련 직업의 장점을 질문하 고, 해당 직업을 위해 필요한 노력과 준비 사항 등을 조사함. 이 과정에서 인공지능 기 초, 알고리즘, 데이터 구조의 중요성을 깨닫고 수학과 통계의 필요성을 인식함. 또한 기계학습, 딥러닝, 자연어 처리 강좌를 통해 지식을 심화해야 함을 알게 됨. 인터뷰를 통해 미래에 대한 긍정적인 전망과 동기부여를 받으며, 인공지능 관련 학과에 진학하 기로 목표를 세움. 이후 GitHub와 같은 커뮤니티를 통해 Python 언어를 학습하고, 인공지능 분야의 최신 동향과 논문을 검색해 읽고 있으며, 실제 생활 문제를 해결하는 경험을 쌓으며 문제 해결 능력을 키움. \n봉사활동실적 \n학년 \n일자 또는 기간 \n2022.05.06. \n2022.07.14. \n장소 또는 주관기관명 \n(학교)목포덕인고등학교 \n(학교)목포덕인고등학교 \n활동내용 \n시간 누계시간 \n환경정화 봉사활동 \n환경정화 봉사활동 \n2 \n2 \n2 \n4 \n2022 굿액션 청소년 자원봉사 캠 \n1 \n2022.07.18. \n(학교)굿네이버스 호남본부 \n2 \n6 \n페인 활동 참여 \n2022.10.07. \n(학교)목포덕인고등학교 \n환경정화 봉사활동 \n2 \n8 \n2022.12.09. \n2023. 03.31. \n(학교)목포덕인고등학교 \n(학교)적십자사 \n환경정화 봉사활동 \n헌혈실적연계 \n2 \n10 \n4 \n2023.04.06. - 2023.06.15. (학교)목포덕인고등학교 \n2 \n2023년 1학기 자기주도학습(멘 토-멘티) 학습도우미 활동 \n10 \n14 \n2023.04.19. \n(학교)굿네이버스 \n2023년 굿네이버스 청소년 자원 봉사 캠페인 활동 \n2 \n16 \n목포덕인고등학교 \n2025년 11월 20일 7/28 반 \n1 \n번호 22 |이름 \n주남영 \ngov.kr \n정부24",
    "문서확인번호: 1763-6194-8644-5012 (신청인 : 주남영) \n봉사활동실적 \n학년 \n일자 또는 기간 \n장소 또는 주관기관명 \n활동내용 \n시간 누계시간 \n2023.05.04. \n2023.07.06. \n(학교)목포덕인고등학교 \n(학교)목포덕인고등학교 \n환경정화 봉사활동 \n환경정화 봉사활동 \n18 \n2 \n20 \n학교폭력 예방 활동, 금연 캠페 \n2023.08.17. - 2023. 12. 29. (학교)목포덕인고등학교 \n10 \n30 \n2 \n인, 장애인식 개선 활동 \n2023.09.18. \n(학교)적십자사 \n헌혈실적 연계 \n34 \n2023.10.06. \n(학교)목포덕인고등학교 \n환경정화 봉사활동 \n2 \n36 \n2023.12.08. \n(학교)목포덕인고등학교 \n환경정화봉사활동 \n2 \n38 \n2024.03.13. \n(학교)대한적십자사혈액관리 본부 \n[적십자사] 헌혈 (전혈) \n4 \n2024.03.21. \n(학교)목포덕인고등학교 \n2024.04.05. - 2024.04.12. (학교)굿네이버스 \n2024.05.02. \n(학교)목포덕인고등학교 \n자살예방(생명존중) 캠페인 활동 \n2024년 굿네이버스 청소년 생명 존중교육 및 자살예방 캠페인 \n환경정화 봉사활동 \n1 5 \n2 \n7 \n2 \n9 \n2024.05.31. \n(학교)목포덕인고등학교 \n흡연예방 캠페인 활동 \n1 \n10 \n3 \n2024.07.05. \n(학교)목포덕인고등학교 \n환경정화 봉사활동 \n2 \n12 \n2024.07.18. \n(학교)목포덕인고등학교 \n학생주도 프로젝트형 봉사활동( 중학교로 찾아가는 진로 멘토-멘 티 활동) \n2 \n14 \n2024.07.24. - 2024.08.02. (학교)목포덕인고등학교 \n다양한 사고 예방을 위한 생활 속 \n안전행동 캠페인 \n18 \n2024.10.04. \n(학교)목포덕인고등학교 \n환경정화 봉사활동 \n2 \n20 \n6. 교과학습발달상황 \n[1학년] \n학기 \n교과 \n국어 \n수학 \n국어 \n수학 \n1 \n영어 \n영어 \n한국사 \n한국사 \n원점수/과목평균 \n성취도 \n과목 \n단위수 \n석차등급 \n비고 \n(표준편차) \n(수강자수) \n3 \n76/65.9(17.6) \nB(160) \n4 \n63/51,1(15.9) \nB(160) \n4 \n3 \n80/58.7(17.8) \nA(160) \n3 \n3 \n79/63, 2(18.3) \nA(160) \n4 \n목포덕인고등학교 \n2025년 11월 20일 \n8/28 반 \n1 \n번호 \n22 이름 \n주남영 \ngov.kr \n정부24",
    "문서확인번호: 1763-6194-8644-5012 (신청인 : 주남영) \n학기 \n교과 \n과목 \n단위수 \n원점수/과목평균 (표준편차) \n성취도 \n석차등급 \n비고 \n(수강자수) \n사회 역사/도덕 \n통합사회 \n3 \n72/58.1(15.0) \nA(160) \n3 \n포함) \n과학 \n통합과학 \n3 \n85/63.4(16.4) \nA(160) \n3 \n과학 \n과학탐구실험 \n1 \n79/77.7(11.2) \nB(160) \n기술.가정/제2 외국어/한문/교 양 \n정보 \n2 \n85/75.8(11.1) \nA(160) \n4 \n1 \n기술.가정/제2 외국어/한문/교 양 \n환경 \n2 \nP \nP \n기술.가정/제2 외국어/한문/교 양 \n진로와 직업 \n1 \nP \nP \n기술.가정/제2 외국어/한문/교 양 \n종교와 삶II \n1 \nP \nP \n국어 \n국어 \n3 \n81/63.9(21,0) \nA(160) \n4 \n수학 \n수학 \n3 \n77/52.9(17.7) \nA(160) \n2 \n영어 \n영어 \n3 \n81/58.6(19,3) \nA(160) \n3 \n한국사 \n한국사 \n3 \n80/63.1(18.8) \nB(160) \n4 \n사회(역사/도덕 \n통합사회 \n3 \n69/57.8(18.6) \nA(160) \n4 \n포함) \n과학 \n통합과학 \n3 \n86/60.7(19,3) \nA(160) \n3 \n과학 \n과학탐구실험 \n1 \n87/78.5(8.4) \nA(160) \n2 \n기술.가정/제2 외국어/한문/교 양 \n정보 \n2 \n90/72.1(14.4) \nA(160) \n3 \n기술.가정/제2 외국어/한문/교 양 \n진로와 직업 \n1 \nP \nP \n기술.가정/제2 \n외국어/한문/교 실용 경제 양 \n2 \nP \nP \n목포덕인고등학교 \n2025년 11월 20일 \n9/28 반 \n1 \n번호 22 이름 \n주남영 \ngov.kr \n정부24",
    "문서확인번호: 1763-6194-8644-5012 (신청인 : 주남영) \n과목 \n단위수 \n원점수/과목평균 \n(표준편차) \n성취도 \n석차등급 \n비고 \n(수강자수) \n학기 \n교과 \n기술.가정/제2 \n2 \n외국어/한문/교 종교와 삶II 양 \n1 \n이수단위 합계 \n과목 \n50 \n세부능력 및 특기사항 \nP \nP",
    "국어: ‘세상에 지배하는 빅데이터를 아십니까?'를 통해 디지털 정보와 가상 공간, 프로그래밍에 대하여 흥미를 가지고 '미래 를 바꾼 아홉 가지 알고리즘'을 찾아 읽고 프로그래밍은 알고리즘을 통해 컴퓨터 과학을 생각해 보아야 한다라는 사실을 알게 되었으며 미래사회에 생존하기 위해서는 첨단 산업 구조의 변화를 넓은 시야로 파악하려는 '근시안적 경각심'을 버려야 한다 고 주장함. '정의란 무엇인가'를 읽고 정의에 관한 여러 학자들의 견해를 검토하는 과정에서 도덕철학, 정의론, 공리주의 등의 다른 이념들이 도덕적으로 상충하는 지점이 있음을 설명함. 정의의 속성은 상대적이며 당시의 사회상 및 윤리관에 교차하며 정당성을 취득한다고 주장하며, 이성으로부터 정의롭다고 여겨질 수 있는 보편적 진리 명제는 오직 확실한 손실만을 부여하 는, 이른바 생사여탈의 문제에만 반응한다고 밝힘. 나아가 정의에 관한 학자들의 논의는 주관에 의해 언도되므로 사변적 기 능이자 추앙의 대상으로 여겨지면 안 되고, 단지 참고와 경험적 판단의 자료로만 활용되어야 하며 사회적 존재인 한 개인들은 \n자신의 도덕적 입지점을 확인하며 스스로의 정의관을 정립하고 지속적으로 점검해야 함을 강조함.",
    "수학: 비유클리드 기하학의 역사적 정초에 관심이 생겨 '길 위의 수학자'를 읽고 유클리드 기하학에 도전하는 수학자들의 연 역 및 귀류적인 접근에 관심을 가지고 각종 자료와 문헌을 참고하여 자세한 내용을 고찰하기 위한 능동적인 모습을 보임. 정 보 탐색의 과정에서 수학의 발산적 사고와 확장 가능성에 관한 것으로, 수학이 진실로 갖는 본질은 기계적인 풀이와 해를 구 하는 것이 아닌, 풀이에 내재되어 있는 원리를 이해하는 것임을 깨달음. 나아가 수학이 궁극적으로 추구하는 바는 폭넓은 사 고를 바탕으로 기존의 공리들을 더욱 점철하고 개편하는 과정을 거쳐 미지의 영역을 탐구하는 지성인 것을 알게 되고 이러한 이해를 중심으로 발표를 진행함. 수업 시간에 배운 명제와 논리 부분을 진로와 연계하여 컴퓨터의 연산에 이용하는 논리회로 를 주제로 ppt를 제작하여 발표함. 논리회로는 상이한 입력값을 논리적인 분류를 통해 정보의 참,거짓을 판단하는 회로로, 이를 통해 우리는 무한한 입력값을 가질 수 있는 장치를 개발할 수 있음을 밝히며 이를 활용한 사례로는 인터넷 금융의 비밀 번호 위치 무작위 배치를 소개함. 실생활 문제에 내재 되어 있는 수학적 원리를 끌어내기 위해 노력하는 분석력이 뛰어난 학 생임.",
    "영어: 첨예하게 입장이 갈리는 쟁점에서 자기 생각을 드러내는 영어 에세이를 작성함. '기술이 인류의 의사소통을 발전시켰 는가?'라는 주제의 논제를 헤아리는 과정에서, 발전과 편리함의 상관관계에 대해 의구심을 품게 됨. 기술적 발전이 인류의 의 사소통을 신속하고 용이한 방향으로 인도한 것은 명백하나, 그러한 편리함이 진정한 의사소통의 발전을 의미함은 섣부른 판 단이라는 생각을 피력하며 글을 작성함. 영작을 위해 모르는 영어단어를 탐색하는 과정에서 같은 의미지만 서로 다르게 쓰이 는 영어단어 들을 발견하고, 이러한 발견을 통해 글의 어조와 분위기에 따라 쓰이는 단어들이 상이함을 알게 됨. 이런 점에서 영어 또한 한국어와 비슷하게 글의 종류와 성향에 따라 다른 형식으로 글을 써야 함을 알 수 있었고, 깨달은 바를 바탕으로 글에 알맞은 영어단어들을 올바르게 선택하여 영작의 완성도를 높이기 위해 노력함. 아울러 진로 영어단어 활동의 일환으로 진행한 영어 마인드맵 그리기 활동에서도 깨달은 바를 실천하며 자신의 진로 분야에 적합한 영어단어를 정보 탐색을 통해 적 절하게 선택하여 마인드맵을 그리는 모습을 보이며 본인의 지식을 적재적소에 사용할 수 있는 역량과 진로 연계성이 돋보이 는 학생임.",
    "한국사: 우리나라의 역사 중 '전쟁과 나라의 성립'과 관련된 주제에 대해 관심이 많아 역사 글쓰기 시간에 후삼국시대 나라의 건국, 세 나라의 전쟁, 발해의 건국, 신라와 후백제의 멸망을 주제로 역사신문을 만들어 학우들에게 발표함. 후백제를 세운 \n목포덕인고등학교 \n2025년 11월 20일 10/28 반 \n1 \n번호 22 이름 \n주남영 \ngov.kr \n이 \n정부24 \n과목",
    "문서확인번호: 1763-6194-8644-5012 (신청인 : 주남영) \n세부능력 및 특기사항 \n견훤은 신라 서남 해안 군인 출신임을, 궁예는 신라의 왕족 출신임을 학우들에게 소개하여 관심을 받음. 발해의 건국과 영토 확장의 과정, 왕의 업적을 친구들에게 소개함. 왕건의 생애와 후고구려의 삼국통일 과정을 학우들에게 소개하며 큰 호응을 얻어냄. 주제발표 시간에 임진왜란을 주제로 거꾸로 수업을 진행함. 임진왜란의 배경을 조사하고 한산도 대첩의 학익진 전법 을 알기 쉬운 시각 자료를 활용하여 설명함. 도요토미 히데요시가 일본을 통합했을 때의 생각과 그 당시 일본군과 조선군의 격차를 조사하고, 도요토미 히데요시의 무모한 야욕이 동아시아 3국의 백성들에게 큰 화를 가져왔다고 주장하는 모습에서 통 합적인 사고력을 확인할 수 있었음. 수업 시간에 의문이 드는 내용을 질문하는 것이 인상적이며, 부족한 부분을 스스로 학습 하는 자기 주도적인 모습을 보임.",
    "통합사회: 세계인권선언을 주제로 역사적 배경, 주요 조항, 다른 인권 문서와 비교한 자료를 정리하여 표현함. 전 인류를 향 한 우호적 평화와 평화를 누릴 수 있는 시민의 권리를 보장하는 선언임에도 불구하고 보편타당의 계약이 사회적 합의에 다다 른 시기는 고작 100년도 되지 않았음에 초점을 두고 강조함. 특히 사회 유지는 사회정의와 직결되는 영역이 아니며 사회를 구성하는 절대다수의 사회적 약자를 착취로부터 보호하는 질서의 필요성과 세계라는 이름의 사회에 속한 국가와 국가 간의 정의를 수호하는 상호적 협의가 글로벌 사회의 정돈과 질서를 목적으로 개개인을 보호하는 실질적 평화를 실현하고 사회를 평온한 상태로 인도하는 작은 실천이 진정한 세계 평화로 들어설 수 있다는 내용이 참신함. 일련의 과정은 PPT를 제작하여 전달함으로써 학생들의 호응을 얻음. 친구가 질문해도 언제나 친절하게 답해주고 성실히 수업에 참여하는 학생임.",
    "통합과학: 자유주제탐구 활동에서 인공지능의 작동 원리를 심층적으로 탐구하고, 이를 세분화된 틀로 분류하여 인공지능의 실질적인 운용 방식을 분석함. 인공지능을 정보의 학습과 사용을 스스로 결정하는 자기향상적 시스템으로 파악하고, 이 원리 가 머신러닝임을 이해함. 지도 학습과 비지도 학습의 차이와 강화 학습의 원리를 명확하게 이해하는 과정에서 인공 지능이 기 계적 입출력 체계와 다름을 앎. 인공지능은 사람의 뇌와 유사한 알고리즘으로 정보를 인식하고 사용하며, 점진적 발달과 피 드백을 스스로 생성하는 무궁한 가능성을 지닌 체계라고 자신의 생각을 밝힘. \n'발명 아이디어 제안하기'에서 대중교통 승차하 알리미를 제안함. 대중교통을 이용하는 사람들이 잠이 들거나 휴대폰을 보다 가 하차 지점을 놓치는 경우가 많다는 점을 들어 GPS 기술을 활용하여 하차할 정류장을 미리 입력하면 도착 직전에 신호를 보내 알려주는 어플을 제안함. 뛰어난 관찰력으로 일상 생활의 불편한 점을 찾고, 배우고 익힌 지식을 올바르게 활용하여 문 제 해결 방안을 제시할 수 있는 과학적 역량을 지닌 학생임.",
    "과학탐구실험: 적정 기술에 대해 학습한 후 시력이 낮아 안경이 필요한 사람 중 그 비용이 부담되어 안경을 사용하지 못하는 사람들을 위한 적정 기술에 대한 호기심이 생겨 조사함. 모둠원들과 역할을 나눠 자료를 조사한 후 장치를 소개하는 포스터를 제작하여 발표함. 이후 다른 적정 기술들의 원리와 청력이 좋지 않고 보청기를 구입하기 힘든 사람들을 위한 적정 기술을 조 사하고, 구현해보고 싶다는 포부를 밝히며 발표를 마무리함. \n평소 노래를 부르기 좋아하여 노래를 부르러 갈 때마다 마이크로 작은 소리를 큰 소리로 만들어주는 원리에 대해 호기심이 생겨 '트랜지스터 증폭'이라는 주제로 탐구를 진행함. 트랜지스터는 규소 또는 저마늄으로 만들어진 반도체를 이용하여 전자 신호 및 전력을 증폭하는 장치임을 소개하고 두 개의 다이오드가 서로 맞물려있어 작은 전류가 높은 전류로 증폭됨을 설명함. \n그 결과 입력 시 약한 변동 신호를 사용하면 증폭된 신호를 얻을 수 있게 되어 큰 소리를 낼 수 있는 것이라 설명함. 학우들 이 어려워하여 흥미를 잃을 수도 있는 상황에서 한눈에 볼 수 있는 시각적인 자료와 쉬운 설명을 사용하여 학우들의 이해를 돕는 모습이 인상적인 학생임.",
    "정보: 4차산업혁명으로 정보화를 이룩한 정보사회를 거시적인 틀에서 조망하여 인간 생활의 변화를 기술적 측면에서 분석하 고, 이를 진로와 연계하여 발표 자료를 제작해 발표함. 4차산업혁명의 핵심 요소인 빅데이터와 인공지능이 생활에 미친 영향 은 단순한 발전을 넘어 산업 전반을 완전히 뒤바꾸고 있으며 다가오는 미래에 적응하기 위해서는 앞으로의 기술 동향을 살피 어 주목받을 직업군과 사라질 직업군을 선별해야 함을 강조함. 이런 점에서 정보화시대 이후 새로운 직업 중 로봇 공학자를 소개함. 인공지능이 탑재된 사물 인터넷과 서비스 로봇들을 사례로 들어 앞으로의 로봇은 기계적 작업이 아닌 스스로 인식하 \n목포덕인고등학교 \n2025년 11월 20일 11/28 반 \n1 \n번호 22 |이름 주남영 \n이 \ngov.kr \n정부24 \n과목",
    "문서확인번호: 1763-6194-8644-5012 (신청인 : 주남영) \n세부능력 및 특기사항 \n고 판단할 수 있는 능력을 갖출 것이라 전망함. 미래의 로봇 공학자는 로봇의 설계 작업에서 다양한 측면을 고려해야 하며, 그러한 범위는 더욱 확장될 것임을 밝히며 발표를 마침. 제공하는 프로그래밍 도구를 활용하여 직접 프로그램을 작성하는 활 동을 진행함. 블록 코딩을 이용한 기본적인 소스에 각종 코드를 조합하여 음성, 효과, 모션 등을 첨가하여 간단한 내기 프로 그램을 작성함. 이러한 활동을 통해 프로그램이란 코딩을 통해 단순한 코드들이 모여 복잡한 구성을 이루는 일련의 체계임을 이해함.",
    "환경: 환경 문제의 심각성을 깨닫고 미래세대를 위해 지속가능한 발전이 필요함을 이해하며 시대에 따른 환경관의 변화를 이 해함. 생태계를 육상, 습지, 수생 생태계로 구분할 수 있으며 각각의 특징을 설명함. 생태계를 구성하는 물, 대기, 토양, 생물 요소의 특성을 학습하고 인간생존의 관점에서 생태계 구성요소와의 상호작용을 정리함. 환경체험을 통해 학교 내외의 자연 환경을 이해하며 인공환경과의 조화를 배움. 국내 물 환경오염 사례를 환경적, 사회적, 경제적 관점에서 분석하여 의미를 파 악함. 음식과 관련된 환경 주제 및 쟁점을 살펴보고 잔반 안남기기 캠페인에 참여하며 음식물쓰레기를 줄이는 방안을 제시 함. 국가적, 지구적 차원에서 발생하는 환경문제를 학습하고 환경문제를 해결하기 위한 방안을 탐색하며 AI를 통해 환경 관 리를 할 수 있는지 호기심을 가지고 프로젝트 학습을 수행함. 빅데이터를 기반으로 기후변화를 예측하고 알고리즘을 개발해 대응하는 방안을 소개하고 실제 인공지능을 활용하여 대기질을 분석하는 플랫폼을 예시로 발표함. 환경과 인공지능의 긍정적 인 상호관련성을 정리하며 협업을 통한 인공분야의 발전으로 환경위기에 대처하는 방안을 제시함. \n진로와 직업: 활발한 자기진단을 통하여 컴퓨터 공학으로 진로를 정함. 인공지능 스피커 제작하는 방법에 대해 궁금증을 가 짐. 스피커의 기본 원리는 음성신호를 주파수 스펙트럼으로 변환하고 들어온 음성을 음소 단위로 분류해 인식하고 단어 사이 의 관계를 확률적으로 계산해 사람이 이해할 수 있는 문장을 만들어 내는 것임을 알게됨. 하지만 음성인식 시스템의 정확도는 약 70% 안팎이어서 실생활에 사용하기에는 부족한 점이 있었다는 것을 알고, 딥러닝이라는 기술을 기반으로 획기적으로 발 전하게 됐다는 사실을 인지함. 딥러닝의 핵심은 분류를 통한 예측, 수많은 데이터에서 패턴을 발견하여 선별하고 빅데이터 분석을 통해 학습한다는 점을 알게됨. 이 활동을 통해 딥러닝에 관심을 가지게 되고 딥러닝과 머신러닝의 차이를 조사함. '알 파고'가 딥러닝을 사용한다는 점과 수학시간에 배운 경우의 수와 관련이 있어 흥미를 느끼고 탐구함. 바둑은 판이 19x19 로 되어 있어 알파고가 계산해야 하는 경우의 수는 기본적으로 361!임을 알게됐고, 딥러닝 기술을 사용 할 경우 효과적으로 경 우의 수를 계산 할 수 있음을 알게됨. 도서 '인공 지능과 딥러닝'를 읽고 딥러닝의 원리에 대해 더 깊은 조사함. \n실용 경제: 가상화폐의 거래 자동 매매 프로그램이 정식 출시되었다는 소식을 접하고 가상화폐에 대한 투자 전망을 유추함. 인공지능 자동 매매 시스템은 기존보다 단순화되어 있고 가상화폐에 대한 투자 지식이 없더라도 인공지능이 자동으로 최적의 \n타이밍에 매수-매매하는 시스템으로 개발되었음을 소개함. 자동 매매프로그램을 통해 일반 투자자가 쉽게 퀀트 트레이를 접하고 기존보다 안정적이고 계획적인 재테크 생활이 가능해질 것으로 예측함. 미래 가상화폐에 대한 투자를 더욱 확대할 수 있는 프로그램으로 더욱 안정적인 투자가 가능해질 것이라고 기대함. 이후 장래 직업의 유망성을 탐구하며 새롭게 생길 직업 과 사라질 직업의 예시를 찾아봄. 미래학자 토마스 프레이의 말에 따르면 2030년까지 20억 개의 일자리가 사라질 것이라고 했고 매표원 및 운전기사, 심판은 자동화 시스템으로 인해 사라질 것이고 자동차 산업의 성장으로 대체 추진 시스템, 자율주 행 자동차, 차량공유와 같은 기술 분야의 일자리 및 스마트 공장의 관리자가 늘어날 것이라고 예측함. 여러 직업군의 변화에 맞춰 취업계획을 세울 필요성을 제기함. \n종교와 삶 II: 4차 산업혁명의 산물이자 방대한 알고리즘의 총체인 인공지능의 출현이 종교 신앙에 일으킬 인문학적 파급에 관하여 고찰한 후, 터득한 바를 바탕으로 발표 자료를 제작하고 발표함. 이러한 고민을 실체화하기 위해 2000년간 축적된 가 톨릭 종교의 역사적 자취를 토대로 프로그래밍한 인공지능 \"산토\"를 채택하여 인공지능과 종교의 실태를 규명해봄. \"산토\"의 도움을 받은 가톨릭 신자들의 의견을 종합하여 살펴보면, 실제 인공지능이 기독교의 교리를 파악하거나 신앙적으로 올바른 길로 인도하는 데에 도움을 줄 수 있다고 말하지만, 그러한 지적 능력이 종교 사제를 대신할 수는 없다고 말함. 해당 부분에 주목하여 인공지능이 종교에 접근하는 방식은 여타의 분야들처럼 알고리즘으로 이루어진 기계적 매뉴얼에 의거하는 것이며, \n목포덕인고등학교 \n2025년 11월 20일 12/28 반 \n1 \n번호 22 이름 주남영 \n(KOR), \ngov.kr \n정부24",
    "문서확인번호: 1763-6194-8644-5012 (신청인 : 주남영) \n과목 \n세부능력 및 특기사항 \n종교의 초월성과 본질에는 관심을 두고 있지 않다는 결론을 도출함. 이런 점에서 인공지능이 진실로 종교 일반에 실천력을 갖 기 위해서는, 여타의 물리학적 시각에서 벗어나 종교의 독립적인 위치를 인식할 수 있도록 하는 새로운 인지 능력이 개발되어 야 함을 밝히며 발표를 마침. \n평소 인공지능에 대해 흥미를 보이던 학생임. 자율주행 자동차는 사람들이 판단하기에 더 옳다고 생각하는 것에 따라야 윤리 적 문제를 해결할 수 있다고 생각해 빅데이터를 통한 판단에 따라 결정해야 한다고 주장하며 자율주행 자동차의 윤리적 판단 기준에 대해 설문조사를 실시함. 탑승자는 설문조사를 받는 사람을 탑승자로 설정하고 보행자와 탑승자의 수, 나이를 결정해 설문조사 결과를 비교하여 통계를 냄. 사람들은 수가 많을수록 더 보호하며, 탑승자가 보행자의 수보다 더 적거나 같은 경우 탑승자가 사망해야 하며, 어린이, 성인, 노인 순으로 보호하려는 경향을 나타낸다는 결론을 도출함. \n무선 이어폰을 사용하면서 소음 제거 기능의 원리에 대해 궁금증을 가지고 탐구함. 소음 제거 기능은 상쇄간섭의 원리를 이 용한다는 것을 조사하며 파동의 성질에 대해 이해함. 소음을 분석하는 과정에서 인공지능 기술이 활용될 수 있다는 사실을 알 고 생각보다 많은 분야에서 인공지능 기술이 활용되고 있음을 깨달음. \n<진로 선택 과목> \n성취도 \n성취도별 \n학기 \n교과 \n과목 \n단위수원점수/과목평균 \n비고 \n(수강자수) \n분포비율 \n이수단위 합계 \n과목 \n해당 사항 없음 \n<체육·예술> \n세부능력 및 특기사항 \n학기 \n교과 \n과목 \n단위수 \n성취도 \n비고 \n체육 \n1 \n예술 \n체육 \n음악 \n2 \nA \n2 \nA \n예술 \n미술 \n1 \nA \n체육 \n체육 \n2 \nA \n2 \n예술 \n음악 \n1 \nA \n예술 \n미술 \n2 \nA \n이수단위 합계 \n10 \n과목 \n세부능력 및 특기사항",
    "체육: 축구 경기 중 주장을 맡아 급우들을 잘 조율하며 리더십과 조율하는 능력을 보임. \n적극적인 공격 차단과 정확한 태클로 팀의 핵심 수비수로서 해야 할 역할을 전문적으로 책임감있게 잘 수행함. \n농구 경기 중 포인트 가드의 역할을 맡고 드리블이 매우 뛰어나며 아이솔레이션션을 적극적으로 활용하는 모습이 돋보이며 급우들과 전술을 만들고 스크린을 활용하는 등 창의성이 돋보임. \n목포덕인고등학교 \n2025년 11월 20일 13/28 반 \n1 \n번호 22 이름 주남영 \n(KOR), \ngov.kr \n정부24",
    "문서확인번호: 1763-6194-8644-5012 (신청인 : 주남영) \n과목 \n세부능력 및 특기사항 \n심폐소생술을 배우는 과정에서 4분의 골든타임 중요성을 잘 깨닫고 있으며 먼저 시범을 보이고 적절한 빠르기와 힘을 주는 등 급우들 앞에서 시범 보이기를 좋아함.",
    "음악: 좋아하는 음악에 대한 주관이 뚜렷한 학생으로 음악 장르 탐구 발표에서 “HIPHOP\"을 선정하여 조사하여 PPT 발표 함. 힙합의 개념 정의, 분류, 역사, 분류에 따른 대표 레퍼와 작품을 소개하며 급우들의 관심을 이끔. 특히 래퍼로 B. I. G, Sc ott, 한국 래퍼 DOK2의 추구하는 음악, 그들만의 뛰어난 음악성, 작품 등을 자세히 설명하며 공연 영상과 함께 발표함. \n감상 활동 '영화 속 음악'으로 영화 인터스텔라 ost 'first step' 를 조사, PPT 발표함. 사랑하는 가족과 인류를 구하기 위해 우주의 시공간 넘어 생존을 위한 대안을 찾는다는 영화의 줄거리와 광대한 오케스트레이션으로 우주의 광활함을 표현하고 큰 규모의 음악을 담은 작곡가 Hans Zimmer의 음악이 영화의 몰입도를 극대화했다는 설명과 함께 ost가 나오는 장면 영상들 을 보여주며 소개함. 또한 우주라는 광활한 공간 속에 혼자 남겨진 이의 외로운 사투가 인상적이였고 양자역학, 중력, 특수상 대성이론 등 과학적 이론에 흥미를 끌었다는 개인적 소감도 함께 발표함. 이후 개인 주제 발표로 ost가 영화의 긴장감을 더해 주고 장면의 몰입도를 높이는 역할을 한다는 것, ost가 없는 영화를 본다면? 이라는 설정으로 ost의 역할과 ost의 구분 설명 으로 ost 탐구 발표함.",
    "미술: 미술부장을 맡아 미리 찾아와 수업 준비물을 챙기고 교실을 정리하는 등 교사가 원할한 미술 수업을 할 수 있는데 기여 함. 긍정적이고 바른 성격으로 친구들이 준비물을 챙겨오지 않으면 본인의 것을 나누어 주고 모둠활동에서 서로 미루는 역할 을 맡는 등 배려심이 돋보이는 학생임. 입체주의 탐구활동을 통해 피카소의 작품세계를 분석하여 활동지를 작성함. 친구와 사과를 여러 시점에서 바라보고 하나의 화면에 조합하여 그려보며 입체주의 스타일을 표현해 봄. 입체주의가 미술, 사회, 역 사 분야에 영향을 준 것에 대한 보고서를 작성하여 제출함. 세계대전 당시 적군을 속이기 위해 군함을 위장 도색한것도 입체 주의의 영향을 받은 것이 가장 인상 깊었다고 발표함. 업사이클링 활동 일상생활에서 발생하는 쓰레기 캔, 양초, 옷걸이를 재 료로 샹들리에를 제작함. 쓰레기들의 가지고 있는 본질의 아름다움과 실용성을 전달하기 위해 샹들리에를 제작했다고 발표 함. 작품 제작을 하며 각각은 일반 쓰레기이지만 재활용하여 작품을 만들면 예술이 될 수 있다는 것을 느끼고 예술에 대한 인 식의 변화가 생겼다고 발표하는 모습이 인상적임. \n[2학년] \n학기 \n교과 \n과목 \n단위수 \n원점수/과목평균 (표준편차) \n성취도 \n석차등급 \n비고 \n(수강자수) \n국어 \n수학 \n문학 \n4 \n80/60.8(22.8) \nA(161) \n4 \n수학 I \n4 \n73/50, 3(18.1) \nA(161) \n3 \n수학 \n확률과 통계 \n2 \n78/55.0(20.5) \nA(121) \n3 \n영어 \n영어 I \n4 \n84/55.1(18.4) \nA(161) \n2 \n1 \n과학 \n화학 I \n4 \n91/60.0(22.0) \nA(45) \n2 \n과학 \n지구과학I \n4 \n85/63.2(21.1) \nA(45) \n3 \n기술.가정/제2 외국어/한문/교 양 \n보건 \n1 \nP \nP \n목포덕인고등학교 \n2025년 11월 20일 14/28 반 \n1 \n번호 22 이름 \n주남영 \ngov.kr \n(KOR \n정부24",
    "문서확인번호: 1763-6194-8644-5012 (신청인 : 주남영) \n원점수/과목평균 \n성취도 \n학기 \n교과 \n과목 \n단위수 \n석차등급 \n비고 \n(표준편차) \n(수강자수) \n기술.가정/제2 외국어/한문/교 \n양 \n중국어 I \n2 \n87/67.0(19.7) \nA(75) \n3 \n1 \n기술.가정/제2 외국어/한문/교 양 \n종교학 \n1 \nP \nP \n국어 \n독서 \n87/62.9(20.9) \nA(157) \n2 \n수학 \n수학 II \n4 \n81/49.9(23.1) \nA (157) \n2 \n수학 \n확률과 통계 \n2 \n82/52,2(23.5) \nA(118) \n3 \n영어 \n영어II \n4 \n79/55.7(19.1) \nA(157) \n3 \n과학 \n물리학 I \n4 \n92/58.8(23.9) \nA(45) \n3 \n과학 \n생명과학 I \n4 \n89/59.2(19.3) \nA(45) \n2 \n2 \n기술.가정/제2 외국어/한문/교 양 \n보건 \n1 \nP \nP \n기술.가정/제2 외국어/한문/교 양 \n중국어 I \n2 \n82/60.6(20.6) \nA(73) \n3 \n기술.가정/제2 \n외국어/한문/교 종교학 양 \n1 \nP \nP \n이수단위 합계 \n과목 \n52 \n세부능력 및 특기사항",
    "독서: 호기심을 갖고 탐구하는 역량이 우수한 학생으로 주제통합 읽기에서 '수상한 인공지능'을 읽고 독서일지 2회와 독서대 화나누기를 함. 인공지능의 이익과 해로움에 대해 문제를 제기하고 인공지능이 사람을 대체할 수 없을 것이라는 의견을 서술 함. 이후 '인공지능이 인간을 지배하거나 대체할 수 없다'는 주제로 논설문을 씀. 인간의 창조성, 감정, 사회성, 융합적 사고 력을 근거로 인공지능이 인간을 지배할 수는 없으며, 인간은 인공지능을 창조, 노동 활동을 위한 보조재로 활용하여 사회를 발전시켜 나가야 함을 주장함. 이후 인공지능에 대한 학생들의 관점에 궁금증을 갖고 탐구활동을 전개함. 2학년 학생 241명 을 대상으로 인공지능윤리, 수행평가를 위한 챗봇사용경험, 인간 존엄성 침해 등과 관련하여 설문지를 작성, 배포, 정리한 내 용을 바탕으로 보고서를 씀. 학생들 설문 결과를 그래프로 제시하고 해석했으며, 인공지능의 창조는 물리적 단자와 알고리즘 의 연산에 불과하고 인간의 창조는 고뇌와 심오함의 표현이라고 정의하고, 인간은 본연의 확고한 위치를 차지할 것이라고 서 술함. 연계적으로 주제를 탐구하고 연구자료를 읽고, 실제적 설문결과를 바탕으로 보고서를 작성한 점, 글이 논리적이며 체 계적이었음.",
    "문학: 작가, 사회문화적 배경, 문학사적 등 다양한 맥락을 활용하여 작품을 깊이 있게 이해하고 감상할 수 있는 학생으로 수 \n목포덕인고등학교 \n2025년 11월 20일 15/28 반 \n1 \n번호 22 이름 주남영 \ngov.kr \n정부24 \n과목",
    "문서확인번호: 1763-6194-8644-5012 (신청인 : 주남영) \n세부능력 및 특기사항 \n업에 적극적인 모습을 보였으며, 모둠원과 협동적으로 수행 과제를 행하여 모범을 보임. '봄'(이성부)를 학습한 후 문학 작품 이 쓰인 시대적 상황과 시인의 삶을 조사하여 이를 중심으로 작품이 시사하는 바를 스스로 재구성하여 탐구 보고서를 작성하 고 발표함. 작품의 사회적 배경인 강압적 정권 하에서 기본적 권리가 결여된 사회, 민주화를 외친 사람들의 삶을 조사하고, 작품의 제목이 암시하는 의미를 민주주의를 이루고자하는 의지로 해석함. 그리고 '지쳐 나자빠져 있던' 표현의 은유적 의미, \n봄을 '너'로 의인화 하여 맞이하는 기쁨이 의미하는 바를 주체적으로 해석하는 모습을 보임. PPT발표에서 작품의 내용에 대 한 분석 뿐만 아니라 유사한 주제를 다룬 작품의 사례를 제시한 후, 작품을 감상할 때는 작품의 내적, 외적 상황, 작가 등을 종합적으로 고려하여 감상하는 것이 작가의 내포된 의도를 제대로 파악할 수 있음을 언급하여 반 학생들의 큰 호응을 받음. 한권읽기 활동으로 '숏컷'(박하령)을 읽고 독서일지, 토론, 독후감쓰기 활동을 우수하게 수행하는 등 모든 활동을 성실하게 참여한 학생임. \n수학I: 로그와 수열 등의 수학적 원리들의 공통점과 차이점을 직관적으로 파악할 수 있으며, 이를 자신만의 문제 해결의 단 서로 유도하는 모습을 보이는 창의적인 역량이 돋보이는 학생임. 수학 교과서에서 삼각함수를 보고 이전에 배웠던 삼각비의 기하학적 개념을 좌표계로 옮겨 함수로 변환한 함수라는 점에서 큰 흥미를 갖게 됨. 이를 계기로 '수학 주제 발표' 활동에서 인공지능 스피커와 삼각함수 간의 연관성을 주제로 수학적 원리가 변환과 가공을 거쳐 활용되는 양상에 대하여 발표함. 자료 조사 과정에서 파동은 삼각함수로 분할할 수 있음을 알게 되어, 인공지능 스피커는 인식한 음성을 삼각함수로 분해하여 목소 리를 구분할 것이라고 예상함. 조사 결과 진폭과 진동수의 상동은 같은 음파의 충분조건이 아님을 알 수 있었고 변환 알고리 즘을 사용하여 음성을 삼각함수로 변환하여 인식한다는 사실을 확인함. 해당 활동을 계기로 법칙이라고 불리우는 모든 관계 들은 임의의 변화 현상을 규정하고자 하는 시도라는 생각을 하게 됨. 또한 정의역과 치역을 가지는 모든 수학적 법칙들은 함 수 좌표계에서 함수로 표현할 수 있음을 알게 되었고, 지수함수와 로그함수의 개형이 갖는 기하적 대칭 관계를 더욱 본질적으 로 이해함. \n수학II: 자유주제 발표활동에서 '인공지능 분야에서 미분의 활용'을 주제로 발표함. 얼굴 인식, 물체 스캔, 자율주행 자동차 등의 예시를 제시하며 인공지능을 구성하는 필수적인 요소로 자가 학습 능력을 말하며 이러한 특성은 많은 데이터 입력값이 설정된 특정 값과 동일률을 추적하는 방식으로 구현되며 많은 피드백과 처리 과정의 연산시간을 단축하는 방법으로 활용됨을 설명함. 이 반복 작업은 많은 시간이 소요되므로 인공지능은 알고리즘을 활용하여 빠르게 답을 찾아내고 미분이 알고리즘을 형성하는 핵심적인 역할을 수행한다는 점을 강조함. 경사하강법은 근삿값을 찾는 최적화 알고리즘으로 극값을 구하기 어려운 비선형적 함수의 임의값에서 미분을 활용하여 보정된 극값의 근사치를 얻어내는 방법임을 설명하고 함수를 미분하는 것보다 효율적인 이유를 강조하며 발표를 마침. \n형성평가를 통해 미분계수의 의미를 정확히 파악하고 정의를 통해 값을 구해낼 수 있으며 주어진 점에서의 미분계수는 그 점 에서의 접선의 기울기인 이유를 정확하게 파악하고 있음을 확인함. 도함수를 활용해 함수의 증가와 감소, 극대와 극소를 판 정하는데 능하며 왜 그런가에 대한 설명을 그래프의 개형을 그려 설명하는 모습이 인상적임. \n확률과 통계: 인공지능의 의사결정 정확도를 높이기 위한 방안과 조건부확률의 연관성을 인지함. 깊은 탐구를 위해 '인공지 능을 더 정확하게 만들어주는 조건부확률'을 주제로 수학탐구활동을 진행함. 먼저 과거 인공지능 의사 결정 시스템의 한계( 규칙을 모든 상황에 적용하는데의 어려움)를 조사함. 이를 조건부 확률을 활용한 인공지능 의사 결정 시스템과 비교분석을 통해 의문을 해결하고자 함. 가장 큰 차이점은 새로운 데이터에 대응하는데 상대적으로 뛰어난 유연성을 보인다는 점을 제시 하며, 이를 조건부확률로 해석하고자 함. 학습했던 조건부확률을 토대로 베이지안 확률을 이해함. 사후, 사전 확률에 대한 개 념을 정확히 정리하며, 해당 식을 파악함. 규칙 기반 의사결정에 반해 베이지안 확률을 통해 데이터를 기반으로 어떤 사건이 일어났을 때, 다른 사건이 일어날 확률을 추측하는데 정확도가 높음을 설명함. 이후 도서 '파이썬을 활용한 베이지안 통계'를 탐독하며, 파이썬과 베이지안 확률을 활용한 날씨 예측 시스템 제작을 계획함. 날씨를 좋다, 안좋다로 구분하고 습도, 구름 의 양을 입력하여 그에 따라 확률값을 추출하여, 날씨를 예측하는 프로그램을 제작하는 모습에서 수학과 ai를 접목하는 역량 을 엿볼 수 있었음. \n목포덕인고등학교 \n2025년 11월 20일 16/28 반 \n1 \n번호 22 이름 \n주남영 \ngov.kr \n이 \n정부24 \n과목",
    "문서확인번호: 1763-6194-8644-5012 (신청인 : 주남영) \n세부능력 및 특기사항 \n영어 I: 최근 관심을 갖고 있던 대화형 인공지능 서비스를 주제로 글로벌 이슈 말하기 활동에 참여함. 인공지능의 가능성과 한계가 인간에 미치는 영향에 대한 내용을 영어로 작성함. 대화형 인공지능 서비스가 작문, 검색, 학습 등의 분야에서 인간에 게 도움을 주고 있으나, 무분별한 사용으로 성취에 따른 사회 경제적 자본 배분 구조를 위협하고 있다는 점을 지적함. 또한 다양한 분야에서 상용화되고 있는 인공지능 기술이 효율성만 기초에 둔 채 남용된다면 인간의 가치 부정이나 존재 의의 위협 에 이를 수 있음을 지적함. 인공지능의 가능성은 인위적으로 규정할 필요가 있는 제한된 자유에 초점을 맞추어야 하며, 이는 사회적 자유주의의 이념과 유사한 방향성을 갖고 있다는 점을 들어 인공지능의 유용성을 검증받기 위해서는 뛰어난 성능뿐만 아니라 올바른 윤리관 또한 지향해야 함을 강하게 역설하는 내용이었음. 해당 내용에 관해 영문 대본과 PPT를 작성하고 급 우들을 대상으로 발표했음. 주장하는 글을 영어로 작성할때 자신의 주장을 드러내는 영단어를 선택하고 자연스럽게 메시지를 \n전달하는 발표를 하려 노력했음. \n영어II: 영어 에세이 쓰기 활동에서 '상대성 이론과 시간의 동일성'을 주제로 영문 에세이를 작성함. 주제에 어긋난 영단어와 영문 표현을 사용하지 않기 위해 검색을 통해 정제된 학술 단어와 표현들을 스크랩해두었다고 함. 각 단어가 모여 새로운 뉘 앙스를 획득하는 모습을 보며 한층 영어에 흥미를 느꼈으며, 이후 영어 학습 중에도 단어와 연어 중심의 검색을 통해 능동적 인 탐색을 했다고 함. 또한 에세이에 표현된 논리적 전개가 자연스럽게 연결되도록 개요를 작성하고, 각 소문단의 주제와 각 문장의 논리적 타당성을 검증하기도 했음. 언제나 진지하게 수업에 참여하고 스스로 사고하는 모습이 두드러진 학생이었음. 도서 인공지능과 딥러닝(마쓰오 유타카)를 읽고, 이 내용을 토대로 인공지능에 관해 습득한 내용을 키워드로 재구성하여 영 단어 마인드맵을 완성함. 인공지능의 특징과 당면한 과제 등을 한눈에 알아볼 수 있도록 시각화한 작품이었음. 영어 지문을 읽고 깔끔하게 독해하지 못한 문장을 구조적으로 분석하고 추론하는 연습을 꾸준히 했으며, 도서 메이즈 러너를 선택하여 모 르는 표현들을 검색하며 읽었다고 함. \n물리학I: 파동 학습 과정에서 파동의 사례로 등장하는 음파에 호기심을 가짐. 특히 초음파의 광범위한 활용에 주목해 '자율 주행자동차의 초음파의 활용'을 주제로 자유 주제 탐구를 진행함. 우선, 도서 '센서와 작동기(Nathan Ida)'를 탐독하여 초음 파의 정의와 특징, 능동형과 수동형으로 구분되는 초음파센서의 종류, 초음파센서의 활용 및 장점 등을 학습함. 이후 아두이 노 키트, DC 모터, 초음파센서, 모형 자동차 등을 활용하여 초음파센서로 거리를 감지해 장애물을 자동으로 피해 주행하는 자동차 제작에 도전함. DC 모터를 자동차 모형에 장착한 후 노트북에 연결해 앞뒤로 움직일 수 있도록 하는 동시에 트랜지스 터로 전류를 증폭함. 또, 초음파센서로 20cm 이내의 물체가 감지되면 DC 모터의 작동이 멈추도록 코딩함. 더 나아가 과거 적외선 센서를 활용해 제작한 RC 자동차의 물체 감지 민감도 측정치를 비교 분석한 결과 그 오차가 크게 줄어들었다는 사실 을 밝힘. 다만 적외선 센서는 초음파센서에 비해 속도가 빠르다는 장점이 있으므로 적외선 센서와 초음파센서를 병합한 형태 로 활용한다면 더 효율적일 것이라 결론지음. 이처럼 교과 학습 내용을 자신의 관심 분야에 적용해 프로그래밍하는 등 진로 분야로의 전문성이 인상적임. \n화학I: 여러 가지 원자 모형을 학습하면서 전자의 위치를 확률로 표현하는 오비탈에 흥미를 보이며, 어떠한 방법으로 전자 의 위치를 알아내고 표현하는지 심화 탐구함. '생명의 화학, 삶의 화학(김희준)'를 통해 오비탈이 전자구름을 수학적으로 나 타낸 함수임을 알고, 전자의 에너지와 각운동량에 따라 4가지 유형(s, p, d, f)으로 나뉜다는 것을 이해함. 또한 결합을 형성하 기 위해 원자 오비탈끼리 재결합되어 혼성호비탈을 형성하며 원자 오비탈의 특성이 결합오비탈에 반영된다는 것을 앎. 학습 중 느낀 호기심을 해결하기 위해 자신만의 방법으로 정보를 찾고 이해하려는 자세가 인상적임. 오비탈에 대한 심화 탐구 중' 인공지능을 사용하여 전자의 위치를 계산한다면 더 효율적이지 않을까'라는 생각을 하게 되었으며, '인공지능을 활용한 전자 위치 확률 계산'이라는 제목으로 자유주제탐구 결과를 정리함. 슈뢰딩거 방정식이 전자의 파동함수를 결정하며, 이 파동함수 로부터 전자의 위치와 운동량에 대한 정보를 얻을 수 있고 파동함수의 제곱이 전자가 발견될 확률을 의미한다는 것을 1s 오비 탈의 파동함수 구하는 과정을 통해 설명함. 인공지능을 활용하였을 때 계산 속도, 정확도, 다양한 시각화라는 장점이 있음을 서술함. \n목포덕인고등학교 \n2025년 11월 20일 17/28 반 \n1 \n번호 22 이름 \n주남영 \ngov.kr \n정부24 \n과목",
    "문서확인번호: 1763-6194-8644-5012 (신청인 : 주남영) \n세부능력 및 특기사항 \n생명과학I: 생명과학이 다른 학문 분야와 연계된 사례 조사하기 탐구활동으로 '인공지능의 활용'에 관한 주제로 개인 발표를 준비함. 인공지능은 유전체 분석, 약물 분석, 분자구조 예측 및 설계, 신경 과학 연구, 생물정보학 분야 등 생명과학 전반에 걸쳐 다양한 방식으로 활용되어 복잡한 문제를 해결하는 데 중요한 도구로 작용하고 있음을 조사함. 또한 각각의 분야에서 인 공지능은 복잡한 문제를 해결하고, 새로운 지식을 생성하는 데 중요한 역할을 하고 있으며, 복잡하고 큰 규모의 데이터 세트 안에서 숨겨진 패턴과 관계를 찾아내어 생명현상에 대해 더 깊게 이해하는 데 도움을 주고 있다고 강조함. \n이후, 딥러닝과 생명과학 분야가 어떻게 융합되어 활용되는지 궁금하여 '생명과학을 위한 딥러닝'을 읽음. 전형적인 머신러닝 의 기초부터 CNN, RNN을 간단하게 알려주고 머신러닝을 하는 법을 알려주어 흥미로웠다는 소감문을 작성함. 딥러닝을 통 한 유전체학, 의료 영상 분석, 단백질 구조예측, 약물 발견에 활용되는 사례를 통해 광범위하게 적용된다는 사실과 딥러닝의 획기적인 힘을 알게 되었다고 설명함. 딥러닝의 적용 범위, 생명과학과 데이터 과학의 결합, 약물 발견이 가장 인상 깊었던 내용이라고 밝힘. \n지구과학I: 기후 변화를 학습하는 과정에서 관심 분야인 인공지능과 연관 지어 기후 변화에 대응해 보고자 '인공지능으로 지구 현상 이해하기'라는 주제로 심화 주제 탐구를 진행함. 지구 현상 중 기후 변화, 자연재해, 환경 변화를 선정하여 탐구함. 인공지능으로 과거의 기후 데이터를 분석 및 패턴 식별에 이용할 수 있고, 이러한 분석이 미래 기후 변화가 어떻게 발생하는 지, 영향을 완화하기 위한 조치 방법 등에 도움이 될 수 있다는 점을 소개함. 조사를 진행하며 기후 변화가 매우 심각한 문제 이며, 인간의 활동이 기후 변화에 큰 영향을 미치고 있다는 점을 깨달았다는 소감을 밝히며 발표를 마무리함. 기후 변화와 인 공지능을 관련지어 탐구 활동을 진행한 모습을 통해 융합적인 사고 역량을 지닌 학생임을 엿볼 수 있었음. \n별의 물리량을 학습한 후 이를 적용하고자 오리온자리의 알파성인 베텔게우스를 선정하여 소개하기 위해 포스터를 제작함. 교과에서 학습한 내용을 활용하여 베텔게우스는 적색 초거성의 단계에 머물러 있으며, 밝기가 변화하는 맥동 변광성임을 설 명함. 더 나아가, 맥동이 내부와 외부의 압력 차이가 불안정하기 때문임을 직접 제작한 그림과 함께 발표 자료로 제작함.",
    "보건: 평소 인터넷 활용도가 높은 학생으로 디지털 성폭력에 대한 관심이 많아 관련 영상을 시청하고 조사함. 디지털 성폭력 은 피해자에게 심리적인 스트레스와 불안감을 유발할 수 있으며 피해자를 사회적으로 고립시킬 수 있다는 점을 알고 심각성 을 느낌. 이를 예방하는 방법으로 처벌 정도의 강화와 성폭력 예방 교육 강화를 제시함. 학우들에게 디지털 성폭력은 무고한 피해자를 만들고 절대로 발생해서는 안 되는 범죄임을 강조함. 평소 인공지능에 관심이 있어 보건 분야에서 활용된 인공지능 을 조사하여 발표 활동을 진행함. 환자의 의료 기록을 분석해 질병의 위험을 예측하고 치료 계획을 수립하는 인공지능과 암 환자를 대상으로 종양의 유전자 패턴을 분석하고 종양의 반응 정도를 예측하는 인공지능을 소개함. 정확한 진단과 예측을 할 수 있고, 데이터 관리가 효율적이라는 장점 (복잡한 문제 해결, 사람의 실수 감소, 반복적인 작업 제거, 빠르고 정확함)을 강 조함. 이 활동을 통해 보건 분야에서의 인공지능 활용은 미래에 더 많은 혁신을 가져올 것으로 예측하고 이 분야에 관심을 가 지고 지속해서 심화탐구 하겠다는 모습에서 AI 전문 역량을 보임. \n중국어 I: 묵묵히 주어진 시간을 충실히 채워가는 학생으로 중국어 발음을 듣고 성모, 운모, 성조를 대부분 변별 할 수 있으 며 일상생활에 필요한 감정 및 의사에 관한 표현을 듣고 낱말의 의미를 파악 할 수 있음. 개인 및 일상생활에 관한 질문을 듣 고 문장 수준으로 간단하게 대답하거나 표현할 수 있음. 수업 시간에 배운 내용(인사하기, 이름, 시간, 날짜, 요일, 생일, 취 미, 장래 희망 등)을 주제로 실시한 인터뷰를 통해 원어민 교사의 질문에 비교적 자연스럽고 적절하게 문장 형식으로 대답함. \n매 시간 학습 목표에 해당하는 문장을 한어병음과 한자로 비교적 정확하게 주제별로 정리하여 내용의 확장성이 뛰어남. 활동 지에 정리한 내용이 알차고, 한어병음을 어순에 맞게 정자체로 쓰려고 하여 전체적으로 가독성이 높음. 중국의 음식 문화에 도 관심을 가지고 중국의 4대 요리를 대표하는 산동(山東), 강소(江蘇), 광동(廣東), 사천(四川)의 각 지역별 특징과 대표 요리에 대해 이해하고 정리함. '한자 이름 디자인' 활동에서 자신의 이름을 선이 가는 신명조에 감각 있게 그림을 더하여 디자 인하였고, '南煐'을 '남쪽(대한민국)을 빛내주는 사람'으로 정의함. \n목포덕인고등학교 \n2025년 11월 20일 18/28 반 \n1 \n번호 22 이름 주남영 \ngov.kr \n정부24",
    "문서확인번호: 1763-6194-8644-5012 (신청인 : 주남영) \n과목 \n세 부 능력 및 특기사항",
    "종교학: '인공지능을 믿는 교회가 5년 만에 폐지되었다'라는 기사를 접하고 이에 흥미를 느껴 '인공지능이 종교에 미친 영향' 이라는 주제로 보고서 작성 및 발표를 진행함. 인공지능이 종교에 미친 긍정적인 영향으로 온라인 기도 사이트 '프레가'를 제 시함. 성인의 이름을 딴 AI 챗봇에 죄를 고백하고 신앙적인 조언을 구하며 이용자가 마음의 평안을 얻는 사례와 또, 유대인 랍비 조슈아 프랭클린이 챗 GPT를 활용하여 설교문을 썼음에도 신도들에게 박수받은 사례를 소개하며 종교인의 수고를 도 울 수 있다고 설명함. 그러나 도움의 영역이 아닌 종교가 인공지능에 의존하게 된다면 종교는 사라질 수 있다고 주장함. 상황 을 해석하고 분석하는 능력이 뛰어난 학생임. 축구 스타 호날두가 대리모를 통해 자녀를 출산했다는 기사를 접하고, 대리모 에 관한 관심으로 수업 중 찬반 토론을 진행함. 찬성 측 토론자로서 자연 임신이 불가능한 사람들에게 대안 및 희망이 될 수 있으며, 대리모 역시 경제적 수입을 통해 생계가 보장되는 상호보완적 행위라고 주장함. 또한 대리모 금지가 보장되지 않은 다양한 피해를 발생시킬 수 있기에 안전한 법의 테두리 안에서 시행된다면 유익할 것 같다는 생각을 자신 있게 피력함. \n평소 인공지능에 흥미를 가지고 있었고, 컴퓨터공학과 또는 인공지능학과로 진로를 희망함. DMQA 세미나 Human Action Recognition를 시청하며 Human Action Recognition의 원리를 학습하고, 그것을 활용한 딴짓 감지 AI를 고안함. 이를 통해 학생의 공부 효율을 증진할 수 있고, 집중력을 높일 수 있는 솔루션을 제공해 줄 수 있을 것으로 기대함. Event Strea m을 사용하여 사용자의 손가락 움직임을 통해 공부를 하는지 딴짓을 하는지 판단할 수 있고, RGB를 사용하여 사용자가 보 고있는 화면이 무엇인지 확인할 수 있음을 설명함. 기대효과로 책상에 앉아있는 시간이 아닌 진짜 공부한 시간을 측정할 수 있으므로 경쟁 시스템을 만들어 공부하는 욕구를 증진 시킬 수 있음을 제시함. 이러한 탐구 활동을 통해 인공지능 기술의 원 리와 중요성을 이해하고, 심도있는 후속 탐구 계획을 수립하며 인공지능 분야에 대한 열의를 드러냄. 인공지능 기술의 종류 를 조사하고 이해하며 그것을 활용하는 능력이 인상적임. 평소 일상생활에서 불편함을 느낀 경험을 바탕으로 사회문제를 해 결하려는 모습이 돋보이며, 그것을 인공지능 기술을 활용하여 더욱 효율적으로 해결하고자 하는 창의성이 인상적임. 인공지 능에 대한 전문성과 융합 능력이 돋보이는 학생임. \n<진로 선택 과목〉 \n성취도 \n성취도별 \n학기 \n교과 \n과목 \n단위수원점수/과목평균 \n비고 \n(수강자수) \n분포비율 \n수학 \n수학과제 탐구 \n2 \n96/92.2 \nA(6) \n1 \n예술 \n미술 창작 \n2 \n86/89.6 \nA (68) \nA(100.0) B(0.0) C(0.0) \nA(92.6) B(5.9) C(1.5) \n공동 \n수학 \n인공지능 수학 \n2 \n94/92.3 \n2 \n예술 \n미술 창작 \n2 \n92/89.4 \nA(8) \nA(69) \nA(100.0) B(0.0) C(0.0) \n공동 \nA(91.3) B(5.8) C(2.9) \n이수단위 합계 \n8 \n과목 \n세부능력 및 특기사항 \n수학과제 탐구: 정보화 시대에 따른 개인 정보 보호의 중요성이 대두됨에 따라 정보 보호의 기본인 암호를 이해하기 위해 진 행된 '암호학'의 탐구 활동에서 두각을 보임. 26개의 영문자를 기준으로 문자를 숫자로 치환하는 과정을 고민하고 교사에게 질문하며 정수론의 항등원과 역원, 모듈로 연산법, 키를 이용해 암호화, 복호화하는 과정을 학습한 후 덧셈암호, 아핀암호, 전치암호 등 암호화하는 방법을 정리하여 탐구일지를 작성함. 특히 애드가 앨런 포의 '황금충'에 등장한 암호문을 알파벳의 빈도수를 이용해 치환암호로 해결하는 과정을 학생들과 공유하는 모습이 인상적임. 더나아가 hill 암호에서 사용된 행렬에 관해 알아보고자 자료를 찾던 중 선형대수학이 컴퓨터 그래픽에 쓰인다는 점을 알고 자유 탐구주제로 선정함. 도서 'Linear Algebra'를 통해 벡터와 행렬의 개념을 이해한 후 회전, 랜더링 등 컴퓨터 그래픽에서 표현되는 운동의 방법과 행렬과 벡터 를 통해 운동하는 개체의 데이터 값을 구하고 구현하고 이를 정리하여 보고서를 작성함. 생소한 내용의 수학적 개념을 수치화 \n목포덕인고등학교 \n2025년 11월 20일 19/28 반 \n1 \n번호 22 이름 \n주남영 \ngov.kr \n정부24",
    "문서확인번호: 1763-6194-8644-5012 (신청인 : 주남영) \n과목 \n세부능력 및 특기사항 \n한 데이터에 적용하는데 생긴 시행착오를 친구들과 공유하는 등 스스로가 설정한 탐구 목표에 도달하고자 심도있게 고민하는 \n열정적인 학생임. \n인공지능 수학: 여러 기사에서 클린봇이 악성 댓글을 차단하는 것을 보고 일반 댓글과 어떻게 구분하는지에 대한 궁금증을 가짐. 교과서를 통해 텍스트 자료에서 단어를 추출하여 벡터로 나타내고, 부정단어 빈도수를 세어 악성 댓글을 판단한다는 정보를 발췌함. 이를 바탕으로 '파이썬을 활용한 부정 리뷰 추출'을 목표로 프로그램 제작 계획을 세움. 먼저 특정 영화의 리 뷰 데이터를 수집하여 파이썬에 저장함. 어떤 단어가 많이 나오는지 빈도 분석을 위해 str 타입이 아닌 데이터는 모두 제거하 고 워드클라우드를 통해 시각화함. 분석결과 '영화, 진짜, 정말, 그냥, 너무'라는 단어가 많이 나옴을 파악함. 이후 정규화하 여 한국어만 남기고 konlpy를 활용해 형태소를 분석함. 불필요한 용어를 제거하고 문자를 인덱스 벡터로 전환한 후 데이터 를 numpy 파일로 저장함. 이후 데이터를 불러와 파라미터를 세팅하고, cnn 분류모델로 학습하게 한 후, 긍정/부정을 파악 하도록 세팅함. 이를 통해 긍정 리뷰 수는 74827개, 부정 리뷰 수는 75173개임을 얻어냄. 포털 사이트에서 활용되는 클린봇 에 숨겨진 수학의 의미를 정확히 파악하고, 자신의 관심분야로 확장하여 알고리즘을 제작하는 일련의 과정에서 인공지능 분 야의 뛰어난 관심과 역량을 엿볼 수 있었음. \n\" \n미술 창작: 독서를 공부하면서 '세잔과 입체파'라는 지문을 읽고 입체주의에 대한 흥미를 느껴 입체파에 대해 탐구함, 조별 프 로젝트 활동에서 입체주의 미술의 태동 배경을 소개하고, 사조 특징인 기하학적인 형태의 강조를 설명함. 또한 입체주의 작 품 예시로 '우는 여인', '아비뇽의 처녀', '테이블 위의 과일그릇과 빵', 그리고 조르주 브라크의 '바이올린과 주전자'를 소개함. 이러한 활동을 통해 미술과 조형예술 분야에서 얼마나 다양하고 창의적인 표현이 이루어지고 있는지에 대해 관심을 가짐. 이 후 학생들의 모습을 입체주의 형태로 그리는 등 후속 활동을 이어감. 이를 통해 얼굴의 다양한 각도와 형태를 탐험하며 그에 따라 공간 인식 능력을 향상함. 피카소의 작품 스타일을 모방하면서 전통적인 얼굴 표현에서 벗어나 형태와 구조를 새롭게 재 해석함. 로고 디자인 활동에서 학교의 명소를 반영하여 캐릭터로 표현하고, 옷에는 교목 그림을 그려 학교의 상징성을 드러 냄. 로고 프로젝트를 통해 브랜드 심볼리즘과 중요성을 이해하며 브랜딩 요소를 적절하게 활용하는 능력을 키움. \n<체육·예술> \n학기 \n교과 \n과목 \n단위수 \n성취도 \n비고 \n1 체육 \n운동과 건강 \n2 \n2 \n체육 \n운동과 건강 \n2 \nA \n이수단위 합계 \n4 \n과목 \n세 부 능력 및 특기사항 \n운동과 건강: 농구 경기를 즐기는 학생으로 영상을 시청하는 것을 좋아하고 농구 선수 '어빈 존슨'의 플레이 스타일을 참고하 여 포인트가드 역할임에도 불구하고 포스트업 기술을 쓰거나 노룩패스를 하는 등 변수를 창출해내는 능력을 보임. 드리블 능 력이 좋고 함께 즐기고자 패스를 많이 하는 모습이 인상적이며 급우들과의 갈등을 중재하는 등 리더십을 보임. \n축구 경기 중 뛰어난 수비력을 보이고 팀의 실점을 막는데 뛰어난 모습을 보임. 특히 빠른 반사 속도와 민첩성을 활용한 1대1 \n수비에 특출남. 넓은 시야를 활용해 뒤로 뛰어오는 상대방을 향한 패스를 차단하는데 능숙하며 축구 경기규칙을 잘 이해하고 페어플레이 정신이 돋보임. \n[3학년] \n목포덕인고등학교 \n2025년 11월 20일 20/28 반 \n1 \n번호 22 이름 주남영 \ngov.kr \n정부24",
    "문서확인번호: 1763-6194-8644-5012 (신청인 : 주남영) \n원점수/과목평균 \n성취도 \n학기 \n교과 \n과목 \n단위수 \n석차등급 \n비고 \n(표준편차) \n(수강자수) \n국어 \n언어와 매체 \n4 \n78/66.4(19.0) \nB(41) \n4 \n1 \n수학 \n미적분 \n86/62.6(20.6) \nA(94) \n3 \n영어 \n영어 독해와 작문 \n이수단위 합계 \n4 \n12 \n81/60.7(15.3) \nA(155) \n3 \n과목 \n세부능력 및 특기사항 \n언어와 매체: 주어진 다양한 정보를 논리적인 기준에 따라 비판하고 분류, 재구성할 수 있는 학생으로 매체 비평 활동에서 ' 나무위키의 문제점'에 대해서 논리적으로 분석하는 비평문을 작성함. 유명한 인플루언서들이 자신의 정보가 기록된 '나무위 키'의 정보를 수정하는 영상을 보며 잘못된 정보를 얼마든지 수정하는 매체의 장점이 애초에 오류가 있는 정보의 기록을 허용 한다는 단점을 포함하고 있다는 모순을 예리하게 지적함. 또한 나무위키를 편집하는 사용자들은 자신의 주관과 특정 시각을 반영하여 편집할 수 있기 때문에 장점과 동시에 단점이 많다는 점을 주장함. 그러나 나무위키의 단점을 역이용하여 위키 정보 를 수용하면 비판적 사고력을 활용해야 하기에 오히려 장점이 될 수 있다는 독창적인 의견을 피력한 점이 돋보임. 매체 제작 프로젝트에서 '카드뉴스' 매체를 선정하고 '인공지능 최신 현황'을 주제로 간결한 정보전달 매체를 제작함. 미국, 중국, 한국 3개국의 AI 현황을 인포그래픽를 이용하여 시각적으로 표현하였고 각 국의 차이가 잘 드러나도록 정보를 명확하게 분류한 점이 돋보임. 카드 뉴스 중간 중간에 수용자와 매체의 특성을 고려한 섬세한 감각이 우수함.",
    "미적분: 매일 푸는 기출문제 프로젝트에서 문제에 필요한 수학적 개념을 파악하고 짝 친구와 함께 문제의 풀이를 토의하는 모습을 보임. 특히 정적분과 급수 사이의 관계에 관한 문제를 해결하는 데 어려움이 있었지만, 적분 구간을 여러 가지 방법으 로 바꿔서 접근하고 스스로 풀이에 오류가 없는지를 파악하며 정확하게 해결하고자 노력함. 여러 가지 함수의 미분법에 관한 내용을 학습하고 교과서를 탐독하던 중 경제학에서 수요와 공급에 관한 탄력성 등 다양한 분야에 미분이 쓰인다는 점에 궁금 증을 느껴 관련 내용을 찾아 '미분방정식의 활용'을 주제로 자유 탐구 발표를 진행함. 미분 방정식의 정의를 학습한 후 '미적 분으로 바라본 하루'를 발췌독하며 로지스틱 방정식과 뉴턴의 냉각법칙의 정의와 그 쓰임을 조사함. 로지스틱 방정식과 뉴턴 의 냉각법칙을 수식으로 표현한 후 관련된 내용을 증명하고 그래프로 표현한 내용을 정리하여 발표함. 특히 뉴턴의 냉각법칙 을 시체의 사망 시각을 추정하는 사례를 가져와 직접 미분방정식을 풀이하고 함께 계산하는 과정을 통해 설명하여 학우들이 자신의 발표에 집중할 수 있도록 유도한 점이 인상적임. \n영어 독해와 작문: 인공지능과 빅데이터 관련 책, 국제 뉴스 기사, 도서 등을 찾아 읽으며 관련된 배경지식을 넓힘. 빅데이터 에 대한 깊은 관심을 바탕으로 빅데이터의 증가는 사회의 복잡한 문제를 해결하는데 이롭고 이로 인한 기대효과는 긍정적일 것이라는 가설을 세움. 이를 증명하기 위해 직접 영어 설문지를 만들어 전체 학생들을 대상으로 설문조사를 실시함. 빅데이 터의 방대한 양이 사용자에게 혼란을 줄 수 있다는 학생의 의견을 얻고 빅데이터의 양면성에 대해 깨달음. '데이터의 증가가 사회적 이익을 초래하는가?'를 주제로 영어 에세이를 작성함. 데이터의 무분별한 증가는 데이터 훈련에 방해 요소가 될 수 있 음과 개인정보 보호, 보안 문제를 주장하며 글의 통일된 주제를 유지함. 강조 구문이나 도치법을 적절히 활용하고 문장의 구 조 설계 및 글의 맥락에 알맞은 어휘 선택 등 수준 높은 에세이를 작성함. 문제 해결 방법을 모색하던 중 수업 시간에 배운 내 용을 인용하여 많은 양의 데이터를 처리, 분석하기 위한 플랫폼을 제작하거나 사용자들은 돕는 소프트웨어 시스템 메커니즘 의 통합을 제언함. 반에서 가장 성실한 학생으로 하루에 단어 50개를 꾸준히 외움. 과제에 책임감을 가지고 최선을 다하는 모 습이 타의 모범이 됨. \n[로켓 제작 과정의 시스템 구축] \n영화 '마션'을 시청하던 중 우주정거장의 모듈을 분리하기 위해 설탕으로 폭탄을 만드는 장면을 보고, 'KNSB를 활용한 모델 로켓 제작 및 비행 알고리즘을 통한 비행 안전성 확보'를 주제로 발표에 참여함. 로켓의 안정적인 발사를 위한 비행 알고리즘 \n목포덕인고등학교 \n2025년 11월 20일 21/28 반 \n1 \n번호 22 |이름 \n주남영 \ngov.kr \n정부24",
    "문서확인번호: 1763-6194-8644-5012 (신청인 : 주남영) \n과목 \n세부능력 및 특기사항 \n을 구현하기 위해 RP2040(MCU), MPU6050(자이로센서), NEO6M(GPS), nRF24L01(통신모듈) 등 여러 하드웨어 구성 요소를 통합하여 데이터를 수집하고 분석하며 MPU6050 (자이로센서)의 센서값에 따라 Fin을 제어하고 자이로스코프, 가 속도계, 압력 센서 등에서 수집된 데이터를 처리하여 로켓의 자세, 고도, 속도 등의 정보를 산출하는 알고리즘을 구성하여 A vionics를 구축함. 또한 파이썬 기반의 비행 제어 프로그램을 PyQt를 이용하여 GUI를 구현하고 이를 이용하여 비행 전과 정을 모니터링하기 위한 FCP(Flight Control Program)를 개발함. 비행의 안정성을 확보하고, 로켓 발사를 진행하였지 만, 발사 2초 후 제어불능으로 추락하게 됨. 비행 컨트롤 모듈의 코드에서 자세 제어를 하는 부분의 서보모터의 핀 제어 각이 기준치 이상이어서 실패했음을 분석하고, 알고리즘을 개선하여 더 안정적이고 효율적인 로켓 시스템을 구축할 수 있을 것으 로 기대함. \n<진로 선택 과목> \n성취도 \n성취도별 \n학기 \n교과 \n과목 \n단위수원점수/과목평균 \n비고 \n(수강자수) \n분포비율 \n수학 \n기하 \n4 \n92/81.1 \nA(79) \nA(51.9) B(39.2) C(8.9) \n사회(역사/도 \n사회문제 탐구 \n2 \n87/83.8 \nA(94) \nA(73.4) B(18.1) C(8.5) \n덕포함) \n과학 \n물리학 II \n4 \n94/85.1 \nA(48) \nA(72.9) B(12.5) C(14.6) \n1 \n과학 \n화학II \n4 \n96/78.2 \nA(46) \nA(52.2) B(23.9) C(23.9) \n과학 \n융합과학 \n2 \n100/87.9 \nA(46) \nA(80.4) B(4.3) C(15.2) \n과학 \n정보과학 \n3 \n100/97.3 \nA(6) \nA(100.0) B(0.0) C(0.0) 공동, 타기관 \n체육 \n스포츠 생활 \n2 \n97/89.8 \nA(155) \nA(96.8) B(3.2) C(0.0) \n국어 \n심화 국어 \n74/79.9 \nB(155) \nA(54.2) B(29.0) C(16.8) \n수학 \n기하 \n79/75.5 \nB(79) \nA(40. 5) B(40. 5) C(19.0) \n수학적 사고와 \n수학 \n79/73.8 \nB(94) \nA(31.9) B(42.6) C(25.5) \n적분 \n영어 \n심화 영어 독해 \nI \n90/73.6 \nA(155) \nA(29.7) B(58.1) C(12.3) \n2 \n사회(역사/도 덕포함) \n사회문제 탐구 \n2 \n77/77.5 \nB(94) \nA(48.9) B(31.9) C(19.1) \n과학 \n융합과학 \n2 \n100/87.9 \nA(46) \nA(80.4) B(4.3) C(15.2) \n물리학 주제 토 \n과학 \n95/79.0 \nA(48) \nA(62.5) B(4.2) C(33.3) \n론 \n과학 \n화학 주제 토론 \n4 \n95/78.1 \nA(46) \nA(52.2) B(23.9) C(23.9) \n체육 \n스포츠 생활 \n2 \n100/91.3 \nA(155) \nA(97.4) B(1.9) C(0.6) \n이수단위 합계 \n51 \n목포덕인고등학교 \n2025년 11월 20일 22/28 반 \n1 \n번호 22 이름 \n주남영 \ngov.kr \n정부24 \n과목",
    "문서확인번호: 1763-6194-8644-5012 (신청인 : 주남영) \n세부능력 및 특기사항 \n심화 국어: 수업 과정에서 학우들과 협력하여 합리적으로 의사 결정하는 능력이 돋보이는 학생임. 토의 과정에서는 동료들과 의 협력을 통해 의견을 조율하며, 다양한 관점을 수용하면서도 합리적인 의사 결정을 위해 노력하는 태도를 보여줌. 다양한 자료를 조사하고 이를 근거로 한 설득력 있는 주장을 펼치며 토론을 이끌어가는 모습이 인상적이었음. 공동체 역량이 뛰어나 팀 활동에서 구성원 간의 조화를 이루며 생산적인 결과를 도출하는 데 기여함. 긍정적이고 적극적인 태도로 학습에 임하며, 협력과 책임감을 바탕으로 공동의 목표를 이루기 위해 꾸준히 노력하는 모습을 보임.",
    "기하: 컴퓨터와 게임에 대한 흥미를 바탕으로 벡터가 게임 화면 구현에 필수적임을 알고, 'Unity 게임 속 사용되는 기하학적 원리 탐구 및 2D 게임 제작'을 주제로 수학탐구활동을 진행함. 2D 게임 개발 과정에서 기하학적 원리를 이해하고, 벡터와 좌표계의 활용을 탐구의 주된 방향으로 설정함. 먼저 객체의 위치와 움직임을 나타내는데 벡터의 크기와 방향을 가지는 특징 이 중요한 역할을 담당함을 파악함. 이를 바탕으로 비디오 게임 개발을 위한 크로스 플랫폼 엔진을 통해 2D 게임을 제작함. 좌표계는 게임 내에서 객체의 위치를 (x, y)로 표현하고, 캐릭터가 좌측으로 이동할 때, x좌표가 감소하고, 우측으로 이동할 때는 증가하는 방식으로 좌표의 변경을 통해 캐릭터의 움직임을 조정함. 더불어 객체의 이동 및 속도는 속도벡터로 다른 객체 \n간의 충돌은 벡터의 뺄셈, 객체의 크기는 스칼라 곱을 활용하여 적용함. 이 과정에서 게임 개발에 쓰이는 벡터의 덧셈과 뺄 셈, 스칼라곱 등의 수학적 개념의 활용이 체감되었다고 함. 이 모든 과정을 코딩을 통해 구현하며 학우들 앞에서 시연함. 흥 미 분야를 바탕으로 수학적 개념을 적용하는 과정을 이해하여 실제 결과물을 만들어내는 모습에서 학생의 뛰어난 융합 역량 과 전문성이 관찰됨. \n수학적 사고와 적분: 컴퓨터 그래픽에 사용되는 수학적 개념 중 적분이 중요하게 쓰인다는 점을 알고 이를 정확하게 이해하 고자 탐구 활동을 진행함. 적분이 광선 추적 알고리즘의 핵심 원리로 작용하며 컴퓨터 그래픽의 이미지 색상, 밝기, 깊이 정 보 등 복잡한 현상을 모델링하는 데 사용됨을 파악하고 적분을 이용한 그래픽 기법의 장, 단점을 분석함. 적분이 컴퓨터 그래 픽에서 적용되는 구체적인 사례 분석을 통해 자연스러운 조명과 사실적인 그림자 생성, Gaussian 블러와 같은 필터링 기법 에서 적분이 노이즈 제거와 부드러운 이미지 처리를 가능하게 하여 그래픽의 시각적 품질을 높임을 실험을 파악한 내용을 토 대로 보고서를 작성함. 이를 소개하며 적분의 이론적 원리를 기반으로 컴퓨터 그래픽과 수학의 융합 가능성을 모색하였으며 실생활 문제를 수학에 어떻게 접목할 수 있을지 고민해 보는 계기가 되었다는 소감을 밝힘. \n심화 영어 독해 I: 자신의 학습 스타일을 정확하게 파악하고 이에 맞는 학습 전략을 수립하는 능력이 뛰어남. 특히 청각적 학 습 스타일임을 인지하여 오디오북과 팟캐스트를 활용한 영어 학습 방법을 적용하여 어휘력과 듣기 능력을 크게 향상시킴. 매 일 짧은 영어 에세이를 작성하는 습관을 들여 영어 작문 능력도 향상시키고자 노력함. 학습 동기를 지속적으로 유지하기 위해 영어 관련 목표를 설정하고 달성할때마다 보상을 주는 방식을 채택하여 꾸준한 학습 의지를 보임. '해외로의 지식 이전'에 관 한 영어 지문을 읽고 무역 규제 완화가 자본과 일자리 이동에 긍정적 영향을 미쳤으나 노동자 이동의 자유에는 한계가 있음을 설명하는 영어 보고서를 작성함. 기술 향상 곡선에서 위치가 높아질수록 규칙이 덜 엄격하게 적용된다는 점을 설명하며 '지 식 이전'이라는 기업 전략의 중요성을 강조함. 정교한 작업 흐름 기술이 업무를 여러 과제로 분할하고 이를 세계 여러 지역에 \n할당하여 최종 결과를 의미 있는 전체로 재구성하는 과정을 자세하게 설명하여 학우들의 이해를 높임. \n사회문제 탐구: 사회 탐구 설계의 주요 요소 및 절차를 설명하며 최근 이슈가 되고 있는 여성 징병제에 대해 흥미를 가지고 설득력 있고, 가독성 높은 프레젠테이션을 진행함. 여성 징병제는 인구 감소로 인한 병력 부족 문제에 대한 현실적인 대안이 라 주장함. 국가 안보를 공동으로 책임져야 한다는 국가 의무라는 점과 여경과 여성 고용할당제와 같이 여성의 사회적 지위 가 향상되었다는 사회적 평가를 근거로 여성 징병제를 시행해야 하며 남녀가 국가의 안보에 동등하게 기여할 수 있는 기회를 제공함으로써 성평등을 실현할 수 있다고 피력함. 사회적 논란이 되는 이슈로 발표 이후 학우들과 함께 모둠을 조직하여 조별 토론을 진행함. 아울러 또 다른 토론과 신문스크랩을 수행하여 <세포 역노화>에 대한 사회탐구 보고서를 작성함, 세포 노화는 알츠하이머병, 심혈관 질환, 당뇨병 등 여러 가지 질병의 주요 원인 중 하나이므로 세포 역노화 기술을 통해 노화 관련 질병 의 발병을 예방하거나 늦출 수 있다는 자료 조사를함. 손상된 조직이나 기관을 복구하고 재생하는 데 사용될 수 있어 장기 이 \n목포덕인고등학교 \n2025년 11월 20일 23/28 반 \n1 \n번호 22 이름 주남영 \ngov.kr \n(KOR \n정부24",
    "문서확인번호: 1763-6194-8644-5012 (신청인 : 주남영) \n과목 \n세부능력 및 특기사항 \n식을 받아야 하는 환자를 살릴 수 있을 뿐만 아니라 경제적 이익을 얻을 수 있다고 주장의 자신의 의견을 논리적으로 제시하 는 모습이 매우 돋보임. \n물리학 II: 유쾌한 성격으로 화기애애한 학습 분위기 조성에 도움을 주는 동시에 과학적 이론을 실생활에 적용하는 노력이 인 상적인 학생임. 특히, 돌림힘을 학습하는 과정에서 거리와 힘의 곱으로 표현된 돌림힘 식이 일의 식과 같다는 사실에 의문을 품고, 벡터의 곱에 내적 곱과 외적 곱이 존재한다는 사실을 추가 학습함. 이를 통해 같은 수식임에도 불구하고 곱의 종류에 따라 각기 다른 결과가 도출된다는 사실을 명확히 이해함. 더 나아가 '고등학생을 위한 물리학 (김형근)'을 탐독하여 돌림힘 사례를 바탕으로 출입문 손잡이 위치, 수공구의 모양 등에 숨겨진 돌림힘의 원리를 학습함. 더 나아가 팔씨름 또한 돌림힘이 적용된 사례라는 점을 토대로 돌림힘의 크기를 증폭하는 방법을 주제로 탐구를 진행함. 팔의 길이와 힘의 세기, 팔의 방향과 힘의 방향이 이루는 각도를 돌림힘 크기에 영향을 주는 변수로 정한 후 변수의 크기에 따른 팔씨름 승률을 확인하는 실험을 진행함. 팔의 길이나 힘의 세기는 실험 대상자가 가진 종속 변수의 성향이 강하기 때문에 팔의 각도와 손목을 이용한 힘의 방 향을 통해 최대 돌림힘을 유도하는 방안을 도출함. 결과 발표에도 참여하여 팔씨름 필승 기술을 주제로 탐구 결과를 논리적으 로 전달함. \n화학II: 물의 여러 가지 독특한 성질들이 수소 결합 때문임을 알고, 수소 결합에 대해 알아보기 위해 도서 '주변의 모든 것을 화학식으로 써 봤다(야마구치 사토루)'를 읽고 독서 활동지를 제출함. 눌린 머리카락과 수소 결합의 연관성을 읽고, 머리카락 은 주로 케라틴 단백질로 구성되어 있는데, 이 단백질 분자들 사이에는 수소 결합이 형성되어 있고, 머리카락이 눌리면 케라 틴 분자들 사이의 수소 결합이 변형되고, 머리카락이 구부러지고 모양이 변형되는데, 물리적 원리가 아닌 화학적 원리가 적 용되는 점이 신기하다고 작성함. \n독서 활동 후 수소 결합의 원리와 예에 관심을 가지고 자유탐구활동을 하고 발표함. 수소 결합의 원리는 수소 원자가 전기음 성도가 높은 원자에 결합 되면 수소 원자는 부분적으로 양의 전하를 띠게 되고, 전기음성도가 높은 다른 원자와 전기적 인력 이 생기며 부분적인 음의 전하를 띠게 되는데 이를 수소 결합이라고 하고, 수소 결합의 예로는 DNA, 물, 카복실산 등이 있음 을 발표함. 수업을 듣는 자세가 좋고 열정적으로 참여하며 다른 친구들이 궁금해하는 것을 잘 도와주고 자신의 지식 확장을 위해 책을 읽고 영상을 본후 찾아와 질문을 많이 하는 등 다방면으로 노력하는 자기주도적인 학생임.",
    "융합과학: 사회적 이슈에 대한 깊은 관심과 분석적 사고를 통해 지속 가능한 해결책을 모색하는 주도적인 학생임. 현재의 인 공지능이 나오기까지 데이터를 수집하고 활용하는 방법이 어떻게 변화됐는지에 대한 발전사를 주제로 스토리보드로 작성함. 활용된 주요 과학적 개념과 기술을 함께 정리하여 단계를 거쳐 발전하게 된 핵심 발견과 발전 요소를 짚었으며 현재 딥러닝과 머신러닝 기술의 인공지능에서 중요한 빅데이터의 발전사를 체계적으로 정리함. 후속 탐구를 통해 데이터 크기와 데이터의 질을 단계별로 늘려가며 모델 성능 변화를 관찰하고 데이터양과 질이 모델 성능에 미치는 영향을 분석하였고 분석 결과 변화 하는 상관관계를 그래프로 나타내고 보고서로 정리함. 디지털 기술이 나아가는 방향성을 제시하는 데 앞의 탐구를 바탕으로 한 데이터 품질을 위한 데이터 전처리에 대한 의견을 제시함과 동시에 인공지능이 잘 활용되기 위해 모든 공정에서의 윤리성 이 보장되어야 하고 지속 가능한 기술 발전에 대한 가치 역시 지향하여야 함을 강조하며 발표를 마침.",
    "정보과학: 일상에서 접할 수 있는 다양한 센서와 IoT 기술에 관심을 갖고 이를 창의적, 효율적으로 구현해 보고자 정보과학 교육과정을 수강함. 팀 프로젝트 활동에서 생활 속 다양한 문제 상황을 피지컬 컴퓨팅으로 구현함. 소파에 앉거나 사람의 움 직임 감지로 켜지는 스마트 조명 (조도 및 PIR센서), 창문 쪽 조도값에 의해 작동되는 알람기능과 블라인드(서보모터), 시청 간격이 너무 가까우면 자동으로 꺼지는 스마트 TV(초음파 및 LCD) 등을 구현하였고, 온·습도 센서의 값에 따라 작동되는 에어컨을 묘사함. 이후, 온·습도 값의 LCD 출력 및 값의 범위에 따른 LED 색상 변화로 시각적인 효과를 추가함. 또한, 팀 원들과 협업하여 블루투스와 앱 제작을 통해 스마트폰 제어가 가능한 조명, 적외선 센서로 외출 시 외부인 침입을 감지하여 경고 메시지를 전송하는 보안 시스템 구현에 성공함. 이 과정에서 창의성과 리더십을 발휘해 팀원들 간의 협력을 촉진하고 문 제 상황에서도 냉정하게 대처하여 효과적인 해결책을 찾는 중추적인 역할을 담당함. 프로젝트 수행 시 문제를 발견하고 분석 \n목포덕인고등학교 \n2025년 11월 20일 24/28 반 \n1 \n번호 22 이름 주남영 \ngov.kr \n정부24",
    "문서확인번호: 1763-6194-8644-5012 (신청인 : 주남영) \n과목 \n세부능력 및 특기사항 \n하여 해결책을 찾는 창의적인 아이디어로 알고리즘을 기획하고 설계하여 원하는 형태로 구현하거나, 이를 새로운 프로그램으 로 확장하는 능력이 탁월함. \n물리학 주제 토론: 휴머노이드 기술의 발전에 따른 인간과 기계의 경계에 대해 심도 있는 토론을 진행하며, 인간성을 규정하 는 핵심 요소를 논리적으로 탐구함. 인간의 정체성을 결정짓는 요소로 뇌와 의식을 강조하며, 뇌가 인간이라면 신체가 기계 로 대체되어도 여전히 인간으로 볼 수 있다는 견해를 제시함. 반면, 뇌가 기계로 대체될 경우 인간의 정체성이 상실되고 로봇 으로 간주된다는 논리를 설득력 있게 설명함. 인간의 의식, 자아 인식 능력, 감정 생성 및 경험 축적, 창의적 사고와 자율적 의사결정 능력을 기준으로 인간과 기계를 구분하는 다양한 근거를 제시함. 이러한 분석을 통해 휴머노이드 기술 발전이 가져 올 윤리적, 사회적 문제를 다각적으로 이해하며, 인간성과 기계성의 정의를 명확히 하는 데 기여함. 토론 과정에서 과학적 근 거와 창의적인 사고를 바탕으로 문제를 논리적으로 접근하며, 구성원 간의 의견을 조율하여 협력적인 분위기를 형성함. 다양 한 관점을 종합하고 이를 명확히 정리하여, 인간과 기계의 구분에 대한 심도 있는 이해를 보여줌. 결과 보고서에서도 주제의 핵심을 체계적으로 표현하며, 창의적이고 논리적인 사고력을 발휘함. \n화학 주제 토론: 산화와 환원 반응에 대한 이해를 바탕으로, 화학적으로 일어나는 전자 이동을 논리적으로 설명하는 모습을 자주 보임. 각 반응이 에너지 변화와 물질의 상태에 미치는 영향을 분석하며, 전자 이동을 통해 산화와 환원의 구체적인 예시 를 들어 설명함. 산화수 변화와 반응물, 생성물 간의 관계를 명확하게 이해하고 이를 실제 화학 반응에 적용하려는 깊은 사고 력을 발휘함. \n스포츠 생활: 매수업 시간과 복장을 준수하고 교사의 지도와 수업과제를 성실하게 참여하는 학생임. 자신이 목표하는 성취기 준에 도달하기 위한 의지가 높고 과제집착력과 몰입도가 상당함. 수업 과제가 주어졌을 때 주어진 할당량을 넘어 자신이 하고 자 하는 기회를 최대치로 활용하는 학생임. 스스로 많은 시도와 연습으로 성공적인 수행과 우수한 평가를 받고자 함. 지구력 과 근력이 뛰어난 학생으로 스포츠 경기에서 수비 역할과 같은 많은 활동량과 넓은 지역을 커버하는 역할에서 경기수행능력 이 돋보이는 학생임. 자신의 실수에는 끝까지 상대를 따라가 포기하지 않으려는 장면이 많이 관찰되고 동료의 실수에는 적극 적으로 커버하여 보완하려는 움직임이 자주 관찰됨. 자신감과 승리하고자 하는 열의가 높아 팀스포츠 경기 중에는 팀 전체에 게 긍정적이고 고무적인 분위기를 형성함. 주어진 과제에 대해 자기주도적으로 하고자 하는 의지가 높은 학생이므로 과제 수 행방법과 적절한 피드백을 제공해준다면 높은 수행능력과 우수한 결과를 나타낼거라 기대됨. \n<체육·예술> \n학기 \n교과 \n과목 \n단위수 \n성취도 \n비고 \n이수단위 합계 \n세부능력 및 특기사항 \n과목 \n해당 사항 없음 \n7. 독서활동상황 \n학년 과목 또는 영역 \n1 수학 \n독서 활동 상황 \n(1학기) 프로그래머, 수학으로 생각하라(유키 히로시) 통계학, 빅데이터를 잡다(조재근) \n목포덕인고등학교 \n2025년 11월 20일 25/28 반 \n1 \n번호 22 이름 \n주남영 \ngov.kr \n정부24",
    "문서확인번호: 1763-6194-8644-5012 (신청인 : 주남영) \n학년 과목 또는 영역 \n1 \n수학 \n수학 I \n2 \n물리학 I \n생명과학 I \n미적분 \n기하 \n3 \n물리학 II \n화학II \n8. 행동특성 및 종합의견 \n독서 활동 상황 \n(2학기) 나는 수학으로 세상을 읽는다(롭 이스터웨이), \n길 위의 수학자(릴리언 R. 리버) \n(1학기) 수학, 컴퓨터, 그리고 미래(데이비드 왈러스), 수학으로 풀어보는 컴퓨터공학(이병수) \n(2학기) 반도체 제대로 이해하기 (강구창) \n센서와 작동기(Nathan Ida) \n(2학기) 생명과학을 위한 딥러닝 (바라스 람순다르, 피터 이스트먼) \n(1학기) 미적분으로 바라본 하루 (오스카 E. 페르난데스) \n(1학기) 유니티로 배우는 게임 수학(구부키 류이치) \n(1학기) 고등학생을 위한 일반 물리학(김형근) \n(1학기) 주변의 모든 것을 화학식으로 써 봤다(야마구치 사토루) \n학년 \n행동특성 및 종합의견 \n1학기 학급 진로 부장(2022.3.2.-2023.8.16.)으로서 친구들이 각자 진로에 관한 관심을 키워나가도록 관련 자료 와 인터넷 사이트를 소개하고 학과를 추천하는 등 맡은 일을 성실하게 수행함. 또한 본인의 진로를 탐색하는 과정에 서 TV의 지식 관련 프로그램을 시청하고 소감문과 활동지를 작성하며 적성을 찾기 위해 노력함. \n2학기 학급 정보부장(2022.8.17.-2023.2.24.)을 맡아 수업 시작 전에 친구들에게 학교 공용 노트북을 나누어 주 고 수업이 끝나면 노트북을 수거하여 충전이 가능한 수납함에 정리하여 다음 수업 시간에 차질 없이 사용할 수 있도 1 록 맡은 일을 성실히 수행함. \n2 \n3 \n컴퓨터 사용 능력이 뛰어나 친구들이 네트워크와 컴퓨터 사용 등 어려워하는 문제를 해결하는 데 도움을 주었으며 친구들의 갈증을 중재하는 등 탁월한 의사소통 능력과 통솔력을 보이며 학급의 질서를 지키는 데 큰 역할을 함. 항상 \n선생님과 친구들을 보면 인사를 하는 학생으로 예의가 바르고 교우관계가 좋은 학생이며, 다른 학생들에게 모범이 되는 모습을 보여줌. 전반적으로 수업 태도가 매우 좋고 필기를 열심히 하며 수업이 끝나면 친구들에게 필기한 내용 을 공유하는 등 배려심과 집중력을 비롯한 학업에 대한 강한 열의가 돋보이는 학생임. \n모범적인 생활 태도와 정의로운 성격을 지니고 있어 불의를 지나치지 못하는 학생임. 2학년 선도부원으로 선생님의 추천을 받아 영입될 정도로 신망이 컸으며, 이후 선도부원으로 성실히 활동하며 교문 앞에서 학생들의 복장 및 지각 지도를 보조하는 역할을 수행함. 규칙 준수에 대한 신념이 강하여 전교생들의 복장 지도 및 생활지도를 수행하였고, 학생 선도에 크게 기여함. 학교의 정보통신부장으로서 컴퓨터 및 IT 기기에 능해 학교의 고장이 난 컴퓨터를 고치 \n고, 학교 컴퓨터를 가지고 비교육적인 행동을 하지 못하도록 막기 위해 학교 컴퓨터의 공공 비밀번호를 관리함. 자신 의 특기를 좋은 곳에 활용하고자 학생들의 전자기기가 고장 났을 때 도움을 주기 위해 알고 있는 지식을 활용해 해결 책을 제시함. 1학기 부반장으로써 학생들이 모금한 돈을 관리하는 역할을 맡음. 친구들과 친하게 지내며 학급의 분 위기를 좋은 방향으로 만들어 가는 데 노력하였으며, 질서를 지키는 데 크게 기여함. 조별 수행평가를 할 때 역할을 적절히 분배해 갈등을 최소화하기 위한 모습을 보임, 친구들이 가장 꺼리는 역할인 발표를 맡으며, 의사소통 능력을 키움. 자신이 가지고 있는 능력을 친구들을 위해 쓰려는 모습이 인상적인 학생임. \n선생님들과 학생회장에게 큰 신임을 받아 학생회 정보통신부장을 맡아달라는 요청을 받을 정도로 책임감과 정보기 술을 갖춘 모범적인 학생임. 컴퓨터와 기계를 다루는 능력이 뛰어나 여러 학생과 선생님의 노트북을 수리하거나 교 \n목포덕인고등학교 \n2025년 11월 20일 26/28 반 \n1 \n번호 22 이름 주남영 \ngov.kr \n정부24 \n학년",
    "문서확인번호: 1763-6194-8644-5012 (신청인 : 주남영) \n행동특성 및 종합의견 \n과 수업 중에 발생하는 컴퓨터 문제를 해결하며 신뢰를 얻음. 도움이 필요한 상황에서 기꺼이 나서며 친구들에게 믿 음직한 존재로 자리매김함. \n리더십 프로그램에 참여하여 효과적으로 의견을 표현하고 상대를 배려하며 사람들을 이끄는 방법을 익히며 리더십 을 한층 강화함. 쓰레기통 청소와 청소도구함 정리를 하루도 빠짐없이 수행하며, 자율학습실 쓰레기통도 자발적으로 \n비우는 등 공동체를 우선으로 생각하는 이타적인 모습을 보임. \n학교에서 화장실 휴지가 없어 곤란해하는 친구들을 위해 학급 방역물품 보관함에 휴지를 비치하여 친구들이 자유롭 게 사용할 수 있도록 배려심을 발휘함. 항상 성실하고 모범적인 태도로 학급이 하나가 될 수 있도록 솔선수범하며 긍 정적인 영향을 미침. \n목포덕인고등학교 \n2025년 11월 20일 27/28 반 \n1 \n번호 22 이름 \n주남영 \ngov.kr \n(KOR \n정부24",
    "문서확인번호: 1763-6194-8644-5012 (신청인 : 주남영)",
    "발급번호: Q100000199-2025-001811 \n학교생활기록 부 \n성 \n명 \n주남영 \n인적 \n사항 \n주민등록번호 060422-******* \n담당부서 \n목포덕인고등학교 \n담당자 전화번호 \n채경운 \n061-240-6419 \n위 사람의 학교생활기록부 사본임을 증명합니다. \n2025년 11월 20일 \n목포덕인고등학교장 \nHND \nOTHE \n목포덕인고등학교 \n2025년 11월 20일 28/28 반 \n1 \n번호 22 이름 \n주남영 \ngov.kr \n정부24"
  ],
  "reading": "학년 과목 또는 영역 \n1 수학 \n독서 활동 상황 \n(1학기) 프로그래머, 수학으로 생각하라(유키 히로시) 통계학, 빅데이터를 잡다(조재근) \n목포덕인고등학교 \n2025년 11월 20일 25/28 반 \n1 \n번호 22 이름 \n주남영 \ngov.kr \n정부24 \n문서확인번호: 1763-6194-8644-5012 (신청인 : 주남영) \n학년 과목 또는 영역 \n1 \n수학 \n수학 I \n2 \n물리학 I \n생명과학 I \n미적분 \n기하 \n3 \n물리학 II \n화학II",
  "behavior": {
    "grade1": "2",
    "grade2": "KST \n정부시절 \n문서확인번호: 1763-6194-8644-5012 (신청인 : 주남영) \n학교생활세부사항기록부(학교생활기록부II) \n졸업대장번호 20420 \n구분 \n학년",
    "grade3": "1. 인적·학적사항 \n성명 : 주남영 \n학생정보 \n학과 \n반 번호 \n담임성명"
  },
  "raw_text": "점 \n확 \n인 \n'진본 \n2025/11/20 \n15:22:52 \nKST \n정부시절 \n문서확인번호: 1763-6194-8644-5012 (신청인 : 주남영) \n학교생활세부사항기록부(학교생활기록부II) \n졸업대장번호 20420 \n구분 \n학년 \n1 \n2 \n3 \n1. 인적·학적사항 \n성명 : 주남영 \n학생정보 \n학과 \n반 번호 \n담임성명 \n2 \n21 \n최석원 \n2 \n20 \n고영학 \n1 \n22 \n김은정 \n성별 : 남 \n주민등록번호 : 060422-******* \n주소: 전라남도 목포시 삼향천로91번길 21, 202동 704호 (옥암동, 현대2차아파트) \n2022년 2월 10일 목포하당중학교 제3학년 졸업 \n학적사항 2022년 3월 2일 목포덕인고등학교 제1학년 입학 \n2025년 2월 5일 목포덕인고등학교 제3학년 졸업 \n특기사항 \n2. 출결상황 \n결석일수 \n지각 \n학년 수업일수 \n1 \n191 \n2 \n190 \n3 \n190 \n3. 수상경력 \n조퇴 \n결과 \n질병 미인정 기타 질병 미인정 기타 질병 미인정 기타 질병 미인정 기타 \n특기사항 \n개근, 원격수업일수 \n5일 \n개근, 원격수업일수 \n0일 \n개근 \n목포덕인고등학교 \n2025년 11월 20일 1/28 반 \n1 \n번호 22 이름 \n주남영 \n(KOR \ngov.kr \n정부24 \n문서확인번호: 1763-6194-8644-5012 (신청인 : 주남영) \n학년 \n수상명 \n등급(위) \n수상연월일 \n수여기관 \n(학기) \n수학 창의문제 해결 경진대 회 \n장려상(5위) \n2022. 05.11. \n목포덕인고등학교장 \n참가대상 \n(참가인원) \n1학년(162명) \n통계포스터 제작 경진대회 \n동상(4위) \n2022.05.13. \n목포덕인고등학교장 \n1학년(162명) \n1 \n수학 심화문제 해결 경진대 회 \n동상(4위) \n2022, 11, 29. \n목포덕인고등학교장 \n1학년(160명) \n2 \n교과우수상(미술) \n2022.12.30. \n1 \n수학 창의문제 해결 \n장려상(5위) \n2023.05.17. \n2 \n수학 심화문제 해결 \n장려상(5위) \n2023, 11, 29. \n2 \n교과우수상(운동과 건강) \n2023. 12. 29. \n목포덕인고등학교장 \n목포덕인고등학교장 \n목포덕인고등학교장 \n목포덕인고등학교장 \n수강자 \n2학년(162명) \n2학년(157명) \n영어 콘텐츠 제작 \n장려상(4위) \n2024.06.28. \n목포덕인고등학교장 \n수강자 \n3학년 전체(156 명) \n교과우수상(융합과학) \n2024.07.19. \n3 \n3년 개근상 \n2025. 02.05. \n목포덕인고등학교장 \n목포덕인고등학교장 \n수강자 \n3학년(156명) \n교과우수상(융합과학, 스포 \n2 \n2025.02.05. \n목포덕인고등학교장 \n수강자 \n츠 생활) \n표창장(봉사부문) \n2025.02.05. \n목포덕인고등학교장 \n3학년(156명) \n4. 자격증 및 인증 취득상황 \n<자격증 및 인증 취득상황> \n구분 \n명칭 또는 종류 \n번호 또는 내용 \n취득연월일 \n발급기관 \n<국가직무능력표준 이수상황> \n능력단위 \n학년 학기 \n세분류 \n이수시간 \n원점수 \n성취도 \n비고 \n(능력단위코드) \n해당 사항 없음 \n5. 창의적 체험활동상황 \n목포덕인고등학교 \n2025년 11월 20일 2/28 반 \n1 \n번호 22 이름 \n주남영 \n(KOR), \ngov.kr \n정부24 \n1 \n문서확인번호: 1763-6194-8644-5012 (신청인 : 주남영) \n학년 \n영역 \n시간 \n자율활동 \n75 \n동아리활동 \n43 \n창의적체험활동상황 \n특기사항 \n평소 인공지능을 활용한 문제 해결에 관해 관심을 지닌 학생으로 해커톤 모둠 활동(20 22.10.31./8시간)에 참여함. 수질검사를 위해 업체를 부르는 번거로움을 줄이고, 사 람이 직접 하는 수질검사의 대안으로 수시로 검사하여 오염도를 빠르게 감지할 수 있도 록 아두이노를 통한 수질검사 자동화 시스템을 고안하여 제안함. 3D 프린터를 활용하 여 외관을 만들고 태양광 발전기를 통해 배터리를 충전하며 GPS를 사용하여 위치를 파악하고 초음파 센서를 통하여 사고를 방지, 아두이노용 아날로그 TDS 센서와 카메 라를 통해 수질을 감지, NRF 통신 모듈을 사용하여 양방향 통신하는 프로토타입을 제 작하여 모둠 활동에 참여한 친구들에게 소개함. 최근 일어났던 강남 홍수 사태의 원인 중 하나로 배수구가 쓰레기로 막혀 빗물이 잘 내려가지 않았다는 기사를 접하고 '스팀 PBL 활동'에서 이를 해결하려는 방법을 모색함. 태양광 발전기를 통해 비영구적인 에 너지 제공이 가능하며 평소에는 중간에 대각선의 쓰레기 거름망을 설치한 일반 하수구 상태이다가 습도 감지 센서가 습기를 감지하였을 때 모터를 이용하여 쓰레기를 올려 배 출하는 형태의 프로토타입을 제작함. 이러한 활동을 수행하면서 창의적 문제 해결 능 력과 응용 능력을 키움. \n(Hacker (융합, 컴퓨터)) (43시간) 자율주행 자동차 탐구를 바탕으로 아두이노를 활용 한 RC카를 전진, 후진을 비롯한 다양한 방향 전환의 프로그래밍을 구현하면서 RC카 앞에 있는 장애물을 피하기 위해 적외선 센서를 사용하여 일정 거리가 되면 바퀴를 회 전시키는 코딩 프로그램을 작성하는 등 창의적 사고력이 돋보임. 제작한 RC카를 동아 리 체험 부스에 선보이며 학우들이 자유롭게 이용할 수 있도록 소프트웨어 체험 부스를 운영하고 아울러 학우들에게 RC카가 구동되는 원리와 제작 과정을 직접 나서 설명하 는 등 소프트웨어의 중요성을 전달하고 적극적인 참여가 돋보이는 학생임. 또한 학교 에서 석식을 먹는 학생들을 구별할 수 있도록 아두이노로 작성된 코드를 수정해보면서 텍스트 프로그래밍에 관심을 가짐. 코드를 수정하는 과정에서 일일이 바꿔야 한다는 점에서 불편함을 느끼고 이를 더 편하게 수정할 수 있도록 동아리 친구들과 파이썬으로 테스트를 해보면서 프로그래밍에 대한 부족한 점을 깨닫고 자신이 나아갈 방향성을 다 짐함. 컴퓨터를 조립, 분해하며 하드웨어 시스템에 관한 이해도를 높이고 선배에게 네 트워크와 윈도우 관련 서비스 시스템에 관해 설명을 듣고 컴퓨터를 고칠 수 있는 능력 을 키움. \n목포덕인고등학교 \n2025년 11월 20일 3/28 반 \n1 \n번호 22 이름 \n주남영 \ngov.kr \n정부24 \n문서확인번호: 1763-6194-8644-5012 (신청인 : 주남영) \n창의적체험활동상황 \n학년 \n영역 \n시간 \n특기사항 \n희망분야 공학계열 \n1 \n진로활동 \n2 \n자율활동 \n7 \n93 \n대학교 학과 체험 (2022. 5. 18.) 중 컴퓨터공학과의 강연을 들으며 컴퓨터에 대한 지식 과 기술을 배우고 다양한 분야에 적용할 수 있는 컴퓨터공학과에 관한 흥미와 관심을 키움. 이후 간단한 연산 프로그램을 직접 프로그래밍하며 컴퓨터를 이용한 문제 해결 에 흥미를 느낌. 이를 계기로 진로에 대해 깊게 고민해 보는 시간을 가짐. 또 00대학교 학과 강연 (2022. 7. 13.)에 참여하여 컴퓨터공학과와 관련된 다양한 부문에서 대학 입 시 관련 내용을 살펴봄. \n대학 전공 알림 아리(2022.9.8.)에서 AI 융합 대학과 '공업과 기술 및 공학 관련 학과 에 대한 설명을 들음. 처음 강연에서는 4차산업혁명 시대를 선도하는 창의적인 융합 인재 양성을 위해 기존 학과의 틀 속에서 진행되는 교육에서 벗어나 융합적이고 복합적 인 지식을 교육하며 인공지능학부, 빅데이터 융합 학과 등 여러 분야를 학습할 수 있다 는 사실과 두 번째 강연에서 소프트웨어 공학과 컴퓨터 정보통신 공학과, 화학 공학부 등에 대해 알게 됨. 이를 통해 인공지능에 관한 관심을 더욱 키웠으며 도서 '인공지능 의 현재와 미래’를 읽으며 인공지능의 기술을 탐구하고, 미래에는 인공지능이 많은 분 야에 활용되어 사용될 것으로 예측함. 이후 컴퓨터 게임에 흥미를 느끼고 컴퓨터 게임 을 직접 만들어 보고 싶다는 포부를 밝힘. 또, 게임을 컴퓨터로 구현하기 위해서는 프 로그래밍을 배워야 함을 알고 현직 컴퓨터 프로그래머와 전화 통화로 인터뷰를 진행하 여 4차 산업 분야에서는 빠질 수 없는 것이 코딩이라는 이야기를 통해 프로그래머의 밝 은 비전을 이해함. 이를 계기로 컴퓨터 프로그래머를 목표로 정하고, 관련 과목인 정보 와 수학 등의 학습에 더욱 매진하는 등 목표를 위하여 꾸준히 노력하는 모습을 보임. \n국어 교과에서 책 '정의란 무엇인가'(마이클 샌델)을 독서함. 특히, '소수가 희생해 다 수가 행복하다면 정의인가?'라는 물음에 깊은 사색을 함. 이후, 이와 관련된 자율주행 자동차의 문제점인 트롤리 딜레마에 대한 관심을 가지고 탐구를 진행함. 특히, 실질적 해결책을 주도적으로 제시하겠다는 목표를 세움. 아이디어 구상 단계에서 MBTI 키워 드에 영감을 받고, 차량을 구매하기 전 사고 상황에 대한 판단 경향 조사를 통해 운전 자의 기준을 AI에 학습시켜 사용자 맞춤화 소프트웨어를 제공하는 해결책을 제시함. 작년 활동에서 트롤리딜레마 내의 학생들의 판단 기준을 설문조사한 결과를 바탕으로 조사집단(185명)은 나이가 어리고 사람의 수가 많을수록 안전을 우선시하는 경향이 있 음을 파악한 후, 8개의 유형으로 이를 나눈 TDTI(트롤리딜레마 MBTI)를 제시함. Py thon을 활용하여 데이터를 정리한 후 학생들의 TDTI를 확인한 뒤 노인, 어른, 어린이 로 이루어진 사고 상황에서의 선택을 제시하는 프로그램을 완성한 후, 일련의 과정을 심화탐구제에서 발표하며 자율주행자동차의 실현 가능성을 한층 더 높일 수 있음을 주 장함. 독서에서 비롯된 의문에 대해 주도적으로 해결책을 제시하는 모습과 프로그램을 \n제작하는 탐구력이 탁월함 \n목포덕인고등학교 \n2025년 11월 20일 4/28 반 \n1 \n번호 22 이름 주남영 \ngov.kr \n정부24 \n2 \n문서확인번호: 1763-6194-8644-5012 (신청인 : 주남영) \n학년 \n영역 \n시간 \n동아리활동 \n53 \n창의적체험활동상황 \n특기사항 \n(Hacker (융합, 컴퓨터)) (53시간) 담임선생님이 두 손에 물건을 들고 학년실로 들어가 기 불편한 모습을 보고 머신러닝을 활용하여 자동문 앞 카메라가 얼굴을 인식해 자동으 로 문을 여는 프로그램을 만들어 보고자 계획함. 3D 프린터로 직사각형 모양의 틀을 만들어 그 안에 카메라와 모터, 플라스틱 블록을 넣은 뒤 라즈베리파이 카메라 센서로 얼굴을 인식하면 신호를 받아 모터가 움직여 블록이 자동문 버튼을 누르는 장치를 설계 하고 3D 모델링을 통해 테스트를 거침. 또한 자신과 친구의 얼굴을 사진으로 촬영한 얼굴인식 모델을 tensorflow로 로드한 후 python 물체 인식 라이브러리인 opencv 의 CascadeClassifier와 VideoCapture를 사용하여 얼굴을 인식하고 검출된 얼굴 이미지를 추출 및 전처리 후 예측 결과에 따라 일치하면 신호를 보내고 일치하지 않 으면 X 신호를 보내 모터를 작동시키는 코드를 작성함. 수학II 시간에 배웠던 미분을 활용하여 오차율을 줄이는 머신러닝의 경사하강법을 활용하면서 얼굴 이미지 학습 정 확도를 높이는 결과를 얻게 됨. 이후 프로그램을 통해 무리하게 문을 열다 다치거나 무 단 침입자가 발생하는 경우를 대비할 수 있을 것이라 기대함. 일상생활에서 문제를 찾 아 능동적인 자세로 해결하는 능력이 뛰어남. \n희망분야 컴퓨터공학 \n진로활동 \n인공지능의 종류, 간단한 원리, 생활 속의 인공지능에 관해 설명을 듣고, 티처블머신을 \n활용해 개와 고양이를 분류하는 프로젝트를 진행함. 사진을 하나하나 가져오는데 불 편함을 느끼고 python과 Selenium 라이브러리를 활용해 크롤링을 통해 사진을 가져 오고 에포크를 50번 진행 시킴. 이러한 활동을 통해 머신러닝 프로세스의 반복적인 특 성에 대해 이해하고 인공지능에 대해 흥미를 가짐. NVIDIA Jet Bot과 python을 활 용해 충돌을 방지하는 자동차의 코드 설명을 듣고, 충돌할 때와 충돌하지 않을 때를 사 진을 찍어 학습시킴. 창의성과 전문성을 활용하기 위해 해커톤 캠프에 참여함. 평소 피 로함을 느끼고, 이를 해결하기 위한 방법은 영양소 불균형을 해결하는 것으로 생각하 고 맞춤형 영양 공급 시스템 C. N. S를 고안해 냄. 신원 확인하기 위해 학생증을 아두이 노 RFID 센서에 태그하고 학생증에 있는 정보를 통해 신체 정보를 분석하고 채혈을 통 해 학생증으로 인식된 정보를 토대로 그 사람의 영양소 상태를 분석한 후 섭취한 식단 분석을 통해 영양소 결핍의 오차 범위를 최소화하는 방식으로 부족한 영양소를 선택하 여 알약을 공급하는 알고리즘을 제작함. python을 활용해 입력받은 키, 몸무게 등 신 체 정보와 식단을 분석하고, 아두이노 LCD 디스플레이와 LED를 활용해 부족한 영양 소와 과도하게 섭취된 영양소를 표시하는 코드를 제작한 후 ppt를 제작해 발표함. 시 스템이 상용화가 된다면 부족한 영양소를 채워 건강한 사회를 만들고, 금전적인 문제 로 인해 식사를 하지 못해 영양소가 부족한 학생들에게 도움을 주는 등 미래 전망을 설 명하며 발표를 마침. 이후 이 아이디어를 실현하고자 하는 의지를 갖추고 OO대학교 창 업 인재 양성을 위한 스타트업 튜터링 프로그램에 참여함. \n목포덕인고등학교 \n2025년 11월 20일 5/28 반 \n1 \n번호 22 이름 \n주남영 \ngov.kr \n정부24 \n3 \n문서확인번호: 1763-6194-8644-5012 (신청인 : 주남영) \n학년 \n영역 \n시간 \n자율활동 \n69 \n창의적체험활동상황 \n특기사항 \n자세 교정 보정 기구에 과도하게 의존하는 친구들을 보고, 자세 교정의 필요성을 인식 하여 학술제에서 '건강한 학교생활을 위한 자세 교정 의자 제작'을 주제로 발표하고, 이 론적 배경으로 빅데이터와 머신러닝을 제시함. 정확한 자세 인식을 위해 많은 양의 데 이터가 필요하지만 적절한 데이터셋을 찾을 수 없어 직접 촬영하여 적합한 데이터를 대 량으로 생산함. 적절한 자세와 부적절한 자세를 구별하기 위해 티처블머신의 포즈 프 로젝트를 활용함. 적절한 자세, 부적절한 자세, 매우 부적절한 자세 3가지 클래스로 구 별하고, 이를 p5.js로 인식하여 아두이노에 신호를 보내는 코드를 작성함. 이후 2개의 LED와 1개의 부저를 활용하여 부적절한 자세에서는 LED 1개가 켜지고 매우 부적절한 자세에서는 LED 2개와 부저가 울리도록 코딩하여 프로토타입 제작에 성공함. 실시간 으로 사용자의 자세를 관찰하여 교정할 수 있고, 사물 인터넷을 활용하여 스마트폰과 결합하여 사용자의 자세를 분석 및 조정할 수 있어 높은 활용도를 보일 수 있다고 발표 함. 이 과정에서 데이터 수집 및 분석, 프로그래밍과 하드웨어 제작 기술을 익히며 융 합적 문제 해결 능력과 창의적 사고력을 발휘함. \n(Hacker (공학, 컴퓨터)) (53시간) 혼자 거주하는 집에 비밀번호를 뚫고 침입한 가구 배 달원 뉴스를 접하면서, 일상 속에서 발생하는 범죄의 위험성과 학교에서 사용되는 사 물함 보안 장치가 친구들에 의해 쉽게 해제되는 상황을 목격하고 보안의 중요성을 절감 함. 이를 계기로 보안 문제 해결 방안을 모색하여 OTP 방식을 활용한 도어락 시스템을 고안하고, 아두이노 통신 모듈을 이용해 OTP 보안 번호를 생성하는 코드를 개발함. F lutter 앱을 통해 비밀번호를 수신하고 스마트폰에서 확인할 수 있도록 구현함. Flutt er 앱에서 아두이노의 시리얼 통신을 통해 OTP 보안 번호를 받아 사용자에게 표시하 고, 사용자가 입력한 OTP 번호를 아두이노로 다시 송신하는 코드를 작성하여 화면 터 치시 메서드가 호출되도록 설계함. 4x4 키패드를 통해 올바른 비밀번호를 입력하면 서보모터가 반 바퀴 회전하도록 코딩함. 이후, 폼 보드를 활용해 실제 프로토타입을 제 작하고 잠금 해제 과정을 시연함. 이러한 보안 강화 조치를 통해 사회 안전과 개인정보 보호의 중요성을 강조하였고, 향후 본인 인증 API를 활용해 스마트폰과 연결하여 사 물인터넷으로 제어할 수 있는 보안 방안을 끊임없이 탐구하며, 일상의 문제를 해결하 려고 노력하겠다는 포부를 밝힘. \n동아리활동 \n53 \n목포덕인고등학교 \n2025년 11월 20일 6/28 반 \n1 \n번호 22 이름 \n주남영 \n(KOR \ngov.kr \n정부24 \n문서확인번호: 1763-6194-8644-5012 (신청인 : 주남영) \n창의적체험활동상황 \n학년 \n영역 \n시간 \n특기사항 \n희망분야 컴퓨터 공학 분야 \n3 \n진로활동 \n24 \n인공지능에 대한 관심이 많은 학생으로 로봇 제작 및 프로그래밍 활동에서 라인 추적 로봇을 제작함. 바닥 판, 바퀴, 모터를 장착하여 로봇의 기본 구조를 만들고, 적외선 센 서를 로봇의 앞쪽에 2개 장착시킨 후 아두이노 프로그래밍을 통해 왼쪽에 있는 적외선 센서의 값이 오른쪽에 있는 적외선 센서의 값보다 크면 왼쪽 바퀴 모터값을 130, 오른 쪽 바퀴 모터값을 0으로 설정하여 오른쪽으로 회전할 수 있도록 코딩하고, 왼쪽으로의 회전은 반대로, 나머지 상황에서는 직진하도록 두 모터의 값을 130으로 설정함. 테스 트를 통해 흰색 바닥에서 검은색 선을 로봇이 잘 따라가는 것을 확인함. 로봇 제작 과 정에서 하드웨어와 소프트웨어 기술에 대한 이해도를 높이고, 관련 분야에 대한 흥미 와 열정을 더욱 키우게 되었음. \n인공지능 특강에 참여하여 인공지능의 역사, Chat GPT의 활용, 인공지능의 다양한 응용 분야에 대한 강연에 참여함. '세상의 모든 직업' 프로그램을 통해 인공지능 전문가 와의 채팅 인터뷰를 진행하며 전문가의 비전과 인공지능 관련 직업의 장점을 질문하 고, 해당 직업을 위해 필요한 노력과 준비 사항 등을 조사함. 이 과정에서 인공지능 기 초, 알고리즘, 데이터 구조의 중요성을 깨닫고 수학과 통계의 필요성을 인식함. 또한 기계학습, 딥러닝, 자연어 처리 강좌를 통해 지식을 심화해야 함을 알게 됨. 인터뷰를 통해 미래에 대한 긍정적인 전망과 동기부여를 받으며, 인공지능 관련 학과에 진학하 기로 목표를 세움. 이후 GitHub와 같은 커뮤니티를 통해 Python 언어를 학습하고, 인공지능 분야의 최신 동향과 논문을 검색해 읽고 있으며, 실제 생활 문제를 해결하는 경험을 쌓으며 문제 해결 능력을 키움. \n봉사활동실적 \n학년 \n일자 또는 기간 \n2022.05.06. \n2022.07.14. \n장소 또는 주관기관명 \n(학교)목포덕인고등학교 \n(학교)목포덕인고등학교 \n활동내용 \n시간 누계시간 \n환경정화 봉사활동 \n환경정화 봉사활동 \n2 \n2 \n2 \n4 \n2022 굿액션 청소년 자원봉사 캠 \n1 \n2022.07.18. \n(학교)굿네이버스 호남본부 \n2 \n6 \n페인 활동 참여 \n2022.10.07. \n(학교)목포덕인고등학교 \n환경정화 봉사활동 \n2 \n8 \n2022.12.09. \n2023. 03.31. \n(학교)목포덕인고등학교 \n(학교)적십자사 \n환경정화 봉사활동 \n헌혈실적연계 \n2 \n10 \n4 \n2023.04.06. - 2023.06.15. (학교)목포덕인고등학교 \n2 \n2023년 1학기 자기주도학습(멘 토-멘티) 학습도우미 활동 \n10 \n14 \n2023.04.19. \n(학교)굿네이버스 \n2023년 굿네이버스 청소년 자원 봉사 캠페인 활동 \n2 \n16 \n목포덕인고등학교 \n2025년 11월 20일 7/28 반 \n1 \n번호 22 |이름 \n주남영 \ngov.kr \n정부24 \n문서확인번호: 1763-6194-8644-5012 (신청인 : 주남영) \n봉사활동실적 \n학년 \n일자 또는 기간 \n장소 또는 주관기관명 \n활동내용 \n시간 누계시간 \n2023.05.04. \n2023.07.06. \n(학교)목포덕인고등학교 \n(학교)목포덕인고등학교 \n환경정화 봉사활동 \n환경정화 봉사활동 \n18 \n2 \n20 \n학교폭력 예방 활동, 금연 캠페 \n2023.08.17. - 2023. 12. 29. (학교)목포덕인고등학교 \n10 \n30 \n2 \n인, 장애인식 개선 활동 \n2023.09.18. \n(학교)적십자사 \n헌혈실적 연계 \n34 \n2023.10.06. \n(학교)목포덕인고등학교 \n환경정화 봉사활동 \n2 \n36 \n2023.12.08. \n(학교)목포덕인고등학교 \n환경정화봉사활동 \n2 \n38 \n2024.03.13. \n(학교)대한적십자사혈액관리 본부 \n[적십자사] 헌혈 (전혈) \n4 \n2024.03.21. \n(학교)목포덕인고등학교 \n2024.04.05. - 2024.04.12. (학교)굿네이버스 \n2024.05.02. \n(학교)목포덕인고등학교 \n자살예방(생명존중) 캠페인 활동 \n2024년 굿네이버스 청소년 생명 존중교육 및 자살예방 캠페인 \n환경정화 봉사활동 \n1 5 \n2 \n7 \n2 \n9 \n2024.05.31. \n(학교)목포덕인고등학교 \n흡연예방 캠페인 활동 \n1 \n10 \n3 \n2024.07.05. \n(학교)목포덕인고등학교 \n환경정화 봉사활동 \n2 \n12 \n2024.07.18. \n(학교)목포덕인고등학교 \n학생주도 프로젝트형 봉사활동( 중학교로 찾아가는 진로 멘토-멘 티 활동) \n2 \n14 \n2024.07.24. - 2024.08.02. (학교)목포덕인고등학교 \n다양한 사고 예방을 위한 생활 속 \n안전행동 캠페인 \n18 \n2024.10.04. \n(학교)목포덕인고등학교 \n환경정화 봉사활동 \n2 \n20 \n6. 교과학습발달상황 \n[1학년] \n학기 \n교과 \n국어 \n수학 \n국어 \n수학 \n1 \n영어 \n영어 \n한국사 \n한국사 \n원점수/과목평균 \n성취도 \n과목 \n단위수 \n석차등급 \n비고 \n(표준편차) \n(수강자수) \n3 \n76/65.9(17.6) \nB(160) \n4 \n63/51,1(15.9) \nB(160) \n4 \n3 \n80/58.7(17.8) \nA(160) \n3 \n3 \n79/63, 2(18.3) \nA(160) \n4 \n목포덕인고등학교 \n2025년 11월 20일 \n8/28 반 \n1 \n번호 \n22 이름 \n주남영 \ngov.kr \n정부24 \n문서확인번호: 1763-6194-8644-5012 (신청인 : 주남영) \n학기 \n교과 \n과목 \n단위수 \n원점수/과목평균 (표준편차) \n성취도 \n석차등급 \n비고 \n(수강자수) \n사회 역사/도덕 \n통합사회 \n3 \n72/58.1(15.0) \nA(160) \n3 \n포함) \n과학 \n통합과학 \n3 \n85/63.4(16.4) \nA(160) \n3 \n과학 \n과학탐구실험 \n1 \n79/77.7(11.2) \nB(160) \n기술.가정/제2 외국어/한문/교 양 \n정보 \n2 \n85/75.8(11.1) \nA(160) \n4 \n1 \n기술.가정/제2 외국어/한문/교 양 \n환경 \n2 \nP \nP \n기술.가정/제2 외국어/한문/교 양 \n진로와 직업 \n1 \nP \nP \n기술.가정/제2 외국어/한문/교 양 \n종교와 삶II \n1 \nP \nP \n국어 \n국어 \n3 \n81/63.9(21,0) \nA(160) \n4 \n수학 \n수학 \n3 \n77/52.9(17.7) \nA(160) \n2 \n영어 \n영어 \n3 \n81/58.6(19,3) \nA(160) \n3 \n한국사 \n한국사 \n3 \n80/63.1(18.8) \nB(160) \n4 \n사회(역사/도덕 \n통합사회 \n3 \n69/57.8(18.6) \nA(160) \n4 \n포함) \n과학 \n통합과학 \n3 \n86/60.7(19,3) \nA(160) \n3 \n과학 \n과학탐구실험 \n1 \n87/78.5(8.4) \nA(160) \n2 \n기술.가정/제2 외국어/한문/교 양 \n정보 \n2 \n90/72.1(14.4) \nA(160) \n3 \n기술.가정/제2 외국어/한문/교 양 \n진로와 직업 \n1 \nP \nP \n기술.가정/제2 \n외국어/한문/교 실용 경제 양 \n2 \nP \nP \n목포덕인고등학교 \n2025년 11월 20일 \n9/28 반 \n1 \n번호 22 이름 \n주남영 \ngov.kr \n정부24 \n문서확인번호: 1763-6194-8644-5012 (신청인 : 주남영) \n과목 \n단위수 \n원점수/과목평균 \n(표준편차) \n성취도 \n석차등급 \n비고 \n(수강자수) \n학기 \n교과 \n기술.가정/제2 \n2 \n외국어/한문/교 종교와 삶II 양 \n1 \n이수단위 합계 \n과목 \n50 \n세부능력 및 특기사항 \nP \nP \n국어: ‘세상에 지배하는 빅데이터를 아십니까?'를 통해 디지털 정보와 가상 공간, 프로그래밍에 대하여 흥미를 가지고 '미래 를 바꾼 아홉 가지 알고리즘'을 찾아 읽고 프로그래밍은 알고리즘을 통해 컴퓨터 과학을 생각해 보아야 한다라는 사실을 알게 되었으며 미래사회에 생존하기 위해서는 첨단 산업 구조의 변화를 넓은 시야로 파악하려는 '근시안적 경각심'을 버려야 한다 고 주장함. '정의란 무엇인가'를 읽고 정의에 관한 여러 학자들의 견해를 검토하는 과정에서 도덕철학, 정의론, 공리주의 등의 다른 이념들이 도덕적으로 상충하는 지점이 있음을 설명함. 정의의 속성은 상대적이며 당시의 사회상 및 윤리관에 교차하며 정당성을 취득한다고 주장하며, 이성으로부터 정의롭다고 여겨질 수 있는 보편적 진리 명제는 오직 확실한 손실만을 부여하 는, 이른바 생사여탈의 문제에만 반응한다고 밝힘. 나아가 정의에 관한 학자들의 논의는 주관에 의해 언도되므로 사변적 기 능이자 추앙의 대상으로 여겨지면 안 되고, 단지 참고와 경험적 판단의 자료로만 활용되어야 하며 사회적 존재인 한 개인들은 \n자신의 도덕적 입지점을 확인하며 스스로의 정의관을 정립하고 지속적으로 점검해야 함을 강조함. \n수학: 비유클리드 기하학의 역사적 정초에 관심이 생겨 '길 위의 수학자'를 읽고 유클리드 기하학에 도전하는 수학자들의 연 역 및 귀류적인 접근에 관심을 가지고 각종 자료와 문헌을 참고하여 자세한 내용을 고찰하기 위한 능동적인 모습을 보임. 정 보 탐색의 과정에서 수학의 발산적 사고와 확장 가능성에 관한 것으로, 수학이 진실로 갖는 본질은 기계적인 풀이와 해를 구 하는 것이 아닌, 풀이에 내재되어 있는 원리를 이해하는 것임을 깨달음. 나아가 수학이 궁극적으로 추구하는 바는 폭넓은 사 고를 바탕으로 기존의 공리들을 더욱 점철하고 개편하는 과정을 거쳐 미지의 영역을 탐구하는 지성인 것을 알게 되고 이러한 이해를 중심으로 발표를 진행함. 수업 시간에 배운 명제와 논리 부분을 진로와 연계하여 컴퓨터의 연산에 이용하는 논리회로 를 주제로 ppt를 제작하여 발표함. 논리회로는 상이한 입력값을 논리적인 분류를 통해 정보의 참,거짓을 판단하는 회로로, 이를 통해 우리는 무한한 입력값을 가질 수 있는 장치를 개발할 수 있음을 밝히며 이를 활용한 사례로는 인터넷 금융의 비밀 번호 위치 무작위 배치를 소개함. 실생활 문제에 내재 되어 있는 수학적 원리를 끌어내기 위해 노력하는 분석력이 뛰어난 학 생임. \n영어: 첨예하게 입장이 갈리는 쟁점에서 자기 생각을 드러내는 영어 에세이를 작성함. '기술이 인류의 의사소통을 발전시켰 는가?'라는 주제의 논제를 헤아리는 과정에서, 발전과 편리함의 상관관계에 대해 의구심을 품게 됨. 기술적 발전이 인류의 의 사소통을 신속하고 용이한 방향으로 인도한 것은 명백하나, 그러한 편리함이 진정한 의사소통의 발전을 의미함은 섣부른 판 단이라는 생각을 피력하며 글을 작성함. 영작을 위해 모르는 영어단어를 탐색하는 과정에서 같은 의미지만 서로 다르게 쓰이 는 영어단어 들을 발견하고, 이러한 발견을 통해 글의 어조와 분위기에 따라 쓰이는 단어들이 상이함을 알게 됨. 이런 점에서 영어 또한 한국어와 비슷하게 글의 종류와 성향에 따라 다른 형식으로 글을 써야 함을 알 수 있었고, 깨달은 바를 바탕으로 글에 알맞은 영어단어들을 올바르게 선택하여 영작의 완성도를 높이기 위해 노력함. 아울러 진로 영어단어 활동의 일환으로 진행한 영어 마인드맵 그리기 활동에서도 깨달은 바를 실천하며 자신의 진로 분야에 적합한 영어단어를 정보 탐색을 통해 적 절하게 선택하여 마인드맵을 그리는 모습을 보이며 본인의 지식을 적재적소에 사용할 수 있는 역량과 진로 연계성이 돋보이 는 학생임. \n한국사: 우리나라의 역사 중 '전쟁과 나라의 성립'과 관련된 주제에 대해 관심이 많아 역사 글쓰기 시간에 후삼국시대 나라의 건국, 세 나라의 전쟁, 발해의 건국, 신라와 후백제의 멸망을 주제로 역사신문을 만들어 학우들에게 발표함. 후백제를 세운 \n목포덕인고등학교 \n2025년 11월 20일 10/28 반 \n1 \n번호 22 이름 \n주남영 \ngov.kr \n이 \n정부24 \n과목 \n문서확인번호: 1763-6194-8644-5012 (신청인 : 주남영) \n세부능력 및 특기사항 \n견훤은 신라 서남 해안 군인 출신임을, 궁예는 신라의 왕족 출신임을 학우들에게 소개하여 관심을 받음. 발해의 건국과 영토 확장의 과정, 왕의 업적을 친구들에게 소개함. 왕건의 생애와 후고구려의 삼국통일 과정을 학우들에게 소개하며 큰 호응을 얻어냄. 주제발표 시간에 임진왜란을 주제로 거꾸로 수업을 진행함. 임진왜란의 배경을 조사하고 한산도 대첩의 학익진 전법 을 알기 쉬운 시각 자료를 활용하여 설명함. 도요토미 히데요시가 일본을 통합했을 때의 생각과 그 당시 일본군과 조선군의 격차를 조사하고, 도요토미 히데요시의 무모한 야욕이 동아시아 3국의 백성들에게 큰 화를 가져왔다고 주장하는 모습에서 통 합적인 사고력을 확인할 수 있었음. 수업 시간에 의문이 드는 내용을 질문하는 것이 인상적이며, 부족한 부분을 스스로 학습 하는 자기 주도적인 모습을 보임. \n통합사회: 세계인권선언을 주제로 역사적 배경, 주요 조항, 다른 인권 문서와 비교한 자료를 정리하여 표현함. 전 인류를 향 한 우호적 평화와 평화를 누릴 수 있는 시민의 권리를 보장하는 선언임에도 불구하고 보편타당의 계약이 사회적 합의에 다다 른 시기는 고작 100년도 되지 않았음에 초점을 두고 강조함. 특히 사회 유지는 사회정의와 직결되는 영역이 아니며 사회를 구성하는 절대다수의 사회적 약자를 착취로부터 보호하는 질서의 필요성과 세계라는 이름의 사회에 속한 국가와 국가 간의 정의를 수호하는 상호적 협의가 글로벌 사회의 정돈과 질서를 목적으로 개개인을 보호하는 실질적 평화를 실현하고 사회를 평온한 상태로 인도하는 작은 실천이 진정한 세계 평화로 들어설 수 있다는 내용이 참신함. 일련의 과정은 PPT를 제작하여 전달함으로써 학생들의 호응을 얻음. 친구가 질문해도 언제나 친절하게 답해주고 성실히 수업에 참여하는 학생임. \n통합과학: 자유주제탐구 활동에서 인공지능의 작동 원리를 심층적으로 탐구하고, 이를 세분화된 틀로 분류하여 인공지능의 실질적인 운용 방식을 분석함. 인공지능을 정보의 학습과 사용을 스스로 결정하는 자기향상적 시스템으로 파악하고, 이 원리 가 머신러닝임을 이해함. 지도 학습과 비지도 학습의 차이와 강화 학습의 원리를 명확하게 이해하는 과정에서 인공 지능이 기 계적 입출력 체계와 다름을 앎. 인공지능은 사람의 뇌와 유사한 알고리즘으로 정보를 인식하고 사용하며, 점진적 발달과 피 드백을 스스로 생성하는 무궁한 가능성을 지닌 체계라고 자신의 생각을 밝힘. \n'발명 아이디어 제안하기'에서 대중교통 승차하 알리미를 제안함. 대중교통을 이용하는 사람들이 잠이 들거나 휴대폰을 보다 가 하차 지점을 놓치는 경우가 많다는 점을 들어 GPS 기술을 활용하여 하차할 정류장을 미리 입력하면 도착 직전에 신호를 보내 알려주는 어플을 제안함. 뛰어난 관찰력으로 일상 생활의 불편한 점을 찾고, 배우고 익힌 지식을 올바르게 활용하여 문 제 해결 방안을 제시할 수 있는 과학적 역량을 지닌 학생임. \n과학탐구실험: 적정 기술에 대해 학습한 후 시력이 낮아 안경이 필요한 사람 중 그 비용이 부담되어 안경을 사용하지 못하는 사람들을 위한 적정 기술에 대한 호기심이 생겨 조사함. 모둠원들과 역할을 나눠 자료를 조사한 후 장치를 소개하는 포스터를 제작하여 발표함. 이후 다른 적정 기술들의 원리와 청력이 좋지 않고 보청기를 구입하기 힘든 사람들을 위한 적정 기술을 조 사하고, 구현해보고 싶다는 포부를 밝히며 발표를 마무리함. \n평소 노래를 부르기 좋아하여 노래를 부르러 갈 때마다 마이크로 작은 소리를 큰 소리로 만들어주는 원리에 대해 호기심이 생겨 '트랜지스터 증폭'이라는 주제로 탐구를 진행함. 트랜지스터는 규소 또는 저마늄으로 만들어진 반도체를 이용하여 전자 신호 및 전력을 증폭하는 장치임을 소개하고 두 개의 다이오드가 서로 맞물려있어 작은 전류가 높은 전류로 증폭됨을 설명함. \n그 결과 입력 시 약한 변동 신호를 사용하면 증폭된 신호를 얻을 수 있게 되어 큰 소리를 낼 수 있는 것이라 설명함. 학우들 이 어려워하여 흥미를 잃을 수도 있는 상황에서 한눈에 볼 수 있는 시각적인 자료와 쉬운 설명을 사용하여 학우들의 이해를 돕는 모습이 인상적인 학생임. \n정보: 4차산업혁명으로 정보화를 이룩한 정보사회를 거시적인 틀에서 조망하여 인간 생활의 변화를 기술적 측면에서 분석하 고, 이를 진로와 연계하여 발표 자료를 제작해 발표함. 4차산업혁명의 핵심 요소인 빅데이터와 인공지능이 생활에 미친 영향 은 단순한 발전을 넘어 산업 전반을 완전히 뒤바꾸고 있으며 다가오는 미래에 적응하기 위해서는 앞으로의 기술 동향을 살피 어 주목받을 직업군과 사라질 직업군을 선별해야 함을 강조함. 이런 점에서 정보화시대 이후 새로운 직업 중 로봇 공학자를 소개함. 인공지능이 탑재된 사물 인터넷과 서비스 로봇들을 사례로 들어 앞으로의 로봇은 기계적 작업이 아닌 스스로 인식하 \n목포덕인고등학교 \n2025년 11월 20일 11/28 반 \n1 \n번호 22 |이름 주남영 \n이 \ngov.kr \n정부24 \n과목 \n문서확인번호: 1763-6194-8644-5012 (신청인 : 주남영) \n세부능력 및 특기사항 \n고 판단할 수 있는 능력을 갖출 것이라 전망함. 미래의 로봇 공학자는 로봇의 설계 작업에서 다양한 측면을 고려해야 하며, 그러한 범위는 더욱 확장될 것임을 밝히며 발표를 마침. 제공하는 프로그래밍 도구를 활용하여 직접 프로그램을 작성하는 활 동을 진행함. 블록 코딩을 이용한 기본적인 소스에 각종 코드를 조합하여 음성, 효과, 모션 등을 첨가하여 간단한 내기 프로 그램을 작성함. 이러한 활동을 통해 프로그램이란 코딩을 통해 단순한 코드들이 모여 복잡한 구성을 이루는 일련의 체계임을 이해함. \n환경: 환경 문제의 심각성을 깨닫고 미래세대를 위해 지속가능한 발전이 필요함을 이해하며 시대에 따른 환경관의 변화를 이 해함. 생태계를 육상, 습지, 수생 생태계로 구분할 수 있으며 각각의 특징을 설명함. 생태계를 구성하는 물, 대기, 토양, 생물 요소의 특성을 학습하고 인간생존의 관점에서 생태계 구성요소와의 상호작용을 정리함. 환경체험을 통해 학교 내외의 자연 환경을 이해하며 인공환경과의 조화를 배움. 국내 물 환경오염 사례를 환경적, 사회적, 경제적 관점에서 분석하여 의미를 파 악함. 음식과 관련된 환경 주제 및 쟁점을 살펴보고 잔반 안남기기 캠페인에 참여하며 음식물쓰레기를 줄이는 방안을 제시 함. 국가적, 지구적 차원에서 발생하는 환경문제를 학습하고 환경문제를 해결하기 위한 방안을 탐색하며 AI를 통해 환경 관 리를 할 수 있는지 호기심을 가지고 프로젝트 학습을 수행함. 빅데이터를 기반으로 기후변화를 예측하고 알고리즘을 개발해 대응하는 방안을 소개하고 실제 인공지능을 활용하여 대기질을 분석하는 플랫폼을 예시로 발표함. 환경과 인공지능의 긍정적 인 상호관련성을 정리하며 협업을 통한 인공분야의 발전으로 환경위기에 대처하는 방안을 제시함. \n진로와 직업: 활발한 자기진단을 통하여 컴퓨터 공학으로 진로를 정함. 인공지능 스피커 제작하는 방법에 대해 궁금증을 가 짐. 스피커의 기본 원리는 음성신호를 주파수 스펙트럼으로 변환하고 들어온 음성을 음소 단위로 분류해 인식하고 단어 사이 의 관계를 확률적으로 계산해 사람이 이해할 수 있는 문장을 만들어 내는 것임을 알게됨. 하지만 음성인식 시스템의 정확도는 약 70% 안팎이어서 실생활에 사용하기에는 부족한 점이 있었다는 것을 알고, 딥러닝이라는 기술을 기반으로 획기적으로 발 전하게 됐다는 사실을 인지함. 딥러닝의 핵심은 분류를 통한 예측, 수많은 데이터에서 패턴을 발견하여 선별하고 빅데이터 분석을 통해 학습한다는 점을 알게됨. 이 활동을 통해 딥러닝에 관심을 가지게 되고 딥러닝과 머신러닝의 차이를 조사함. '알 파고'가 딥러닝을 사용한다는 점과 수학시간에 배운 경우의 수와 관련이 있어 흥미를 느끼고 탐구함. 바둑은 판이 19x19 로 되어 있어 알파고가 계산해야 하는 경우의 수는 기본적으로 361!임을 알게됐고, 딥러닝 기술을 사용 할 경우 효과적으로 경 우의 수를 계산 할 수 있음을 알게됨. 도서 '인공 지능과 딥러닝'를 읽고 딥러닝의 원리에 대해 더 깊은 조사함. \n실용 경제: 가상화폐의 거래 자동 매매 프로그램이 정식 출시되었다는 소식을 접하고 가상화폐에 대한 투자 전망을 유추함. 인공지능 자동 매매 시스템은 기존보다 단순화되어 있고 가상화폐에 대한 투자 지식이 없더라도 인공지능이 자동으로 최적의 \n타이밍에 매수-매매하는 시스템으로 개발되었음을 소개함. 자동 매매프로그램을 통해 일반 투자자가 쉽게 퀀트 트레이를 접하고 기존보다 안정적이고 계획적인 재테크 생활이 가능해질 것으로 예측함. 미래 가상화폐에 대한 투자를 더욱 확대할 수 있는 프로그램으로 더욱 안정적인 투자가 가능해질 것이라고 기대함. 이후 장래 직업의 유망성을 탐구하며 새롭게 생길 직업 과 사라질 직업의 예시를 찾아봄. 미래학자 토마스 프레이의 말에 따르면 2030년까지 20억 개의 일자리가 사라질 것이라고 했고 매표원 및 운전기사, 심판은 자동화 시스템으로 인해 사라질 것이고 자동차 산업의 성장으로 대체 추진 시스템, 자율주 행 자동차, 차량공유와 같은 기술 분야의 일자리 및 스마트 공장의 관리자가 늘어날 것이라고 예측함. 여러 직업군의 변화에 맞춰 취업계획을 세울 필요성을 제기함. \n종교와 삶 II: 4차 산업혁명의 산물이자 방대한 알고리즘의 총체인 인공지능의 출현이 종교 신앙에 일으킬 인문학적 파급에 관하여 고찰한 후, 터득한 바를 바탕으로 발표 자료를 제작하고 발표함. 이러한 고민을 실체화하기 위해 2000년간 축적된 가 톨릭 종교의 역사적 자취를 토대로 프로그래밍한 인공지능 \"산토\"를 채택하여 인공지능과 종교의 실태를 규명해봄. \"산토\"의 도움을 받은 가톨릭 신자들의 의견을 종합하여 살펴보면, 실제 인공지능이 기독교의 교리를 파악하거나 신앙적으로 올바른 길로 인도하는 데에 도움을 줄 수 있다고 말하지만, 그러한 지적 능력이 종교 사제를 대신할 수는 없다고 말함. 해당 부분에 주목하여 인공지능이 종교에 접근하는 방식은 여타의 분야들처럼 알고리즘으로 이루어진 기계적 매뉴얼에 의거하는 것이며, \n목포덕인고등학교 \n2025년 11월 20일 12/28 반 \n1 \n번호 22 이름 주남영 \n(KOR), \ngov.kr \n정부24 \n문서확인번호: 1763-6194-8644-5012 (신청인 : 주남영) \n과목 \n세부능력 및 특기사항 \n종교의 초월성과 본질에는 관심을 두고 있지 않다는 결론을 도출함. 이런 점에서 인공지능이 진실로 종교 일반에 실천력을 갖 기 위해서는, 여타의 물리학적 시각에서 벗어나 종교의 독립적인 위치를 인식할 수 있도록 하는 새로운 인지 능력이 개발되어 야 함을 밝히며 발표를 마침. \n평소 인공지능에 대해 흥미를 보이던 학생임. 자율주행 자동차는 사람들이 판단하기에 더 옳다고 생각하는 것에 따라야 윤리 적 문제를 해결할 수 있다고 생각해 빅데이터를 통한 판단에 따라 결정해야 한다고 주장하며 자율주행 자동차의 윤리적 판단 기준에 대해 설문조사를 실시함. 탑승자는 설문조사를 받는 사람을 탑승자로 설정하고 보행자와 탑승자의 수, 나이를 결정해 설문조사 결과를 비교하여 통계를 냄. 사람들은 수가 많을수록 더 보호하며, 탑승자가 보행자의 수보다 더 적거나 같은 경우 탑승자가 사망해야 하며, 어린이, 성인, 노인 순으로 보호하려는 경향을 나타낸다는 결론을 도출함. \n무선 이어폰을 사용하면서 소음 제거 기능의 원리에 대해 궁금증을 가지고 탐구함. 소음 제거 기능은 상쇄간섭의 원리를 이 용한다는 것을 조사하며 파동의 성질에 대해 이해함. 소음을 분석하는 과정에서 인공지능 기술이 활용될 수 있다는 사실을 알 고 생각보다 많은 분야에서 인공지능 기술이 활용되고 있음을 깨달음. \n<진로 선택 과목> \n성취도 \n성취도별 \n학기 \n교과 \n과목 \n단위수원점수/과목평균 \n비고 \n(수강자수) \n분포비율 \n이수단위 합계 \n과목 \n해당 사항 없음 \n<체육·예술> \n세부능력 및 특기사항 \n학기 \n교과 \n과목 \n단위수 \n성취도 \n비고 \n체육 \n1 \n예술 \n체육 \n음악 \n2 \nA \n2 \nA \n예술 \n미술 \n1 \nA \n체육 \n체육 \n2 \nA \n2 \n예술 \n음악 \n1 \nA \n예술 \n미술 \n2 \nA \n이수단위 합계 \n10 \n과목 \n세부능력 및 특기사항 \n체육: 축구 경기 중 주장을 맡아 급우들을 잘 조율하며 리더십과 조율하는 능력을 보임. \n적극적인 공격 차단과 정확한 태클로 팀의 핵심 수비수로서 해야 할 역할을 전문적으로 책임감있게 잘 수행함. \n농구 경기 중 포인트 가드의 역할을 맡고 드리블이 매우 뛰어나며 아이솔레이션션을 적극적으로 활용하는 모습이 돋보이며 급우들과 전술을 만들고 스크린을 활용하는 등 창의성이 돋보임. \n목포덕인고등학교 \n2025년 11월 20일 13/28 반 \n1 \n번호 22 이름 주남영 \n(KOR), \ngov.kr \n정부24 \n문서확인번호: 1763-6194-8644-5012 (신청인 : 주남영) \n과목 \n세부능력 및 특기사항 \n심폐소생술을 배우는 과정에서 4분의 골든타임 중요성을 잘 깨닫고 있으며 먼저 시범을 보이고 적절한 빠르기와 힘을 주는 등 급우들 앞에서 시범 보이기를 좋아함. \n음악: 좋아하는 음악에 대한 주관이 뚜렷한 학생으로 음악 장르 탐구 발표에서 “HIPHOP\"을 선정하여 조사하여 PPT 발표 함. 힙합의 개념 정의, 분류, 역사, 분류에 따른 대표 레퍼와 작품을 소개하며 급우들의 관심을 이끔. 특히 래퍼로 B. I. G, Sc ott, 한국 래퍼 DOK2의 추구하는 음악, 그들만의 뛰어난 음악성, 작품 등을 자세히 설명하며 공연 영상과 함께 발표함. \n감상 활동 '영화 속 음악'으로 영화 인터스텔라 ost 'first step' 를 조사, PPT 발표함. 사랑하는 가족과 인류를 구하기 위해 우주의 시공간 넘어 생존을 위한 대안을 찾는다는 영화의 줄거리와 광대한 오케스트레이션으로 우주의 광활함을 표현하고 큰 규모의 음악을 담은 작곡가 Hans Zimmer의 음악이 영화의 몰입도를 극대화했다는 설명과 함께 ost가 나오는 장면 영상들 을 보여주며 소개함. 또한 우주라는 광활한 공간 속에 혼자 남겨진 이의 외로운 사투가 인상적이였고 양자역학, 중력, 특수상 대성이론 등 과학적 이론에 흥미를 끌었다는 개인적 소감도 함께 발표함. 이후 개인 주제 발표로 ost가 영화의 긴장감을 더해 주고 장면의 몰입도를 높이는 역할을 한다는 것, ost가 없는 영화를 본다면? 이라는 설정으로 ost의 역할과 ost의 구분 설명 으로 ost 탐구 발표함. \n미술: 미술부장을 맡아 미리 찾아와 수업 준비물을 챙기고 교실을 정리하는 등 교사가 원할한 미술 수업을 할 수 있는데 기여 함. 긍정적이고 바른 성격으로 친구들이 준비물을 챙겨오지 않으면 본인의 것을 나누어 주고 모둠활동에서 서로 미루는 역할 을 맡는 등 배려심이 돋보이는 학생임. 입체주의 탐구활동을 통해 피카소의 작품세계를 분석하여 활동지를 작성함. 친구와 사과를 여러 시점에서 바라보고 하나의 화면에 조합하여 그려보며 입체주의 스타일을 표현해 봄. 입체주의가 미술, 사회, 역 사 분야에 영향을 준 것에 대한 보고서를 작성하여 제출함. 세계대전 당시 적군을 속이기 위해 군함을 위장 도색한것도 입체 주의의 영향을 받은 것이 가장 인상 깊었다고 발표함. 업사이클링 활동 일상생활에서 발생하는 쓰레기 캔, 양초, 옷걸이를 재 료로 샹들리에를 제작함. 쓰레기들의 가지고 있는 본질의 아름다움과 실용성을 전달하기 위해 샹들리에를 제작했다고 발표 함. 작품 제작을 하며 각각은 일반 쓰레기이지만 재활용하여 작품을 만들면 예술이 될 수 있다는 것을 느끼고 예술에 대한 인 식의 변화가 생겼다고 발표하는 모습이 인상적임. \n[2학년] \n학기 \n교과 \n과목 \n단위수 \n원점수/과목평균 (표준편차) \n성취도 \n석차등급 \n비고 \n(수강자수) \n국어 \n수학 \n문학 \n4 \n80/60.8(22.8) \nA(161) \n4 \n수학 I \n4 \n73/50, 3(18.1) \nA(161) \n3 \n수학 \n확률과 통계 \n2 \n78/55.0(20.5) \nA(121) \n3 \n영어 \n영어 I \n4 \n84/55.1(18.4) \nA(161) \n2 \n1 \n과학 \n화학 I \n4 \n91/60.0(22.0) \nA(45) \n2 \n과학 \n지구과학I \n4 \n85/63.2(21.1) \nA(45) \n3 \n기술.가정/제2 외국어/한문/교 양 \n보건 \n1 \nP \nP \n목포덕인고등학교 \n2025년 11월 20일 14/28 반 \n1 \n번호 22 이름 \n주남영 \ngov.kr \n(KOR \n정부24 \n문서확인번호: 1763-6194-8644-5012 (신청인 : 주남영) \n원점수/과목평균 \n성취도 \n학기 \n교과 \n과목 \n단위수 \n석차등급 \n비고 \n(표준편차) \n(수강자수) \n기술.가정/제2 외국어/한문/교 \n양 \n중국어 I \n2 \n87/67.0(19.7) \nA(75) \n3 \n1 \n기술.가정/제2 외국어/한문/교 양 \n종교학 \n1 \nP \nP \n국어 \n독서 \n87/62.9(20.9) \nA(157) \n2 \n수학 \n수학 II \n4 \n81/49.9(23.1) \nA (157) \n2 \n수학 \n확률과 통계 \n2 \n82/52,2(23.5) \nA(118) \n3 \n영어 \n영어II \n4 \n79/55.7(19.1) \nA(157) \n3 \n과학 \n물리학 I \n4 \n92/58.8(23.9) \nA(45) \n3 \n과학 \n생명과학 I \n4 \n89/59.2(19.3) \nA(45) \n2 \n2 \n기술.가정/제2 외국어/한문/교 양 \n보건 \n1 \nP \nP \n기술.가정/제2 외국어/한문/교 양 \n중국어 I \n2 \n82/60.6(20.6) \nA(73) \n3 \n기술.가정/제2 \n외국어/한문/교 종교학 양 \n1 \nP \nP \n이수단위 합계 \n과목 \n52 \n세부능력 및 특기사항 \n독서: 호기심을 갖고 탐구하는 역량이 우수한 학생으로 주제통합 읽기에서 '수상한 인공지능'을 읽고 독서일지 2회와 독서대 화나누기를 함. 인공지능의 이익과 해로움에 대해 문제를 제기하고 인공지능이 사람을 대체할 수 없을 것이라는 의견을 서술 함. 이후 '인공지능이 인간을 지배하거나 대체할 수 없다'는 주제로 논설문을 씀. 인간의 창조성, 감정, 사회성, 융합적 사고 력을 근거로 인공지능이 인간을 지배할 수는 없으며, 인간은 인공지능을 창조, 노동 활동을 위한 보조재로 활용하여 사회를 발전시켜 나가야 함을 주장함. 이후 인공지능에 대한 학생들의 관점에 궁금증을 갖고 탐구활동을 전개함. 2학년 학생 241명 을 대상으로 인공지능윤리, 수행평가를 위한 챗봇사용경험, 인간 존엄성 침해 등과 관련하여 설문지를 작성, 배포, 정리한 내 용을 바탕으로 보고서를 씀. 학생들 설문 결과를 그래프로 제시하고 해석했으며, 인공지능의 창조는 물리적 단자와 알고리즘 의 연산에 불과하고 인간의 창조는 고뇌와 심오함의 표현이라고 정의하고, 인간은 본연의 확고한 위치를 차지할 것이라고 서 술함. 연계적으로 주제를 탐구하고 연구자료를 읽고, 실제적 설문결과를 바탕으로 보고서를 작성한 점, 글이 논리적이며 체 계적이었음. \n문학: 작가, 사회문화적 배경, 문학사적 등 다양한 맥락을 활용하여 작품을 깊이 있게 이해하고 감상할 수 있는 학생으로 수 \n목포덕인고등학교 \n2025년 11월 20일 15/28 반 \n1 \n번호 22 이름 주남영 \ngov.kr \n정부24 \n과목 \n문서확인번호: 1763-6194-8644-5012 (신청인 : 주남영) \n세부능력 및 특기사항 \n업에 적극적인 모습을 보였으며, 모둠원과 협동적으로 수행 과제를 행하여 모범을 보임. '봄'(이성부)를 학습한 후 문학 작품 이 쓰인 시대적 상황과 시인의 삶을 조사하여 이를 중심으로 작품이 시사하는 바를 스스로 재구성하여 탐구 보고서를 작성하 고 발표함. 작품의 사회적 배경인 강압적 정권 하에서 기본적 권리가 결여된 사회, 민주화를 외친 사람들의 삶을 조사하고, 작품의 제목이 암시하는 의미를 민주주의를 이루고자하는 의지로 해석함. 그리고 '지쳐 나자빠져 있던' 표현의 은유적 의미, \n봄을 '너'로 의인화 하여 맞이하는 기쁨이 의미하는 바를 주체적으로 해석하는 모습을 보임. PPT발표에서 작품의 내용에 대 한 분석 뿐만 아니라 유사한 주제를 다룬 작품의 사례를 제시한 후, 작품을 감상할 때는 작품의 내적, 외적 상황, 작가 등을 종합적으로 고려하여 감상하는 것이 작가의 내포된 의도를 제대로 파악할 수 있음을 언급하여 반 학생들의 큰 호응을 받음. 한권읽기 활동으로 '숏컷'(박하령)을 읽고 독서일지, 토론, 독후감쓰기 활동을 우수하게 수행하는 등 모든 활동을 성실하게 참여한 학생임. \n수학I: 로그와 수열 등의 수학적 원리들의 공통점과 차이점을 직관적으로 파악할 수 있으며, 이를 자신만의 문제 해결의 단 서로 유도하는 모습을 보이는 창의적인 역량이 돋보이는 학생임. 수학 교과서에서 삼각함수를 보고 이전에 배웠던 삼각비의 기하학적 개념을 좌표계로 옮겨 함수로 변환한 함수라는 점에서 큰 흥미를 갖게 됨. 이를 계기로 '수학 주제 발표' 활동에서 인공지능 스피커와 삼각함수 간의 연관성을 주제로 수학적 원리가 변환과 가공을 거쳐 활용되는 양상에 대하여 발표함. 자료 조사 과정에서 파동은 삼각함수로 분할할 수 있음을 알게 되어, 인공지능 스피커는 인식한 음성을 삼각함수로 분해하여 목소 리를 구분할 것이라고 예상함. 조사 결과 진폭과 진동수의 상동은 같은 음파의 충분조건이 아님을 알 수 있었고 변환 알고리 즘을 사용하여 음성을 삼각함수로 변환하여 인식한다는 사실을 확인함. 해당 활동을 계기로 법칙이라고 불리우는 모든 관계 들은 임의의 변화 현상을 규정하고자 하는 시도라는 생각을 하게 됨. 또한 정의역과 치역을 가지는 모든 수학적 법칙들은 함 수 좌표계에서 함수로 표현할 수 있음을 알게 되었고, 지수함수와 로그함수의 개형이 갖는 기하적 대칭 관계를 더욱 본질적으 로 이해함. \n수학II: 자유주제 발표활동에서 '인공지능 분야에서 미분의 활용'을 주제로 발표함. 얼굴 인식, 물체 스캔, 자율주행 자동차 등의 예시를 제시하며 인공지능을 구성하는 필수적인 요소로 자가 학습 능력을 말하며 이러한 특성은 많은 데이터 입력값이 설정된 특정 값과 동일률을 추적하는 방식으로 구현되며 많은 피드백과 처리 과정의 연산시간을 단축하는 방법으로 활용됨을 설명함. 이 반복 작업은 많은 시간이 소요되므로 인공지능은 알고리즘을 활용하여 빠르게 답을 찾아내고 미분이 알고리즘을 형성하는 핵심적인 역할을 수행한다는 점을 강조함. 경사하강법은 근삿값을 찾는 최적화 알고리즘으로 극값을 구하기 어려운 비선형적 함수의 임의값에서 미분을 활용하여 보정된 극값의 근사치를 얻어내는 방법임을 설명하고 함수를 미분하는 것보다 효율적인 이유를 강조하며 발표를 마침. \n형성평가를 통해 미분계수의 의미를 정확히 파악하고 정의를 통해 값을 구해낼 수 있으며 주어진 점에서의 미분계수는 그 점 에서의 접선의 기울기인 이유를 정확하게 파악하고 있음을 확인함. 도함수를 활용해 함수의 증가와 감소, 극대와 극소를 판 정하는데 능하며 왜 그런가에 대한 설명을 그래프의 개형을 그려 설명하는 모습이 인상적임. \n확률과 통계: 인공지능의 의사결정 정확도를 높이기 위한 방안과 조건부확률의 연관성을 인지함. 깊은 탐구를 위해 '인공지 능을 더 정확하게 만들어주는 조건부확률'을 주제로 수학탐구활동을 진행함. 먼저 과거 인공지능 의사 결정 시스템의 한계( 규칙을 모든 상황에 적용하는데의 어려움)를 조사함. 이를 조건부 확률을 활용한 인공지능 의사 결정 시스템과 비교분석을 통해 의문을 해결하고자 함. 가장 큰 차이점은 새로운 데이터에 대응하는데 상대적으로 뛰어난 유연성을 보인다는 점을 제시 하며, 이를 조건부확률로 해석하고자 함. 학습했던 조건부확률을 토대로 베이지안 확률을 이해함. 사후, 사전 확률에 대한 개 념을 정확히 정리하며, 해당 식을 파악함. 규칙 기반 의사결정에 반해 베이지안 확률을 통해 데이터를 기반으로 어떤 사건이 일어났을 때, 다른 사건이 일어날 확률을 추측하는데 정확도가 높음을 설명함. 이후 도서 '파이썬을 활용한 베이지안 통계'를 탐독하며, 파이썬과 베이지안 확률을 활용한 날씨 예측 시스템 제작을 계획함. 날씨를 좋다, 안좋다로 구분하고 습도, 구름 의 양을 입력하여 그에 따라 확률값을 추출하여, 날씨를 예측하는 프로그램을 제작하는 모습에서 수학과 ai를 접목하는 역량 을 엿볼 수 있었음. \n목포덕인고등학교 \n2025년 11월 20일 16/28 반 \n1 \n번호 22 이름 \n주남영 \ngov.kr \n이 \n정부24 \n과목 \n문서확인번호: 1763-6194-8644-5012 (신청인 : 주남영) \n세부능력 및 특기사항 \n영어 I: 최근 관심을 갖고 있던 대화형 인공지능 서비스를 주제로 글로벌 이슈 말하기 활동에 참여함. 인공지능의 가능성과 한계가 인간에 미치는 영향에 대한 내용을 영어로 작성함. 대화형 인공지능 서비스가 작문, 검색, 학습 등의 분야에서 인간에 게 도움을 주고 있으나, 무분별한 사용으로 성취에 따른 사회 경제적 자본 배분 구조를 위협하고 있다는 점을 지적함. 또한 다양한 분야에서 상용화되고 있는 인공지능 기술이 효율성만 기초에 둔 채 남용된다면 인간의 가치 부정이나 존재 의의 위협 에 이를 수 있음을 지적함. 인공지능의 가능성은 인위적으로 규정할 필요가 있는 제한된 자유에 초점을 맞추어야 하며, 이는 사회적 자유주의의 이념과 유사한 방향성을 갖고 있다는 점을 들어 인공지능의 유용성을 검증받기 위해서는 뛰어난 성능뿐만 아니라 올바른 윤리관 또한 지향해야 함을 강하게 역설하는 내용이었음. 해당 내용에 관해 영문 대본과 PPT를 작성하고 급 우들을 대상으로 발표했음. 주장하는 글을 영어로 작성할때 자신의 주장을 드러내는 영단어를 선택하고 자연스럽게 메시지를 \n전달하는 발표를 하려 노력했음. \n영어II: 영어 에세이 쓰기 활동에서 '상대성 이론과 시간의 동일성'을 주제로 영문 에세이를 작성함. 주제에 어긋난 영단어와 영문 표현을 사용하지 않기 위해 검색을 통해 정제된 학술 단어와 표현들을 스크랩해두었다고 함. 각 단어가 모여 새로운 뉘 앙스를 획득하는 모습을 보며 한층 영어에 흥미를 느꼈으며, 이후 영어 학습 중에도 단어와 연어 중심의 검색을 통해 능동적 인 탐색을 했다고 함. 또한 에세이에 표현된 논리적 전개가 자연스럽게 연결되도록 개요를 작성하고, 각 소문단의 주제와 각 문장의 논리적 타당성을 검증하기도 했음. 언제나 진지하게 수업에 참여하고 스스로 사고하는 모습이 두드러진 학생이었음. 도서 인공지능과 딥러닝(마쓰오 유타카)를 읽고, 이 내용을 토대로 인공지능에 관해 습득한 내용을 키워드로 재구성하여 영 단어 마인드맵을 완성함. 인공지능의 특징과 당면한 과제 등을 한눈에 알아볼 수 있도록 시각화한 작품이었음. 영어 지문을 읽고 깔끔하게 독해하지 못한 문장을 구조적으로 분석하고 추론하는 연습을 꾸준히 했으며, 도서 메이즈 러너를 선택하여 모 르는 표현들을 검색하며 읽었다고 함. \n물리학I: 파동 학습 과정에서 파동의 사례로 등장하는 음파에 호기심을 가짐. 특히 초음파의 광범위한 활용에 주목해 '자율 주행자동차의 초음파의 활용'을 주제로 자유 주제 탐구를 진행함. 우선, 도서 '센서와 작동기(Nathan Ida)'를 탐독하여 초음 파의 정의와 특징, 능동형과 수동형으로 구분되는 초음파센서의 종류, 초음파센서의 활용 및 장점 등을 학습함. 이후 아두이 노 키트, DC 모터, 초음파센서, 모형 자동차 등을 활용하여 초음파센서로 거리를 감지해 장애물을 자동으로 피해 주행하는 자동차 제작에 도전함. DC 모터를 자동차 모형에 장착한 후 노트북에 연결해 앞뒤로 움직일 수 있도록 하는 동시에 트랜지스 터로 전류를 증폭함. 또, 초음파센서로 20cm 이내의 물체가 감지되면 DC 모터의 작동이 멈추도록 코딩함. 더 나아가 과거 적외선 센서를 활용해 제작한 RC 자동차의 물체 감지 민감도 측정치를 비교 분석한 결과 그 오차가 크게 줄어들었다는 사실 을 밝힘. 다만 적외선 센서는 초음파센서에 비해 속도가 빠르다는 장점이 있으므로 적외선 센서와 초음파센서를 병합한 형태 로 활용한다면 더 효율적일 것이라 결론지음. 이처럼 교과 학습 내용을 자신의 관심 분야에 적용해 프로그래밍하는 등 진로 분야로의 전문성이 인상적임. \n화학I: 여러 가지 원자 모형을 학습하면서 전자의 위치를 확률로 표현하는 오비탈에 흥미를 보이며, 어떠한 방법으로 전자 의 위치를 알아내고 표현하는지 심화 탐구함. '생명의 화학, 삶의 화학(김희준)'를 통해 오비탈이 전자구름을 수학적으로 나 타낸 함수임을 알고, 전자의 에너지와 각운동량에 따라 4가지 유형(s, p, d, f)으로 나뉜다는 것을 이해함. 또한 결합을 형성하 기 위해 원자 오비탈끼리 재결합되어 혼성호비탈을 형성하며 원자 오비탈의 특성이 결합오비탈에 반영된다는 것을 앎. 학습 중 느낀 호기심을 해결하기 위해 자신만의 방법으로 정보를 찾고 이해하려는 자세가 인상적임. 오비탈에 대한 심화 탐구 중' 인공지능을 사용하여 전자의 위치를 계산한다면 더 효율적이지 않을까'라는 생각을 하게 되었으며, '인공지능을 활용한 전자 위치 확률 계산'이라는 제목으로 자유주제탐구 결과를 정리함. 슈뢰딩거 방정식이 전자의 파동함수를 결정하며, 이 파동함수 로부터 전자의 위치와 운동량에 대한 정보를 얻을 수 있고 파동함수의 제곱이 전자가 발견될 확률을 의미한다는 것을 1s 오비 탈의 파동함수 구하는 과정을 통해 설명함. 인공지능을 활용하였을 때 계산 속도, 정확도, 다양한 시각화라는 장점이 있음을 서술함. \n목포덕인고등학교 \n2025년 11월 20일 17/28 반 \n1 \n번호 22 이름 \n주남영 \ngov.kr \n정부24 \n과목 \n문서확인번호: 1763-6194-8644-5012 (신청인 : 주남영) \n세부능력 및 특기사항 \n생명과학I: 생명과학이 다른 학문 분야와 연계된 사례 조사하기 탐구활동으로 '인공지능의 활용'에 관한 주제로 개인 발표를 준비함. 인공지능은 유전체 분석, 약물 분석, 분자구조 예측 및 설계, 신경 과학 연구, 생물정보학 분야 등 생명과학 전반에 걸쳐 다양한 방식으로 활용되어 복잡한 문제를 해결하는 데 중요한 도구로 작용하고 있음을 조사함. 또한 각각의 분야에서 인 공지능은 복잡한 문제를 해결하고, 새로운 지식을 생성하는 데 중요한 역할을 하고 있으며, 복잡하고 큰 규모의 데이터 세트 안에서 숨겨진 패턴과 관계를 찾아내어 생명현상에 대해 더 깊게 이해하는 데 도움을 주고 있다고 강조함. \n이후, 딥러닝과 생명과학 분야가 어떻게 융합되어 활용되는지 궁금하여 '생명과학을 위한 딥러닝'을 읽음. 전형적인 머신러닝 의 기초부터 CNN, RNN을 간단하게 알려주고 머신러닝을 하는 법을 알려주어 흥미로웠다는 소감문을 작성함. 딥러닝을 통 한 유전체학, 의료 영상 분석, 단백질 구조예측, 약물 발견에 활용되는 사례를 통해 광범위하게 적용된다는 사실과 딥러닝의 획기적인 힘을 알게 되었다고 설명함. 딥러닝의 적용 범위, 생명과학과 데이터 과학의 결합, 약물 발견이 가장 인상 깊었던 내용이라고 밝힘. \n지구과학I: 기후 변화를 학습하는 과정에서 관심 분야인 인공지능과 연관 지어 기후 변화에 대응해 보고자 '인공지능으로 지구 현상 이해하기'라는 주제로 심화 주제 탐구를 진행함. 지구 현상 중 기후 변화, 자연재해, 환경 변화를 선정하여 탐구함. 인공지능으로 과거의 기후 데이터를 분석 및 패턴 식별에 이용할 수 있고, 이러한 분석이 미래 기후 변화가 어떻게 발생하는 지, 영향을 완화하기 위한 조치 방법 등에 도움이 될 수 있다는 점을 소개함. 조사를 진행하며 기후 변화가 매우 심각한 문제 이며, 인간의 활동이 기후 변화에 큰 영향을 미치고 있다는 점을 깨달았다는 소감을 밝히며 발표를 마무리함. 기후 변화와 인 공지능을 관련지어 탐구 활동을 진행한 모습을 통해 융합적인 사고 역량을 지닌 학생임을 엿볼 수 있었음. \n별의 물리량을 학습한 후 이를 적용하고자 오리온자리의 알파성인 베텔게우스를 선정하여 소개하기 위해 포스터를 제작함. 교과에서 학습한 내용을 활용하여 베텔게우스는 적색 초거성의 단계에 머물러 있으며, 밝기가 변화하는 맥동 변광성임을 설 명함. 더 나아가, 맥동이 내부와 외부의 압력 차이가 불안정하기 때문임을 직접 제작한 그림과 함께 발표 자료로 제작함. \n보건: 평소 인터넷 활용도가 높은 학생으로 디지털 성폭력에 대한 관심이 많아 관련 영상을 시청하고 조사함. 디지털 성폭력 은 피해자에게 심리적인 스트레스와 불안감을 유발할 수 있으며 피해자를 사회적으로 고립시킬 수 있다는 점을 알고 심각성 을 느낌. 이를 예방하는 방법으로 처벌 정도의 강화와 성폭력 예방 교육 강화를 제시함. 학우들에게 디지털 성폭력은 무고한 피해자를 만들고 절대로 발생해서는 안 되는 범죄임을 강조함. 평소 인공지능에 관심이 있어 보건 분야에서 활용된 인공지능 을 조사하여 발표 활동을 진행함. 환자의 의료 기록을 분석해 질병의 위험을 예측하고 치료 계획을 수립하는 인공지능과 암 환자를 대상으로 종양의 유전자 패턴을 분석하고 종양의 반응 정도를 예측하는 인공지능을 소개함. 정확한 진단과 예측을 할 수 있고, 데이터 관리가 효율적이라는 장점 (복잡한 문제 해결, 사람의 실수 감소, 반복적인 작업 제거, 빠르고 정확함)을 강 조함. 이 활동을 통해 보건 분야에서의 인공지능 활용은 미래에 더 많은 혁신을 가져올 것으로 예측하고 이 분야에 관심을 가 지고 지속해서 심화탐구 하겠다는 모습에서 AI 전문 역량을 보임. \n중국어 I: 묵묵히 주어진 시간을 충실히 채워가는 학생으로 중국어 발음을 듣고 성모, 운모, 성조를 대부분 변별 할 수 있으 며 일상생활에 필요한 감정 및 의사에 관한 표현을 듣고 낱말의 의미를 파악 할 수 있음. 개인 및 일상생활에 관한 질문을 듣 고 문장 수준으로 간단하게 대답하거나 표현할 수 있음. 수업 시간에 배운 내용(인사하기, 이름, 시간, 날짜, 요일, 생일, 취 미, 장래 희망 등)을 주제로 실시한 인터뷰를 통해 원어민 교사의 질문에 비교적 자연스럽고 적절하게 문장 형식으로 대답함. \n매 시간 학습 목표에 해당하는 문장을 한어병음과 한자로 비교적 정확하게 주제별로 정리하여 내용의 확장성이 뛰어남. 활동 지에 정리한 내용이 알차고, 한어병음을 어순에 맞게 정자체로 쓰려고 하여 전체적으로 가독성이 높음. 중국의 음식 문화에 도 관심을 가지고 중국의 4대 요리를 대표하는 산동(山東), 강소(江蘇), 광동(廣東), 사천(四川)의 각 지역별 특징과 대표 요리에 대해 이해하고 정리함. '한자 이름 디자인' 활동에서 자신의 이름을 선이 가는 신명조에 감각 있게 그림을 더하여 디자 인하였고, '南煐'을 '남쪽(대한민국)을 빛내주는 사람'으로 정의함. \n목포덕인고등학교 \n2025년 11월 20일 18/28 반 \n1 \n번호 22 이름 주남영 \ngov.kr \n정부24 \n문서확인번호: 1763-6194-8644-5012 (신청인 : 주남영) \n과목 \n세 부 능력 및 특기사항 \n종교학: '인공지능을 믿는 교회가 5년 만에 폐지되었다'라는 기사를 접하고 이에 흥미를 느껴 '인공지능이 종교에 미친 영향' 이라는 주제로 보고서 작성 및 발표를 진행함. 인공지능이 종교에 미친 긍정적인 영향으로 온라인 기도 사이트 '프레가'를 제 시함. 성인의 이름을 딴 AI 챗봇에 죄를 고백하고 신앙적인 조언을 구하며 이용자가 마음의 평안을 얻는 사례와 또, 유대인 랍비 조슈아 프랭클린이 챗 GPT를 활용하여 설교문을 썼음에도 신도들에게 박수받은 사례를 소개하며 종교인의 수고를 도 울 수 있다고 설명함. 그러나 도움의 영역이 아닌 종교가 인공지능에 의존하게 된다면 종교는 사라질 수 있다고 주장함. 상황 을 해석하고 분석하는 능력이 뛰어난 학생임. 축구 스타 호날두가 대리모를 통해 자녀를 출산했다는 기사를 접하고, 대리모 에 관한 관심으로 수업 중 찬반 토론을 진행함. 찬성 측 토론자로서 자연 임신이 불가능한 사람들에게 대안 및 희망이 될 수 있으며, 대리모 역시 경제적 수입을 통해 생계가 보장되는 상호보완적 행위라고 주장함. 또한 대리모 금지가 보장되지 않은 다양한 피해를 발생시킬 수 있기에 안전한 법의 테두리 안에서 시행된다면 유익할 것 같다는 생각을 자신 있게 피력함. \n평소 인공지능에 흥미를 가지고 있었고, 컴퓨터공학과 또는 인공지능학과로 진로를 희망함. DMQA 세미나 Human Action Recognition를 시청하며 Human Action Recognition의 원리를 학습하고, 그것을 활용한 딴짓 감지 AI를 고안함. 이를 통해 학생의 공부 효율을 증진할 수 있고, 집중력을 높일 수 있는 솔루션을 제공해 줄 수 있을 것으로 기대함. Event Strea m을 사용하여 사용자의 손가락 움직임을 통해 공부를 하는지 딴짓을 하는지 판단할 수 있고, RGB를 사용하여 사용자가 보 고있는 화면이 무엇인지 확인할 수 있음을 설명함. 기대효과로 책상에 앉아있는 시간이 아닌 진짜 공부한 시간을 측정할 수 있으므로 경쟁 시스템을 만들어 공부하는 욕구를 증진 시킬 수 있음을 제시함. 이러한 탐구 활동을 통해 인공지능 기술의 원 리와 중요성을 이해하고, 심도있는 후속 탐구 계획을 수립하며 인공지능 분야에 대한 열의를 드러냄. 인공지능 기술의 종류 를 조사하고 이해하며 그것을 활용하는 능력이 인상적임. 평소 일상생활에서 불편함을 느낀 경험을 바탕으로 사회문제를 해 결하려는 모습이 돋보이며, 그것을 인공지능 기술을 활용하여 더욱 효율적으로 해결하고자 하는 창의성이 인상적임. 인공지 능에 대한 전문성과 융합 능력이 돋보이는 학생임. \n<진로 선택 과목〉 \n성취도 \n성취도별 \n학기 \n교과 \n과목 \n단위수원점수/과목평균 \n비고 \n(수강자수) \n분포비율 \n수학 \n수학과제 탐구 \n2 \n96/92.2 \nA(6) \n1 \n예술 \n미술 창작 \n2 \n86/89.6 \nA (68) \nA(100.0) B(0.0) C(0.0) \nA(92.6) B(5.9) C(1.5) \n공동 \n수학 \n인공지능 수학 \n2 \n94/92.3 \n2 \n예술 \n미술 창작 \n2 \n92/89.4 \nA(8) \nA(69) \nA(100.0) B(0.0) C(0.0) \n공동 \nA(91.3) B(5.8) C(2.9) \n이수단위 합계 \n8 \n과목 \n세부능력 및 특기사항 \n수학과제 탐구: 정보화 시대에 따른 개인 정보 보호의 중요성이 대두됨에 따라 정보 보호의 기본인 암호를 이해하기 위해 진 행된 '암호학'의 탐구 활동에서 두각을 보임. 26개의 영문자를 기준으로 문자를 숫자로 치환하는 과정을 고민하고 교사에게 질문하며 정수론의 항등원과 역원, 모듈로 연산법, 키를 이용해 암호화, 복호화하는 과정을 학습한 후 덧셈암호, 아핀암호, 전치암호 등 암호화하는 방법을 정리하여 탐구일지를 작성함. 특히 애드가 앨런 포의 '황금충'에 등장한 암호문을 알파벳의 빈도수를 이용해 치환암호로 해결하는 과정을 학생들과 공유하는 모습이 인상적임. 더나아가 hill 암호에서 사용된 행렬에 관해 알아보고자 자료를 찾던 중 선형대수학이 컴퓨터 그래픽에 쓰인다는 점을 알고 자유 탐구주제로 선정함. 도서 'Linear Algebra'를 통해 벡터와 행렬의 개념을 이해한 후 회전, 랜더링 등 컴퓨터 그래픽에서 표현되는 운동의 방법과 행렬과 벡터 를 통해 운동하는 개체의 데이터 값을 구하고 구현하고 이를 정리하여 보고서를 작성함. 생소한 내용의 수학적 개념을 수치화 \n목포덕인고등학교 \n2025년 11월 20일 19/28 반 \n1 \n번호 22 이름 \n주남영 \ngov.kr \n정부24 \n문서확인번호: 1763-6194-8644-5012 (신청인 : 주남영) \n과목 \n세부능력 및 특기사항 \n한 데이터에 적용하는데 생긴 시행착오를 친구들과 공유하는 등 스스로가 설정한 탐구 목표에 도달하고자 심도있게 고민하는 \n열정적인 학생임. \n인공지능 수학: 여러 기사에서 클린봇이 악성 댓글을 차단하는 것을 보고 일반 댓글과 어떻게 구분하는지에 대한 궁금증을 가짐. 교과서를 통해 텍스트 자료에서 단어를 추출하여 벡터로 나타내고, 부정단어 빈도수를 세어 악성 댓글을 판단한다는 정보를 발췌함. 이를 바탕으로 '파이썬을 활용한 부정 리뷰 추출'을 목표로 프로그램 제작 계획을 세움. 먼저 특정 영화의 리 뷰 데이터를 수집하여 파이썬에 저장함. 어떤 단어가 많이 나오는지 빈도 분석을 위해 str 타입이 아닌 데이터는 모두 제거하 고 워드클라우드를 통해 시각화함. 분석결과 '영화, 진짜, 정말, 그냥, 너무'라는 단어가 많이 나옴을 파악함. 이후 정규화하 여 한국어만 남기고 konlpy를 활용해 형태소를 분석함. 불필요한 용어를 제거하고 문자를 인덱스 벡터로 전환한 후 데이터 를 numpy 파일로 저장함. 이후 데이터를 불러와 파라미터를 세팅하고, cnn 분류모델로 학습하게 한 후, 긍정/부정을 파악 하도록 세팅함. 이를 통해 긍정 리뷰 수는 74827개, 부정 리뷰 수는 75173개임을 얻어냄. 포털 사이트에서 활용되는 클린봇 에 숨겨진 수학의 의미를 정확히 파악하고, 자신의 관심분야로 확장하여 알고리즘을 제작하는 일련의 과정에서 인공지능 분 야의 뛰어난 관심과 역량을 엿볼 수 있었음. \n\" \n미술 창작: 독서를 공부하면서 '세잔과 입체파'라는 지문을 읽고 입체주의에 대한 흥미를 느껴 입체파에 대해 탐구함, 조별 프 로젝트 활동에서 입체주의 미술의 태동 배경을 소개하고, 사조 특징인 기하학적인 형태의 강조를 설명함. 또한 입체주의 작 품 예시로 '우는 여인', '아비뇽의 처녀', '테이블 위의 과일그릇과 빵', 그리고 조르주 브라크의 '바이올린과 주전자'를 소개함. 이러한 활동을 통해 미술과 조형예술 분야에서 얼마나 다양하고 창의적인 표현이 이루어지고 있는지에 대해 관심을 가짐. 이 후 학생들의 모습을 입체주의 형태로 그리는 등 후속 활동을 이어감. 이를 통해 얼굴의 다양한 각도와 형태를 탐험하며 그에 따라 공간 인식 능력을 향상함. 피카소의 작품 스타일을 모방하면서 전통적인 얼굴 표현에서 벗어나 형태와 구조를 새롭게 재 해석함. 로고 디자인 활동에서 학교의 명소를 반영하여 캐릭터로 표현하고, 옷에는 교목 그림을 그려 학교의 상징성을 드러 냄. 로고 프로젝트를 통해 브랜드 심볼리즘과 중요성을 이해하며 브랜딩 요소를 적절하게 활용하는 능력을 키움. \n<체육·예술> \n학기 \n교과 \n과목 \n단위수 \n성취도 \n비고 \n1 체육 \n운동과 건강 \n2 \n2 \n체육 \n운동과 건강 \n2 \nA \n이수단위 합계 \n4 \n과목 \n세 부 능력 및 특기사항 \n운동과 건강: 농구 경기를 즐기는 학생으로 영상을 시청하는 것을 좋아하고 농구 선수 '어빈 존슨'의 플레이 스타일을 참고하 여 포인트가드 역할임에도 불구하고 포스트업 기술을 쓰거나 노룩패스를 하는 등 변수를 창출해내는 능력을 보임. 드리블 능 력이 좋고 함께 즐기고자 패스를 많이 하는 모습이 인상적이며 급우들과의 갈등을 중재하는 등 리더십을 보임. \n축구 경기 중 뛰어난 수비력을 보이고 팀의 실점을 막는데 뛰어난 모습을 보임. 특히 빠른 반사 속도와 민첩성을 활용한 1대1 \n수비에 특출남. 넓은 시야를 활용해 뒤로 뛰어오는 상대방을 향한 패스를 차단하는데 능숙하며 축구 경기규칙을 잘 이해하고 페어플레이 정신이 돋보임. \n[3학년] \n목포덕인고등학교 \n2025년 11월 20일 20/28 반 \n1 \n번호 22 이름 주남영 \ngov.kr \n정부24 \n문서확인번호: 1763-6194-8644-5012 (신청인 : 주남영) \n원점수/과목평균 \n성취도 \n학기 \n교과 \n과목 \n단위수 \n석차등급 \n비고 \n(표준편차) \n(수강자수) \n국어 \n언어와 매체 \n4 \n78/66.4(19.0) \nB(41) \n4 \n1 \n수학 \n미적분 \n86/62.6(20.6) \nA(94) \n3 \n영어 \n영어 독해와 작문 \n이수단위 합계 \n4 \n12 \n81/60.7(15.3) \nA(155) \n3 \n과목 \n세부능력 및 특기사항 \n언어와 매체: 주어진 다양한 정보를 논리적인 기준에 따라 비판하고 분류, 재구성할 수 있는 학생으로 매체 비평 활동에서 ' 나무위키의 문제점'에 대해서 논리적으로 분석하는 비평문을 작성함. 유명한 인플루언서들이 자신의 정보가 기록된 '나무위 키'의 정보를 수정하는 영상을 보며 잘못된 정보를 얼마든지 수정하는 매체의 장점이 애초에 오류가 있는 정보의 기록을 허용 한다는 단점을 포함하고 있다는 모순을 예리하게 지적함. 또한 나무위키를 편집하는 사용자들은 자신의 주관과 특정 시각을 반영하여 편집할 수 있기 때문에 장점과 동시에 단점이 많다는 점을 주장함. 그러나 나무위키의 단점을 역이용하여 위키 정보 를 수용하면 비판적 사고력을 활용해야 하기에 오히려 장점이 될 수 있다는 독창적인 의견을 피력한 점이 돋보임. 매체 제작 프로젝트에서 '카드뉴스' 매체를 선정하고 '인공지능 최신 현황'을 주제로 간결한 정보전달 매체를 제작함. 미국, 중국, 한국 3개국의 AI 현황을 인포그래픽를 이용하여 시각적으로 표현하였고 각 국의 차이가 잘 드러나도록 정보를 명확하게 분류한 점이 돋보임. 카드 뉴스 중간 중간에 수용자와 매체의 특성을 고려한 섬세한 감각이 우수함. \n미적분: 매일 푸는 기출문제 프로젝트에서 문제에 필요한 수학적 개념을 파악하고 짝 친구와 함께 문제의 풀이를 토의하는 모습을 보임. 특히 정적분과 급수 사이의 관계에 관한 문제를 해결하는 데 어려움이 있었지만, 적분 구간을 여러 가지 방법으 로 바꿔서 접근하고 스스로 풀이에 오류가 없는지를 파악하며 정확하게 해결하고자 노력함. 여러 가지 함수의 미분법에 관한 내용을 학습하고 교과서를 탐독하던 중 경제학에서 수요와 공급에 관한 탄력성 등 다양한 분야에 미분이 쓰인다는 점에 궁금 증을 느껴 관련 내용을 찾아 '미분방정식의 활용'을 주제로 자유 탐구 발표를 진행함. 미분 방정식의 정의를 학습한 후 '미적 분으로 바라본 하루'를 발췌독하며 로지스틱 방정식과 뉴턴의 냉각법칙의 정의와 그 쓰임을 조사함. 로지스틱 방정식과 뉴턴 의 냉각법칙을 수식으로 표현한 후 관련된 내용을 증명하고 그래프로 표현한 내용을 정리하여 발표함. 특히 뉴턴의 냉각법칙 을 시체의 사망 시각을 추정하는 사례를 가져와 직접 미분방정식을 풀이하고 함께 계산하는 과정을 통해 설명하여 학우들이 자신의 발표에 집중할 수 있도록 유도한 점이 인상적임. \n영어 독해와 작문: 인공지능과 빅데이터 관련 책, 국제 뉴스 기사, 도서 등을 찾아 읽으며 관련된 배경지식을 넓힘. 빅데이터 에 대한 깊은 관심을 바탕으로 빅데이터의 증가는 사회의 복잡한 문제를 해결하는데 이롭고 이로 인한 기대효과는 긍정적일 것이라는 가설을 세움. 이를 증명하기 위해 직접 영어 설문지를 만들어 전체 학생들을 대상으로 설문조사를 실시함. 빅데이 터의 방대한 양이 사용자에게 혼란을 줄 수 있다는 학생의 의견을 얻고 빅데이터의 양면성에 대해 깨달음. '데이터의 증가가 사회적 이익을 초래하는가?'를 주제로 영어 에세이를 작성함. 데이터의 무분별한 증가는 데이터 훈련에 방해 요소가 될 수 있 음과 개인정보 보호, 보안 문제를 주장하며 글의 통일된 주제를 유지함. 강조 구문이나 도치법을 적절히 활용하고 문장의 구 조 설계 및 글의 맥락에 알맞은 어휘 선택 등 수준 높은 에세이를 작성함. 문제 해결 방법을 모색하던 중 수업 시간에 배운 내 용을 인용하여 많은 양의 데이터를 처리, 분석하기 위한 플랫폼을 제작하거나 사용자들은 돕는 소프트웨어 시스템 메커니즘 의 통합을 제언함. 반에서 가장 성실한 학생으로 하루에 단어 50개를 꾸준히 외움. 과제에 책임감을 가지고 최선을 다하는 모 습이 타의 모범이 됨. \n[로켓 제작 과정의 시스템 구축] \n영화 '마션'을 시청하던 중 우주정거장의 모듈을 분리하기 위해 설탕으로 폭탄을 만드는 장면을 보고, 'KNSB를 활용한 모델 로켓 제작 및 비행 알고리즘을 통한 비행 안전성 확보'를 주제로 발표에 참여함. 로켓의 안정적인 발사를 위한 비행 알고리즘 \n목포덕인고등학교 \n2025년 11월 20일 21/28 반 \n1 \n번호 22 |이름 \n주남영 \ngov.kr \n정부24 \n문서확인번호: 1763-6194-8644-5012 (신청인 : 주남영) \n과목 \n세부능력 및 특기사항 \n을 구현하기 위해 RP2040(MCU), MPU6050(자이로센서), NEO6M(GPS), nRF24L01(통신모듈) 등 여러 하드웨어 구성 요소를 통합하여 데이터를 수집하고 분석하며 MPU6050 (자이로센서)의 센서값에 따라 Fin을 제어하고 자이로스코프, 가 속도계, 압력 센서 등에서 수집된 데이터를 처리하여 로켓의 자세, 고도, 속도 등의 정보를 산출하는 알고리즘을 구성하여 A vionics를 구축함. 또한 파이썬 기반의 비행 제어 프로그램을 PyQt를 이용하여 GUI를 구현하고 이를 이용하여 비행 전과 정을 모니터링하기 위한 FCP(Flight Control Program)를 개발함. 비행의 안정성을 확보하고, 로켓 발사를 진행하였지 만, 발사 2초 후 제어불능으로 추락하게 됨. 비행 컨트롤 모듈의 코드에서 자세 제어를 하는 부분의 서보모터의 핀 제어 각이 기준치 이상이어서 실패했음을 분석하고, 알고리즘을 개선하여 더 안정적이고 효율적인 로켓 시스템을 구축할 수 있을 것으 로 기대함. \n<진로 선택 과목> \n성취도 \n성취도별 \n학기 \n교과 \n과목 \n단위수원점수/과목평균 \n비고 \n(수강자수) \n분포비율 \n수학 \n기하 \n4 \n92/81.1 \nA(79) \nA(51.9) B(39.2) C(8.9) \n사회(역사/도 \n사회문제 탐구 \n2 \n87/83.8 \nA(94) \nA(73.4) B(18.1) C(8.5) \n덕포함) \n과학 \n물리학 II \n4 \n94/85.1 \nA(48) \nA(72.9) B(12.5) C(14.6) \n1 \n과학 \n화학II \n4 \n96/78.2 \nA(46) \nA(52.2) B(23.9) C(23.9) \n과학 \n융합과학 \n2 \n100/87.9 \nA(46) \nA(80.4) B(4.3) C(15.2) \n과학 \n정보과학 \n3 \n100/97.3 \nA(6) \nA(100.0) B(0.0) C(0.0) 공동, 타기관 \n체육 \n스포츠 생활 \n2 \n97/89.8 \nA(155) \nA(96.8) B(3.2) C(0.0) \n국어 \n심화 국어 \n74/79.9 \nB(155) \nA(54.2) B(29.0) C(16.8) \n수학 \n기하 \n79/75.5 \nB(79) \nA(40. 5) B(40. 5) C(19.0) \n수학적 사고와 \n수학 \n79/73.8 \nB(94) \nA(31.9) B(42.6) C(25.5) \n적분 \n영어 \n심화 영어 독해 \nI \n90/73.6 \nA(155) \nA(29.7) B(58.1) C(12.3) \n2 \n사회(역사/도 덕포함) \n사회문제 탐구 \n2 \n77/77.5 \nB(94) \nA(48.9) B(31.9) C(19.1) \n과학 \n융합과학 \n2 \n100/87.9 \nA(46) \nA(80.4) B(4.3) C(15.2) \n물리학 주제 토 \n과학 \n95/79.0 \nA(48) \nA(62.5) B(4.2) C(33.3) \n론 \n과학 \n화학 주제 토론 \n4 \n95/78.1 \nA(46) \nA(52.2) B(23.9) C(23.9) \n체육 \n스포츠 생활 \n2 \n100/91.3 \nA(155) \nA(97.4) B(1.9) C(0.6) \n이수단위 합계 \n51 \n목포덕인고등학교 \n2025년 11월 20일 22/28 반 \n1 \n번호 22 이름 \n주남영 \ngov.kr \n정부24 \n과목 \n문서확인번호: 1763-6194-8644-5012 (신청인 : 주남영) \n세부능력 및 특기사항 \n심화 국어: 수업 과정에서 학우들과 협력하여 합리적으로 의사 결정하는 능력이 돋보이는 학생임. 토의 과정에서는 동료들과 의 협력을 통해 의견을 조율하며, 다양한 관점을 수용하면서도 합리적인 의사 결정을 위해 노력하는 태도를 보여줌. 다양한 자료를 조사하고 이를 근거로 한 설득력 있는 주장을 펼치며 토론을 이끌어가는 모습이 인상적이었음. 공동체 역량이 뛰어나 팀 활동에서 구성원 간의 조화를 이루며 생산적인 결과를 도출하는 데 기여함. 긍정적이고 적극적인 태도로 학습에 임하며, 협력과 책임감을 바탕으로 공동의 목표를 이루기 위해 꾸준히 노력하는 모습을 보임. \n기하: 컴퓨터와 게임에 대한 흥미를 바탕으로 벡터가 게임 화면 구현에 필수적임을 알고, 'Unity 게임 속 사용되는 기하학적 원리 탐구 및 2D 게임 제작'을 주제로 수학탐구활동을 진행함. 2D 게임 개발 과정에서 기하학적 원리를 이해하고, 벡터와 좌표계의 활용을 탐구의 주된 방향으로 설정함. 먼저 객체의 위치와 움직임을 나타내는데 벡터의 크기와 방향을 가지는 특징 이 중요한 역할을 담당함을 파악함. 이를 바탕으로 비디오 게임 개발을 위한 크로스 플랫폼 엔진을 통해 2D 게임을 제작함. 좌표계는 게임 내에서 객체의 위치를 (x, y)로 표현하고, 캐릭터가 좌측으로 이동할 때, x좌표가 감소하고, 우측으로 이동할 때는 증가하는 방식으로 좌표의 변경을 통해 캐릭터의 움직임을 조정함. 더불어 객체의 이동 및 속도는 속도벡터로 다른 객체 \n간의 충돌은 벡터의 뺄셈, 객체의 크기는 스칼라 곱을 활용하여 적용함. 이 과정에서 게임 개발에 쓰이는 벡터의 덧셈과 뺄 셈, 스칼라곱 등의 수학적 개념의 활용이 체감되었다고 함. 이 모든 과정을 코딩을 통해 구현하며 학우들 앞에서 시연함. 흥 미 분야를 바탕으로 수학적 개념을 적용하는 과정을 이해하여 실제 결과물을 만들어내는 모습에서 학생의 뛰어난 융합 역량 과 전문성이 관찰됨. \n수학적 사고와 적분: 컴퓨터 그래픽에 사용되는 수학적 개념 중 적분이 중요하게 쓰인다는 점을 알고 이를 정확하게 이해하 고자 탐구 활동을 진행함. 적분이 광선 추적 알고리즘의 핵심 원리로 작용하며 컴퓨터 그래픽의 이미지 색상, 밝기, 깊이 정 보 등 복잡한 현상을 모델링하는 데 사용됨을 파악하고 적분을 이용한 그래픽 기법의 장, 단점을 분석함. 적분이 컴퓨터 그래 픽에서 적용되는 구체적인 사례 분석을 통해 자연스러운 조명과 사실적인 그림자 생성, Gaussian 블러와 같은 필터링 기법 에서 적분이 노이즈 제거와 부드러운 이미지 처리를 가능하게 하여 그래픽의 시각적 품질을 높임을 실험을 파악한 내용을 토 대로 보고서를 작성함. 이를 소개하며 적분의 이론적 원리를 기반으로 컴퓨터 그래픽과 수학의 융합 가능성을 모색하였으며 실생활 문제를 수학에 어떻게 접목할 수 있을지 고민해 보는 계기가 되었다는 소감을 밝힘. \n심화 영어 독해 I: 자신의 학습 스타일을 정확하게 파악하고 이에 맞는 학습 전략을 수립하는 능력이 뛰어남. 특히 청각적 학 습 스타일임을 인지하여 오디오북과 팟캐스트를 활용한 영어 학습 방법을 적용하여 어휘력과 듣기 능력을 크게 향상시킴. 매 일 짧은 영어 에세이를 작성하는 습관을 들여 영어 작문 능력도 향상시키고자 노력함. 학습 동기를 지속적으로 유지하기 위해 영어 관련 목표를 설정하고 달성할때마다 보상을 주는 방식을 채택하여 꾸준한 학습 의지를 보임. '해외로의 지식 이전'에 관 한 영어 지문을 읽고 무역 규제 완화가 자본과 일자리 이동에 긍정적 영향을 미쳤으나 노동자 이동의 자유에는 한계가 있음을 설명하는 영어 보고서를 작성함. 기술 향상 곡선에서 위치가 높아질수록 규칙이 덜 엄격하게 적용된다는 점을 설명하며 '지 식 이전'이라는 기업 전략의 중요성을 강조함. 정교한 작업 흐름 기술이 업무를 여러 과제로 분할하고 이를 세계 여러 지역에 \n할당하여 최종 결과를 의미 있는 전체로 재구성하는 과정을 자세하게 설명하여 학우들의 이해를 높임. \n사회문제 탐구: 사회 탐구 설계의 주요 요소 및 절차를 설명하며 최근 이슈가 되고 있는 여성 징병제에 대해 흥미를 가지고 설득력 있고, 가독성 높은 프레젠테이션을 진행함. 여성 징병제는 인구 감소로 인한 병력 부족 문제에 대한 현실적인 대안이 라 주장함. 국가 안보를 공동으로 책임져야 한다는 국가 의무라는 점과 여경과 여성 고용할당제와 같이 여성의 사회적 지위 가 향상되었다는 사회적 평가를 근거로 여성 징병제를 시행해야 하며 남녀가 국가의 안보에 동등하게 기여할 수 있는 기회를 제공함으로써 성평등을 실현할 수 있다고 피력함. 사회적 논란이 되는 이슈로 발표 이후 학우들과 함께 모둠을 조직하여 조별 토론을 진행함. 아울러 또 다른 토론과 신문스크랩을 수행하여 <세포 역노화>에 대한 사회탐구 보고서를 작성함, 세포 노화는 알츠하이머병, 심혈관 질환, 당뇨병 등 여러 가지 질병의 주요 원인 중 하나이므로 세포 역노화 기술을 통해 노화 관련 질병 의 발병을 예방하거나 늦출 수 있다는 자료 조사를함. 손상된 조직이나 기관을 복구하고 재생하는 데 사용될 수 있어 장기 이 \n목포덕인고등학교 \n2025년 11월 20일 23/28 반 \n1 \n번호 22 이름 주남영 \ngov.kr \n(KOR \n정부24 \n문서확인번호: 1763-6194-8644-5012 (신청인 : 주남영) \n과목 \n세부능력 및 특기사항 \n식을 받아야 하는 환자를 살릴 수 있을 뿐만 아니라 경제적 이익을 얻을 수 있다고 주장의 자신의 의견을 논리적으로 제시하 는 모습이 매우 돋보임. \n물리학 II: 유쾌한 성격으로 화기애애한 학습 분위기 조성에 도움을 주는 동시에 과학적 이론을 실생활에 적용하는 노력이 인 상적인 학생임. 특히, 돌림힘을 학습하는 과정에서 거리와 힘의 곱으로 표현된 돌림힘 식이 일의 식과 같다는 사실에 의문을 품고, 벡터의 곱에 내적 곱과 외적 곱이 존재한다는 사실을 추가 학습함. 이를 통해 같은 수식임에도 불구하고 곱의 종류에 따라 각기 다른 결과가 도출된다는 사실을 명확히 이해함. 더 나아가 '고등학생을 위한 물리학 (김형근)'을 탐독하여 돌림힘 사례를 바탕으로 출입문 손잡이 위치, 수공구의 모양 등에 숨겨진 돌림힘의 원리를 학습함. 더 나아가 팔씨름 또한 돌림힘이 적용된 사례라는 점을 토대로 돌림힘의 크기를 증폭하는 방법을 주제로 탐구를 진행함. 팔의 길이와 힘의 세기, 팔의 방향과 힘의 방향이 이루는 각도를 돌림힘 크기에 영향을 주는 변수로 정한 후 변수의 크기에 따른 팔씨름 승률을 확인하는 실험을 진행함. 팔의 길이나 힘의 세기는 실험 대상자가 가진 종속 변수의 성향이 강하기 때문에 팔의 각도와 손목을 이용한 힘의 방 향을 통해 최대 돌림힘을 유도하는 방안을 도출함. 결과 발표에도 참여하여 팔씨름 필승 기술을 주제로 탐구 결과를 논리적으 로 전달함. \n화학II: 물의 여러 가지 독특한 성질들이 수소 결합 때문임을 알고, 수소 결합에 대해 알아보기 위해 도서 '주변의 모든 것을 화학식으로 써 봤다(야마구치 사토루)'를 읽고 독서 활동지를 제출함. 눌린 머리카락과 수소 결합의 연관성을 읽고, 머리카락 은 주로 케라틴 단백질로 구성되어 있는데, 이 단백질 분자들 사이에는 수소 결합이 형성되어 있고, 머리카락이 눌리면 케라 틴 분자들 사이의 수소 결합이 변형되고, 머리카락이 구부러지고 모양이 변형되는데, 물리적 원리가 아닌 화학적 원리가 적 용되는 점이 신기하다고 작성함. \n독서 활동 후 수소 결합의 원리와 예에 관심을 가지고 자유탐구활동을 하고 발표함. 수소 결합의 원리는 수소 원자가 전기음 성도가 높은 원자에 결합 되면 수소 원자는 부분적으로 양의 전하를 띠게 되고, 전기음성도가 높은 다른 원자와 전기적 인력 이 생기며 부분적인 음의 전하를 띠게 되는데 이를 수소 결합이라고 하고, 수소 결합의 예로는 DNA, 물, 카복실산 등이 있음 을 발표함. 수업을 듣는 자세가 좋고 열정적으로 참여하며 다른 친구들이 궁금해하는 것을 잘 도와주고 자신의 지식 확장을 위해 책을 읽고 영상을 본후 찾아와 질문을 많이 하는 등 다방면으로 노력하는 자기주도적인 학생임. \n융합과학: 사회적 이슈에 대한 깊은 관심과 분석적 사고를 통해 지속 가능한 해결책을 모색하는 주도적인 학생임. 현재의 인 공지능이 나오기까지 데이터를 수집하고 활용하는 방법이 어떻게 변화됐는지에 대한 발전사를 주제로 스토리보드로 작성함. 활용된 주요 과학적 개념과 기술을 함께 정리하여 단계를 거쳐 발전하게 된 핵심 발견과 발전 요소를 짚었으며 현재 딥러닝과 머신러닝 기술의 인공지능에서 중요한 빅데이터의 발전사를 체계적으로 정리함. 후속 탐구를 통해 데이터 크기와 데이터의 질을 단계별로 늘려가며 모델 성능 변화를 관찰하고 데이터양과 질이 모델 성능에 미치는 영향을 분석하였고 분석 결과 변화 하는 상관관계를 그래프로 나타내고 보고서로 정리함. 디지털 기술이 나아가는 방향성을 제시하는 데 앞의 탐구를 바탕으로 한 데이터 품질을 위한 데이터 전처리에 대한 의견을 제시함과 동시에 인공지능이 잘 활용되기 위해 모든 공정에서의 윤리성 이 보장되어야 하고 지속 가능한 기술 발전에 대한 가치 역시 지향하여야 함을 강조하며 발표를 마침. \n정보과학: 일상에서 접할 수 있는 다양한 센서와 IoT 기술에 관심을 갖고 이를 창의적, 효율적으로 구현해 보고자 정보과학 교육과정을 수강함. 팀 프로젝트 활동에서 생활 속 다양한 문제 상황을 피지컬 컴퓨팅으로 구현함. 소파에 앉거나 사람의 움 직임 감지로 켜지는 스마트 조명 (조도 및 PIR센서), 창문 쪽 조도값에 의해 작동되는 알람기능과 블라인드(서보모터), 시청 간격이 너무 가까우면 자동으로 꺼지는 스마트 TV(초음파 및 LCD) 등을 구현하였고, 온·습도 센서의 값에 따라 작동되는 에어컨을 묘사함. 이후, 온·습도 값의 LCD 출력 및 값의 범위에 따른 LED 색상 변화로 시각적인 효과를 추가함. 또한, 팀 원들과 협업하여 블루투스와 앱 제작을 통해 스마트폰 제어가 가능한 조명, 적외선 센서로 외출 시 외부인 침입을 감지하여 경고 메시지를 전송하는 보안 시스템 구현에 성공함. 이 과정에서 창의성과 리더십을 발휘해 팀원들 간의 협력을 촉진하고 문 제 상황에서도 냉정하게 대처하여 효과적인 해결책을 찾는 중추적인 역할을 담당함. 프로젝트 수행 시 문제를 발견하고 분석 \n목포덕인고등학교 \n2025년 11월 20일 24/28 반 \n1 \n번호 22 이름 주남영 \ngov.kr \n정부24 \n문서확인번호: 1763-6194-8644-5012 (신청인 : 주남영) \n과목 \n세부능력 및 특기사항 \n하여 해결책을 찾는 창의적인 아이디어로 알고리즘을 기획하고 설계하여 원하는 형태로 구현하거나, 이를 새로운 프로그램으 로 확장하는 능력이 탁월함. \n물리학 주제 토론: 휴머노이드 기술의 발전에 따른 인간과 기계의 경계에 대해 심도 있는 토론을 진행하며, 인간성을 규정하 는 핵심 요소를 논리적으로 탐구함. 인간의 정체성을 결정짓는 요소로 뇌와 의식을 강조하며, 뇌가 인간이라면 신체가 기계 로 대체되어도 여전히 인간으로 볼 수 있다는 견해를 제시함. 반면, 뇌가 기계로 대체될 경우 인간의 정체성이 상실되고 로봇 으로 간주된다는 논리를 설득력 있게 설명함. 인간의 의식, 자아 인식 능력, 감정 생성 및 경험 축적, 창의적 사고와 자율적 의사결정 능력을 기준으로 인간과 기계를 구분하는 다양한 근거를 제시함. 이러한 분석을 통해 휴머노이드 기술 발전이 가져 올 윤리적, 사회적 문제를 다각적으로 이해하며, 인간성과 기계성의 정의를 명확히 하는 데 기여함. 토론 과정에서 과학적 근 거와 창의적인 사고를 바탕으로 문제를 논리적으로 접근하며, 구성원 간의 의견을 조율하여 협력적인 분위기를 형성함. 다양 한 관점을 종합하고 이를 명확히 정리하여, 인간과 기계의 구분에 대한 심도 있는 이해를 보여줌. 결과 보고서에서도 주제의 핵심을 체계적으로 표현하며, 창의적이고 논리적인 사고력을 발휘함. \n화학 주제 토론: 산화와 환원 반응에 대한 이해를 바탕으로, 화학적으로 일어나는 전자 이동을 논리적으로 설명하는 모습을 자주 보임. 각 반응이 에너지 변화와 물질의 상태에 미치는 영향을 분석하며, 전자 이동을 통해 산화와 환원의 구체적인 예시 를 들어 설명함. 산화수 변화와 반응물, 생성물 간의 관계를 명확하게 이해하고 이를 실제 화학 반응에 적용하려는 깊은 사고 력을 발휘함. \n스포츠 생활: 매수업 시간과 복장을 준수하고 교사의 지도와 수업과제를 성실하게 참여하는 학생임. 자신이 목표하는 성취기 준에 도달하기 위한 의지가 높고 과제집착력과 몰입도가 상당함. 수업 과제가 주어졌을 때 주어진 할당량을 넘어 자신이 하고 자 하는 기회를 최대치로 활용하는 학생임. 스스로 많은 시도와 연습으로 성공적인 수행과 우수한 평가를 받고자 함. 지구력 과 근력이 뛰어난 학생으로 스포츠 경기에서 수비 역할과 같은 많은 활동량과 넓은 지역을 커버하는 역할에서 경기수행능력 이 돋보이는 학생임. 자신의 실수에는 끝까지 상대를 따라가 포기하지 않으려는 장면이 많이 관찰되고 동료의 실수에는 적극 적으로 커버하여 보완하려는 움직임이 자주 관찰됨. 자신감과 승리하고자 하는 열의가 높아 팀스포츠 경기 중에는 팀 전체에 게 긍정적이고 고무적인 분위기를 형성함. 주어진 과제에 대해 자기주도적으로 하고자 하는 의지가 높은 학생이므로 과제 수 행방법과 적절한 피드백을 제공해준다면 높은 수행능력과 우수한 결과를 나타낼거라 기대됨. \n<체육·예술> \n학기 \n교과 \n과목 \n단위수 \n성취도 \n비고 \n이수단위 합계 \n세부능력 및 특기사항 \n과목 \n해당 사항 없음 \n7. 독서활동상황 \n학년 과목 또는 영역 \n1 수학 \n독서 활동 상황 \n(1학기) 프로그래머, 수학으로 생각하라(유키 히로시) 통계학, 빅데이터를 잡다(조재근) \n목포덕인고등학교 \n2025년 11월 20일 25/28 반 \n1 \n번호 22 이름 \n주남영 \ngov.kr \n정부24 \n문서확인번호: 1763-6194-8644-5012 (신청인 : 주남영) \n학년 과목 또는 영역 \n1 \n수학 \n수학 I \n2 \n물리학 I \n생명과학 I \n미적분 \n기하 \n3 \n물리학 II \n화학II \n8. 행동특성 및 종합의견 \n독서 활동 상황 \n(2학기) 나는 수학으로 세상을 읽는다(롭 이스터웨이), \n길 위의 수학자(릴리언 R. 리버) \n(1학기) 수학, 컴퓨터, 그리고 미래(데이비드 왈러스), 수학으로 풀어보는 컴퓨터공학(이병수) \n(2학기) 반도체 제대로 이해하기 (강구창) \n센서와 작동기(Nathan Ida) \n(2학기) 생명과학을 위한 딥러닝 (바라스 람순다르, 피터 이스트먼) \n(1학기) 미적분으로 바라본 하루 (오스카 E. 페르난데스) \n(1학기) 유니티로 배우는 게임 수학(구부키 류이치) \n(1학기) 고등학생을 위한 일반 물리학(김형근) \n(1학기) 주변의 모든 것을 화학식으로 써 봤다(야마구치 사토루) \n학년 \n행동특성 및 종합의견 \n1학기 학급 진로 부장(2022.3.2.-2023.8.16.)으로서 친구들이 각자 진로에 관한 관심을 키워나가도록 관련 자료 와 인터넷 사이트를 소개하고 학과를 추천하는 등 맡은 일을 성실하게 수행함. 또한 본인의 진로를 탐색하는 과정에 서 TV의 지식 관련 프로그램을 시청하고 소감문과 활동지를 작성하며 적성을 찾기 위해 노력함. \n2학기 학급 정보부장(2022.8.17.-2023.2.24.)을 맡아 수업 시작 전에 친구들에게 학교 공용 노트북을 나누어 주 고 수업이 끝나면 노트북을 수거하여 충전이 가능한 수납함에 정리하여 다음 수업 시간에 차질 없이 사용할 수 있도 1 록 맡은 일을 성실히 수행함. \n2 \n3 \n컴퓨터 사용 능력이 뛰어나 친구들이 네트워크와 컴퓨터 사용 등 어려워하는 문제를 해결하는 데 도움을 주었으며 친구들의 갈증을 중재하는 등 탁월한 의사소통 능력과 통솔력을 보이며 학급의 질서를 지키는 데 큰 역할을 함. 항상 \n선생님과 친구들을 보면 인사를 하는 학생으로 예의가 바르고 교우관계가 좋은 학생이며, 다른 학생들에게 모범이 되는 모습을 보여줌. 전반적으로 수업 태도가 매우 좋고 필기를 열심히 하며 수업이 끝나면 친구들에게 필기한 내용 을 공유하는 등 배려심과 집중력을 비롯한 학업에 대한 강한 열의가 돋보이는 학생임. \n모범적인 생활 태도와 정의로운 성격을 지니고 있어 불의를 지나치지 못하는 학생임. 2학년 선도부원으로 선생님의 추천을 받아 영입될 정도로 신망이 컸으며, 이후 선도부원으로 성실히 활동하며 교문 앞에서 학생들의 복장 및 지각 지도를 보조하는 역할을 수행함. 규칙 준수에 대한 신념이 강하여 전교생들의 복장 지도 및 생활지도를 수행하였고, 학생 선도에 크게 기여함. 학교의 정보통신부장으로서 컴퓨터 및 IT 기기에 능해 학교의 고장이 난 컴퓨터를 고치 \n고, 학교 컴퓨터를 가지고 비교육적인 행동을 하지 못하도록 막기 위해 학교 컴퓨터의 공공 비밀번호를 관리함. 자신 의 특기를 좋은 곳에 활용하고자 학생들의 전자기기가 고장 났을 때 도움을 주기 위해 알고 있는 지식을 활용해 해결 책을 제시함. 1학기 부반장으로써 학생들이 모금한 돈을 관리하는 역할을 맡음. 친구들과 친하게 지내며 학급의 분 위기를 좋은 방향으로 만들어 가는 데 노력하였으며, 질서를 지키는 데 크게 기여함. 조별 수행평가를 할 때 역할을 적절히 분배해 갈등을 최소화하기 위한 모습을 보임, 친구들이 가장 꺼리는 역할인 발표를 맡으며, 의사소통 능력을 키움. 자신이 가지고 있는 능력을 친구들을 위해 쓰려는 모습이 인상적인 학생임. \n선생님들과 학생회장에게 큰 신임을 받아 학생회 정보통신부장을 맡아달라는 요청을 받을 정도로 책임감과 정보기 술을 갖춘 모범적인 학생임. 컴퓨터와 기계를 다루는 능력이 뛰어나 여러 학생과 선생님의 노트북을 수리하거나 교 \n목포덕인고등학교 \n2025년 11월 20일 26/28 반 \n1 \n번호 22 이름 주남영 \ngov.kr \n정부24 \n학년 \n문서확인번호: 1763-6194-8644-5012 (신청인 : 주남영) \n행동특성 및 종합의견 \n과 수업 중에 발생하는 컴퓨터 문제를 해결하며 신뢰를 얻음. 도움이 필요한 상황에서 기꺼이 나서며 친구들에게 믿 음직한 존재로 자리매김함. \n리더십 프로그램에 참여하여 효과적으로 의견을 표현하고 상대를 배려하며 사람들을 이끄는 방법을 익히며 리더십 을 한층 강화함. 쓰레기통 청소와 청소도구함 정리를 하루도 빠짐없이 수행하며, 자율학습실 쓰레기통도 자발적으로 \n비우는 등 공동체를 우선으로 생각하는 이타적인 모습을 보임. \n학교에서 화장실 휴지가 없어 곤란해하는 친구들을 위해 학급 방역물품 보관함에 휴지를 비치하여 친구들이 자유롭 게 사용할 수 있도록 배려심을 발휘함. 항상 성실하고 모범적인 태도로 학급이 하나가 될 수 있도록 솔선수범하며 긍 정적인 영향을 미침. \n목포덕인고등학교 \n2025년 11월 20일 27/28 반 \n1 \n번호 22 이름 \n주남영 \ngov.kr \n(KOR \n정부24 \n문서확인번호: 1763-6194-8644-5012 (신청인 : 주남영) \n발급번호: Q100000199-2025-001811 \n학교생활기록 부 \n성 \n명 \n주남영 \n인적 \n사항 \n주민등록번호 060422-******* \n담당부서 \n목포덕인고등학교 \n담당자 전화번호 \n채경운 \n061-240-6419 \n위 사람의 학교생활기록부 사본임을 증명합니다. \n2025년 11월 20일 \n목포덕인고등학교장 \nHND \nOTHE \n목포덕인고등학교 \n2025년 11월 20일 28/28 반 \n1 \n번호 22 이름 \n주남영 \ngov.kr \n정부24 \n"
}